\set ECHO none
-- Before running this file User must create database mysql_fdw_regress on
-- MySQL with all permission for 'edb' user with 'edb' password and ran
-- mysql_init.sh file to create tables.
\c contrib_regression
--Testcase 1:
CREATE EXTENSION IF NOT EXISTS mysql_fdw;
--Testcase 2:
CREATE SERVER mysql_svr FOREIGN DATA WRAPPER mysql_fdw
  OPTIONS (host :MYSQL_HOST, port :MYSQL_PORT);
--Testcase 3:
CREATE USER MAPPING FOR public SERVER mysql_svr
  OPTIONS (username :MYSQL_USER_NAME, password :MYSQL_PASS);
-- Create foreign tables
--Testcase 4:
CREATE FOREIGN TABLE f_mysql_test(a int, b int)
  SERVER mysql_svr OPTIONS (dbname 'mysql_fdw_regress', table_name 'mysql_test');
--Testcase 5:
CREATE FOREIGN TABLE fdw126_ft1(stu_id int, stu_name varchar(255), stu_dept int)
  SERVER mysql_svr OPTIONS (dbname 'mysql_fdw_regress1', table_name 'student');
--Testcase 6:
CREATE FOREIGN TABLE fdw126_ft2(stu_id int, stu_name varchar(255))
  SERVER mysql_svr OPTIONS (table_name 'student');
--Testcase 7:
CREATE FOREIGN TABLE fdw126_ft3(a int, b varchar(255))
  SERVER mysql_svr OPTIONS (dbname 'mysql_fdw_regress1', table_name 'numbers');
--Testcase 8:
CREATE FOREIGN TABLE fdw126_ft4(a int, b varchar(255))
  SERVER mysql_svr OPTIONS (dbname 'mysql_fdw_regress1', table_name 'nosuchtable');
--Testcase 9:
CREATE FOREIGN TABLE fdw126_ft5(a int, b varchar(255))
  SERVER mysql_svr OPTIONS (dbname 'mysql_fdw_regress2', table_name 'numbers');
--Testcase 10:
CREATE FOREIGN TABLE fdw126_ft6(stu_id int, stu_name varchar(255))
  SERVER mysql_svr OPTIONS (table_name 'mysql_fdw_regress1.student');
--Testcase 11:
CREATE FOREIGN TABLE f_empdata(emp_id int, emp_dat bytea)
  SERVER mysql_svr OPTIONS (dbname 'mysql_fdw_regress', table_name 'empdata');
--Testcase 40:
CREATE FOREIGN TABLE fdw193_ft1(stu_id varchar(10), stu_name varchar(255), stu_dept int)
  SERVER mysql_svr OPTIONS (dbname 'mysql_fdw_regress1', table_name 'student1');
-- Operation on blob data.
--Testcase 12:
INSERT INTO f_empdata VALUES (1, decode ('01234567', 'hex'));
--Testcase 13:
SELECT count(*) FROM f_empdata ORDER BY 1;
 count 
-------
     1
(1 row)

--Testcase 14:
SELECT emp_id, emp_dat FROM f_empdata ORDER BY 1;
 emp_id |  emp_dat   
--------+------------
      1 | \x01234567
(1 row)

--Testcase 15:
UPDATE f_empdata SET emp_dat = decode ('0123', 'hex');
--Testcase 16:
SELECT emp_id, emp_dat FROM f_empdata ORDER BY 1;
 emp_id | emp_dat 
--------+---------
      1 | \x0123
(1 row)

-- FDW-126: Insert/update/delete statement failing in mysql_fdw by picking
-- wrong database name.
-- Verify the INSERT/UPDATE/DELETE operations on another foreign table which
-- resides in the another database in MySQL.  The previous commands performs
-- the operation on foreign table created for tables in mysql_fdw_regress
-- MySQL database.  Below operations will be performed for foreign table
-- created for table in mysql_fdw_regress1 MySQL database.
--Testcase 17:
INSERT INTO fdw126_ft1 VALUES(1, 'One', 101);
--Testcase 18:
UPDATE fdw126_ft1 SET stu_name = 'one' WHERE stu_id = 1;
--Testcase 19:
DELETE FROM fdw126_ft1 WHERE stu_id = 1;
-- Select on f_mysql_test foreign table which is created for mysql_test table
-- from mysql_fdw_regress MySQL database.  This call is just to cross verify if
-- everything is working correctly.
--Testcase 20:
SELECT a, b FROM f_mysql_test ORDER BY 1, 2;
 a | b 
---+---
 1 | 1
(1 row)

-- Insert into fdw126_ft2 table which does not have dbname specified while
-- creating the foreign table, so it will consider the schema name of foreign
-- table as database name and try to connect/lookup into that database.  Will
-- throw an error.
--Testcase 21:
INSERT INTO fdw126_ft2 VALUES(2, 'Two');
ERROR:  failed to execute the MySQL query: 
Unknown database 'public'
-- Check with the same table name from different database. fdw126_ft3 is
-- pointing to the mysql_fdw_regress1.numbers and not mysql_fdw_regress.numbers
-- table.  INSERT/UPDATE/DELETE should be failing.  SELECT will return no rows.
--Testcase 22:
INSERT INTO fdw126_ft3 VALUES(1, 'One');
ERROR:  first column of remote table must be unique for INSERT/UPDATE/DELETE operation
--Testcase 23:
SELECT a, b FROM fdw126_ft3 ORDER BY 1, 2 LIMIT 1;
 a | b 
---+---
(0 rows)

--Testcase 24:
UPDATE fdw126_ft3 SET b = 'one' WHERE a = 1;
ERROR:  first column of remote table must be unique for INSERT/UPDATE/DELETE operation
--Testcase 25:
DELETE FROM fdw126_ft3 WHERE a = 1;
ERROR:  first column of remote table must be unique for INSERT/UPDATE/DELETE operation
-- Check when table_name is given in database.table form in foreign table
-- should error out as syntax error
--Testcase 26:
INSERT INTO fdw126_ft6 VALUES(1, 'One');
ERROR:  failed to execute the MySQL query: 
You have an error in your SQL syntax; check the manual that corresponds to your MySQL server version for the right syntax to use near '.student' at line 1
-- Perform the ANALYZE on the foreign table which is not present on the remote
-- side.  Should not crash.
-- The database is present but not the target table.
ANALYZE fdw126_ft4;
ERROR:  relation mysql_fdw_regress1.nosuchtable does not exist
-- The database itself is not present.
ANALYZE fdw126_ft5;
ERROR:  relation mysql_fdw_regress2.numbers does not exist
-- Some other variant of analyze and vacuum.
-- when table exists, should give skip-warning
VACUUM f_empdata;
WARNING:  skipping "f_empdata" --- cannot vacuum non-tables or special system tables
VACUUM FULL f_empdata;
WARNING:  skipping "f_empdata" --- cannot vacuum non-tables or special system tables
VACUUM FREEZE f_empdata;
WARNING:  skipping "f_empdata" --- cannot vacuum non-tables or special system tables
ANALYZE f_empdata;
WARNING:  skipping "f_empdata" --- cannot analyze this foreign table
ANALYZE f_empdata(emp_id);
WARNING:  skipping "f_empdata" --- cannot analyze this foreign table
VACUUM ANALYZE f_empdata;
WARNING:  skipping "f_empdata" --- cannot vacuum non-tables or special system tables
-- Verify the before update trigger which modifies the column value which is not
-- part of update statement.
--Testcase 41:
CREATE FUNCTION before_row_update_func() RETURNS TRIGGER AS $$
BEGIN
  NEW.stu_name := NEW.stu_name || ' trigger updated!';
	RETURN NEW;
  END
$$ language plpgsql;
--Testcase 42:
CREATE TRIGGER before_row_update_trig
BEFORE UPDATE ON fdw126_ft1
FOR EACH ROW EXECUTE PROCEDURE before_row_update_func();
--Testcase 43:
INSERT INTO fdw126_ft1 VALUES(1, 'One', 101);
--Testcase 44:
EXPLAIN (verbose, costs off)
UPDATE fdw126_ft1 SET stu_dept = 201 WHERE stu_id = 1;
                                                             QUERY PLAN                                                              
-------------------------------------------------------------------------------------------------------------------------------------
 Update on public.fdw126_ft1
   ->  Foreign Scan on public.fdw126_ft1
         Output: stu_id, stu_name, 201, stu_id, fdw126_ft1.*
         Local server startup cost: 10
         Remote query: SELECT `stu_id`, `stu_name`, `stu_dept` FROM `mysql_fdw_regress1`.`student` WHERE ((`stu_id` = 1)) FOR UPDATE
(5 rows)

--Testcase 45:
UPDATE fdw126_ft1 SET stu_dept = 201 WHERE stu_id = 1;
--Testcase 46:
SELECT * FROM fdw126_ft1 ORDER BY stu_id;
 stu_id |       stu_name       | stu_dept 
--------+----------------------+----------
      1 | One trigger updated! |      201
(1 row)

-- Throw an error when target list has row identifier column.
--Testcase 47:
UPDATE fdw126_ft1 SET stu_dept = 201, stu_id = 10  WHERE stu_id = 1;
ERROR:  row identifier column update is not supported
-- Throw an error when before row update trigger modify the row identifier
-- column (int column) value.
--Testcase 48:
CREATE OR REPLACE FUNCTION before_row_update_func() RETURNS TRIGGER AS $$
BEGIN
  NEW.stu_name := NEW.stu_name || ' trigger updated!';
  NEW.stu_id = 20;
  RETURN NEW;
  END
$$ language plpgsql;
--Testcase 49:
UPDATE fdw126_ft1 SET stu_dept = 301 WHERE stu_id = 1;
ERROR:  row identifier column update is not supported
-- Verify the before update trigger which modifies the column value which is
-- not part of update statement.
--Testcase 50:
CREATE OR REPLACE FUNCTION before_row_update_func() RETURNS TRIGGER AS $$
BEGIN
  NEW.stu_name := NEW.stu_name || ' trigger updated!';
  RETURN NEW;
  END
$$ language plpgsql;
--Testcase 51:
CREATE TRIGGER before_row_update_trig1
BEFORE UPDATE ON fdw193_ft1
FOR EACH ROW EXECUTE PROCEDURE before_row_update_func();
--Testcase 52:
INSERT INTO fdw193_ft1 VALUES('aa', 'One', 101);
--Testcase 53:
EXPLAIN (verbose, costs off)
UPDATE fdw193_ft1 SET stu_dept = 201 WHERE stu_id = 'aa';
                                                               QUERY PLAN                                                                
-----------------------------------------------------------------------------------------------------------------------------------------
 Update on public.fdw193_ft1
   ->  Foreign Scan on public.fdw193_ft1
         Output: stu_id, stu_name, 201, stu_id, fdw193_ft1.*
         Local server startup cost: 10
         Remote query: SELECT `stu_id`, `stu_name`, `stu_dept` FROM `mysql_fdw_regress1`.`student1` WHERE ((`stu_id` = 'aa')) FOR UPDATE
(5 rows)

--Testcase 54:
UPDATE fdw193_ft1 SET stu_dept = 201 WHERE stu_id = 'aa';
--Testcase 55:
SELECT * FROM fdw193_ft1 ORDER BY stu_id;
 stu_id |       stu_name       | stu_dept 
--------+----------------------+----------
 aa     | One trigger updated! |      201
(1 row)

-- Throw an error when before row update trigger modify the row identifier
-- column (varchar column) value.
--Testcase 56:
CREATE OR REPLACE FUNCTION before_row_update_func() RETURNS TRIGGER AS $$
BEGIN
  NEW.stu_name := NEW.stu_name || ' trigger updated!';
  NEW.stu_id = 'bb';
  RETURN NEW;
  END
$$ language plpgsql;
--Testcase 57:
UPDATE fdw193_ft1 SET stu_dept = 301 WHERE stu_id = 'aa';
ERROR:  row identifier column update is not supported
-- Verify the NULL assignment scenario.
--Testcase 58:
CREATE OR REPLACE FUNCTION before_row_update_func() RETURNS TRIGGER AS $$
BEGIN
  NEW.stu_name := NEW.stu_name || ' trigger updated!';
  NEW.stu_id = NULL;
  RETURN NEW;
  END
$$ language plpgsql;
--Testcase 59:
UPDATE fdw193_ft1 SET stu_dept = 401 WHERE stu_id = 'aa';
ERROR:  row identifier column update is not supported
-- Cleanup
--Testcase 27:
DELETE FROM fdw126_ft1;
--Testcase 28:
DELETE FROM f_empdata;
--Testcase 60:
DELETE FROM fdw193_ft1;
--Testcase 29:
DROP FOREIGN TABLE f_mysql_test;
--Testcase 30:
DROP FOREIGN TABLE fdw126_ft1;
--Testcase 31:
DROP FOREIGN TABLE fdw126_ft2;
--Testcase 32:
DROP FOREIGN TABLE fdw126_ft3;
--Testcase 33:
DROP FOREIGN TABLE fdw126_ft4;
--Testcase 34:
DROP FOREIGN TABLE fdw126_ft5;
--Testcase 35:
DROP FOREIGN TABLE fdw126_ft6;
--Testcase 36:
DROP FOREIGN TABLE f_empdata;
--Testcase 61:
DROP FOREIGN TABLE fdw193_ft1;
--Testcase 62:
DROP FUNCTION before_row_update_func();
--Testcase 37:
DROP USER MAPPING FOR public SERVER mysql_svr;
--Testcase 38:
DROP SERVER mysql_svr;
--Testcase 39:
DROP EXTENSION mysql_fdw;
