\set ECHO none
-- Before running this file User must create database mysql_fdw_regress on
-- MySQL with all permission for 'edb' user with 'edb' password and ran
-- mysql_init.sh file to create tables.
--Testcase 1:
CREATE EXTENSION mysql_fdw;
--Testcase 2:
CREATE SERVER mysql_svr FOREIGN DATA WRAPPER mysql_fdw
  OPTIONS (host :MYSQL_HOST, port :MYSQL_PORT);
--Testcase 3:
CREATE SERVER mysql_svr2 FOREIGN DATA WRAPPER mysql_fdw
  OPTIONS (host :MYSQL_HOST, port :MYSQL_PORT);
--Testcase 4:
CREATE USER MAPPING FOR PUBLIC SERVER mysql_svr
  OPTIONS (username :MYSQL_USER_NAME, password :MYSQL_PASS);
--Testcase 5:
CREATE USER MAPPING FOR PUBLIC SERVER mysql_svr2
  OPTIONS (username :MYSQL_USER_NAME, password :MYSQL_PASS);
-- ===================================================================
-- create objects used through FDW mysql_svr server
-- ===================================================================
--Testcase 6:
CREATE TYPE user_enum AS ENUM ('foo', 'bar', 'buz');
--Testcase 7:
CREATE SCHEMA "S 1";
IMPORT FOREIGN SCHEMA mysql_fdw_post FROM SERVER mysql_svr INTO "S 1";
--Testcase 8:
INSERT INTO "S 1"."T 1"
	SELECT id,
	       id % 10,
	       to_char(id, 'FM00000'),
	       '1970-01-01'::timestamptz + ((id % 100) || ' days')::interval,
	       '1970-01-01'::timestamp + ((id % 100) || ' days')::interval,
	       id % 10,
	       id % 10,
	       'foo'::user_enum
	FROM generate_series(1, 1000) id;
--Testcase 9:
INSERT INTO "S 1"."T 2"
	SELECT id,
	       'AAA' || to_char(id, 'FM000')
	FROM generate_series(1, 100) id;
--Testcase 10:
INSERT INTO "S 1"."T 3"
	SELECT id,
	       id + 1,
	       'AAA' || to_char(id, 'FM000')
	FROM generate_series(1, 100) id;
--Testcase 11:
DELETE FROM "S 1"."T 3" WHERE c1 % 2 != 0;	-- delete for outer join tests
--Testcase 12:
INSERT INTO "S 1"."T 4"
	SELECT id,
	       id + 1,
	       'AAA' || to_char(id, 'FM000')
	FROM generate_series(1, 100) id;
--Testcase 13:
DELETE FROM "S 1"."T 4" WHERE c1 % 3 != 0;	-- delete for outer join tests
-- ANALYZE "S 1"."T 1";
-- ANALYZE "S 1"."T 2";
-- ANALYZE "S 1"."T 3";
-- ANALYZE "S 1"."T 4";
-- ===================================================================
-- create foreign tables
-- ===================================================================
--Testcase 14:
CREATE FOREIGN TABLE ft1 (
	c0 int,
	c1 int NOT NULL,
	c2 int NOT NULL,
	c3 text,
	c4 timestamptz,
	c5 timestamp,
	c6 varchar(10),
	c7 char(10) default 'ft1',
	c8 user_enum
) SERVER mysql_svr OPTIONS (dbname 'mysql_fdw_post');
ALTER FOREIGN TABLE ft1 DROP COLUMN c0;
--Testcase 15:
CREATE FOREIGN TABLE ft2 (
	c1 int NOT NULL,
	c2 int NOT NULL,
	cx int,
	c3 text,
	c4 timestamptz,
	c5 timestamp,
	c6 varchar(10),
	c7 char(10) default 'ft2',
	c8 user_enum
) SERVER mysql_svr OPTIONS (dbname 'mysql_fdw_post');
ALTER FOREIGN TABLE ft2 DROP COLUMN cx;
--Testcase 16:
CREATE FOREIGN TABLE ft4 (
	c1 int NOT NULL,
	c2 int NOT NULL,
	c3 text
) SERVER mysql_svr OPTIONS (dbname 'mysql_fdw_post', table_name 'T 3');
--Testcase 17:
CREATE FOREIGN TABLE ft5 (
	c1 int NOT NULL,
	c2 int NOT NULL,
	c3 text
) SERVER mysql_svr OPTIONS (dbname 'mysql_fdw_post', table_name 'T 4');
--Testcase 18:
CREATE FOREIGN TABLE ft6 (
	c1 int NOT NULL,
	c2 int NOT NULL,
	c3 text
) SERVER mysql_svr2 OPTIONS (dbname 'mysql_fdw_post', table_name 'T 4');
-- -- ===================================================================
-- -- tests for validator
-- -- ===================================================================
-- -- requiressl and some other parameters are omitted because
-- -- valid values for them depend on configure options
-- ALTER SERVER testserver1 OPTIONS (
-- 	use_remote_estimate 'false',
-- 	updatable 'true',
-- 	fdw_startup_cost '123.456',
-- 	fdw_tuple_cost '0.123',
-- 	service 'value',
-- 	connect_timeout 'value',
-- 	dbname 'value',
-- 	host 'value',
-- 	hostaddr 'value',
-- 	port 'value',
-- 	--client_encoding 'value',
-- 	application_name 'value',
-- 	--fallback_application_name 'value',
-- 	keepalives 'value',
-- 	keepalives_idle 'value',
-- 	keepalives_interval 'value',
-- 	tcp_user_timeout 'value',
-- 	-- requiressl 'value',
-- 	sslcompression 'value',
-- 	sslmode 'value',
-- 	sslcert 'value',
-- 	sslkey 'value',
-- 	sslrootcert 'value',
-- 	sslcrl 'value',
-- 	--requirepeer 'value',
-- 	krbsrvname 'value',
-- 	gsslib 'value'
-- 	--replication 'value'
-- );
-- -- Error, invalid list syntax
-- ALTER SERVER testserver1 OPTIONS (ADD extensions 'foo; bar');
-- -- OK but gets a warning
-- ALTER SERVER testserver1 OPTIONS (ADD extensions 'foo, bar');
-- ALTER SERVER testserver1 OPTIONS (DROP extensions);
-- ALTER USER MAPPING FOR public SERVER testserver1
-- 	OPTIONS (DROP user, DROP password);
-- -- Attempt to add a valid option that's not allowed in a user mapping
-- ALTER USER MAPPING FOR public SERVER testserver1
-- 	OPTIONS (ADD sslmode 'require');
-- -- But we can add valid ones fine
-- ALTER USER MAPPING FOR public SERVER testserver1
-- 	OPTIONS (ADD sslpassword 'dummy');
-- -- Ensure valid options we haven't used in a user mapping yet are
-- -- permitted to check validation.
-- ALTER USER MAPPING FOR public SERVER testserver1
-- 	OPTIONS (ADD sslkey 'value', ADD sslcert 'value');
ALTER FOREIGN TABLE ft1 OPTIONS (table_name 'T 1');
ALTER FOREIGN TABLE ft2 OPTIONS (table_name 'T 1');
ALTER FOREIGN TABLE ft1 ALTER COLUMN c1 OPTIONS (column_name 'C 1');
ALTER FOREIGN TABLE ft2 ALTER COLUMN c1 OPTIONS (column_name 'C 1');
--Testcase 19:
\det+
                                 List of foreign tables
 Schema | Table |   Server   |                 FDW options                 | Description 
--------+-------+------------+---------------------------------------------+-------------
 public | ft1   | mysql_svr  | (dbname 'mysql_fdw_post', table_name 'T 1') | 
 public | ft2   | mysql_svr  | (dbname 'mysql_fdw_post', table_name 'T 1') | 
 public | ft4   | mysql_svr  | (dbname 'mysql_fdw_post', table_name 'T 3') | 
 public | ft5   | mysql_svr  | (dbname 'mysql_fdw_post', table_name 'T 4') | 
 public | ft6   | mysql_svr2 | (dbname 'mysql_fdw_post', table_name 'T 4') | 
(5 rows)

-- Test that alteration of server options causes reconnection
-- Remote's errors might be non-English, so hide them to ensure stable results
\set VERBOSITY terse
--Testcase 20:
SELECT c3, c4 FROM ft1 ORDER BY c3, c1 LIMIT 1;  -- should work
  c3   |              c4              
-------+------------------------------
 00001 | Fri Jan 02 00:00:00 1970 PST
(1 row)

ALTER FOREIGN TABLE ft1 OPTIONS (SET dbname 'no such database');
--Testcase 21:
SELECT c3, c4 FROM ft1 ORDER BY c3, c1 LIMIT 1;  -- should fail
ERROR:  failed to prepare the MySQL query: 
SELECT command denied to user 'edb'@'localhost' for table 'T 1'
ALTER FOREIGN TABLE ft1 OPTIONS (SET dbname 'mysql_fdw_post');
--Testcase 22:
SELECT c3, c4 FROM ft1 ORDER BY c3, c1 LIMIT 1;  -- should work again
  c3   |              c4              
-------+------------------------------
 00001 | Fri Jan 02 00:00:00 1970 PST
(1 row)

-- Test that alteration of user mapping options causes reconnection
-- ALTER USER MAPPING FOR CURRENT_USER SERVER mysql_svr
--   OPTIONS (ADD user 'no such user');
-- SELECT c3, c4 FROM ft1 ORDER BY c3, c1 LIMIT 1;  -- should fail
-- ALTER USER MAPPING FOR CURRENT_USER SERVER mysql_svr
--   OPTIONS (DROP user);
-- SELECT c3, c4 FROM ft1 ORDER BY c3, c1 LIMIT 1;  -- should work again
-- \set VERBOSITY default
-- Now we should be able to run ANALYZE.
-- To exercise multiple code paths, we use local stats on ft1
-- and remote-estimate mode on ft2.
-- ANALYZE ft1;
ALTER FOREIGN TABLE ft2 OPTIONS (use_remote_estimate 'true');
-- ===================================================================
-- simple queries
-- ===================================================================
-- single table without alias
--Testcase 23:
EXPLAIN (COSTS OFF) SELECT * FROM ft1 ORDER BY c3, c1 OFFSET 100 LIMIT 10;
     QUERY PLAN      
---------------------
 Foreign Scan on ft1
(1 row)

--Testcase 24:
SELECT * FROM ft1 ORDER BY c3, c1 OFFSET 100 LIMIT 10;
 c1  | c2 |  c3   |              c4              |            c5            | c6 | c7 | c8  
-----+----+-------+------------------------------+--------------------------+----+----+-----
 101 |  1 | 00101 | Fri Jan 02 00:00:00 1970 PST | Fri Jan 02 00:00:00 1970 | 1  | 1  | foo
 102 |  2 | 00102 | Sat Jan 03 00:00:00 1970 PST | Sat Jan 03 00:00:00 1970 | 2  | 2  | foo
 103 |  3 | 00103 | Sun Jan 04 00:00:00 1970 PST | Sun Jan 04 00:00:00 1970 | 3  | 3  | foo
 104 |  4 | 00104 | Mon Jan 05 00:00:00 1970 PST | Mon Jan 05 00:00:00 1970 | 4  | 4  | foo
 105 |  5 | 00105 | Tue Jan 06 00:00:00 1970 PST | Tue Jan 06 00:00:00 1970 | 5  | 5  | foo
 106 |  6 | 00106 | Wed Jan 07 00:00:00 1970 PST | Wed Jan 07 00:00:00 1970 | 6  | 6  | foo
 107 |  7 | 00107 | Thu Jan 08 00:00:00 1970 PST | Thu Jan 08 00:00:00 1970 | 7  | 7  | foo
 108 |  8 | 00108 | Fri Jan 09 00:00:00 1970 PST | Fri Jan 09 00:00:00 1970 | 8  | 8  | foo
 109 |  9 | 00109 | Sat Jan 10 00:00:00 1970 PST | Sat Jan 10 00:00:00 1970 | 9  | 9  | foo
 110 |  0 | 00110 | Sun Jan 11 00:00:00 1970 PST | Sun Jan 11 00:00:00 1970 | 0  | 0  | foo
(10 rows)

-- mysql_fdw does not support tableoid
-- -- single table with alias - also test that tableoid sort is not pushed to remote side
-- EXPLAIN (VERBOSE, COSTS OFF) SELECT * FROM ft1 t1 ORDER BY t1.c3, t1.c1, t1.tableoid OFFSET 100 LIMIT 10;
-- SELECT * FROM ft1 t1 ORDER BY t1.c3, t1.c1, t1.tableoid OFFSET 100 LIMIT 10;
-- whole-row reference
--Testcase 25:
EXPLAIN (VERBOSE, COSTS OFF) SELECT t1 FROM ft1 t1 ORDER BY t1.c3, t1.c1 OFFSET 100 LIMIT 10;
                                                                                        QUERY PLAN                                                                                        
------------------------------------------------------------------------------------------------------------------------------------------------------------------------------------------
 Foreign Scan on public.ft1 t1
   Output: t1.*, c3, c1
   Local server startup cost: 10
   Remote query: SELECT `C 1`, `c2`, `c3`, `c4`, `c5`, `c6`, `c7`, `c8` FROM `mysql_fdw_post`.`T 1` ORDER BY `c3` IS NULL ASC, `c3` ASC, `C 1` IS NULL ASC, `C 1` ASC LIMIT 10 OFFSET 100
(4 rows)

--Testcase 26:
SELECT t1 FROM ft1 t1 ORDER BY t1.c3, t1.c1 OFFSET 100 LIMIT 10;
                                       t1                                        
---------------------------------------------------------------------------------
 (101,1,00101,"Fri Jan 02 00:00:00 1970 PST","Fri Jan 02 00:00:00 1970",1,1,foo)
 (102,2,00102,"Sat Jan 03 00:00:00 1970 PST","Sat Jan 03 00:00:00 1970",2,2,foo)
 (103,3,00103,"Sun Jan 04 00:00:00 1970 PST","Sun Jan 04 00:00:00 1970",3,3,foo)
 (104,4,00104,"Mon Jan 05 00:00:00 1970 PST","Mon Jan 05 00:00:00 1970",4,4,foo)
 (105,5,00105,"Tue Jan 06 00:00:00 1970 PST","Tue Jan 06 00:00:00 1970",5,5,foo)
 (106,6,00106,"Wed Jan 07 00:00:00 1970 PST","Wed Jan 07 00:00:00 1970",6,6,foo)
 (107,7,00107,"Thu Jan 08 00:00:00 1970 PST","Thu Jan 08 00:00:00 1970",7,7,foo)
 (108,8,00108,"Fri Jan 09 00:00:00 1970 PST","Fri Jan 09 00:00:00 1970",8,8,foo)
 (109,9,00109,"Sat Jan 10 00:00:00 1970 PST","Sat Jan 10 00:00:00 1970",9,9,foo)
 (110,0,00110,"Sun Jan 11 00:00:00 1970 PST","Sun Jan 11 00:00:00 1970",0,0,foo)
(10 rows)

-- empty result
--Testcase 27:
SELECT * FROM ft1 WHERE false;
 c1 | c2 | c3 | c4 | c5 | c6 | c7 | c8 
----+----+----+----+----+----+----+----
(0 rows)

-- with WHERE clause
--Testcase 28:
EXPLAIN (VERBOSE, COSTS OFF) SELECT * FROM ft1 t1 WHERE t1.c1 = 101 AND t1.c6 = '1' AND t1.c7 >= '1';
                                                                           QUERY PLAN                                                                            
-----------------------------------------------------------------------------------------------------------------------------------------------------------------
 Foreign Scan on public.ft1 t1
   Output: c1, c2, c3, c4, c5, c6, c7, c8
   Local server startup cost: 10
   Remote query: SELECT `C 1`, `c2`, `c3`, `c4`, `c5`, `c6`, `c7`, `c8` FROM `mysql_fdw_post`.`T 1` WHERE ((`c7` >= '1')) AND ((`C 1` = 101)) AND ((`c6` = '1'))
(4 rows)

--Testcase 29:
SELECT * FROM ft1 t1 WHERE t1.c1 = 101 AND t1.c6 = '1' AND t1.c7 >= '1';
 c1  | c2 |  c3   |              c4              |            c5            | c6 | c7 | c8  
-----+----+-------+------------------------------+--------------------------+----+----+-----
 101 |  1 | 00101 | Fri Jan 02 00:00:00 1970 PST | Fri Jan 02 00:00:00 1970 | 1  | 1  | foo
(1 row)

-- with FOR UPDATE/SHARE
--Testcase 30:
EXPLAIN (VERBOSE, COSTS OFF) SELECT * FROM ft1 t1 WHERE c1 = 101 FOR UPDATE;
                                                             QUERY PLAN                                                              
-------------------------------------------------------------------------------------------------------------------------------------
 Foreign Scan on public.ft1 t1
   Output: c1, c2, c3, c4, c5, c6, c7, c8, t1.*
   Local server startup cost: 10
   Remote query: SELECT `C 1`, `c2`, `c3`, `c4`, `c5`, `c6`, `c7`, `c8` FROM `mysql_fdw_post`.`T 1` WHERE ((`C 1` = 101)) FOR UPDATE
(4 rows)

--Testcase 31:
SELECT * FROM ft1 t1 WHERE c1 = 101 FOR UPDATE;
 c1  | c2 |  c3   |              c4              |            c5            | c6 | c7 | c8  
-----+----+-------+------------------------------+--------------------------+----+----+-----
 101 |  1 | 00101 | Fri Jan 02 00:00:00 1970 PST | Fri Jan 02 00:00:00 1970 | 1  | 1  | foo
(1 row)

--Testcase 32:
EXPLAIN (VERBOSE, COSTS OFF) SELECT * FROM ft1 t1 WHERE c1 = 102 FOR SHARE;
                                                             QUERY PLAN                                                             
------------------------------------------------------------------------------------------------------------------------------------
 Foreign Scan on public.ft1 t1
   Output: c1, c2, c3, c4, c5, c6, c7, c8, t1.*
   Local server startup cost: 10
   Remote query: SELECT `C 1`, `c2`, `c3`, `c4`, `c5`, `c6`, `c7`, `c8` FROM `mysql_fdw_post`.`T 1` WHERE ((`C 1` = 102)) FOR SHARE
(4 rows)

--Testcase 33:
SELECT * FROM ft1 t1 WHERE c1 = 102 FOR SHARE;
 c1  | c2 |  c3   |              c4              |            c5            | c6 | c7 | c8  
-----+----+-------+------------------------------+--------------------------+----+----+-----
 102 |  2 | 00102 | Sat Jan 03 00:00:00 1970 PST | Sat Jan 03 00:00:00 1970 | 2  | 2  | foo
(1 row)

-- aggregate
--Testcase 34:
SELECT COUNT(*) FROM ft1 t1;
 count 
-------
  1000
(1 row)

-- subquery
--Testcase 35:
SELECT * FROM ft1 t1 WHERE t1.c3 IN (SELECT c3 FROM ft2 t2 WHERE c1 <= 10) ORDER BY c1;
 c1 | c2 |  c3   |              c4              |            c5            | c6 | c7 | c8  
----+----+-------+------------------------------+--------------------------+----+----+-----
  1 |  1 | 00001 | Fri Jan 02 00:00:00 1970 PST | Fri Jan 02 00:00:00 1970 | 1  | 1  | foo
  2 |  2 | 00002 | Sat Jan 03 00:00:00 1970 PST | Sat Jan 03 00:00:00 1970 | 2  | 2  | foo
  3 |  3 | 00003 | Sun Jan 04 00:00:00 1970 PST | Sun Jan 04 00:00:00 1970 | 3  | 3  | foo
  4 |  4 | 00004 | Mon Jan 05 00:00:00 1970 PST | Mon Jan 05 00:00:00 1970 | 4  | 4  | foo
  5 |  5 | 00005 | Tue Jan 06 00:00:00 1970 PST | Tue Jan 06 00:00:00 1970 | 5  | 5  | foo
  6 |  6 | 00006 | Wed Jan 07 00:00:00 1970 PST | Wed Jan 07 00:00:00 1970 | 6  | 6  | foo
  7 |  7 | 00007 | Thu Jan 08 00:00:00 1970 PST | Thu Jan 08 00:00:00 1970 | 7  | 7  | foo
  8 |  8 | 00008 | Fri Jan 09 00:00:00 1970 PST | Fri Jan 09 00:00:00 1970 | 8  | 8  | foo
  9 |  9 | 00009 | Sat Jan 10 00:00:00 1970 PST | Sat Jan 10 00:00:00 1970 | 9  | 9  | foo
 10 |  0 | 00010 | Sun Jan 11 00:00:00 1970 PST | Sun Jan 11 00:00:00 1970 | 0  | 0  | foo
(10 rows)

-- subquery+MAX
--Testcase 36:
SELECT * FROM ft1 t1 WHERE t1.c3 = (SELECT MAX(c3) FROM ft2 t2) ORDER BY c1;
  c1  | c2 |  c3   |              c4              |            c5            | c6 | c7 | c8  
------+----+-------+------------------------------+--------------------------+----+----+-----
 1000 |  0 | 01000 | Thu Jan 01 00:00:00 1970 PST | Thu Jan 01 00:00:00 1970 | 0  | 0  | foo
(1 row)

-- used in CTE
--Testcase 37:
WITH t1 AS (SELECT * FROM ft1 WHERE c1 <= 10) SELECT t2.c1, t2.c2, t2.c3, t2.c4 FROM t1, ft2 t2 WHERE t1.c1 = t2.c1 ORDER BY t1.c1;
 c1 | c2 |  c3   |              c4              
----+----+-------+------------------------------
  1 |  1 | 00001 | Fri Jan 02 00:00:00 1970 PST
  2 |  2 | 00002 | Sat Jan 03 00:00:00 1970 PST
  3 |  3 | 00003 | Sun Jan 04 00:00:00 1970 PST
  4 |  4 | 00004 | Mon Jan 05 00:00:00 1970 PST
  5 |  5 | 00005 | Tue Jan 06 00:00:00 1970 PST
  6 |  6 | 00006 | Wed Jan 07 00:00:00 1970 PST
  7 |  7 | 00007 | Thu Jan 08 00:00:00 1970 PST
  8 |  8 | 00008 | Fri Jan 09 00:00:00 1970 PST
  9 |  9 | 00009 | Sat Jan 10 00:00:00 1970 PST
 10 |  0 | 00010 | Sun Jan 11 00:00:00 1970 PST
(10 rows)

-- fixed values
--Testcase 38:
SELECT 'fixed', NULL FROM ft1 t1 WHERE c1 = 1;
 ?column? | ?column? 
----------+----------
 fixed    | 
(1 row)

-- Test forcing the remote server to produce sorted data for a merge join.
SET enable_hashjoin TO false;
SET enable_nestloop TO false;
-- inner join; expressions in the clauses appear in the equivalence class list
--Testcase 39:
EXPLAIN (VERBOSE, COSTS OFF)
	SELECT t1.c1, t2."C 1" FROM ft2 t1 JOIN "S 1"."T 1" t2 ON (t1.c1 = t2."C 1") OFFSET 100 LIMIT 10;
                                                                            QUERY PLAN                                                                            
------------------------------------------------------------------------------------------------------------------------------------------------------------------
 Foreign Scan
   Output: t1.c1, t2."C 1"
   Local server startup cost: 10
   Remote query: SELECT r1.`C 1`, r2.`C 1` FROM (`mysql_fdw_post`.`T 1` r1 INNER JOIN `mysql_fdw_post`.`T 1` r2 ON (((r1.`C 1` = r2.`C 1`)))) LIMIT 10 OFFSET 100
(4 rows)

--Testcase 40:
SELECT t1.c1, t2."C 1" FROM ft2 t1 JOIN "S 1"."T 1" t2 ON (t1.c1 = t2."C 1") OFFSET 100 LIMIT 10;
 c1  | C 1 
-----+-----
 101 | 101
 102 | 102
 103 | 103
 104 | 104
 105 | 105
 106 | 106
 107 | 107
 108 | 108
 109 | 109
 110 | 110
(10 rows)

-- outer join; expressions in the clauses do not appear in equivalence class
-- list but no output change as compared to the previous query
--Testcase 41:
EXPLAIN (VERBOSE, COSTS OFF)
	SELECT t1.c1, t2."C 1" FROM ft2 t1 LEFT JOIN "S 1"."T 1" t2 ON (t1.c1 = t2."C 1") OFFSET 100 LIMIT 10;
                                                                           QUERY PLAN                                                                            
-----------------------------------------------------------------------------------------------------------------------------------------------------------------
 Foreign Scan
   Output: t1.c1, t2."C 1"
   Local server startup cost: 10
   Remote query: SELECT r1.`C 1`, r2.`C 1` FROM (`mysql_fdw_post`.`T 1` r1 LEFT JOIN `mysql_fdw_post`.`T 1` r2 ON (((r1.`C 1` = r2.`C 1`)))) LIMIT 10 OFFSET 100
(4 rows)

--Testcase 42:
SELECT t1.c1, t2."C 1" FROM ft2 t1 LEFT JOIN "S 1"."T 1" t2 ON (t1.c1 = t2."C 1") OFFSET 100 LIMIT 10;
 c1  | C 1 
-----+-----
 101 | 101
 102 | 102
 103 | 103
 104 | 104
 105 | 105
 106 | 106
 107 | 107
 108 | 108
 109 | 109
 110 | 110
(10 rows)

-- A join between local table and foreign join. ORDER BY clause is added to the
-- foreign join so that the local table can be joined using merge join strategy.
--Testcase 43:
EXPLAIN (VERBOSE, COSTS OFF)
	SELECT t1."C 1" FROM "S 1"."T 1" t1 left join ft1 t2 join ft2 t3 on (t2.c1 = t3.c1) on (t3.c1 = t1."C 1") OFFSET 100 LIMIT 10;
                                                                                                        QUERY PLAN                                                                                                         
---------------------------------------------------------------------------------------------------------------------------------------------------------------------------------------------------------------------------
 Foreign Scan
   Output: t1."C 1"
   Local server startup cost: 10
   Remote query: SELECT r1.`C 1` FROM (`mysql_fdw_post`.`T 1` r1 LEFT JOIN (`mysql_fdw_post`.`T 1` r2 INNER JOIN `mysql_fdw_post`.`T 1` r3 ON (((r2.`C 1` = r3.`C 1`)))) ON (((r3.`C 1` = r1.`C 1`)))) LIMIT 10 OFFSET 100
(4 rows)

--Testcase 44:
SELECT t1."C 1" FROM "S 1"."T 1" t1 left join ft1 t2 join ft2 t3 on (t2.c1 = t3.c1) on (t3.c1 = t1."C 1") OFFSET 100 LIMIT 10;
 C 1 
-----
 101
 102
 103
 104
 105
 106
 107
 108
 109
 110
(10 rows)

-- Test similar to above, except that the full join prevents any equivalence
-- classes from being merged. This produces single relation equivalence classes
-- included in join restrictions.
--Testcase 45:
EXPLAIN (VERBOSE, COSTS OFF)
	SELECT t1."C 1", t2.c1, t3.c1 FROM "S 1"."T 1" t1 left join ft1 t2 full join ft2 t3 on (t2.c1 = t3.c1) on (t3.c1 = t1."C 1") OFFSET 100 LIMIT 10;
                                                                                                                  QUERY PLAN                                                                                                                  
----------------------------------------------------------------------------------------------------------------------------------------------------------------------------------------------------------------------------------------------
 Foreign Scan
   Output: t1."C 1", t2.c1, t3.c1
   Local server startup cost: 10
   Remote query: SELECT r1.`C 1`, r2.`C 1`, r3.`C 1` FROM ((`mysql_fdw_post`.`T 1` r1 LEFT JOIN `mysql_fdw_post`.`T 1` r3 ON (((r3.`C 1` = r1.`C 1`)))) LEFT JOIN `mysql_fdw_post`.`T 1` r2 ON (((r2.`C 1` = r3.`C 1`)))) LIMIT 10 OFFSET 100
(4 rows)

--Testcase 46:
SELECT t1."C 1", t2.c1, t3.c1 FROM "S 1"."T 1" t1 left join ft1 t2 full join ft2 t3 on (t2.c1 = t3.c1) on (t3.c1 = t1."C 1") OFFSET 100 LIMIT 10;
 C 1 | c1  | c1  
-----+-----+-----
 101 | 101 | 101
 102 | 102 | 102
 103 | 103 | 103
 104 | 104 | 104
 105 | 105 | 105
 106 | 106 | 106
 107 | 107 | 107
 108 | 108 | 108
 109 | 109 | 109
 110 | 110 | 110
(10 rows)

-- Test similar to above with all full outer joins
--Testcase 47:
EXPLAIN (VERBOSE, COSTS OFF)
	SELECT t1."C 1", t2.c1, t3.c1 FROM "S 1"."T 1" t1 full join ft1 t2 full join ft2 t3 on (t2.c1 = t3.c1) on (t3.c1 = t1."C 1") OFFSET 100 LIMIT 10;
                                                       QUERY PLAN                                                       
------------------------------------------------------------------------------------------------------------------------
 Limit
   Output: t1."C 1", t2.c1, t3.c1
   ->  Merge Full Join
         Output: t1."C 1", t2.c1, t3.c1
         Merge Cond: (t1."C 1" = t3.c1)
         ->  Sort
               Output: t1."C 1"
               Sort Key: t1."C 1"
               ->  Foreign Scan on "S 1"."T 1" t1
                     Output: t1."C 1"
                     Local server startup cost: 10
                     Remote query: SELECT `C 1` FROM `mysql_fdw_post`.`T 1`
         ->  Sort
               Output: t2.c1, t3.c1
               Sort Key: t3.c1
               ->  Merge Full Join
                     Output: t2.c1, t3.c1
                     Merge Cond: (t3.c1 = t2.c1)
                     ->  Foreign Scan on public.ft2 t3
                           Output: t3.c1
                           Local server startup cost: 10
                           Remote query: SELECT `C 1` FROM `mysql_fdw_post`.`T 1` ORDER BY `C 1` IS NULL ASC, `C 1` ASC
                     ->  Sort
                           Output: t2.c1
                           Sort Key: t2.c1
                           ->  Foreign Scan on public.ft1 t2
                                 Output: t2.c1
                                 Local server startup cost: 10
                                 Remote query: SELECT `C 1` FROM `mysql_fdw_post`.`T 1`
(29 rows)

--Testcase 48:
SELECT t1."C 1", t2.c1, t3.c1 FROM "S 1"."T 1" t1 full join ft1 t2 full join ft2 t3 on (t2.c1 = t3.c1) on (t3.c1 = t1."C 1") OFFSET 100 LIMIT 10;
 C 1 | c1  | c1  
-----+-----+-----
 101 | 101 | 101
 102 | 102 | 102
 103 | 103 | 103
 104 | 104 | 104
 105 | 105 | 105
 106 | 106 | 106
 107 | 107 | 107
 108 | 108 | 108
 109 | 109 | 109
 110 | 110 | 110
(10 rows)

RESET enable_hashjoin;
RESET enable_nestloop;
-- ===================================================================
-- WHERE with remotely-executable conditions
-- ===================================================================
--Testcase 49:
EXPLAIN (VERBOSE, COSTS OFF) SELECT * FROM ft1 t1 WHERE t1.c1 = 1;         -- Var, OpExpr(b), Const
                                                       QUERY PLAN                                                       
------------------------------------------------------------------------------------------------------------------------
 Foreign Scan on public.ft1 t1
   Output: c1, c2, c3, c4, c5, c6, c7, c8
   Local server startup cost: 10
   Remote query: SELECT `C 1`, `c2`, `c3`, `c4`, `c5`, `c6`, `c7`, `c8` FROM `mysql_fdw_post`.`T 1` WHERE ((`C 1` = 1))
(4 rows)

--Testcase 50:
EXPLAIN (VERBOSE, COSTS OFF) SELECT * FROM ft1 t1 WHERE t1.c1 = 100 AND t1.c2 = 0; -- BoolExpr
                                                                QUERY PLAN                                                                 
-------------------------------------------------------------------------------------------------------------------------------------------
 Foreign Scan on public.ft1 t1
   Output: c1, c2, c3, c4, c5, c6, c7, c8
   Local server startup cost: 10
   Remote query: SELECT `C 1`, `c2`, `c3`, `c4`, `c5`, `c6`, `c7`, `c8` FROM `mysql_fdw_post`.`T 1` WHERE ((`C 1` = 100)) AND ((`c2` = 0))
(4 rows)

--Testcase 51:
EXPLAIN (VERBOSE, COSTS OFF) SELECT * FROM ft1 t1 WHERE c1 IS NULL;        -- NullTest
                                                         QUERY PLAN                                                         
----------------------------------------------------------------------------------------------------------------------------
 Foreign Scan on public.ft1 t1
   Output: c1, c2, c3, c4, c5, c6, c7, c8
   Local server startup cost: 10
   Remote query: SELECT `C 1`, `c2`, `c3`, `c4`, `c5`, `c6`, `c7`, `c8` FROM `mysql_fdw_post`.`T 1` WHERE ((`C 1` IS NULL))
(4 rows)

--Testcase 52:
EXPLAIN (VERBOSE, COSTS OFF) SELECT * FROM ft1 t1 WHERE c1 IS NOT NULL;    -- NullTest
                                                           QUERY PLAN                                                           
--------------------------------------------------------------------------------------------------------------------------------
 Foreign Scan on public.ft1 t1
   Output: c1, c2, c3, c4, c5, c6, c7, c8
   Local server startup cost: 10
   Remote query: SELECT `C 1`, `c2`, `c3`, `c4`, `c5`, `c6`, `c7`, `c8` FROM `mysql_fdw_post`.`T 1` WHERE ((`C 1` IS NOT NULL))
(4 rows)

--Testcase 53:
EXPLAIN (VERBOSE, COSTS OFF) SELECT * FROM ft1 t1 WHERE round(abs(c1), 0) = 1; -- FuncExpr
                                             QUERY PLAN                                             
----------------------------------------------------------------------------------------------------
 Foreign Scan on public.ft1 t1
   Output: c1, c2, c3, c4, c5, c6, c7, c8
   Filter: (round((abs(t1.c1))::numeric, 0) = '1'::numeric)
   Local server startup cost: 10
   Remote query: SELECT `C 1`, `c2`, `c3`, `c4`, `c5`, `c6`, `c7`, `c8` FROM `mysql_fdw_post`.`T 1`
(5 rows)

--Testcase 54:
EXPLAIN (VERBOSE, COSTS OFF) SELECT * FROM ft1 t1 WHERE c1 = -c1;          -- OpExpr(l)
                                                           QUERY PLAN                                                           
--------------------------------------------------------------------------------------------------------------------------------
 Foreign Scan on public.ft1 t1
   Output: c1, c2, c3, c4, c5, c6, c7, c8
   Local server startup cost: 10
   Remote query: SELECT `C 1`, `c2`, `c3`, `c4`, `c5`, `c6`, `c7`, `c8` FROM `mysql_fdw_post`.`T 1` WHERE ((`C 1` = (- `C 1`)))
(4 rows)

-- mysql_fdw does not support Op ! and array
-- EXPLAIN (VERBOSE, COSTS OFF) SELECT * FROM ft1 t1 WHERE 1 = c1!;           -- OpExpr(r)
-- EXPLAIN (VERBOSE, COSTS OFF) SELECT * FROM ft1 t1 WHERE (c1 IS NOT NULL) IS DISTINCT FROM (c1 IS NOT NULL); -- DistinctExpr
-- EXPLAIN (VERBOSE, COSTS OFF) SELECT * FROM ft1 t1 WHERE c1 = ANY(ARRAY[c2, 1, c1 + 0]); -- ScalarArrayOpExpr
-- EXPLAIN (VERBOSE, COSTS OFF) SELECT * FROM ft1 t1 WHERE c1 = (ARRAY[c1,c2,3])[1]; -- SubscriptingRef
--Testcase 55:
EXPLAIN (VERBOSE, COSTS OFF) SELECT * FROM ft1 t1 WHERE c6 = E'foo''s\\bar';  -- check special chars
                                                            QUERY PLAN                                                             
-----------------------------------------------------------------------------------------------------------------------------------
 Foreign Scan on public.ft1 t1
   Output: c1, c2, c3, c4, c5, c6, c7, c8
   Local server startup cost: 10
   Remote query: SELECT `C 1`, `c2`, `c3`, `c4`, `c5`, `c6`, `c7`, `c8` FROM `mysql_fdw_post`.`T 1` WHERE ((`c6` = 'foo''s\\bar'))
(4 rows)

--Testcase 56:
EXPLAIN (VERBOSE, COSTS OFF) SELECT * FROM ft1 t1 WHERE c8 = 'foo';  -- can't be sent to remote
                                             QUERY PLAN                                             
----------------------------------------------------------------------------------------------------
 Foreign Scan on public.ft1 t1
   Output: c1, c2, c3, c4, c5, c6, c7, c8
   Filter: (t1.c8 = 'foo'::user_enum)
   Local server startup cost: 10
   Remote query: SELECT `C 1`, `c2`, `c3`, `c4`, `c5`, `c6`, `c7`, `c8` FROM `mysql_fdw_post`.`T 1`
(5 rows)

-- parameterized remote path for foreign table
--Testcase 57:
EXPLAIN (VERBOSE, COSTS OFF)
  SELECT * FROM "S 1"."T 1" a, ft2 b WHERE a."C 1" = 47 AND b.c1 = a.c2;
                                                                                                                                           QUERY PLAN                                                                                                                                            
-------------------------------------------------------------------------------------------------------------------------------------------------------------------------------------------------------------------------------------------------------------------------------------------------
 Foreign Scan
   Output: a."C 1", a.c2, a.c3, a.c4, a.c5, a.c6, a.c7, a.c8, b.c1, b.c2, b.c3, b.c4, b.c5, b.c6, b.c7, b.c8
   Local server startup cost: 10
   Remote query: SELECT r1.`C 1`, r1.`c2`, r1.`c3`, r1.`c4`, r1.`c5`, r1.`c6`, r1.`c7`, r1.`c8`, r2.`C 1`, r2.`c2`, r2.`c3`, r2.`c4`, r2.`c5`, r2.`c6`, r2.`c7`, r2.`c8` FROM (`mysql_fdw_post`.`T 1` r1 INNER JOIN `mysql_fdw_post`.`T 1` r2 ON (((r1.`c2` = r2.`C 1`)) AND ((r1.`C 1` = 47))))
(4 rows)

--Testcase 58:
SELECT * FROM ft2 a, ft2 b WHERE a.c1 = 47 AND b.c1 = a.c2;
 c1 | c2 |  c3   |              c4              |            c5            | c6 | c7 | c8  | c1 | c2 |  c3   |              c4              |            c5            | c6 | c7 | c8  
----+----+-------+------------------------------+--------------------------+----+----+-----+----+----+-------+------------------------------+--------------------------+----+----+-----
 47 |  7 | 00047 | Tue Feb 17 00:00:00 1970 PST | Tue Feb 17 00:00:00 1970 | 7  | 7  | foo |  7 |  7 | 00007 | Thu Jan 08 00:00:00 1970 PST | Thu Jan 08 00:00:00 1970 | 7  | 7  | foo
(1 row)

-- check both safe and unsafe join conditions
--Testcase 59:
EXPLAIN (VERBOSE, COSTS OFF)
  SELECT * FROM ft2 a, ft2 b
  WHERE a.c2 = 6 AND b.c1 = a.c1 AND a.c8 = 'foo' AND b.c7 = upper(a.c7);
                                                                               QUERY PLAN                                                                                
-------------------------------------------------------------------------------------------------------------------------------------------------------------------------
 Merge Join
   Output: a.c1, a.c2, a.c3, a.c4, a.c5, a.c6, a.c7, a.c8, b.c1, b.c2, b.c3, b.c4, b.c5, b.c6, b.c7, b.c8
   Merge Cond: (b.c1 = a.c1)
   Join Filter: (upper((a.c7)::text) = (b.c7)::text)
   ->  Foreign Scan on public.ft2 b
         Output: b.c1, b.c2, b.c3, b.c4, b.c5, b.c6, b.c7, b.c8
         Local server startup cost: 10
         Remote query: SELECT `C 1`, `c2`, `c3`, `c4`, `c5`, `c6`, `c7`, `c8` FROM `mysql_fdw_post`.`T 1` ORDER BY `C 1` IS NULL ASC, `C 1` ASC
   ->  Materialize
         Output: a.c1, a.c2, a.c3, a.c4, a.c5, a.c6, a.c7, a.c8
         ->  Foreign Scan on public.ft2 a
               Output: a.c1, a.c2, a.c3, a.c4, a.c5, a.c6, a.c7, a.c8
               Filter: (a.c8 = 'foo'::user_enum)
               Local server startup cost: 10
               Remote query: SELECT `C 1`, `c2`, `c3`, `c4`, `c5`, `c6`, `c7`, `c8` FROM `mysql_fdw_post`.`T 1` WHERE ((`c2` = 6)) ORDER BY `C 1` IS NULL ASC, `C 1` ASC
(15 rows)

--Testcase 60:
SELECT * FROM ft2 a, ft2 b
WHERE a.c2 = 6 AND b.c1 = a.c1 AND a.c8 = 'foo' AND b.c7 = upper(a.c7);
 c1  | c2 |  c3   |              c4              |            c5            | c6 | c7 | c8  | c1  | c2 |  c3   |              c4              |            c5            | c6 | c7 | c8  
-----+----+-------+------------------------------+--------------------------+----+----+-----+-----+----+-------+------------------------------+--------------------------+----+----+-----
   6 |  6 | 00006 | Wed Jan 07 00:00:00 1970 PST | Wed Jan 07 00:00:00 1970 | 6  | 6  | foo |   6 |  6 | 00006 | Wed Jan 07 00:00:00 1970 PST | Wed Jan 07 00:00:00 1970 | 6  | 6  | foo
  16 |  6 | 00016 | Sat Jan 17 00:00:00 1970 PST | Sat Jan 17 00:00:00 1970 | 6  | 6  | foo |  16 |  6 | 00016 | Sat Jan 17 00:00:00 1970 PST | Sat Jan 17 00:00:00 1970 | 6  | 6  | foo
  26 |  6 | 00026 | Tue Jan 27 00:00:00 1970 PST | Tue Jan 27 00:00:00 1970 | 6  | 6  | foo |  26 |  6 | 00026 | Tue Jan 27 00:00:00 1970 PST | Tue Jan 27 00:00:00 1970 | 6  | 6  | foo
  36 |  6 | 00036 | Fri Feb 06 00:00:00 1970 PST | Fri Feb 06 00:00:00 1970 | 6  | 6  | foo |  36 |  6 | 00036 | Fri Feb 06 00:00:00 1970 PST | Fri Feb 06 00:00:00 1970 | 6  | 6  | foo
  46 |  6 | 00046 | Mon Feb 16 00:00:00 1970 PST | Mon Feb 16 00:00:00 1970 | 6  | 6  | foo |  46 |  6 | 00046 | Mon Feb 16 00:00:00 1970 PST | Mon Feb 16 00:00:00 1970 | 6  | 6  | foo
  56 |  6 | 00056 | Thu Feb 26 00:00:00 1970 PST | Thu Feb 26 00:00:00 1970 | 6  | 6  | foo |  56 |  6 | 00056 | Thu Feb 26 00:00:00 1970 PST | Thu Feb 26 00:00:00 1970 | 6  | 6  | foo
  66 |  6 | 00066 | Sun Mar 08 00:00:00 1970 PST | Sun Mar 08 00:00:00 1970 | 6  | 6  | foo |  66 |  6 | 00066 | Sun Mar 08 00:00:00 1970 PST | Sun Mar 08 00:00:00 1970 | 6  | 6  | foo
  76 |  6 | 00076 | Wed Mar 18 00:00:00 1970 PST | Wed Mar 18 00:00:00 1970 | 6  | 6  | foo |  76 |  6 | 00076 | Wed Mar 18 00:00:00 1970 PST | Wed Mar 18 00:00:00 1970 | 6  | 6  | foo
  86 |  6 | 00086 | Sat Mar 28 00:00:00 1970 PST | Sat Mar 28 00:00:00 1970 | 6  | 6  | foo |  86 |  6 | 00086 | Sat Mar 28 00:00:00 1970 PST | Sat Mar 28 00:00:00 1970 | 6  | 6  | foo
  96 |  6 | 00096 | Tue Apr 07 00:00:00 1970 PST | Tue Apr 07 00:00:00 1970 | 6  | 6  | foo |  96 |  6 | 00096 | Tue Apr 07 00:00:00 1970 PST | Tue Apr 07 00:00:00 1970 | 6  | 6  | foo
 106 |  6 | 00106 | Wed Jan 07 00:00:00 1970 PST | Wed Jan 07 00:00:00 1970 | 6  | 6  | foo | 106 |  6 | 00106 | Wed Jan 07 00:00:00 1970 PST | Wed Jan 07 00:00:00 1970 | 6  | 6  | foo
 116 |  6 | 00116 | Sat Jan 17 00:00:00 1970 PST | Sat Jan 17 00:00:00 1970 | 6  | 6  | foo | 116 |  6 | 00116 | Sat Jan 17 00:00:00 1970 PST | Sat Jan 17 00:00:00 1970 | 6  | 6  | foo
 126 |  6 | 00126 | Tue Jan 27 00:00:00 1970 PST | Tue Jan 27 00:00:00 1970 | 6  | 6  | foo | 126 |  6 | 00126 | Tue Jan 27 00:00:00 1970 PST | Tue Jan 27 00:00:00 1970 | 6  | 6  | foo
 136 |  6 | 00136 | Fri Feb 06 00:00:00 1970 PST | Fri Feb 06 00:00:00 1970 | 6  | 6  | foo | 136 |  6 | 00136 | Fri Feb 06 00:00:00 1970 PST | Fri Feb 06 00:00:00 1970 | 6  | 6  | foo
 146 |  6 | 00146 | Mon Feb 16 00:00:00 1970 PST | Mon Feb 16 00:00:00 1970 | 6  | 6  | foo | 146 |  6 | 00146 | Mon Feb 16 00:00:00 1970 PST | Mon Feb 16 00:00:00 1970 | 6  | 6  | foo
 156 |  6 | 00156 | Thu Feb 26 00:00:00 1970 PST | Thu Feb 26 00:00:00 1970 | 6  | 6  | foo | 156 |  6 | 00156 | Thu Feb 26 00:00:00 1970 PST | Thu Feb 26 00:00:00 1970 | 6  | 6  | foo
 166 |  6 | 00166 | Sun Mar 08 00:00:00 1970 PST | Sun Mar 08 00:00:00 1970 | 6  | 6  | foo | 166 |  6 | 00166 | Sun Mar 08 00:00:00 1970 PST | Sun Mar 08 00:00:00 1970 | 6  | 6  | foo
 176 |  6 | 00176 | Wed Mar 18 00:00:00 1970 PST | Wed Mar 18 00:00:00 1970 | 6  | 6  | foo | 176 |  6 | 00176 | Wed Mar 18 00:00:00 1970 PST | Wed Mar 18 00:00:00 1970 | 6  | 6  | foo
 186 |  6 | 00186 | Sat Mar 28 00:00:00 1970 PST | Sat Mar 28 00:00:00 1970 | 6  | 6  | foo | 186 |  6 | 00186 | Sat Mar 28 00:00:00 1970 PST | Sat Mar 28 00:00:00 1970 | 6  | 6  | foo
 196 |  6 | 00196 | Tue Apr 07 00:00:00 1970 PST | Tue Apr 07 00:00:00 1970 | 6  | 6  | foo | 196 |  6 | 00196 | Tue Apr 07 00:00:00 1970 PST | Tue Apr 07 00:00:00 1970 | 6  | 6  | foo
 206 |  6 | 00206 | Wed Jan 07 00:00:00 1970 PST | Wed Jan 07 00:00:00 1970 | 6  | 6  | foo | 206 |  6 | 00206 | Wed Jan 07 00:00:00 1970 PST | Wed Jan 07 00:00:00 1970 | 6  | 6  | foo
 216 |  6 | 00216 | Sat Jan 17 00:00:00 1970 PST | Sat Jan 17 00:00:00 1970 | 6  | 6  | foo | 216 |  6 | 00216 | Sat Jan 17 00:00:00 1970 PST | Sat Jan 17 00:00:00 1970 | 6  | 6  | foo
 226 |  6 | 00226 | Tue Jan 27 00:00:00 1970 PST | Tue Jan 27 00:00:00 1970 | 6  | 6  | foo | 226 |  6 | 00226 | Tue Jan 27 00:00:00 1970 PST | Tue Jan 27 00:00:00 1970 | 6  | 6  | foo
 236 |  6 | 00236 | Fri Feb 06 00:00:00 1970 PST | Fri Feb 06 00:00:00 1970 | 6  | 6  | foo | 236 |  6 | 00236 | Fri Feb 06 00:00:00 1970 PST | Fri Feb 06 00:00:00 1970 | 6  | 6  | foo
 246 |  6 | 00246 | Mon Feb 16 00:00:00 1970 PST | Mon Feb 16 00:00:00 1970 | 6  | 6  | foo | 246 |  6 | 00246 | Mon Feb 16 00:00:00 1970 PST | Mon Feb 16 00:00:00 1970 | 6  | 6  | foo
 256 |  6 | 00256 | Thu Feb 26 00:00:00 1970 PST | Thu Feb 26 00:00:00 1970 | 6  | 6  | foo | 256 |  6 | 00256 | Thu Feb 26 00:00:00 1970 PST | Thu Feb 26 00:00:00 1970 | 6  | 6  | foo
 266 |  6 | 00266 | Sun Mar 08 00:00:00 1970 PST | Sun Mar 08 00:00:00 1970 | 6  | 6  | foo | 266 |  6 | 00266 | Sun Mar 08 00:00:00 1970 PST | Sun Mar 08 00:00:00 1970 | 6  | 6  | foo
 276 |  6 | 00276 | Wed Mar 18 00:00:00 1970 PST | Wed Mar 18 00:00:00 1970 | 6  | 6  | foo | 276 |  6 | 00276 | Wed Mar 18 00:00:00 1970 PST | Wed Mar 18 00:00:00 1970 | 6  | 6  | foo
 286 |  6 | 00286 | Sat Mar 28 00:00:00 1970 PST | Sat Mar 28 00:00:00 1970 | 6  | 6  | foo | 286 |  6 | 00286 | Sat Mar 28 00:00:00 1970 PST | Sat Mar 28 00:00:00 1970 | 6  | 6  | foo
 296 |  6 | 00296 | Tue Apr 07 00:00:00 1970 PST | Tue Apr 07 00:00:00 1970 | 6  | 6  | foo | 296 |  6 | 00296 | Tue Apr 07 00:00:00 1970 PST | Tue Apr 07 00:00:00 1970 | 6  | 6  | foo
 306 |  6 | 00306 | Wed Jan 07 00:00:00 1970 PST | Wed Jan 07 00:00:00 1970 | 6  | 6  | foo | 306 |  6 | 00306 | Wed Jan 07 00:00:00 1970 PST | Wed Jan 07 00:00:00 1970 | 6  | 6  | foo
 316 |  6 | 00316 | Sat Jan 17 00:00:00 1970 PST | Sat Jan 17 00:00:00 1970 | 6  | 6  | foo | 316 |  6 | 00316 | Sat Jan 17 00:00:00 1970 PST | Sat Jan 17 00:00:00 1970 | 6  | 6  | foo
 326 |  6 | 00326 | Tue Jan 27 00:00:00 1970 PST | Tue Jan 27 00:00:00 1970 | 6  | 6  | foo | 326 |  6 | 00326 | Tue Jan 27 00:00:00 1970 PST | Tue Jan 27 00:00:00 1970 | 6  | 6  | foo
 336 |  6 | 00336 | Fri Feb 06 00:00:00 1970 PST | Fri Feb 06 00:00:00 1970 | 6  | 6  | foo | 336 |  6 | 00336 | Fri Feb 06 00:00:00 1970 PST | Fri Feb 06 00:00:00 1970 | 6  | 6  | foo
 346 |  6 | 00346 | Mon Feb 16 00:00:00 1970 PST | Mon Feb 16 00:00:00 1970 | 6  | 6  | foo | 346 |  6 | 00346 | Mon Feb 16 00:00:00 1970 PST | Mon Feb 16 00:00:00 1970 | 6  | 6  | foo
 356 |  6 | 00356 | Thu Feb 26 00:00:00 1970 PST | Thu Feb 26 00:00:00 1970 | 6  | 6  | foo | 356 |  6 | 00356 | Thu Feb 26 00:00:00 1970 PST | Thu Feb 26 00:00:00 1970 | 6  | 6  | foo
 366 |  6 | 00366 | Sun Mar 08 00:00:00 1970 PST | Sun Mar 08 00:00:00 1970 | 6  | 6  | foo | 366 |  6 | 00366 | Sun Mar 08 00:00:00 1970 PST | Sun Mar 08 00:00:00 1970 | 6  | 6  | foo
 376 |  6 | 00376 | Wed Mar 18 00:00:00 1970 PST | Wed Mar 18 00:00:00 1970 | 6  | 6  | foo | 376 |  6 | 00376 | Wed Mar 18 00:00:00 1970 PST | Wed Mar 18 00:00:00 1970 | 6  | 6  | foo
 386 |  6 | 00386 | Sat Mar 28 00:00:00 1970 PST | Sat Mar 28 00:00:00 1970 | 6  | 6  | foo | 386 |  6 | 00386 | Sat Mar 28 00:00:00 1970 PST | Sat Mar 28 00:00:00 1970 | 6  | 6  | foo
 396 |  6 | 00396 | Tue Apr 07 00:00:00 1970 PST | Tue Apr 07 00:00:00 1970 | 6  | 6  | foo | 396 |  6 | 00396 | Tue Apr 07 00:00:00 1970 PST | Tue Apr 07 00:00:00 1970 | 6  | 6  | foo
 406 |  6 | 00406 | Wed Jan 07 00:00:00 1970 PST | Wed Jan 07 00:00:00 1970 | 6  | 6  | foo | 406 |  6 | 00406 | Wed Jan 07 00:00:00 1970 PST | Wed Jan 07 00:00:00 1970 | 6  | 6  | foo
 416 |  6 | 00416 | Sat Jan 17 00:00:00 1970 PST | Sat Jan 17 00:00:00 1970 | 6  | 6  | foo | 416 |  6 | 00416 | Sat Jan 17 00:00:00 1970 PST | Sat Jan 17 00:00:00 1970 | 6  | 6  | foo
 426 |  6 | 00426 | Tue Jan 27 00:00:00 1970 PST | Tue Jan 27 00:00:00 1970 | 6  | 6  | foo | 426 |  6 | 00426 | Tue Jan 27 00:00:00 1970 PST | Tue Jan 27 00:00:00 1970 | 6  | 6  | foo
 436 |  6 | 00436 | Fri Feb 06 00:00:00 1970 PST | Fri Feb 06 00:00:00 1970 | 6  | 6  | foo | 436 |  6 | 00436 | Fri Feb 06 00:00:00 1970 PST | Fri Feb 06 00:00:00 1970 | 6  | 6  | foo
 446 |  6 | 00446 | Mon Feb 16 00:00:00 1970 PST | Mon Feb 16 00:00:00 1970 | 6  | 6  | foo | 446 |  6 | 00446 | Mon Feb 16 00:00:00 1970 PST | Mon Feb 16 00:00:00 1970 | 6  | 6  | foo
 456 |  6 | 00456 | Thu Feb 26 00:00:00 1970 PST | Thu Feb 26 00:00:00 1970 | 6  | 6  | foo | 456 |  6 | 00456 | Thu Feb 26 00:00:00 1970 PST | Thu Feb 26 00:00:00 1970 | 6  | 6  | foo
 466 |  6 | 00466 | Sun Mar 08 00:00:00 1970 PST | Sun Mar 08 00:00:00 1970 | 6  | 6  | foo | 466 |  6 | 00466 | Sun Mar 08 00:00:00 1970 PST | Sun Mar 08 00:00:00 1970 | 6  | 6  | foo
 476 |  6 | 00476 | Wed Mar 18 00:00:00 1970 PST | Wed Mar 18 00:00:00 1970 | 6  | 6  | foo | 476 |  6 | 00476 | Wed Mar 18 00:00:00 1970 PST | Wed Mar 18 00:00:00 1970 | 6  | 6  | foo
 486 |  6 | 00486 | Sat Mar 28 00:00:00 1970 PST | Sat Mar 28 00:00:00 1970 | 6  | 6  | foo | 486 |  6 | 00486 | Sat Mar 28 00:00:00 1970 PST | Sat Mar 28 00:00:00 1970 | 6  | 6  | foo
 496 |  6 | 00496 | Tue Apr 07 00:00:00 1970 PST | Tue Apr 07 00:00:00 1970 | 6  | 6  | foo | 496 |  6 | 00496 | Tue Apr 07 00:00:00 1970 PST | Tue Apr 07 00:00:00 1970 | 6  | 6  | foo
 506 |  6 | 00506 | Wed Jan 07 00:00:00 1970 PST | Wed Jan 07 00:00:00 1970 | 6  | 6  | foo | 506 |  6 | 00506 | Wed Jan 07 00:00:00 1970 PST | Wed Jan 07 00:00:00 1970 | 6  | 6  | foo
 516 |  6 | 00516 | Sat Jan 17 00:00:00 1970 PST | Sat Jan 17 00:00:00 1970 | 6  | 6  | foo | 516 |  6 | 00516 | Sat Jan 17 00:00:00 1970 PST | Sat Jan 17 00:00:00 1970 | 6  | 6  | foo
 526 |  6 | 00526 | Tue Jan 27 00:00:00 1970 PST | Tue Jan 27 00:00:00 1970 | 6  | 6  | foo | 526 |  6 | 00526 | Tue Jan 27 00:00:00 1970 PST | Tue Jan 27 00:00:00 1970 | 6  | 6  | foo
 536 |  6 | 00536 | Fri Feb 06 00:00:00 1970 PST | Fri Feb 06 00:00:00 1970 | 6  | 6  | foo | 536 |  6 | 00536 | Fri Feb 06 00:00:00 1970 PST | Fri Feb 06 00:00:00 1970 | 6  | 6  | foo
 546 |  6 | 00546 | Mon Feb 16 00:00:00 1970 PST | Mon Feb 16 00:00:00 1970 | 6  | 6  | foo | 546 |  6 | 00546 | Mon Feb 16 00:00:00 1970 PST | Mon Feb 16 00:00:00 1970 | 6  | 6  | foo
 556 |  6 | 00556 | Thu Feb 26 00:00:00 1970 PST | Thu Feb 26 00:00:00 1970 | 6  | 6  | foo | 556 |  6 | 00556 | Thu Feb 26 00:00:00 1970 PST | Thu Feb 26 00:00:00 1970 | 6  | 6  | foo
 566 |  6 | 00566 | Sun Mar 08 00:00:00 1970 PST | Sun Mar 08 00:00:00 1970 | 6  | 6  | foo | 566 |  6 | 00566 | Sun Mar 08 00:00:00 1970 PST | Sun Mar 08 00:00:00 1970 | 6  | 6  | foo
 576 |  6 | 00576 | Wed Mar 18 00:00:00 1970 PST | Wed Mar 18 00:00:00 1970 | 6  | 6  | foo | 576 |  6 | 00576 | Wed Mar 18 00:00:00 1970 PST | Wed Mar 18 00:00:00 1970 | 6  | 6  | foo
 586 |  6 | 00586 | Sat Mar 28 00:00:00 1970 PST | Sat Mar 28 00:00:00 1970 | 6  | 6  | foo | 586 |  6 | 00586 | Sat Mar 28 00:00:00 1970 PST | Sat Mar 28 00:00:00 1970 | 6  | 6  | foo
 596 |  6 | 00596 | Tue Apr 07 00:00:00 1970 PST | Tue Apr 07 00:00:00 1970 | 6  | 6  | foo | 596 |  6 | 00596 | Tue Apr 07 00:00:00 1970 PST | Tue Apr 07 00:00:00 1970 | 6  | 6  | foo
 606 |  6 | 00606 | Wed Jan 07 00:00:00 1970 PST | Wed Jan 07 00:00:00 1970 | 6  | 6  | foo | 606 |  6 | 00606 | Wed Jan 07 00:00:00 1970 PST | Wed Jan 07 00:00:00 1970 | 6  | 6  | foo
 616 |  6 | 00616 | Sat Jan 17 00:00:00 1970 PST | Sat Jan 17 00:00:00 1970 | 6  | 6  | foo | 616 |  6 | 00616 | Sat Jan 17 00:00:00 1970 PST | Sat Jan 17 00:00:00 1970 | 6  | 6  | foo
 626 |  6 | 00626 | Tue Jan 27 00:00:00 1970 PST | Tue Jan 27 00:00:00 1970 | 6  | 6  | foo | 626 |  6 | 00626 | Tue Jan 27 00:00:00 1970 PST | Tue Jan 27 00:00:00 1970 | 6  | 6  | foo
 636 |  6 | 00636 | Fri Feb 06 00:00:00 1970 PST | Fri Feb 06 00:00:00 1970 | 6  | 6  | foo | 636 |  6 | 00636 | Fri Feb 06 00:00:00 1970 PST | Fri Feb 06 00:00:00 1970 | 6  | 6  | foo
 646 |  6 | 00646 | Mon Feb 16 00:00:00 1970 PST | Mon Feb 16 00:00:00 1970 | 6  | 6  | foo | 646 |  6 | 00646 | Mon Feb 16 00:00:00 1970 PST | Mon Feb 16 00:00:00 1970 | 6  | 6  | foo
 656 |  6 | 00656 | Thu Feb 26 00:00:00 1970 PST | Thu Feb 26 00:00:00 1970 | 6  | 6  | foo | 656 |  6 | 00656 | Thu Feb 26 00:00:00 1970 PST | Thu Feb 26 00:00:00 1970 | 6  | 6  | foo
 666 |  6 | 00666 | Sun Mar 08 00:00:00 1970 PST | Sun Mar 08 00:00:00 1970 | 6  | 6  | foo | 666 |  6 | 00666 | Sun Mar 08 00:00:00 1970 PST | Sun Mar 08 00:00:00 1970 | 6  | 6  | foo
 676 |  6 | 00676 | Wed Mar 18 00:00:00 1970 PST | Wed Mar 18 00:00:00 1970 | 6  | 6  | foo | 676 |  6 | 00676 | Wed Mar 18 00:00:00 1970 PST | Wed Mar 18 00:00:00 1970 | 6  | 6  | foo
 686 |  6 | 00686 | Sat Mar 28 00:00:00 1970 PST | Sat Mar 28 00:00:00 1970 | 6  | 6  | foo | 686 |  6 | 00686 | Sat Mar 28 00:00:00 1970 PST | Sat Mar 28 00:00:00 1970 | 6  | 6  | foo
 696 |  6 | 00696 | Tue Apr 07 00:00:00 1970 PST | Tue Apr 07 00:00:00 1970 | 6  | 6  | foo | 696 |  6 | 00696 | Tue Apr 07 00:00:00 1970 PST | Tue Apr 07 00:00:00 1970 | 6  | 6  | foo
 706 |  6 | 00706 | Wed Jan 07 00:00:00 1970 PST | Wed Jan 07 00:00:00 1970 | 6  | 6  | foo | 706 |  6 | 00706 | Wed Jan 07 00:00:00 1970 PST | Wed Jan 07 00:00:00 1970 | 6  | 6  | foo
 716 |  6 | 00716 | Sat Jan 17 00:00:00 1970 PST | Sat Jan 17 00:00:00 1970 | 6  | 6  | foo | 716 |  6 | 00716 | Sat Jan 17 00:00:00 1970 PST | Sat Jan 17 00:00:00 1970 | 6  | 6  | foo
 726 |  6 | 00726 | Tue Jan 27 00:00:00 1970 PST | Tue Jan 27 00:00:00 1970 | 6  | 6  | foo | 726 |  6 | 00726 | Tue Jan 27 00:00:00 1970 PST | Tue Jan 27 00:00:00 1970 | 6  | 6  | foo
 736 |  6 | 00736 | Fri Feb 06 00:00:00 1970 PST | Fri Feb 06 00:00:00 1970 | 6  | 6  | foo | 736 |  6 | 00736 | Fri Feb 06 00:00:00 1970 PST | Fri Feb 06 00:00:00 1970 | 6  | 6  | foo
 746 |  6 | 00746 | Mon Feb 16 00:00:00 1970 PST | Mon Feb 16 00:00:00 1970 | 6  | 6  | foo | 746 |  6 | 00746 | Mon Feb 16 00:00:00 1970 PST | Mon Feb 16 00:00:00 1970 | 6  | 6  | foo
 756 |  6 | 00756 | Thu Feb 26 00:00:00 1970 PST | Thu Feb 26 00:00:00 1970 | 6  | 6  | foo | 756 |  6 | 00756 | Thu Feb 26 00:00:00 1970 PST | Thu Feb 26 00:00:00 1970 | 6  | 6  | foo
 766 |  6 | 00766 | Sun Mar 08 00:00:00 1970 PST | Sun Mar 08 00:00:00 1970 | 6  | 6  | foo | 766 |  6 | 00766 | Sun Mar 08 00:00:00 1970 PST | Sun Mar 08 00:00:00 1970 | 6  | 6  | foo
 776 |  6 | 00776 | Wed Mar 18 00:00:00 1970 PST | Wed Mar 18 00:00:00 1970 | 6  | 6  | foo | 776 |  6 | 00776 | Wed Mar 18 00:00:00 1970 PST | Wed Mar 18 00:00:00 1970 | 6  | 6  | foo
 786 |  6 | 00786 | Sat Mar 28 00:00:00 1970 PST | Sat Mar 28 00:00:00 1970 | 6  | 6  | foo | 786 |  6 | 00786 | Sat Mar 28 00:00:00 1970 PST | Sat Mar 28 00:00:00 1970 | 6  | 6  | foo
 796 |  6 | 00796 | Tue Apr 07 00:00:00 1970 PST | Tue Apr 07 00:00:00 1970 | 6  | 6  | foo | 796 |  6 | 00796 | Tue Apr 07 00:00:00 1970 PST | Tue Apr 07 00:00:00 1970 | 6  | 6  | foo
 806 |  6 | 00806 | Wed Jan 07 00:00:00 1970 PST | Wed Jan 07 00:00:00 1970 | 6  | 6  | foo | 806 |  6 | 00806 | Wed Jan 07 00:00:00 1970 PST | Wed Jan 07 00:00:00 1970 | 6  | 6  | foo
 816 |  6 | 00816 | Sat Jan 17 00:00:00 1970 PST | Sat Jan 17 00:00:00 1970 | 6  | 6  | foo | 816 |  6 | 00816 | Sat Jan 17 00:00:00 1970 PST | Sat Jan 17 00:00:00 1970 | 6  | 6  | foo
 826 |  6 | 00826 | Tue Jan 27 00:00:00 1970 PST | Tue Jan 27 00:00:00 1970 | 6  | 6  | foo | 826 |  6 | 00826 | Tue Jan 27 00:00:00 1970 PST | Tue Jan 27 00:00:00 1970 | 6  | 6  | foo
 836 |  6 | 00836 | Fri Feb 06 00:00:00 1970 PST | Fri Feb 06 00:00:00 1970 | 6  | 6  | foo | 836 |  6 | 00836 | Fri Feb 06 00:00:00 1970 PST | Fri Feb 06 00:00:00 1970 | 6  | 6  | foo
 846 |  6 | 00846 | Mon Feb 16 00:00:00 1970 PST | Mon Feb 16 00:00:00 1970 | 6  | 6  | foo | 846 |  6 | 00846 | Mon Feb 16 00:00:00 1970 PST | Mon Feb 16 00:00:00 1970 | 6  | 6  | foo
 856 |  6 | 00856 | Thu Feb 26 00:00:00 1970 PST | Thu Feb 26 00:00:00 1970 | 6  | 6  | foo | 856 |  6 | 00856 | Thu Feb 26 00:00:00 1970 PST | Thu Feb 26 00:00:00 1970 | 6  | 6  | foo
 866 |  6 | 00866 | Sun Mar 08 00:00:00 1970 PST | Sun Mar 08 00:00:00 1970 | 6  | 6  | foo | 866 |  6 | 00866 | Sun Mar 08 00:00:00 1970 PST | Sun Mar 08 00:00:00 1970 | 6  | 6  | foo
 876 |  6 | 00876 | Wed Mar 18 00:00:00 1970 PST | Wed Mar 18 00:00:00 1970 | 6  | 6  | foo | 876 |  6 | 00876 | Wed Mar 18 00:00:00 1970 PST | Wed Mar 18 00:00:00 1970 | 6  | 6  | foo
 886 |  6 | 00886 | Sat Mar 28 00:00:00 1970 PST | Sat Mar 28 00:00:00 1970 | 6  | 6  | foo | 886 |  6 | 00886 | Sat Mar 28 00:00:00 1970 PST | Sat Mar 28 00:00:00 1970 | 6  | 6  | foo
 896 |  6 | 00896 | Tue Apr 07 00:00:00 1970 PST | Tue Apr 07 00:00:00 1970 | 6  | 6  | foo | 896 |  6 | 00896 | Tue Apr 07 00:00:00 1970 PST | Tue Apr 07 00:00:00 1970 | 6  | 6  | foo
 906 |  6 | 00906 | Wed Jan 07 00:00:00 1970 PST | Wed Jan 07 00:00:00 1970 | 6  | 6  | foo | 906 |  6 | 00906 | Wed Jan 07 00:00:00 1970 PST | Wed Jan 07 00:00:00 1970 | 6  | 6  | foo
 916 |  6 | 00916 | Sat Jan 17 00:00:00 1970 PST | Sat Jan 17 00:00:00 1970 | 6  | 6  | foo | 916 |  6 | 00916 | Sat Jan 17 00:00:00 1970 PST | Sat Jan 17 00:00:00 1970 | 6  | 6  | foo
 926 |  6 | 00926 | Tue Jan 27 00:00:00 1970 PST | Tue Jan 27 00:00:00 1970 | 6  | 6  | foo | 926 |  6 | 00926 | Tue Jan 27 00:00:00 1970 PST | Tue Jan 27 00:00:00 1970 | 6  | 6  | foo
 936 |  6 | 00936 | Fri Feb 06 00:00:00 1970 PST | Fri Feb 06 00:00:00 1970 | 6  | 6  | foo | 936 |  6 | 00936 | Fri Feb 06 00:00:00 1970 PST | Fri Feb 06 00:00:00 1970 | 6  | 6  | foo
 946 |  6 | 00946 | Mon Feb 16 00:00:00 1970 PST | Mon Feb 16 00:00:00 1970 | 6  | 6  | foo | 946 |  6 | 00946 | Mon Feb 16 00:00:00 1970 PST | Mon Feb 16 00:00:00 1970 | 6  | 6  | foo
 956 |  6 | 00956 | Thu Feb 26 00:00:00 1970 PST | Thu Feb 26 00:00:00 1970 | 6  | 6  | foo | 956 |  6 | 00956 | Thu Feb 26 00:00:00 1970 PST | Thu Feb 26 00:00:00 1970 | 6  | 6  | foo
 966 |  6 | 00966 | Sun Mar 08 00:00:00 1970 PST | Sun Mar 08 00:00:00 1970 | 6  | 6  | foo | 966 |  6 | 00966 | Sun Mar 08 00:00:00 1970 PST | Sun Mar 08 00:00:00 1970 | 6  | 6  | foo
 976 |  6 | 00976 | Wed Mar 18 00:00:00 1970 PST | Wed Mar 18 00:00:00 1970 | 6  | 6  | foo | 976 |  6 | 00976 | Wed Mar 18 00:00:00 1970 PST | Wed Mar 18 00:00:00 1970 | 6  | 6  | foo
 986 |  6 | 00986 | Sat Mar 28 00:00:00 1970 PST | Sat Mar 28 00:00:00 1970 | 6  | 6  | foo | 986 |  6 | 00986 | Sat Mar 28 00:00:00 1970 PST | Sat Mar 28 00:00:00 1970 | 6  | 6  | foo
 996 |  6 | 00996 | Tue Apr 07 00:00:00 1970 PST | Tue Apr 07 00:00:00 1970 | 6  | 6  | foo | 996 |  6 | 00996 | Tue Apr 07 00:00:00 1970 PST | Tue Apr 07 00:00:00 1970 | 6  | 6  | foo
(100 rows)

-- mysql_fdw does not support ANY ARRAY with some type
-- -- bug before 9.3.5 due to sloppy handling of remote-estimate parameters
-- SELECT * FROM ft1 WHERE c1 = ANY (ARRAY(SELECT c1 FROM ft2 WHERE c1 < 5));
-- SELECT * FROM ft2 WHERE c1 = ANY (ARRAY(SELECT c1 FROM ft1 WHERE c1 < 5));
-- -- we should not push order by clause with volatile expressions or unsafe
-- collations
--Testcase 61:
EXPLAIN (VERBOSE, COSTS OFF)
	SELECT * FROM ft2 ORDER BY ft2.c1, random();
                                                QUERY PLAN                                                
----------------------------------------------------------------------------------------------------------
 Sort
   Output: c1, c2, c3, c4, c5, c6, c7, c8, (random())
   Sort Key: ft2.c1, (random())
   ->  Foreign Scan on public.ft2
         Output: c1, c2, c3, c4, c5, c6, c7, c8, random()
         Local server startup cost: 10
         Remote query: SELECT `C 1`, `c2`, `c3`, `c4`, `c5`, `c6`, `c7`, `c8` FROM `mysql_fdw_post`.`T 1`
(7 rows)

--Testcase 62:
EXPLAIN (VERBOSE, COSTS OFF)
	SELECT * FROM ft2 ORDER BY ft2.c1, ft2.c3 collate "C";
                                                QUERY PLAN                                                
----------------------------------------------------------------------------------------------------------
 Sort
   Output: c1, c2, c3, c4, c5, c6, c7, c8, ((c3)::text)
   Sort Key: ft2.c1, ft2.c3 COLLATE "C"
   ->  Foreign Scan on public.ft2
         Output: c1, c2, c3, c4, c5, c6, c7, c8, c3
         Local server startup cost: 10
         Remote query: SELECT `C 1`, `c2`, `c3`, `c4`, `c5`, `c6`, `c7`, `c8` FROM `mysql_fdw_post`.`T 1`
(7 rows)

-- user-defined operator/function
--Testcase 63:
CREATE FUNCTION mysql_fdw_abs(int) RETURNS int AS $$
BEGIN
RETURN abs($1);
END
$$ LANGUAGE plpgsql IMMUTABLE;
--Testcase 64:
CREATE OPERATOR === (
    LEFTARG = int,
    RIGHTARG = int,
    PROCEDURE = int4eq,
    COMMUTATOR = ===
);
-- built-in operators and functions can be shipped for remote execution
--Testcase 65:
EXPLAIN (VERBOSE, COSTS OFF)
  SELECT count(c3) FROM ft1 t1 WHERE t1.c1 = abs(t1.c2);
                                         QUERY PLAN                                         
--------------------------------------------------------------------------------------------
 Foreign Scan
   Output: (count(c3))
   Local server startup cost: 10
   Remote query: SELECT count(`c3`) FROM `mysql_fdw_post`.`T 1` WHERE ((`C 1` = abs(`c2`)))
(4 rows)

--Testcase 66:
SELECT count(c3) FROM ft1 t1 WHERE t1.c1 = abs(t1.c2);
 count 
-------
     9
(1 row)

--Testcase 67:
EXPLAIN (VERBOSE, COSTS OFF)
  SELECT count(c3) FROM ft1 t1 WHERE t1.c1 = t1.c2;
                                      QUERY PLAN                                       
---------------------------------------------------------------------------------------
 Foreign Scan
   Output: (count(c3))
   Local server startup cost: 10
   Remote query: SELECT count(`c3`) FROM `mysql_fdw_post`.`T 1` WHERE ((`C 1` = `c2`))
(4 rows)

--Testcase 68:
SELECT count(c3) FROM ft1 t1 WHERE t1.c1 = t1.c2;
 count 
-------
     9
(1 row)

-- by default, user-defined ones cannot
--Testcase 69:
EXPLAIN (VERBOSE, COSTS OFF)
  SELECT count(c3) FROM ft1 t1 WHERE t1.c1 = mysql_fdw_abs(t1.c2);
                                 QUERY PLAN                                 
----------------------------------------------------------------------------
 Aggregate
   Output: count(c3)
   ->  Foreign Scan on public.ft1 t1
         Output: c3
         Filter: (t1.c1 = mysql_fdw_abs(t1.c2))
         Local server startup cost: 10
         Remote query: SELECT `C 1`, `c2`, `c3` FROM `mysql_fdw_post`.`T 1`
(7 rows)

--Testcase 70:
SELECT count(c3) FROM ft1 t1 WHERE t1.c1 = mysql_fdw_abs(t1.c2);
 count 
-------
     9
(1 row)

--Testcase 71:
EXPLAIN (VERBOSE, COSTS OFF)
  SELECT count(c3) FROM ft1 t1 WHERE t1.c1 === t1.c2;
                                 QUERY PLAN                                 
----------------------------------------------------------------------------
 Aggregate
   Output: count(c3)
   ->  Foreign Scan on public.ft1 t1
         Output: c3
         Filter: (t1.c1 === t1.c2)
         Local server startup cost: 10
         Remote query: SELECT `C 1`, `c2`, `c3` FROM `mysql_fdw_post`.`T 1`
(7 rows)

--Testcase 72:
SELECT count(c3) FROM ft1 t1 WHERE t1.c1 === t1.c2;
 count 
-------
     9
(1 row)

-- ORDER BY can be shipped, though
--Testcase 73:
EXPLAIN (VERBOSE, COSTS OFF)
  SELECT * FROM ft1 t1 WHERE t1.c1 === t1.c2 order by t1.c2 limit 1;
                                                                  QUERY PLAN                                                                  
----------------------------------------------------------------------------------------------------------------------------------------------
 Limit
   Output: c1, c2, c3, c4, c5, c6, c7, c8
   ->  Foreign Scan on public.ft1 t1
         Output: c1, c2, c3, c4, c5, c6, c7, c8
         Filter: (t1.c1 === t1.c2)
         Local server startup cost: 10
         Remote query: SELECT `C 1`, `c2`, `c3`, `c4`, `c5`, `c6`, `c7`, `c8` FROM `mysql_fdw_post`.`T 1` ORDER BY `c2` IS NULL ASC, `c2` ASC
(7 rows)

--Testcase 74:
SELECT * FROM ft1 t1 WHERE t1.c1 === t1.c2 order by t1.c2 limit 1;
 c1 | c2 |  c3   |              c4              |            c5            | c6 | c7 | c8  
----+----+-------+------------------------------+--------------------------+----+----+-----
  1 |  1 | 00001 | Fri Jan 02 00:00:00 1970 PST | Fri Jan 02 00:00:00 1970 | 1  | 1  | foo
(1 row)

-- but let's put them in an extension ...
ALTER EXTENSION mysql_fdw ADD FUNCTION mysql_fdw_abs(int);
ALTER EXTENSION mysql_fdw ADD OPERATOR === (int, int);
ALTER SERVER mysql_svr OPTIONS (ADD extensions 'mysql_fdw');
-- ... now they can be shipped
--Testcase 75:
EXPLAIN (VERBOSE, COSTS OFF)
  SELECT count(c3) FROM ft1 t1 WHERE t1.c1 = mysql_fdw_abs(t1.c2);
                                 QUERY PLAN                                 
----------------------------------------------------------------------------
 Aggregate
   Output: count(c3)
   ->  Foreign Scan on public.ft1 t1
         Output: c3
         Filter: (t1.c1 = mysql_fdw_abs(t1.c2))
         Local server startup cost: 10
         Remote query: SELECT `C 1`, `c2`, `c3` FROM `mysql_fdw_post`.`T 1`
(7 rows)

--Testcase 76:
SELECT count(c3) FROM ft1 t1 WHERE t1.c1 = mysql_fdw_abs(t1.c2);
 count 
-------
     9
(1 row)

--Testcase 77:
EXPLAIN (VERBOSE, COSTS OFF)
  SELECT count(c3) FROM ft1 t1 WHERE t1.c1 === t1.c2;
                                 QUERY PLAN                                 
----------------------------------------------------------------------------
 Aggregate
   Output: count(c3)
   ->  Foreign Scan on public.ft1 t1
         Output: c3
         Filter: (t1.c1 === t1.c2)
         Local server startup cost: 10
         Remote query: SELECT `C 1`, `c2`, `c3` FROM `mysql_fdw_post`.`T 1`
(7 rows)

--Testcase 78:
SELECT count(c3) FROM ft1 t1 WHERE t1.c1 === t1.c2;
 count 
-------
     9
(1 row)

-- and both ORDER BY and LIMIT can be shipped
--Testcase 79:
EXPLAIN (VERBOSE, COSTS OFF)
  SELECT * FROM ft1 t1 WHERE t1.c1 === t1.c2 order by t1.c2 limit 1;
                                                                  QUERY PLAN                                                                  
----------------------------------------------------------------------------------------------------------------------------------------------
 Limit
   Output: c1, c2, c3, c4, c5, c6, c7, c8
   ->  Foreign Scan on public.ft1 t1
         Output: c1, c2, c3, c4, c5, c6, c7, c8
         Filter: (t1.c1 === t1.c2)
         Local server startup cost: 10
         Remote query: SELECT `C 1`, `c2`, `c3`, `c4`, `c5`, `c6`, `c7`, `c8` FROM `mysql_fdw_post`.`T 1` ORDER BY `c2` IS NULL ASC, `c2` ASC
(7 rows)

--Testcase 80:
SELECT * FROM ft1 t1 WHERE t1.c1 === t1.c2 order by t1.c2 limit 1;
 c1 | c2 |  c3   |              c4              |            c5            | c6 | c7 | c8  
----+----+-------+------------------------------+--------------------------+----+----+-----
  1 |  1 | 00001 | Fri Jan 02 00:00:00 1970 PST | Fri Jan 02 00:00:00 1970 | 1  | 1  | foo
(1 row)

-- ===================================================================
-- JOIN queries
-- ===================================================================
-- Analyze ft4 and ft5 so that we have better statistics. These tables do not
-- have use_remote_estimate set.
-- ANALYZE ft4;
-- ANALYZE ft5;
-- join two tables
--Testcase 81:
EXPLAIN (VERBOSE, COSTS OFF)
SELECT t1.c1, t2.c1 FROM ft1 t1 JOIN ft2 t2 ON (t1.c1 = t2.c1) ORDER BY t1.c3, t1.c1 OFFSET 100 LIMIT 10;
                                                                                                                QUERY PLAN                                                                                                                 
-------------------------------------------------------------------------------------------------------------------------------------------------------------------------------------------------------------------------------------------
 Limit
   Output: t1.c1, t2.c1, t1.c3
   ->  Foreign Scan
         Output: t1.c1, t2.c1, t1.c3
         Local server startup cost: 10
         Remote query: SELECT r1.`C 1`, r2.`C 1`, r1.`c3` FROM (`mysql_fdw_post`.`T 1` r1 INNER JOIN `mysql_fdw_post`.`T 1` r2 ON (((r1.`C 1` = r2.`C 1`)))) ORDER BY r1.`c3` IS NULL ASC, r1.`c3` ASC, r1.`C 1` IS NULL ASC, r1.`C 1` ASC
(6 rows)

--Testcase 82:
SELECT t1.c1, t2.c1 FROM ft1 t1 JOIN ft2 t2 ON (t1.c1 = t2.c1) ORDER BY t1.c3, t1.c1 OFFSET 100 LIMIT 10;
 c1  | c1  
-----+-----
 101 | 101
 102 | 102
 103 | 103
 104 | 104
 105 | 105
 106 | 106
 107 | 107
 108 | 108
 109 | 109
 110 | 110
(10 rows)

-- join three tables
--Testcase 83:
EXPLAIN (VERBOSE, COSTS OFF)
SELECT t1.c1, t2.c2, t3.c3 FROM ft1 t1 JOIN ft2 t2 ON (t1.c1 = t2.c1) JOIN ft4 t3 ON (t3.c1 = t1.c1) ORDER BY t1.c3, t1.c1 OFFSET 10 LIMIT 10;
                                                                                                                                                      QUERY PLAN                                                                                                                                                      
----------------------------------------------------------------------------------------------------------------------------------------------------------------------------------------------------------------------------------------------------------------------------------------------------------------------
 Limit
   Output: t1.c1, t2.c2, t3.c3, t1.c3
   ->  Foreign Scan
         Output: t1.c1, t2.c2, t3.c3, t1.c3
         Local server startup cost: 10
         Remote query: SELECT r1.`C 1`, r2.`c2`, r4.`c3`, r1.`c3` FROM ((`mysql_fdw_post`.`T 1` r1 INNER JOIN `mysql_fdw_post`.`T 1` r2 ON (((r1.`C 1` = r2.`C 1`)))) INNER JOIN `mysql_fdw_post`.`T 3` r4 ON (((r1.`C 1` = r4.`c1`)))) ORDER BY r1.`c3` IS NULL ASC, r1.`c3` ASC, r1.`C 1` IS NULL ASC, r1.`C 1` ASC
(6 rows)

--Testcase 84:
SELECT t1.c1, t2.c2, t3.c3 FROM ft1 t1 JOIN ft2 t2 ON (t1.c1 = t2.c1) JOIN ft4 t3 ON (t3.c1 = t1.c1) ORDER BY t1.c3, t1.c1 OFFSET 10 LIMIT 10;
 c1 | c2 |   c3   
----+----+--------
 22 |  2 | AAA022
 24 |  4 | AAA024
 26 |  6 | AAA026
 28 |  8 | AAA028
 30 |  0 | AAA030
 32 |  2 | AAA032
 34 |  4 | AAA034
 36 |  6 | AAA036
 38 |  8 | AAA038
 40 |  0 | AAA040
(10 rows)

-- left outer join
--Testcase 85:
EXPLAIN (VERBOSE, COSTS OFF)
SELECT t1.c1, t2.c1 FROM ft4 t1 LEFT JOIN ft5 t2 ON (t1.c1 = t2.c1) ORDER BY t1.c1, t2.c1 OFFSET 10 LIMIT 10;
                                                                                                               QUERY PLAN                                                                                                               
----------------------------------------------------------------------------------------------------------------------------------------------------------------------------------------------------------------------------------------
 Foreign Scan
   Output: t1.c1, t2.c1
   Local server startup cost: 10
   Remote query: SELECT r1.`c1`, r2.`c1` FROM (`mysql_fdw_post`.`T 3` r1 LEFT JOIN `mysql_fdw_post`.`T 4` r2 ON (((r1.`c1` = r2.`c1`)))) ORDER BY r1.`c1` IS NULL ASC, r1.`c1` ASC, r2.`c1` IS NULL ASC, r2.`c1` ASC LIMIT 10 OFFSET 10
(4 rows)

--Testcase 86:
SELECT t1.c1, t2.c1 FROM ft4 t1 LEFT JOIN ft5 t2 ON (t1.c1 = t2.c1) ORDER BY t1.c1, t2.c1 OFFSET 10 LIMIT 10;
 c1 | c1 
----+----
 22 |   
 24 | 24
 26 |   
 28 |   
 30 | 30
 32 |   
 34 |   
 36 | 36
 38 |   
 40 |   
(10 rows)

-- left outer join three tables
--Testcase 87:
EXPLAIN (VERBOSE, COSTS OFF)
SELECT t1.c1, t2.c2, t3.c3 FROM ft2 t1 LEFT JOIN ft2 t2 ON (t1.c1 = t2.c1) LEFT JOIN ft4 t3 ON (t2.c1 = t3.c1) OFFSET 10 LIMIT 10;
                                                                                                                QUERY PLAN                                                                                                                
------------------------------------------------------------------------------------------------------------------------------------------------------------------------------------------------------------------------------------------
 Foreign Scan
   Output: t1.c1, t2.c2, t3.c3
   Local server startup cost: 10
   Remote query: SELECT r1.`C 1`, r2.`c2`, r4.`c3` FROM ((`mysql_fdw_post`.`T 1` r1 LEFT JOIN `mysql_fdw_post`.`T 1` r2 ON (((r1.`C 1` = r2.`C 1`)))) LEFT JOIN `mysql_fdw_post`.`T 3` r4 ON (((r2.`C 1` = r4.`c1`)))) LIMIT 10 OFFSET 10
(4 rows)

--Testcase 88:
SELECT t1.c1, t2.c2, t3.c3 FROM ft2 t1 LEFT JOIN ft2 t2 ON (t1.c1 = t2.c1) LEFT JOIN ft4 t3 ON (t2.c1 = t3.c1) OFFSET 10 LIMIT 10;
 c1 | c2 |   c3   
----+----+--------
 11 |  1 | 
 12 |  2 | AAA012
 13 |  3 | 
 14 |  4 | AAA014
 15 |  5 | 
 16 |  6 | AAA016
 17 |  7 | 
 18 |  8 | AAA018
 19 |  9 | 
 20 |  0 | AAA020
(10 rows)

-- left outer join + placement of clauses.
-- clauses within the nullable side are not pulled up, but top level clause on
-- non-nullable side is pushed into non-nullable side
--Testcase 89:
EXPLAIN (VERBOSE, COSTS OFF)
SELECT t1.c1, t1.c2, t2.c1, t2.c2 FROM ft4 t1 LEFT JOIN (SELECT * FROM ft5 WHERE c1 < 10) t2 ON (t1.c1 = t2.c1) WHERE t1.c1 < 10;
                                          QUERY PLAN                                           
-----------------------------------------------------------------------------------------------
 Hash Left Join
   Output: t1.c1, t1.c2, ft5.c1, ft5.c2
   Hash Cond: (t1.c1 = ft5.c1)
   ->  Foreign Scan on public.ft4 t1
         Output: t1.c1, t1.c2, t1.c3
         Local server startup cost: 10
         Remote query: SELECT `c1`, `c2` FROM `mysql_fdw_post`.`T 3` WHERE ((`c1` < 10))
   ->  Hash
         Output: ft5.c1, ft5.c2
         ->  Foreign Scan on public.ft5
               Output: ft5.c1, ft5.c2
               Local server startup cost: 10
               Remote query: SELECT `c1`, `c2` FROM `mysql_fdw_post`.`T 4` WHERE ((`c1` < 10))
(13 rows)

--Testcase 90:
SELECT t1.c1, t1.c2, t2.c1, t2.c2 FROM ft4 t1 LEFT JOIN (SELECT * FROM ft5 WHERE c1 < 10) t2 ON (t1.c1 = t2.c1) WHERE t1.c1 < 10;
 c1 | c2 | c1 | c2 
----+----+----+----
  2 |  3 |    |   
  4 |  5 |    |   
  6 |  7 |  6 |  7
  8 |  9 |    |   
(4 rows)

-- clauses within the nullable side are not pulled up, but the top level clause
-- on nullable side is not pushed down into nullable side
--Testcase 91:
EXPLAIN (VERBOSE, COSTS OFF)
SELECT t1.c1, t1.c2, t2.c1, t2.c2 FROM ft4 t1 LEFT JOIN (SELECT * FROM ft5 WHERE c1 < 10) t2 ON (t1.c1 = t2.c1)
			WHERE (t2.c1 < 10 OR t2.c1 IS NULL) AND t1.c1 < 10;
                                          QUERY PLAN                                           
-----------------------------------------------------------------------------------------------
 Hash Left Join
   Output: t1.c1, t1.c2, ft5.c1, ft5.c2
   Hash Cond: (t1.c1 = ft5.c1)
   Filter: ((ft5.c1 < 10) OR (ft5.c1 IS NULL))
   ->  Foreign Scan on public.ft4 t1
         Output: t1.c1, t1.c2, t1.c3
         Local server startup cost: 10
         Remote query: SELECT `c1`, `c2` FROM `mysql_fdw_post`.`T 3` WHERE ((`c1` < 10))
   ->  Hash
         Output: ft5.c1, ft5.c2
         ->  Foreign Scan on public.ft5
               Output: ft5.c1, ft5.c2
               Local server startup cost: 10
               Remote query: SELECT `c1`, `c2` FROM `mysql_fdw_post`.`T 4` WHERE ((`c1` < 10))
(14 rows)

--Testcase 92:
SELECT t1.c1, t1.c2, t2.c1, t2.c2 FROM ft4 t1 LEFT JOIN (SELECT * FROM ft5 WHERE c1 < 10) t2 ON (t1.c1 = t2.c1)
			WHERE (t2.c1 < 10 OR t2.c1 IS NULL) AND t1.c1 < 10;
 c1 | c2 | c1 | c2 
----+----+----+----
  2 |  3 |    |   
  4 |  5 |    |   
  6 |  7 |  6 |  7
  8 |  9 |    |   
(4 rows)

-- right outer join
--Testcase 93:
EXPLAIN (VERBOSE, COSTS OFF)
SELECT t1.c1, t2.c1 FROM ft5 t1 RIGHT JOIN ft4 t2 ON (t1.c1 = t2.c1) ORDER BY t2.c1, t1.c1 OFFSET 10 LIMIT 10;
                                                                                                               QUERY PLAN                                                                                                               
----------------------------------------------------------------------------------------------------------------------------------------------------------------------------------------------------------------------------------------
 Foreign Scan
   Output: t1.c1, t2.c1
   Local server startup cost: 10
   Remote query: SELECT r1.`c1`, r2.`c1` FROM (`mysql_fdw_post`.`T 3` r2 LEFT JOIN `mysql_fdw_post`.`T 4` r1 ON (((r1.`c1` = r2.`c1`)))) ORDER BY r2.`c1` IS NULL ASC, r2.`c1` ASC, r1.`c1` IS NULL ASC, r1.`c1` ASC LIMIT 10 OFFSET 10
(4 rows)

--Testcase 94:
SELECT t1.c1, t2.c1 FROM ft5 t1 RIGHT JOIN ft4 t2 ON (t1.c1 = t2.c1) ORDER BY t2.c1, t1.c1 OFFSET 10 LIMIT 10;
 c1 | c1 
----+----
    | 22
 24 | 24
    | 26
    | 28
 30 | 30
    | 32
    | 34
 36 | 36
    | 38
    | 40
(10 rows)

-- right outer join three tables
--Testcase 95:
EXPLAIN (VERBOSE, COSTS OFF)
SELECT t1.c1, t2.c2, t3.c3 FROM ft2 t1 RIGHT JOIN ft2 t2 ON (t1.c1 = t2.c1) RIGHT JOIN ft4 t3 ON (t2.c1 = t3.c1) OFFSET 10 LIMIT 10;
                                                                                                                QUERY PLAN                                                                                                                
------------------------------------------------------------------------------------------------------------------------------------------------------------------------------------------------------------------------------------------
 Foreign Scan
   Output: t1.c1, t2.c2, t3.c3
   Local server startup cost: 10
   Remote query: SELECT r1.`C 1`, r2.`c2`, r4.`c3` FROM ((`mysql_fdw_post`.`T 3` r4 LEFT JOIN `mysql_fdw_post`.`T 1` r2 ON (((r2.`C 1` = r4.`c1`)))) LEFT JOIN `mysql_fdw_post`.`T 1` r1 ON (((r1.`C 1` = r2.`C 1`)))) LIMIT 10 OFFSET 10
(4 rows)

--Testcase 96:
SELECT t1.c1, t2.c2, t3.c3 FROM ft2 t1 RIGHT JOIN ft2 t2 ON (t1.c1 = t2.c1) RIGHT JOIN ft4 t3 ON (t2.c1 = t3.c1) OFFSET 10 LIMIT 10;
 c1 | c2 |   c3   
----+----+--------
 22 |  2 | AAA022
 24 |  4 | AAA024
 26 |  6 | AAA026
 28 |  8 | AAA028
 30 |  0 | AAA030
 32 |  2 | AAA032
 34 |  4 | AAA034
 36 |  6 | AAA036
 38 |  8 | AAA038
 40 |  0 | AAA040
(10 rows)

-- full outer join
--Testcase 97:
EXPLAIN (VERBOSE, COSTS OFF)
SELECT t1.c1, t2.c1 FROM ft4 t1 FULL JOIN ft5 t2 ON (t1.c1 = t2.c1) ORDER BY t1.c1, t2.c1 OFFSET 45 LIMIT 10;
                                   QUERY PLAN                                    
---------------------------------------------------------------------------------
 Limit
   Output: t1.c1, t2.c1
   ->  Sort
         Output: t1.c1, t2.c1
         Sort Key: t1.c1, t2.c1
         ->  Merge Full Join
               Output: t1.c1, t2.c1
               Merge Cond: (t1.c1 = t2.c1)
               ->  Sort
                     Output: t1.c1
                     Sort Key: t1.c1
                     ->  Foreign Scan on public.ft4 t1
                           Output: t1.c1
                           Local server startup cost: 10
                           Remote query: SELECT `c1` FROM `mysql_fdw_post`.`T 3`
               ->  Sort
                     Output: t2.c1
                     Sort Key: t2.c1
                     ->  Foreign Scan on public.ft5 t2
                           Output: t2.c1
                           Local server startup cost: 10
                           Remote query: SELECT `c1` FROM `mysql_fdw_post`.`T 4`
(22 rows)

--Testcase 98:
SELECT t1.c1, t2.c1 FROM ft4 t1 FULL JOIN ft5 t2 ON (t1.c1 = t2.c1) ORDER BY t1.c1, t2.c1 OFFSET 45 LIMIT 10;
 c1  | c1 
-----+----
  92 |   
  94 |   
  96 | 96
  98 |   
 100 |   
     |  3
     |  9
     | 15
     | 21
     | 27
(10 rows)

-- full outer join with restrictions on the joining relations
-- a. the joining relations are both base relations
--Testcase 99:
EXPLAIN (VERBOSE, COSTS OFF)
SELECT t1.c1, t2.c1 FROM (SELECT c1 FROM ft4 WHERE c1 between 50 and 60) t1 FULL JOIN (SELECT c1 FROM ft5 WHERE c1 between 50 and 60) t2 ON (t1.c1 = t2.c1) ORDER BY t1.c1, t2.c1;
                                                    QUERY PLAN                                                     
-------------------------------------------------------------------------------------------------------------------
 Sort
   Output: ft4.c1, ft5.c1
   Sort Key: ft4.c1, ft5.c1
   ->  Hash Full Join
         Output: ft4.c1, ft5.c1
         Hash Cond: (ft4.c1 = ft5.c1)
         ->  Foreign Scan on public.ft4
               Output: ft4.c1, ft4.c2, ft4.c3
               Local server startup cost: 10
               Remote query: SELECT `c1` FROM `mysql_fdw_post`.`T 3` WHERE ((`c1` >= 50)) AND ((`c1` <= 60))
         ->  Hash
               Output: ft5.c1
               ->  Foreign Scan on public.ft5
                     Output: ft5.c1
                     Local server startup cost: 10
                     Remote query: SELECT `c1` FROM `mysql_fdw_post`.`T 4` WHERE ((`c1` >= 50)) AND ((`c1` <= 60))
(16 rows)

--Testcase 100:
SELECT t1.c1, t2.c1 FROM (SELECT c1 FROM ft4 WHERE c1 between 50 and 60) t1 FULL JOIN (SELECT c1 FROM ft5 WHERE c1 between 50 and 60) t2 ON (t1.c1 = t2.c1) ORDER BY t1.c1, t2.c1;
 c1 | c1 
----+----
 50 |   
 52 |   
 54 | 54
 56 |   
 58 |   
 60 | 60
    | 51
    | 57
(8 rows)

--Testcase 101:
EXPLAIN (VERBOSE, COSTS OFF)
SELECT 1 FROM (SELECT c1 FROM ft4 WHERE c1 between 50 and 60) t1 FULL JOIN (SELECT c1 FROM ft5 WHERE c1 between 50 and 60) t2 ON (TRUE) OFFSET 10 LIMIT 10;
                                                    QUERY PLAN                                                     
-------------------------------------------------------------------------------------------------------------------
 Limit
   Output: 1
   ->  Merge Full Join
         Output: 1
         ->  Foreign Scan on public.ft4
               Output: ft4.c1, ft4.c2, ft4.c3
               Local server startup cost: 10
               Remote query: SELECT NULL FROM `mysql_fdw_post`.`T 3` WHERE ((`c1` >= 50)) AND ((`c1` <= 60))
         ->  Materialize
               Output: ft5.c1, ft5.c2, ft5.c3
               ->  Foreign Scan on public.ft5
                     Output: ft5.c1, ft5.c2, ft5.c3
                     Local server startup cost: 10
                     Remote query: SELECT NULL FROM `mysql_fdw_post`.`T 4` WHERE ((`c1` >= 50)) AND ((`c1` <= 60))
(14 rows)

--Testcase 102:
SELECT 1 FROM (SELECT c1 FROM ft4 WHERE c1 between 50 and 60) t1 FULL JOIN (SELECT c1 FROM ft5 WHERE c1 between 50 and 60) t2 ON (TRUE) OFFSET 10 LIMIT 10;
 ?column? 
----------
        1
        1
        1
        1
        1
        1
        1
        1
        1
        1
(10 rows)

-- b. one of the joining relations is a base relation and the other is a join
-- relation
--Testcase 103:
EXPLAIN (VERBOSE, COSTS OFF)
SELECT t1.c1, ss.a, ss.b FROM (SELECT c1 FROM ft4 WHERE c1 between 50 and 60) t1 FULL JOIN (SELECT t2.c1, t3.c1 FROM ft4 t2 LEFT JOIN ft5 t3 ON (t2.c1 = t3.c1) WHERE (t2.c1 between 50 and 60)) ss(a, b) ON (t1.c1 = ss.a) ORDER BY t1.c1, ss.a, ss.b;
                                                                                            QUERY PLAN                                                                                             
---------------------------------------------------------------------------------------------------------------------------------------------------------------------------------------------------
 Sort
   Output: ft4.c1, t2.c1, t3.c1
   Sort Key: ft4.c1, t2.c1, t3.c1
   ->  Hash Full Join
         Output: ft4.c1, t2.c1, t3.c1
         Hash Cond: (t2.c1 = ft4.c1)
         ->  Foreign Scan
               Output: t2.c1, t3.c1
               Local server startup cost: 10
               Remote query: SELECT r5.`c1`, r6.`c1` FROM (`mysql_fdw_post`.`T 3` r5 LEFT JOIN `mysql_fdw_post`.`T 4` r6 ON (((r5.`c1` = r6.`c1`)))) WHERE ((r5.`c1` >= 50)) AND ((r5.`c1` <= 60))
         ->  Hash
               Output: ft4.c1
               ->  Foreign Scan on public.ft4
                     Output: ft4.c1
                     Local server startup cost: 10
                     Remote query: SELECT `c1` FROM `mysql_fdw_post`.`T 3` WHERE ((`c1` >= 50)) AND ((`c1` <= 60))
(16 rows)

--Testcase 104:
SELECT t1.c1, ss.a, ss.b FROM (SELECT c1 FROM ft4 WHERE c1 between 50 and 60) t1 FULL JOIN (SELECT t2.c1, t3.c1 FROM ft4 t2 LEFT JOIN ft5 t3 ON (t2.c1 = t3.c1) WHERE (t2.c1 between 50 and 60)) ss(a, b) ON (t1.c1 = ss.a) ORDER BY t1.c1, ss.a, ss.b;
 c1 | a  | b  
----+----+----
 50 | 50 |   
 52 | 52 |   
 54 | 54 | 54
 56 | 56 |   
 58 | 58 |   
 60 | 60 | 60
(6 rows)

-- c. test deparsing the remote query as nested subqueries
--Testcase 105:
EXPLAIN (VERBOSE, COSTS OFF)
SELECT t1.c1, ss.a, ss.b FROM (SELECT c1 FROM ft4 WHERE c1 between 50 and 60) t1 FULL JOIN (SELECT t2.c1, t3.c1 FROM (SELECT c1 FROM ft4 WHERE c1 between 50 and 60) t2 FULL JOIN (SELECT c1 FROM ft5 WHERE c1 between 50 and 60) t3 ON (t2.c1 = t3.c1) WHERE t2.c1 IS NULL OR t2.c1 IS NOT NULL) ss(a, b) ON (t1.c1 = ss.a) ORDER BY t1.c1, ss.a, ss.b;
                                                       QUERY PLAN                                                        
-------------------------------------------------------------------------------------------------------------------------
 Sort
   Output: ft4.c1, ft4_1.c1, ft5.c1
   Sort Key: ft4.c1, ft4_1.c1, ft5.c1
   ->  Hash Full Join
         Output: ft4.c1, ft4_1.c1, ft5.c1
         Hash Cond: (ft4_1.c1 = ft4.c1)
         ->  Hash Full Join
               Output: ft4_1.c1, ft5.c1
               Hash Cond: (ft4_1.c1 = ft5.c1)
               Filter: ((ft4_1.c1 IS NULL) OR (ft4_1.c1 IS NOT NULL))
               ->  Foreign Scan on public.ft4 ft4_1
                     Output: ft4_1.c1, ft4_1.c2, ft4_1.c3
                     Local server startup cost: 10
                     Remote query: SELECT `c1` FROM `mysql_fdw_post`.`T 3` WHERE ((`c1` >= 50)) AND ((`c1` <= 60))
               ->  Hash
                     Output: ft5.c1
                     ->  Foreign Scan on public.ft5
                           Output: ft5.c1
                           Local server startup cost: 10
                           Remote query: SELECT `c1` FROM `mysql_fdw_post`.`T 4` WHERE ((`c1` >= 50)) AND ((`c1` <= 60))
         ->  Hash
               Output: ft4.c1
               ->  Foreign Scan on public.ft4
                     Output: ft4.c1
                     Local server startup cost: 10
                     Remote query: SELECT `c1` FROM `mysql_fdw_post`.`T 3` WHERE ((`c1` >= 50)) AND ((`c1` <= 60))
(26 rows)

--Testcase 106:
SELECT t1.c1, ss.a, ss.b FROM (SELECT c1 FROM ft4 WHERE c1 between 50 and 60) t1 FULL JOIN (SELECT t2.c1, t3.c1 FROM (SELECT c1 FROM ft4 WHERE c1 between 50 and 60) t2 FULL JOIN (SELECT c1 FROM ft5 WHERE c1 between 50 and 60) t3 ON (t2.c1 = t3.c1) WHERE t2.c1 IS NULL OR t2.c1 IS NOT NULL) ss(a, b) ON (t1.c1 = ss.a) ORDER BY t1.c1, ss.a, ss.b;
 c1 | a  | b  
----+----+----
 50 | 50 |   
 52 | 52 |   
 54 | 54 | 54
 56 | 56 |   
 58 | 58 |   
 60 | 60 | 60
    |    | 51
    |    | 57
(8 rows)

-- d. test deparsing rowmarked relations as subqueries
--Testcase 107:
EXPLAIN (VERBOSE, COSTS OFF)
SELECT t1.c1, ss.a, ss.b FROM (SELECT c1 FROM "S 1"."T 3" WHERE c1 = 50) t1 INNER JOIN (SELECT t2.c1, t3.c1 FROM (SELECT c1 FROM ft4 WHERE c1 between 50 and 60) t2 FULL JOIN (SELECT c1 FROM ft5 WHERE c1 between 50 and 60) t3 ON (t2.c1 = t3.c1) WHERE t2.c1 IS NULL OR t2.c1 IS NOT NULL) ss(a, b) ON (TRUE) ORDER BY t1.c1, ss.a, ss.b FOR UPDATE OF t1;
                                                                   QUERY PLAN                                                                    
-------------------------------------------------------------------------------------------------------------------------------------------------
 LockRows
   Output: "T 3".c1, ft4.c1, ft5.c1, "T 3".*, ft4.*, ft5.*
   ->  Sort
         Output: "T 3".c1, ft4.c1, ft5.c1, "T 3".*, ft4.*, ft5.*
         Sort Key: ft4.c1, ft5.c1
         ->  Nested Loop
               Output: "T 3".c1, ft4.c1, ft5.c1, "T 3".*, ft4.*, ft5.*
               ->  Foreign Scan on "S 1"."T 3"
                     Output: "T 3".c1, "T 3".*
                     Local server startup cost: 10
                     Remote query: SELECT `c1`, `c2`, `c3` FROM `mysql_fdw_post`.`T 3` WHERE ((`c1` = 50)) FOR UPDATE
               ->  Materialize
                     Output: ft4.c1, ft4.*, ft5.c1, ft5.*
                     ->  Hash Full Join
                           Output: ft4.c1, ft4.*, ft5.c1, ft5.*
                           Hash Cond: (ft4.c1 = ft5.c1)
                           Filter: ((ft4.c1 IS NULL) OR (ft4.c1 IS NOT NULL))
                           ->  Foreign Scan on public.ft4
                                 Output: ft4.c1, ft4.*
                                 Local server startup cost: 10
                                 Remote query: SELECT `c1`, `c2`, `c3` FROM `mysql_fdw_post`.`T 3` WHERE ((`c1` >= 50)) AND ((`c1` <= 60))
                           ->  Hash
                                 Output: ft5.c1, ft5.*
                                 ->  Foreign Scan on public.ft5
                                       Output: ft5.c1, ft5.*
                                       Local server startup cost: 10
                                       Remote query: SELECT `c1`, `c2`, `c3` FROM `mysql_fdw_post`.`T 4` WHERE ((`c1` >= 50)) AND ((`c1` <= 60))
(27 rows)

--Testcase 108:
SELECT t1.c1, ss.a, ss.b FROM (SELECT c1 FROM "S 1"."T 3" WHERE c1 = 50) t1 INNER JOIN (SELECT t2.c1, t3.c1 FROM (SELECT c1 FROM ft4 WHERE c1 between 50 and 60) t2 FULL JOIN (SELECT c1 FROM ft5 WHERE c1 between 50 and 60) t3 ON (t2.c1 = t3.c1) WHERE t2.c1 IS NULL OR t2.c1 IS NOT NULL) ss(a, b) ON (TRUE) ORDER BY t1.c1, ss.a, ss.b FOR UPDATE OF t1;
 c1 | a  | b  
----+----+----
 50 | 50 |   
 50 | 52 |   
 50 | 54 | 54
 50 | 56 |   
 50 | 58 |   
 50 | 60 | 60
 50 |    | 51
 50 |    | 57
(8 rows)

-- full outer join + inner join
--Testcase 109:
EXPLAIN (VERBOSE, COSTS OFF)
SELECT t1.c1, t2.c1, t3.c1 FROM ft4 t1 INNER JOIN ft5 t2 ON (t1.c1 = t2.c1 + 1 and t1.c1 between 50 and 60) FULL JOIN ft4 t3 ON (t2.c1 = t3.c1) ORDER BY t1.c1, t2.c1, t3.c1 LIMIT 10;
                                                             QUERY PLAN                                                              
-------------------------------------------------------------------------------------------------------------------------------------
 Limit
   Output: t1.c1, t2.c1, t3.c1
   ->  Sort
         Output: t1.c1, t2.c1, t3.c1
         Sort Key: t1.c1, t2.c1, t3.c1
         ->  Hash Full Join
               Output: t1.c1, t2.c1, t3.c1
               Hash Cond: (t3.c1 = t2.c1)
               ->  Foreign Scan on public.ft4 t3
                     Output: t3.c1, t3.c2, t3.c3
                     Local server startup cost: 10
                     Remote query: SELECT `c1` FROM `mysql_fdw_post`.`T 3`
               ->  Hash
                     Output: t1.c1, t2.c1
                     ->  Hash Join
                           Output: t1.c1, t2.c1
                           Hash Cond: ((t2.c1 + 1) = t1.c1)
                           ->  Foreign Scan on public.ft5 t2
                                 Output: t2.c1, t2.c2, t2.c3
                                 Local server startup cost: 10
                                 Remote query: SELECT `c1` FROM `mysql_fdw_post`.`T 4`
                           ->  Hash
                                 Output: t1.c1
                                 ->  Foreign Scan on public.ft4 t1
                                       Output: t1.c1
                                       Local server startup cost: 10
                                       Remote query: SELECT `c1` FROM `mysql_fdw_post`.`T 3` WHERE ((`c1` >= 50)) AND ((`c1` <= 60))
(27 rows)

--Testcase 110:
SELECT t1.c1, t2.c1, t3.c1 FROM ft4 t1 INNER JOIN ft5 t2 ON (t1.c1 = t2.c1 + 1 and t1.c1 between 50 and 60) FULL JOIN ft4 t3 ON (t2.c1 = t3.c1) ORDER BY t1.c1, t2.c1, t3.c1 LIMIT 10;
 c1 | c1 | c1 
----+----+----
 52 | 51 |   
 58 | 57 |   
    |    |  2
    |    |  4
    |    |  6
    |    |  8
    |    | 10
    |    | 12
    |    | 14
    |    | 16
(10 rows)

-- full outer join three tables
--Testcase 111:
EXPLAIN (VERBOSE, COSTS OFF)
SELECT t1.c1, t2.c2, t3.c3 FROM ft2 t1 FULL JOIN ft2 t2 ON (t1.c1 = t2.c1) FULL JOIN ft4 t3 ON (t2.c1 = t3.c1) ORDER BY t1.c1, t2.c1 OFFSET 10 LIMIT 10;
                                                                QUERY PLAN                                                                
------------------------------------------------------------------------------------------------------------------------------------------
 Limit
   Output: t1.c1, t2.c2, t3.c3, t2.c1
   ->  Sort
         Output: t1.c1, t2.c2, t3.c3, t2.c1
         Sort Key: t1.c1, t2.c1
         ->  Merge Full Join
               Output: t1.c1, t2.c2, t3.c3, t2.c1
               Merge Cond: (t3.c1 = t2.c1)
               ->  Sort
                     Output: t3.c3, t3.c1
                     Sort Key: t3.c1
                     ->  Foreign Scan on public.ft4 t3
                           Output: t3.c3, t3.c1
                           Local server startup cost: 10
                           Remote query: SELECT `c1`, `c3` FROM `mysql_fdw_post`.`T 3`
               ->  Sort
                     Output: t1.c1, t2.c2, t2.c1
                     Sort Key: t2.c1
                     ->  Merge Full Join
                           Output: t1.c1, t2.c2, t2.c1
                           Merge Cond: (t1.c1 = t2.c1)
                           ->  Foreign Scan on public.ft2 t1
                                 Output: t1.c1
                                 Local server startup cost: 10
                                 Remote query: SELECT `C 1` FROM `mysql_fdw_post`.`T 1` ORDER BY `C 1` IS NULL ASC, `C 1` ASC
                           ->  Materialize
                                 Output: t2.c2, t2.c1
                                 ->  Foreign Scan on public.ft2 t2
                                       Output: t2.c2, t2.c1
                                       Local server startup cost: 10
                                       Remote query: SELECT `C 1`, `c2` FROM `mysql_fdw_post`.`T 1` ORDER BY `C 1` IS NULL ASC, `C 1` ASC
(31 rows)

--Testcase 112:
SELECT t1.c1, t2.c2, t3.c3 FROM ft2 t1 FULL JOIN ft2 t2 ON (t1.c1 = t2.c1) FULL JOIN ft4 t3 ON (t2.c1 = t3.c1) ORDER BY t1.c1, t2.c1 OFFSET 10 LIMIT 10;
 c1 | c2 |   c3   
----+----+--------
 11 |  1 | 
 12 |  2 | AAA012
 13 |  3 | 
 14 |  4 | AAA014
 15 |  5 | 
 16 |  6 | AAA016
 17 |  7 | 
 18 |  8 | AAA018
 19 |  9 | 
 20 |  0 | AAA020
(10 rows)

-- full outer join + right outer join
--Testcase 113:
EXPLAIN (VERBOSE, COSTS OFF)
SELECT t1.c1, t2.c2, t3.c3 FROM ft2 t1 FULL JOIN ft2 t2 ON (t1.c1 = t2.c1) RIGHT JOIN ft4 t3 ON (t2.c1 = t3.c1) ORDER BY t1.c1, t2.c1 OFFSET 10 LIMIT 10;
                                                                                                                                                      QUERY PLAN                                                                                                                                                       
-----------------------------------------------------------------------------------------------------------------------------------------------------------------------------------------------------------------------------------------------------------------------------------------------------------------------
 Limit
   Output: t1.c1, t2.c2, t3.c3, t2.c1
   ->  Foreign Scan
         Output: t1.c1, t2.c2, t3.c3, t2.c1
         Local server startup cost: 10
         Remote query: SELECT r1.`C 1`, r2.`c2`, r4.`c3`, r2.`C 1` FROM ((`mysql_fdw_post`.`T 3` r4 LEFT JOIN `mysql_fdw_post`.`T 1` r2 ON (((r2.`C 1` = r4.`c1`)))) LEFT JOIN `mysql_fdw_post`.`T 1` r1 ON (((r1.`C 1` = r2.`C 1`)))) ORDER BY r1.`C 1` IS NULL ASC, r1.`C 1` ASC, r2.`C 1` IS NULL ASC, r2.`C 1` ASC
(6 rows)

--Testcase 114:
SELECT t1.c1, t2.c2, t3.c3 FROM ft2 t1 FULL JOIN ft2 t2 ON (t1.c1 = t2.c1) RIGHT JOIN ft4 t3 ON (t2.c1 = t3.c1) ORDER BY t1.c1, t2.c1 OFFSET 10 LIMIT 10;
 c1 | c2 |   c3   
----+----+--------
 22 |  2 | AAA022
 24 |  4 | AAA024
 26 |  6 | AAA026
 28 |  8 | AAA028
 30 |  0 | AAA030
 32 |  2 | AAA032
 34 |  4 | AAA034
 36 |  6 | AAA036
 38 |  8 | AAA038
 40 |  0 | AAA040
(10 rows)

-- right outer join + full outer join
--Testcase 115:
EXPLAIN (VERBOSE, COSTS OFF)
SELECT t1.c1, t2.c2, t3.c3 FROM ft2 t1 RIGHT JOIN ft2 t2 ON (t1.c1 = t2.c1) FULL JOIN ft4 t3 ON (t2.c1 = t3.c1) ORDER BY t1.c1, t2.c1 OFFSET 10 LIMIT 10;
                                                                                                     QUERY PLAN                                                                                                     
--------------------------------------------------------------------------------------------------------------------------------------------------------------------------------------------------------------------
 Limit
   Output: t1.c1, t2.c2, t3.c3, t2.c1
   ->  Sort
         Output: t1.c1, t2.c2, t3.c3, t2.c1
         Sort Key: t1.c1, t2.c1
         ->  Merge Full Join
               Output: t1.c1, t2.c2, t3.c3, t2.c1
               Merge Cond: (t2.c1 = t3.c1)
               ->  Foreign Scan
                     Output: t2.c2, t2.c1, t1.c1
                     Local server startup cost: 10
                     Remote query: SELECT r2.`c2`, r2.`C 1`, r1.`C 1` FROM (`mysql_fdw_post`.`T 1` r2 LEFT JOIN `mysql_fdw_post`.`T 1` r1 ON (((r1.`C 1` = r2.`C 1`)))) ORDER BY r2.`C 1` IS NULL ASC, r2.`C 1` ASC
               ->  Sort
                     Output: t3.c3, t3.c1
                     Sort Key: t3.c1
                     ->  Foreign Scan on public.ft4 t3
                           Output: t3.c3, t3.c1
                           Local server startup cost: 10
                           Remote query: SELECT `c1`, `c3` FROM `mysql_fdw_post`.`T 3`
(19 rows)

--Testcase 116:
SELECT t1.c1, t2.c2, t3.c3 FROM ft2 t1 RIGHT JOIN ft2 t2 ON (t1.c1 = t2.c1) FULL JOIN ft4 t3 ON (t2.c1 = t3.c1) ORDER BY t1.c1, t2.c1 OFFSET 10 LIMIT 10;
 c1 | c2 |   c3   
----+----+--------
 11 |  1 | 
 12 |  2 | AAA012
 13 |  3 | 
 14 |  4 | AAA014
 15 |  5 | 
 16 |  6 | AAA016
 17 |  7 | 
 18 |  8 | AAA018
 19 |  9 | 
 20 |  0 | AAA020
(10 rows)

-- full outer join + left outer join
--Testcase 117:
EXPLAIN (VERBOSE, COSTS OFF)
SELECT t1.c1, t2.c2, t3.c3 FROM ft2 t1 FULL JOIN ft2 t2 ON (t1.c1 = t2.c1) LEFT JOIN ft4 t3 ON (t2.c1 = t3.c1) ORDER BY t1.c1, t2.c1 OFFSET 10 LIMIT 10;
                                                                QUERY PLAN                                                                
------------------------------------------------------------------------------------------------------------------------------------------
 Limit
   Output: t1.c1, t2.c2, t3.c3, t2.c1
   ->  Sort
         Output: t1.c1, t2.c2, t3.c3, t2.c1
         Sort Key: t1.c1, t2.c1
         ->  Merge Right Join
               Output: t1.c1, t2.c2, t3.c3, t2.c1
               Merge Cond: (t3.c1 = t2.c1)
               ->  Sort
                     Output: t3.c3, t3.c1
                     Sort Key: t3.c1
                     ->  Foreign Scan on public.ft4 t3
                           Output: t3.c3, t3.c1
                           Local server startup cost: 10
                           Remote query: SELECT `c1`, `c3` FROM `mysql_fdw_post`.`T 3`
               ->  Sort
                     Output: t1.c1, t2.c2, t2.c1
                     Sort Key: t2.c1
                     ->  Merge Full Join
                           Output: t1.c1, t2.c2, t2.c1
                           Merge Cond: (t1.c1 = t2.c1)
                           ->  Foreign Scan on public.ft2 t1
                                 Output: t1.c1
                                 Local server startup cost: 10
                                 Remote query: SELECT `C 1` FROM `mysql_fdw_post`.`T 1` ORDER BY `C 1` IS NULL ASC, `C 1` ASC
                           ->  Materialize
                                 Output: t2.c2, t2.c1
                                 ->  Foreign Scan on public.ft2 t2
                                       Output: t2.c2, t2.c1
                                       Local server startup cost: 10
                                       Remote query: SELECT `C 1`, `c2` FROM `mysql_fdw_post`.`T 1` ORDER BY `C 1` IS NULL ASC, `C 1` ASC
(31 rows)

--Testcase 118:
SELECT t1.c1, t2.c2, t3.c3 FROM ft2 t1 FULL JOIN ft2 t2 ON (t1.c1 = t2.c1) LEFT JOIN ft4 t3 ON (t2.c1 = t3.c1) ORDER BY t1.c1, t2.c1 OFFSET 10 LIMIT 10;
 c1 | c2 |   c3   
----+----+--------
 11 |  1 | 
 12 |  2 | AAA012
 13 |  3 | 
 14 |  4 | AAA014
 15 |  5 | 
 16 |  6 | AAA016
 17 |  7 | 
 18 |  8 | AAA018
 19 |  9 | 
 20 |  0 | AAA020
(10 rows)

-- left outer join + full outer join
--Testcase 119:
EXPLAIN (VERBOSE, COSTS OFF)
SELECT t1.c1, t2.c2, t3.c3 FROM ft2 t1 LEFT JOIN ft2 t2 ON (t1.c1 = t2.c1) FULL JOIN ft4 t3 ON (t2.c1 = t3.c1) ORDER BY t1.c1, t2.c1 OFFSET 10 LIMIT 10;
                                                                                                     QUERY PLAN                                                                                                     
--------------------------------------------------------------------------------------------------------------------------------------------------------------------------------------------------------------------
 Limit
   Output: t1.c1, t2.c2, t3.c3, t2.c1
   ->  Sort
         Output: t1.c1, t2.c2, t3.c3, t2.c1
         Sort Key: t1.c1, t2.c1
         ->  Merge Full Join
               Output: t1.c1, t2.c2, t3.c3, t2.c1
               Merge Cond: (t2.c1 = t3.c1)
               ->  Foreign Scan
                     Output: t1.c1, t2.c2, t2.c1
                     Local server startup cost: 10
                     Remote query: SELECT r1.`C 1`, r2.`c2`, r2.`C 1` FROM (`mysql_fdw_post`.`T 1` r1 LEFT JOIN `mysql_fdw_post`.`T 1` r2 ON (((r1.`C 1` = r2.`C 1`)))) ORDER BY r2.`C 1` IS NULL ASC, r2.`C 1` ASC
               ->  Sort
                     Output: t3.c3, t3.c1
                     Sort Key: t3.c1
                     ->  Foreign Scan on public.ft4 t3
                           Output: t3.c3, t3.c1
                           Local server startup cost: 10
                           Remote query: SELECT `c1`, `c3` FROM `mysql_fdw_post`.`T 3`
(19 rows)

--Testcase 120:
SELECT t1.c1, t2.c2, t3.c3 FROM ft2 t1 LEFT JOIN ft2 t2 ON (t1.c1 = t2.c1) FULL JOIN ft4 t3 ON (t2.c1 = t3.c1) ORDER BY t1.c1, t2.c1 OFFSET 10 LIMIT 10;
 c1 | c2 |   c3   
----+----+--------
 11 |  1 | 
 12 |  2 | AAA012
 13 |  3 | 
 14 |  4 | AAA014
 15 |  5 | 
 16 |  6 | AAA016
 17 |  7 | 
 18 |  8 | AAA018
 19 |  9 | 
 20 |  0 | AAA020
(10 rows)

-- right outer join + left outer join
--Testcase 121:
EXPLAIN (VERBOSE, COSTS OFF)
SELECT t1.c1, t2.c2, t3.c3 FROM ft2 t1 RIGHT JOIN ft2 t2 ON (t1.c1 = t2.c1) LEFT JOIN ft4 t3 ON (t2.c1 = t3.c1) ORDER BY t1.c1, t2.c1 OFFSET 10 LIMIT 10;
                                                                                                                                                      QUERY PLAN                                                                                                                                                       
-----------------------------------------------------------------------------------------------------------------------------------------------------------------------------------------------------------------------------------------------------------------------------------------------------------------------
 Limit
   Output: t1.c1, t2.c2, t3.c3, t2.c1
   ->  Foreign Scan
         Output: t1.c1, t2.c2, t3.c3, t2.c1
         Local server startup cost: 10
         Remote query: SELECT r1.`C 1`, r2.`c2`, r4.`c3`, r2.`C 1` FROM ((`mysql_fdw_post`.`T 1` r2 LEFT JOIN `mysql_fdw_post`.`T 1` r1 ON (((r1.`C 1` = r2.`C 1`)))) LEFT JOIN `mysql_fdw_post`.`T 3` r4 ON (((r2.`C 1` = r4.`c1`)))) ORDER BY r1.`C 1` IS NULL ASC, r1.`C 1` ASC, r2.`C 1` IS NULL ASC, r2.`C 1` ASC
(6 rows)

--Testcase 122:
SELECT t1.c1, t2.c2, t3.c3 FROM ft2 t1 RIGHT JOIN ft2 t2 ON (t1.c1 = t2.c1) LEFT JOIN ft4 t3 ON (t2.c1 = t3.c1) ORDER BY t1.c1, t2.c1 OFFSET 10 LIMIT 10;
 c1 | c2 |   c3   
----+----+--------
 11 |  1 | 
 12 |  2 | AAA012
 13 |  3 | 
 14 |  4 | AAA014
 15 |  5 | 
 16 |  6 | AAA016
 17 |  7 | 
 18 |  8 | AAA018
 19 |  9 | 
 20 |  0 | AAA020
(10 rows)

-- left outer join + right outer join
--Testcase 123:
EXPLAIN (VERBOSE, COSTS OFF)
SELECT t1.c1, t2.c2, t3.c3 FROM ft2 t1 LEFT JOIN ft2 t2 ON (t1.c1 = t2.c1) RIGHT JOIN ft4 t3 ON (t2.c1 = t3.c1) ORDER BY t1.c1, t2.c1 OFFSET 10 LIMIT 10;
                                                                                                                                     QUERY PLAN                                                                                                                                     
------------------------------------------------------------------------------------------------------------------------------------------------------------------------------------------------------------------------------------------------------------------------------------
 Limit
   Output: t1.c1, t2.c2, t3.c3, t2.c1
   ->  Foreign Scan
         Output: t1.c1, t2.c2, t3.c3, t2.c1
         Local server startup cost: 10
         Remote query: SELECT r1.`C 1`, r2.`c2`, r4.`c3`, r2.`C 1` FROM (`mysql_fdw_post`.`T 3` r4 LEFT JOIN (`mysql_fdw_post`.`T 1` r1 INNER JOIN `mysql_fdw_post`.`T 1` r2 ON (((r1.`C 1` = r2.`C 1`)))) ON (((r2.`C 1` = r4.`c1`)))) ORDER BY r1.`C 1` IS NULL ASC, r1.`C 1` ASC
(6 rows)

--Testcase 124:
SELECT t1.c1, t2.c2, t3.c3 FROM ft2 t1 LEFT JOIN ft2 t2 ON (t1.c1 = t2.c1) RIGHT JOIN ft4 t3 ON (t2.c1 = t3.c1) ORDER BY t1.c1, t2.c1 OFFSET 10 LIMIT 10;
 c1 | c2 |   c3   
----+----+--------
 22 |  2 | AAA022
 24 |  4 | AAA024
 26 |  6 | AAA026
 28 |  8 | AAA028
 30 |  0 | AAA030
 32 |  2 | AAA032
 34 |  4 | AAA034
 36 |  6 | AAA036
 38 |  8 | AAA038
 40 |  0 | AAA040
(10 rows)

-- full outer join + WHERE clause, only matched rows
--Testcase 125:
EXPLAIN (VERBOSE, COSTS OFF)
SELECT t1.c1, t2.c1 FROM ft4 t1 FULL JOIN ft5 t2 ON (t1.c1 = t2.c1) WHERE (t1.c1 = t2.c1 OR t1.c1 IS NULL) ORDER BY t1.c1, t2.c1 OFFSET 10 LIMIT 10;
                                   QUERY PLAN                                    
---------------------------------------------------------------------------------
 Limit
   Output: t1.c1, t2.c1
   ->  Sort
         Output: t1.c1, t2.c1
         Sort Key: t1.c1, t2.c1
         ->  Merge Full Join
               Output: t1.c1, t2.c1
               Merge Cond: (t1.c1 = t2.c1)
               Filter: ((t1.c1 = t2.c1) OR (t1.c1 IS NULL))
               ->  Sort
                     Output: t1.c1
                     Sort Key: t1.c1
                     ->  Foreign Scan on public.ft4 t1
                           Output: t1.c1
                           Local server startup cost: 10
                           Remote query: SELECT `c1` FROM `mysql_fdw_post`.`T 3`
               ->  Sort
                     Output: t2.c1
                     Sort Key: t2.c1
                     ->  Foreign Scan on public.ft5 t2
                           Output: t2.c1
                           Local server startup cost: 10
                           Remote query: SELECT `c1` FROM `mysql_fdw_post`.`T 4`
(23 rows)

--Testcase 126:
SELECT t1.c1, t2.c1 FROM ft4 t1 FULL JOIN ft5 t2 ON (t1.c1 = t2.c1) WHERE (t1.c1 = t2.c1 OR t1.c1 IS NULL) ORDER BY t1.c1, t2.c1 OFFSET 10 LIMIT 10;
 c1 | c1 
----+----
 66 | 66
 72 | 72
 78 | 78
 84 | 84
 90 | 90
 96 | 96
    |  3
    |  9
    | 15
    | 21
(10 rows)

-- full outer join + WHERE clause with shippable extensions set
--Testcase 127:
EXPLAIN (VERBOSE, COSTS OFF)
SELECT t1.c1, t2.c2, t1.c3 FROM ft1 t1 FULL JOIN ft2 t2 ON (t1.c1 = t2.c1) WHERE mysql_fdw_abs(t1.c1) > 0 OFFSET 10 LIMIT 10;
                                                       QUERY PLAN                                                       
------------------------------------------------------------------------------------------------------------------------
 Limit
   Output: t1.c1, t2.c2, t1.c3
   ->  Hash Full Join
         Output: t1.c1, t2.c2, t1.c3
         Hash Cond: (t1.c1 = t2.c1)
         Filter: (mysql_fdw_abs(t1.c1) > 0)
         ->  Foreign Scan on public.ft1 t1
               Output: t1.c1, t1.c3
               Local server startup cost: 10
               Remote query: SELECT `C 1`, `c3` FROM `mysql_fdw_post`.`T 1`
         ->  Hash
               Output: t2.c2, t2.c1
               ->  Foreign Scan on public.ft2 t2
                     Output: t2.c2, t2.c1
                     Local server startup cost: 10
                     Remote query: SELECT `C 1`, `c2` FROM `mysql_fdw_post`.`T 1` ORDER BY `C 1` IS NULL ASC, `C 1` ASC
(16 rows)

ALTER SERVER mysql_svr OPTIONS (DROP extensions);
-- full outer join + WHERE clause with shippable extensions not set
--Testcase 128:
EXPLAIN (VERBOSE, COSTS OFF)
SELECT t1.c1, t2.c2, t1.c3 FROM ft1 t1 FULL JOIN ft2 t2 ON (t1.c1 = t2.c1) WHERE mysql_fdw_abs(t1.c1) > 0 OFFSET 10 LIMIT 10;
                                                       QUERY PLAN                                                       
------------------------------------------------------------------------------------------------------------------------
 Limit
   Output: t1.c1, t2.c2, t1.c3
   ->  Hash Full Join
         Output: t1.c1, t2.c2, t1.c3
         Hash Cond: (t1.c1 = t2.c1)
         Filter: (mysql_fdw_abs(t1.c1) > 0)
         ->  Foreign Scan on public.ft1 t1
               Output: t1.c1, t1.c3
               Local server startup cost: 10
               Remote query: SELECT `C 1`, `c3` FROM `mysql_fdw_post`.`T 1`
         ->  Hash
               Output: t2.c2, t2.c1
               ->  Foreign Scan on public.ft2 t2
                     Output: t2.c2, t2.c1
                     Local server startup cost: 10
                     Remote query: SELECT `C 1`, `c2` FROM `mysql_fdw_post`.`T 1` ORDER BY `C 1` IS NULL ASC, `C 1` ASC
(16 rows)

ALTER SERVER mysql_svr OPTIONS (ADD extensions 'mysql_fdw');
-- join two tables with FOR UPDATE clause
-- tests whole-row reference for row marks
--Testcase 129:
EXPLAIN (VERBOSE, COSTS OFF)
SELECT t1.c1, t2.c1 FROM ft1 t1 JOIN ft2 t2 ON (t1.c1 = t2.c1) ORDER BY t1.c3, t1.c1 OFFSET 100 LIMIT 10 FOR UPDATE OF t1;
                                                                                                                                                                                                                                                                                                                                                                    QUERY PLAN                                                                                                                                                                                                                                                                                                                                                                    
--------------------------------------------------------------------------------------------------------------------------------------------------------------------------------------------------------------------------------------------------------------------------------------------------------------------------------------------------------------------------------------------------------------------------------------------------------------------------------------------------------------------------------------------------------------------------------------------------------------------------------------------------------------------------------------------------------------------------------------------------
 Limit
   Output: t1.c1, t2.c1, t1.c3, t1.*, t2.*
   ->  LockRows
         Output: t1.c1, t2.c1, t1.c3, t1.*, t2.*
         ->  Foreign Scan
               Output: t1.c1, t2.c1, t1.c3, t1.*, t2.*
               Local server startup cost: 10
               Remote query: SELECT r1.`C 1`, r2.`C 1`, r1.`c3`, CONCAT( '(', CONCAT_WS(',' , IFNULL( r1.`C 1` , '') , IFNULL( r1.`c2` , '') , IFNULL( r1.`c3` , '') , IFNULL( r1.`c4` , '') , IFNULL( r1.`c5` , '') , IFNULL( r1.`c6` , '') , IFNULL( r1.`c7` , '') , IFNULL( r1.`c8` , '')  ) , ')' ), CONCAT( '(', CONCAT_WS(',' , IFNULL( r2.`C 1` , '') , IFNULL( r2.`c2` , '') , IFNULL( r2.`c3` , '') , IFNULL( r2.`c4` , '') , IFNULL( r2.`c5` , '') , IFNULL( r2.`c6` , '') , IFNULL( r2.`c7` , '') , IFNULL( r2.`c8` , '')  ) , ')' ) FROM (`mysql_fdw_post`.`T 1` r1 INNER JOIN `mysql_fdw_post`.`T 1` r2 ON (((r1.`C 1` = r2.`C 1`)))) ORDER BY r1.`c3` IS NULL ASC, r1.`c3` ASC, r1.`C 1` IS NULL ASC, r1.`C 1` ASC FOR UPDATE OF r1
               ->  Result
                     Output: t1.c1, t2.c1, t1.c3, t1.*, t2.*
                     ->  Sort
                           Output: t1.c1, t1.c3, t1.*, t2.c1, t2.*
                           Sort Key: t1.c3, t1.c1
                           ->  Merge Join
                                 Output: t1.c1, t1.c3, t1.*, t2.c1, t2.*
                                 Merge Cond: (t1.c1 = t2.c1)
                                 ->  Sort
                                       Output: t1.c1, t1.c3, t1.*
                                       Sort Key: t1.c1
                                       ->  Foreign Scan on public.ft1 t1
                                             Output: t1.c1, t1.c3, t1.*
                                             Local server startup cost: 10
                                             Remote query: SELECT `C 1`, `c2`, `c3`, `c4`, `c5`, `c6`, `c7`, `c8` FROM `mysql_fdw_post`.`T 1` FOR UPDATE
                                 ->  Materialize
                                       Output: t2.c1, t2.*
                                       ->  Foreign Scan on public.ft2 t2
                                             Output: t2.c1, t2.*
                                             Local server startup cost: 10
                                             Remote query: SELECT `C 1`, `c2`, `c3`, `c4`, `c5`, `c6`, `c7`, `c8` FROM `mysql_fdw_post`.`T 1` ORDER BY `C 1` IS NULL ASC, `C 1` ASC
(29 rows)

--Testcase 130:
SELECT t1.c1, t2.c1 FROM ft1 t1 JOIN ft2 t2 ON (t1.c1 = t2.c1) ORDER BY t1.c3, t1.c1 OFFSET 100 LIMIT 10 FOR UPDATE OF t1;
 c1  | c1  
-----+-----
 101 | 101
 102 | 102
 103 | 103
 104 | 104
 105 | 105
 106 | 106
 107 | 107
 108 | 108
 109 | 109
 110 | 110
(10 rows)

--Testcase 131:
EXPLAIN (VERBOSE, COSTS OFF)
SELECT t1.c1, t2.c1 FROM ft1 t1 JOIN ft2 t2 ON (t1.c1 = t2.c1) ORDER BY t1.c3, t1.c1 OFFSET 100 LIMIT 10 FOR UPDATE;
                                                                                                                                                                                                                                                                                                                                                                            QUERY PLAN                                                                                                                                                                                                                                                                                                                                                                             
-------------------------------------------------------------------------------------------------------------------------------------------------------------------------------------------------------------------------------------------------------------------------------------------------------------------------------------------------------------------------------------------------------------------------------------------------------------------------------------------------------------------------------------------------------------------------------------------------------------------------------------------------------------------------------------------------------------------------------------------------------------------
 Limit
   Output: t1.c1, t2.c1, t1.c3, t1.*, t2.*
   ->  LockRows
         Output: t1.c1, t2.c1, t1.c3, t1.*, t2.*
         ->  Foreign Scan
               Output: t1.c1, t2.c1, t1.c3, t1.*, t2.*
               Local server startup cost: 10
               Remote query: SELECT r1.`C 1`, r2.`C 1`, r1.`c3`, CONCAT( '(', CONCAT_WS(',' , IFNULL( r1.`C 1` , '') , IFNULL( r1.`c2` , '') , IFNULL( r1.`c3` , '') , IFNULL( r1.`c4` , '') , IFNULL( r1.`c5` , '') , IFNULL( r1.`c6` , '') , IFNULL( r1.`c7` , '') , IFNULL( r1.`c8` , '')  ) , ')' ), CONCAT( '(', CONCAT_WS(',' , IFNULL( r2.`C 1` , '') , IFNULL( r2.`c2` , '') , IFNULL( r2.`c3` , '') , IFNULL( r2.`c4` , '') , IFNULL( r2.`c5` , '') , IFNULL( r2.`c6` , '') , IFNULL( r2.`c7` , '') , IFNULL( r2.`c8` , '')  ) , ')' ) FROM (`mysql_fdw_post`.`T 1` r1 INNER JOIN `mysql_fdw_post`.`T 1` r2 ON (((r1.`C 1` = r2.`C 1`)))) ORDER BY r1.`c3` IS NULL ASC, r1.`c3` ASC, r1.`C 1` IS NULL ASC, r1.`C 1` ASC FOR UPDATE OF r1 FOR UPDATE OF r2
               ->  Result
                     Output: t1.c1, t2.c1, t1.c3, t1.*, t2.*
                     ->  Sort
                           Output: t1.c1, t1.c3, t1.*, t2.c1, t2.*
                           Sort Key: t1.c3, t1.c1
                           ->  Merge Join
                                 Output: t1.c1, t1.c3, t1.*, t2.c1, t2.*
                                 Merge Cond: (t1.c1 = t2.c1)
                                 ->  Sort
                                       Output: t1.c1, t1.c3, t1.*
                                       Sort Key: t1.c1
                                       ->  Foreign Scan on public.ft1 t1
                                             Output: t1.c1, t1.c3, t1.*
                                             Local server startup cost: 10
                                             Remote query: SELECT `C 1`, `c2`, `c3`, `c4`, `c5`, `c6`, `c7`, `c8` FROM `mysql_fdw_post`.`T 1` FOR UPDATE
                                 ->  Materialize
                                       Output: t2.c1, t2.*
                                       ->  Foreign Scan on public.ft2 t2
                                             Output: t2.c1, t2.*
                                             Local server startup cost: 10
                                             Remote query: SELECT `C 1`, `c2`, `c3`, `c4`, `c5`, `c6`, `c7`, `c8` FROM `mysql_fdw_post`.`T 1` ORDER BY `C 1` IS NULL ASC, `C 1` ASC FOR UPDATE
(29 rows)

--Testcase 132:
SELECT t1.c1, t2.c1 FROM ft1 t1 JOIN ft2 t2 ON (t1.c1 = t2.c1) ORDER BY t1.c3, t1.c1 OFFSET 100 LIMIT 10 FOR UPDATE;
 c1  | c1  
-----+-----
 101 | 101
 102 | 102
 103 | 103
 104 | 104
 105 | 105
 106 | 106
 107 | 107
 108 | 108
 109 | 109
 110 | 110
(10 rows)

-- join two tables with FOR SHARE clause
--Testcase 133:
EXPLAIN (VERBOSE, COSTS OFF)
SELECT t1.c1, t2.c1 FROM ft1 t1 JOIN ft2 t2 ON (t1.c1 = t2.c1) ORDER BY t1.c3, t1.c1 OFFSET 100 LIMIT 10 FOR SHARE OF t1;
                                                                                                                                                                                                                                                                                                                                                                   QUERY PLAN                                                                                                                                                                                                                                                                                                                                                                    
-------------------------------------------------------------------------------------------------------------------------------------------------------------------------------------------------------------------------------------------------------------------------------------------------------------------------------------------------------------------------------------------------------------------------------------------------------------------------------------------------------------------------------------------------------------------------------------------------------------------------------------------------------------------------------------------------------------------------------------------------
 Limit
   Output: t1.c1, t2.c1, t1.c3, t1.*, t2.*
   ->  LockRows
         Output: t1.c1, t2.c1, t1.c3, t1.*, t2.*
         ->  Foreign Scan
               Output: t1.c1, t2.c1, t1.c3, t1.*, t2.*
               Local server startup cost: 10
               Remote query: SELECT r1.`C 1`, r2.`C 1`, r1.`c3`, CONCAT( '(', CONCAT_WS(',' , IFNULL( r1.`C 1` , '') , IFNULL( r1.`c2` , '') , IFNULL( r1.`c3` , '') , IFNULL( r1.`c4` , '') , IFNULL( r1.`c5` , '') , IFNULL( r1.`c6` , '') , IFNULL( r1.`c7` , '') , IFNULL( r1.`c8` , '')  ) , ')' ), CONCAT( '(', CONCAT_WS(',' , IFNULL( r2.`C 1` , '') , IFNULL( r2.`c2` , '') , IFNULL( r2.`c3` , '') , IFNULL( r2.`c4` , '') , IFNULL( r2.`c5` , '') , IFNULL( r2.`c6` , '') , IFNULL( r2.`c7` , '') , IFNULL( r2.`c8` , '')  ) , ')' ) FROM (`mysql_fdw_post`.`T 1` r1 INNER JOIN `mysql_fdw_post`.`T 1` r2 ON (((r1.`C 1` = r2.`C 1`)))) ORDER BY r1.`c3` IS NULL ASC, r1.`c3` ASC, r1.`C 1` IS NULL ASC, r1.`C 1` ASC FOR SHARE OF r1
               ->  Result
                     Output: t1.c1, t2.c1, t1.c3, t1.*, t2.*
                     ->  Sort
                           Output: t1.c1, t1.c3, t1.*, t2.c1, t2.*
                           Sort Key: t1.c3, t1.c1
                           ->  Merge Join
                                 Output: t1.c1, t1.c3, t1.*, t2.c1, t2.*
                                 Merge Cond: (t1.c1 = t2.c1)
                                 ->  Sort
                                       Output: t1.c1, t1.c3, t1.*
                                       Sort Key: t1.c1
                                       ->  Foreign Scan on public.ft1 t1
                                             Output: t1.c1, t1.c3, t1.*
                                             Local server startup cost: 10
                                             Remote query: SELECT `C 1`, `c2`, `c3`, `c4`, `c5`, `c6`, `c7`, `c8` FROM `mysql_fdw_post`.`T 1` FOR SHARE
                                 ->  Materialize
                                       Output: t2.c1, t2.*
                                       ->  Foreign Scan on public.ft2 t2
                                             Output: t2.c1, t2.*
                                             Local server startup cost: 10
                                             Remote query: SELECT `C 1`, `c2`, `c3`, `c4`, `c5`, `c6`, `c7`, `c8` FROM `mysql_fdw_post`.`T 1` ORDER BY `C 1` IS NULL ASC, `C 1` ASC
(29 rows)

--Testcase 134:
SELECT t1.c1, t2.c1 FROM ft1 t1 JOIN ft2 t2 ON (t1.c1 = t2.c1) ORDER BY t1.c3, t1.c1 OFFSET 100 LIMIT 10 FOR SHARE OF t1;
 c1  | c1  
-----+-----
 101 | 101
 102 | 102
 103 | 103
 104 | 104
 105 | 105
 106 | 106
 107 | 107
 108 | 108
 109 | 109
 110 | 110
(10 rows)

--Testcase 135:
EXPLAIN (VERBOSE, COSTS OFF)
SELECT t1.c1, t2.c1 FROM ft1 t1 JOIN ft2 t2 ON (t1.c1 = t2.c1) ORDER BY t1.c3, t1.c1 OFFSET 100 LIMIT 10 FOR SHARE;
                                                                                                                                                                                                                                                                                                                                                                           QUERY PLAN                                                                                                                                                                                                                                                                                                                                                                            
-----------------------------------------------------------------------------------------------------------------------------------------------------------------------------------------------------------------------------------------------------------------------------------------------------------------------------------------------------------------------------------------------------------------------------------------------------------------------------------------------------------------------------------------------------------------------------------------------------------------------------------------------------------------------------------------------------------------------------------------------------------------
 Limit
   Output: t1.c1, t2.c1, t1.c3, t1.*, t2.*
   ->  LockRows
         Output: t1.c1, t2.c1, t1.c3, t1.*, t2.*
         ->  Foreign Scan
               Output: t1.c1, t2.c1, t1.c3, t1.*, t2.*
               Local server startup cost: 10
               Remote query: SELECT r1.`C 1`, r2.`C 1`, r1.`c3`, CONCAT( '(', CONCAT_WS(',' , IFNULL( r1.`C 1` , '') , IFNULL( r1.`c2` , '') , IFNULL( r1.`c3` , '') , IFNULL( r1.`c4` , '') , IFNULL( r1.`c5` , '') , IFNULL( r1.`c6` , '') , IFNULL( r1.`c7` , '') , IFNULL( r1.`c8` , '')  ) , ')' ), CONCAT( '(', CONCAT_WS(',' , IFNULL( r2.`C 1` , '') , IFNULL( r2.`c2` , '') , IFNULL( r2.`c3` , '') , IFNULL( r2.`c4` , '') , IFNULL( r2.`c5` , '') , IFNULL( r2.`c6` , '') , IFNULL( r2.`c7` , '') , IFNULL( r2.`c8` , '')  ) , ')' ) FROM (`mysql_fdw_post`.`T 1` r1 INNER JOIN `mysql_fdw_post`.`T 1` r2 ON (((r1.`C 1` = r2.`C 1`)))) ORDER BY r1.`c3` IS NULL ASC, r1.`c3` ASC, r1.`C 1` IS NULL ASC, r1.`C 1` ASC FOR SHARE OF r1 FOR SHARE OF r2
               ->  Result
                     Output: t1.c1, t2.c1, t1.c3, t1.*, t2.*
                     ->  Sort
                           Output: t1.c1, t1.c3, t1.*, t2.c1, t2.*
                           Sort Key: t1.c3, t1.c1
                           ->  Merge Join
                                 Output: t1.c1, t1.c3, t1.*, t2.c1, t2.*
                                 Merge Cond: (t1.c1 = t2.c1)
                                 ->  Sort
                                       Output: t1.c1, t1.c3, t1.*
                                       Sort Key: t1.c1
                                       ->  Foreign Scan on public.ft1 t1
                                             Output: t1.c1, t1.c3, t1.*
                                             Local server startup cost: 10
                                             Remote query: SELECT `C 1`, `c2`, `c3`, `c4`, `c5`, `c6`, `c7`, `c8` FROM `mysql_fdw_post`.`T 1` FOR SHARE
                                 ->  Materialize
                                       Output: t2.c1, t2.*
                                       ->  Foreign Scan on public.ft2 t2
                                             Output: t2.c1, t2.*
                                             Local server startup cost: 10
                                             Remote query: SELECT `C 1`, `c2`, `c3`, `c4`, `c5`, `c6`, `c7`, `c8` FROM `mysql_fdw_post`.`T 1` ORDER BY `C 1` IS NULL ASC, `C 1` ASC FOR SHARE
(29 rows)

--Testcase 136:
SELECT t1.c1, t2.c1 FROM ft1 t1 JOIN ft2 t2 ON (t1.c1 = t2.c1) ORDER BY t1.c3, t1.c1 OFFSET 100 LIMIT 10 FOR SHARE;
 c1  | c1  
-----+-----
 101 | 101
 102 | 102
 103 | 103
 104 | 104
 105 | 105
 106 | 106
 107 | 107
 108 | 108
 109 | 109
 110 | 110
(10 rows)

-- join in CTE
--Testcase 137:
EXPLAIN (VERBOSE, COSTS OFF)
WITH t (c1_1, c1_3, c2_1) AS MATERIALIZED (SELECT t1.c1, t1.c3, t2.c1 FROM ft1 t1 JOIN ft2 t2 ON (t1.c1 = t2.c1)) SELECT c1_1, c2_1 FROM t ORDER BY c1_3, c1_1 OFFSET 100 LIMIT 10;
                                                                          QUERY PLAN                                                                           
---------------------------------------------------------------------------------------------------------------------------------------------------------------
 Limit
   Output: t.c1_1, t.c2_1, t.c1_3
   CTE t
     ->  Foreign Scan
           Output: t1.c1, t1.c3, t2.c1
           Local server startup cost: 10
           Remote query: SELECT r1.`C 1`, r1.`c3`, r2.`C 1` FROM (`mysql_fdw_post`.`T 1` r1 INNER JOIN `mysql_fdw_post`.`T 1` r2 ON (((r1.`C 1` = r2.`C 1`))))
   ->  Sort
         Output: t.c1_1, t.c2_1, t.c1_3
         Sort Key: t.c1_3, t.c1_1
         ->  CTE Scan on t
               Output: t.c1_1, t.c2_1, t.c1_3
(12 rows)

--Testcase 138:
WITH t (c1_1, c1_3, c2_1) AS MATERIALIZED (SELECT t1.c1, t1.c3, t2.c1 FROM ft1 t1 JOIN ft2 t2 ON (t1.c1 = t2.c1)) SELECT c1_1, c2_1 FROM t ORDER BY c1_3, c1_1 OFFSET 100 LIMIT 10;
 c1_1 | c2_1 
------+------
  101 |  101
  102 |  102
  103 |  103
  104 |  104
  105 |  105
  106 |  106
  107 |  107
  108 |  108
  109 |  109
  110 |  110
(10 rows)

-- mysql_fdw not support ctid
-- -- ctid with whole-row reference
-- EXPLAIN (VERBOSE, COSTS OFF)
-- SELECT t1.ctid, t1, t2, t1.c1 FROM ft1 t1 JOIN ft2 t2 ON (t1.c1 = t2.c1) ORDER BY t1.c3, t1.c1 OFFSET 100 LIMIT 10;
-- SEMI JOIN, not pushed down
--Testcase 139:
EXPLAIN (VERBOSE, COSTS OFF)
SELECT t1.c1 FROM ft1 t1 WHERE EXISTS (SELECT 1 FROM ft2 t2 WHERE t1.c1 = t2.c1) ORDER BY t1.c1 OFFSET 100 LIMIT 10;
                                                 QUERY PLAN                                                 
------------------------------------------------------------------------------------------------------------
 Limit
   Output: t1.c1
   ->  Merge Semi Join
         Output: t1.c1
         Merge Cond: (t1.c1 = t2.c1)
         ->  Foreign Scan on public.ft1 t1
               Output: t1.c1
               Local server startup cost: 10
               Remote query: SELECT `C 1` FROM `mysql_fdw_post`.`T 1` ORDER BY `C 1` IS NULL ASC, `C 1` ASC
         ->  Foreign Scan on public.ft2 t2
               Output: t2.c1
               Local server startup cost: 10
               Remote query: SELECT `C 1` FROM `mysql_fdw_post`.`T 1` ORDER BY `C 1` IS NULL ASC, `C 1` ASC
(13 rows)

--Testcase 140:
SELECT t1.c1 FROM ft1 t1 WHERE EXISTS (SELECT 1 FROM ft2 t2 WHERE t1.c1 = t2.c1) ORDER BY t1.c1 OFFSET 100 LIMIT 10;
 c1  
-----
 101
 102
 103
 104
 105
 106
 107
 108
 109
 110
(10 rows)

-- ANTI JOIN, not pushed down
--Testcase 141:
EXPLAIN (VERBOSE, COSTS OFF)
SELECT t1.c1 FROM ft1 t1 WHERE NOT EXISTS (SELECT 1 FROM ft2 t2 WHERE t1.c1 = t2.c2) ORDER BY t1.c1 OFFSET 100 LIMIT 10;
                                                 QUERY PLAN                                                 
------------------------------------------------------------------------------------------------------------
 Limit
   Output: t1.c1
   ->  Merge Anti Join
         Output: t1.c1
         Merge Cond: (t1.c1 = t2.c2)
         ->  Foreign Scan on public.ft1 t1
               Output: t1.c1
               Local server startup cost: 10
               Remote query: SELECT `C 1` FROM `mysql_fdw_post`.`T 1` ORDER BY `C 1` IS NULL ASC, `C 1` ASC
         ->  Foreign Scan on public.ft2 t2
               Output: t2.c2
               Local server startup cost: 10
               Remote query: SELECT `c2` FROM `mysql_fdw_post`.`T 1` ORDER BY `c2` IS NULL ASC, `c2` ASC
(13 rows)

--Testcase 142:
SELECT t1.c1 FROM ft1 t1 WHERE NOT EXISTS (SELECT 1 FROM ft2 t2 WHERE t1.c1 = t2.c2) ORDER BY t1.c1 OFFSET 100 LIMIT 10;
 c1  
-----
 110
 111
 112
 113
 114
 115
 116
 117
 118
 119
(10 rows)

-- CROSS JOIN can be pushed down
--Testcase 143:
EXPLAIN (VERBOSE, COSTS OFF)
SELECT t1.c1, t2.c1 FROM ft1 t1 CROSS JOIN ft2 t2 ORDER BY t1.c1, t2.c1 OFFSET 100 LIMIT 10;
                                                                                                   QUERY PLAN                                                                                                    
-----------------------------------------------------------------------------------------------------------------------------------------------------------------------------------------------------------------
 Limit
   Output: t1.c1, t2.c1
   ->  Foreign Scan
         Output: t1.c1, t2.c1
         Local server startup cost: 10
         Remote query: SELECT r1.`C 1`, r2.`C 1` FROM (`mysql_fdw_post`.`T 1` r1 INNER JOIN `mysql_fdw_post`.`T 1` r2 ON (TRUE)) ORDER BY r1.`C 1` IS NULL ASC, r1.`C 1` ASC, r2.`C 1` IS NULL ASC, r2.`C 1` ASC
(6 rows)

--Testcase 144:
SELECT t1.c1, t2.c1 FROM ft1 t1 CROSS JOIN ft2 t2 ORDER BY t1.c1, t2.c1 OFFSET 100 LIMIT 10;
 c1 | c1  
----+-----
  1 | 101
  1 | 102
  1 | 103
  1 | 104
  1 | 105
  1 | 106
  1 | 107
  1 | 108
  1 | 109
  1 | 110
(10 rows)

-- different server, not pushed down. No result expected.
--Testcase 145:
EXPLAIN (VERBOSE, COSTS OFF)
SELECT t1.c1, t2.c1 FROM ft5 t1 JOIN ft6 t2 ON (t1.c1 = t2.c1) ORDER BY t1.c1, t2.c1 OFFSET 100 LIMIT 10;
                                                  QUERY PLAN                                                   
---------------------------------------------------------------------------------------------------------------
 Limit
   Output: t1.c1, t2.c1
   ->  Merge Join
         Output: t1.c1, t2.c1
         Merge Cond: (t1.c1 = t2.c1)
         ->  Foreign Scan on public.ft5 t1
               Output: t1.c1, t1.c2, t1.c3
               Local server startup cost: 10
               Remote query: SELECT `c1` FROM `mysql_fdw_post`.`T 4` ORDER BY `c1` IS NULL ASC, `c1` ASC
         ->  Materialize
               Output: t2.c1, t2.c2, t2.c3
               ->  Foreign Scan on public.ft6 t2
                     Output: t2.c1, t2.c2, t2.c3
                     Local server startup cost: 10
                     Remote query: SELECT `c1` FROM `mysql_fdw_post`.`T 4` ORDER BY `c1` IS NULL ASC, `c1` ASC
(15 rows)

--Testcase 146:
SELECT t1.c1, t2.c1 FROM ft5 t1 JOIN ft6 t2 ON (t1.c1 = t2.c1) ORDER BY t1.c1, t2.c1 OFFSET 100 LIMIT 10;
 c1 | c1 
----+----
(0 rows)

-- unsafe join conditions (c8 has a UDT), not pushed down. Practically a CROSS
-- JOIN since c8 in both tables has same value.
--Testcase 147:
EXPLAIN (VERBOSE, COSTS OFF)
SELECT t1.c1, t2.c1 FROM ft1 t1 LEFT JOIN ft2 t2 ON (t1.c8 = t2.c8) ORDER BY t1.c1, t2.c1 OFFSET 100 LIMIT 10;
                                       QUERY PLAN                                       
----------------------------------------------------------------------------------------
 Limit
   Output: t1.c1, t2.c1
   ->  Sort
         Output: t1.c1, t2.c1
         Sort Key: t1.c1, t2.c1
         ->  Merge Right Join
               Output: t1.c1, t2.c1
               Merge Cond: (t2.c8 = t1.c8)
               ->  Sort
                     Output: t2.c1, t2.c8
                     Sort Key: t2.c8
                     ->  Foreign Scan on public.ft2 t2
                           Output: t2.c1, t2.c8
                           Local server startup cost: 10
                           Remote query: SELECT `C 1`, `c8` FROM `mysql_fdw_post`.`T 1`
               ->  Sort
                     Output: t1.c1, t1.c8
                     Sort Key: t1.c8
                     ->  Foreign Scan on public.ft1 t1
                           Output: t1.c1, t1.c8
                           Local server startup cost: 10
                           Remote query: SELECT `C 1`, `c8` FROM `mysql_fdw_post`.`T 1`
(22 rows)

--Testcase 148:
SELECT t1.c1, t2.c1 FROM ft1 t1 LEFT JOIN ft2 t2 ON (t1.c8 = t2.c8) ORDER BY t1.c1, t2.c1 OFFSET 100 LIMIT 10;
 c1 | c1  
----+-----
  1 | 101
  1 | 102
  1 | 103
  1 | 104
  1 | 105
  1 | 106
  1 | 107
  1 | 108
  1 | 109
  1 | 110
(10 rows)

-- unsafe conditions on one side (c8 has a UDT), not pushed down.
--Testcase 149:
EXPLAIN (VERBOSE, COSTS OFF)
SELECT t1.c1, t2.c1 FROM ft1 t1 LEFT JOIN ft2 t2 ON (t1.c1 = t2.c1) WHERE t1.c8 = 'foo' ORDER BY t1.c3, t1.c1 OFFSET 100 LIMIT 10;
                                                    QUERY PLAN                                                    
------------------------------------------------------------------------------------------------------------------
 Limit
   Output: t1.c1, t2.c1, t1.c3
   ->  Sort
         Output: t1.c1, t2.c1, t1.c3
         Sort Key: t1.c3, t1.c1
         ->  Merge Right Join
               Output: t1.c1, t2.c1, t1.c3
               Merge Cond: (t2.c1 = t1.c1)
               ->  Foreign Scan on public.ft2 t2
                     Output: t2.c1
                     Local server startup cost: 10
                     Remote query: SELECT `C 1` FROM `mysql_fdw_post`.`T 1` ORDER BY `C 1` IS NULL ASC, `C 1` ASC
               ->  Sort
                     Output: t1.c1, t1.c3
                     Sort Key: t1.c1
                     ->  Foreign Scan on public.ft1 t1
                           Output: t1.c1, t1.c3
                           Filter: (t1.c8 = 'foo'::user_enum)
                           Local server startup cost: 10
                           Remote query: SELECT `C 1`, `c3`, `c8` FROM `mysql_fdw_post`.`T 1`
(20 rows)

--Testcase 150:
SELECT t1.c1, t2.c1 FROM ft1 t1 LEFT JOIN ft2 t2 ON (t1.c1 = t2.c1) WHERE t1.c8 = 'foo' ORDER BY t1.c3, t1.c1 OFFSET 100 LIMIT 10;
 c1  | c1  
-----+-----
 101 | 101
 102 | 102
 103 | 103
 104 | 104
 105 | 105
 106 | 106
 107 | 107
 108 | 108
 109 | 109
 110 | 110
(10 rows)

-- join where unsafe to pushdown condition in WHERE clause has a column not
-- in the SELECT clause. In this test unsafe clause needs to have column
-- references from both joining sides so that the clause is not pushed down
-- into one of the joining sides.
--Testcase 151:
EXPLAIN (VERBOSE, COSTS OFF)
SELECT t1.c1, t2.c1 FROM ft1 t1 JOIN ft2 t2 ON (t1.c1 = t2.c1) WHERE t1.c8 = t2.c8 ORDER BY t1.c3, t1.c1 OFFSET 100 LIMIT 10;
                                                                                                                         QUERY PLAN                                                                                                                          
-------------------------------------------------------------------------------------------------------------------------------------------------------------------------------------------------------------------------------------------------------------
 Limit
   Output: t1.c1, t2.c1, t1.c3
   ->  Foreign Scan
         Output: t1.c1, t2.c1, t1.c3
         Filter: (t1.c8 = t2.c8)
         Local server startup cost: 10
         Remote query: SELECT r1.`C 1`, r2.`C 1`, r1.`c3`, r1.`c8`, r2.`c8` FROM (`mysql_fdw_post`.`T 1` r1 INNER JOIN `mysql_fdw_post`.`T 1` r2 ON (((r1.`C 1` = r2.`C 1`)))) ORDER BY r1.`c3` IS NULL ASC, r1.`c3` ASC, r1.`C 1` IS NULL ASC, r1.`C 1` ASC
(7 rows)

--Testcase 152:
SELECT t1.c1, t2.c1 FROM ft1 t1 JOIN ft2 t2 ON (t1.c1 = t2.c1) WHERE t1.c8 = t2.c8 ORDER BY t1.c3, t1.c1 OFFSET 100 LIMIT 10;
 c1  | c1  
-----+-----
 101 | 101
 102 | 102
 103 | 103
 104 | 104
 105 | 105
 106 | 106
 107 | 107
 108 | 108
 109 | 109
 110 | 110
(10 rows)

-- Aggregate after UNION, for testing setrefs
--Testcase 153:
EXPLAIN (VERBOSE, COSTS OFF)
SELECT t1c1, avg(t1c1 + t2c1) FROM (SELECT t1.c1, t2.c1 FROM ft1 t1 JOIN ft2 t2 ON (t1.c1 = t2.c1) UNION SELECT t1.c1, t2.c1 FROM ft1 t1 JOIN ft2 t2 ON (t1.c1 = t2.c1)) AS t (t1c1, t2c1) GROUP BY t1c1 ORDER BY t1c1 OFFSET 100 LIMIT 10;
                                                                                 QUERY PLAN                                                                                 
----------------------------------------------------------------------------------------------------------------------------------------------------------------------------
 Limit
   Output: t1.c1, (avg((t1.c1 + t2.c1)))
   ->  Sort
         Output: t1.c1, (avg((t1.c1 + t2.c1)))
         Sort Key: t1.c1
         ->  HashAggregate
               Output: t1.c1, avg((t1.c1 + t2.c1))
               Group Key: t1.c1
               ->  HashAggregate
                     Output: t1.c1, t2.c1
                     Group Key: t1.c1, t2.c1
                     ->  Append
                           ->  Foreign Scan
                                 Output: t1.c1, t2.c1
                                 Local server startup cost: 10
                                 Remote query: SELECT r1.`C 1`, r2.`C 1` FROM (`mysql_fdw_post`.`T 1` r1 INNER JOIN `mysql_fdw_post`.`T 1` r2 ON (((r1.`C 1` = r2.`C 1`))))
                           ->  Foreign Scan
                                 Output: t1_1.c1, t2_1.c1
                                 Local server startup cost: 10
                                 Remote query: SELECT r1.`C 1`, r2.`C 1` FROM (`mysql_fdw_post`.`T 1` r1 INNER JOIN `mysql_fdw_post`.`T 1` r2 ON (((r1.`C 1` = r2.`C 1`))))
(20 rows)

--Testcase 154:
SELECT t1c1, avg(t1c1 + t2c1) FROM (SELECT t1.c1, t2.c1 FROM ft1 t1 JOIN ft2 t2 ON (t1.c1 = t2.c1) UNION SELECT t1.c1, t2.c1 FROM ft1 t1 JOIN ft2 t2 ON (t1.c1 = t2.c1)) AS t (t1c1, t2c1) GROUP BY t1c1 ORDER BY t1c1 OFFSET 100 LIMIT 10;
 t1c1 |         avg          
------+----------------------
  101 | 202.0000000000000000
  102 | 204.0000000000000000
  103 | 206.0000000000000000
  104 | 208.0000000000000000
  105 | 210.0000000000000000
  106 | 212.0000000000000000
  107 | 214.0000000000000000
  108 | 216.0000000000000000
  109 | 218.0000000000000000
  110 | 220.0000000000000000
(10 rows)

-- join with lateral reference
--Testcase 155:
EXPLAIN (VERBOSE, COSTS OFF)
SELECT t1."C 1" FROM "S 1"."T 1" t1, LATERAL (SELECT DISTINCT t2.c1, t3.c1 FROM ft1 t2, ft2 t3 WHERE t2.c1 = t3.c1 AND t2.c2 = t1.c2) q ORDER BY t1."C 1" OFFSET 10 LIMIT 10;
                                                                                                           QUERY PLAN                                                                                                           
--------------------------------------------------------------------------------------------------------------------------------------------------------------------------------------------------------------------------------
 Limit
   Output: t1."C 1"
   ->  Nested Loop
         Output: t1."C 1"
         ->  Foreign Scan on "S 1"."T 1" t1
               Output: t1."C 1", t1.c2, t1.c3, t1.c4, t1.c5, t1.c6, t1.c7, t1.c8
               Local server startup cost: 10
               Remote query: SELECT `C 1`, `c2` FROM `mysql_fdw_post`.`T 1` ORDER BY `C 1` IS NULL ASC, `C 1` ASC
         ->  Unique
               Output: t2.c1, t3.c1
               ->  Foreign Scan
                     Output: t2.c1, t3.c1
                     Local server startup cost: 10
                     Remote query: SELECT r1.`C 1`, r2.`C 1` FROM (`mysql_fdw_post`.`T 1` r1 INNER JOIN `mysql_fdw_post`.`T 1` r2 ON (((r1.`C 1` = r2.`C 1`)) AND ((r1.`c2` = ?)))) ORDER BY r1.`C 1` IS NULL ASC, r1.`C 1` ASC
(14 rows)

--Testcase 156:
SELECT t1."C 1" FROM "S 1"."T 1" t1, LATERAL (SELECT DISTINCT t2.c1, t3.c1 FROM ft1 t2, ft2 t3 WHERE t2.c1 = t3.c1 AND t2.c2 = t1.c2) q ORDER BY t1."C 1" OFFSET 10 LIMIT 10;
 C 1 
-----
   1
   1
   1
   1
   1
   1
   1
   1
   1
   1
(10 rows)

-- non-Var items in targetlist of the nullable rel of a join preventing
-- push-down in some cases
-- unable to push {ft1, ft2}
--Testcase 157:
EXPLAIN (VERBOSE, COSTS OFF)
SELECT q.a, ft2.c1 FROM (SELECT 13 FROM ft1 WHERE c1 = 13) q(a) RIGHT JOIN ft2 ON (q.a = ft2.c1) WHERE ft2.c1 BETWEEN 10 AND 15;
                                                                   QUERY PLAN                                                                   
------------------------------------------------------------------------------------------------------------------------------------------------
 Nested Loop Left Join
   Output: (13), ft2.c1
   Join Filter: (13 = ft2.c1)
   ->  Foreign Scan on public.ft2
         Output: ft2.c1
         Local server startup cost: 10
         Remote query: SELECT `C 1` FROM `mysql_fdw_post`.`T 1` WHERE ((`C 1` >= 10)) AND ((`C 1` <= 15)) ORDER BY `C 1` IS NULL ASC, `C 1` ASC
   ->  Materialize
         Output: (13)
         ->  Foreign Scan on public.ft1
               Output: 13
               Local server startup cost: 10
               Remote query: SELECT NULL FROM `mysql_fdw_post`.`T 1` WHERE ((`C 1` = 13))
(13 rows)

--Testcase 158:
SELECT q.a, ft2.c1 FROM (SELECT 13 FROM ft1 WHERE c1 = 13) q(a) RIGHT JOIN ft2 ON (q.a = ft2.c1) WHERE ft2.c1 BETWEEN 10 AND 15;
 a  | c1 
----+----
    | 10
    | 11
    | 12
 13 | 13
    | 14
    | 15
(6 rows)

-- ok to push {ft1, ft2} but not {ft1, ft2, ft4}
--Testcase 159:
EXPLAIN (VERBOSE, COSTS OFF)
SELECT ft4.c1, q.* FROM ft4 LEFT JOIN (SELECT 13, ft1.c1, ft2.c1 FROM ft1 RIGHT JOIN ft2 ON (ft1.c1 = ft2.c1) WHERE ft1.c1 = 12) q(a, b, c) ON (ft4.c1 = q.b) WHERE ft4.c1 BETWEEN 10 AND 15;
                                                                                                      QUERY PLAN                                                                                                      
----------------------------------------------------------------------------------------------------------------------------------------------------------------------------------------------------------------------
 Hash Left Join
   Output: ft4.c1, (13), ft1.c1, ft2.c1
   Hash Cond: (ft4.c1 = ft1.c1)
   ->  Foreign Scan on public.ft4
         Output: ft4.c1, ft4.c2, ft4.c3
         Local server startup cost: 10
         Remote query: SELECT `c1` FROM `mysql_fdw_post`.`T 3` WHERE ((`c1` >= 10)) AND ((`c1` <= 15))
   ->  Hash
         Output: ft1.c1, ft2.c1, (13)
         ->  Foreign Scan
               Output: ft1.c1, ft2.c1, 13
               Local server startup cost: 10
               Remote query: SELECT r4.`C 1`, r5.`C 1` FROM (`mysql_fdw_post`.`T 1` r4 INNER JOIN `mysql_fdw_post`.`T 1` r5 ON (((r5.`C 1` = 12)) AND ((r4.`C 1` = 12)))) ORDER BY r4.`C 1` IS NULL ASC, r4.`C 1` ASC
(13 rows)

--Testcase 160:
SELECT ft4.c1, q.* FROM ft4 LEFT JOIN (SELECT 13, ft1.c1, ft2.c1 FROM ft1 RIGHT JOIN ft2 ON (ft1.c1 = ft2.c1) WHERE ft1.c1 = 12) q(a, b, c) ON (ft4.c1 = q.b) WHERE ft4.c1 BETWEEN 10 AND 15;
 c1 | a  | b  | c  
----+----+----+----
 10 |    |    |   
 12 | 13 | 12 | 12
 14 |    |    |   
(3 rows)

-- join with nullable side with some columns with null values
--Testcase 161:
UPDATE ft5 SET c3 = null where c1 % 9 = 0;
--Testcase 162:
EXPLAIN (VERBOSE, COSTS OFF)
SELECT ft5, ft5.c1, ft5.c2, ft5.c3, ft4.c1, ft4.c2 FROM ft5 left join ft4 on ft5.c1 = ft4.c1 WHERE ft4.c1 BETWEEN 10 and 30 ORDER BY ft5.c1, ft4.c1;
                                                                                                                                                              QUERY PLAN                                                                                                                                                              
--------------------------------------------------------------------------------------------------------------------------------------------------------------------------------------------------------------------------------------------------------------------------------------------------------------------------------------
 Sort
   Output: ft5.*, ft5.c1, ft5.c2, ft5.c3, ft4.c1, ft4.c2
   Sort Key: ft5.c1
   ->  Foreign Scan
         Output: ft5.*, ft5.c1, ft5.c2, ft5.c3, ft4.c1, ft4.c2
         Local server startup cost: 10
         Remote query: SELECT CONCAT( '(', CONCAT_WS(',' , IFNULL( r1.`c1` , '') , IFNULL( r1.`c2` , '') , IFNULL( r1.`c3` , '')  ) , ')' ), r1.`c1`, r1.`c2`, r1.`c3`, r2.`c1`, r2.`c2` FROM (`mysql_fdw_post`.`T 4` r1 INNER JOIN `mysql_fdw_post`.`T 3` r2 ON (((r1.`c1` = r2.`c1`)) AND ((r2.`c1` >= 10)) AND ((r2.`c1` <= 30))))
(7 rows)

--Testcase 163:
SELECT ft5, ft5.c1, ft5.c2, ft5.c3, ft4.c1, ft4.c2 FROM ft5 left join ft4 on ft5.c1 = ft4.c1 WHERE ft4.c1 BETWEEN 10 and 30 ORDER BY ft5.c1, ft4.c1;
      ft5       | c1 | c2 |   c3   | c1 | c2 
----------------+----+----+--------+----+----
 (12,13,AAA012) | 12 | 13 | AAA012 | 12 | 13
 (18,19,)       | 18 | 19 |        | 18 | 19
 (24,25,AAA024) | 24 | 25 | AAA024 | 24 | 25
 (30,31,AAA030) | 30 | 31 | AAA030 | 30 | 31
(4 rows)

-- multi-way join involving multiple merge joins
-- (this case used to have EPQ-related planning problems)
--Testcase 164:
CREATE TABLE local_tbl (c1 int NOT NULL, c2 int NOT NULL, c3 text, CONSTRAINT local_tbl_pkey PRIMARY KEY (c1));
--Testcase 165:
INSERT INTO local_tbl SELECT id, id % 10, to_char(id, 'FM0000') FROM generate_series(1, 1000) id;
-- ANALYZE local_tbl;
SET enable_nestloop TO false;
SET enable_hashjoin TO false;
--Testcase 166:
EXPLAIN (VERBOSE, COSTS OFF)
SELECT * FROM ft1, ft2, ft4, ft5, local_tbl WHERE ft1.c1 = ft2.c1 AND ft1.c2 = ft4.c1
    AND ft1.c2 = ft5.c1 AND ft1.c2 = local_tbl.c1 AND ft1.c1 < 100 AND ft2.c1 < 100 ORDER BY ft1.c1 FOR UPDATE;
                                                                                                                                                                                                                                                                                                                                                                                                                                                                                                                                                                                                                                                                            QUERY PLAN                                                                                                                                                                                                                                                                                                                                                                                                                                                                                                                                                                                                                                                                            
------------------------------------------------------------------------------------------------------------------------------------------------------------------------------------------------------------------------------------------------------------------------------------------------------------------------------------------------------------------------------------------------------------------------------------------------------------------------------------------------------------------------------------------------------------------------------------------------------------------------------------------------------------------------------------------------------------------------------------------------------------------------------------------------------------------------------------------------------------------------------------------------------------------------------------------------------------------------------------------------------------------------------------------------------------------------------------------------------------------------------------------------------------------------------------------------------------------------------------------------------------------------------------------------------------------------------------------------------------------
 LockRows
   Output: ft1.c1, ft1.c2, ft1.c3, ft1.c4, ft1.c5, ft1.c6, ft1.c7, ft1.c8, ft2.c1, ft2.c2, ft2.c3, ft2.c4, ft2.c5, ft2.c6, ft2.c7, ft2.c8, ft4.c1, ft4.c2, ft4.c3, ft5.c1, ft5.c2, ft5.c3, local_tbl.c1, local_tbl.c2, local_tbl.c3, ft1.*, ft2.*, ft4.*, ft5.*, local_tbl.ctid
   ->  Sort
         Output: ft1.c1, ft1.c2, ft1.c3, ft1.c4, ft1.c5, ft1.c6, ft1.c7, ft1.c8, ft2.c1, ft2.c2, ft2.c3, ft2.c4, ft2.c5, ft2.c6, ft2.c7, ft2.c8, ft4.c1, ft4.c2, ft4.c3, ft5.c1, ft5.c2, ft5.c3, local_tbl.c1, local_tbl.c2, local_tbl.c3, ft1.*, ft2.*, ft4.*, ft5.*, local_tbl.ctid
         Sort Key: ft1.c1
         ->  Merge Join
               Output: ft1.c1, ft1.c2, ft1.c3, ft1.c4, ft1.c5, ft1.c6, ft1.c7, ft1.c8, ft2.c1, ft2.c2, ft2.c3, ft2.c4, ft2.c5, ft2.c6, ft2.c7, ft2.c8, ft4.c1, ft4.c2, ft4.c3, ft5.c1, ft5.c2, ft5.c3, local_tbl.c1, local_tbl.c2, local_tbl.c3, ft1.*, ft2.*, ft4.*, ft5.*, local_tbl.ctid
               Inner Unique: true
               Merge Cond: (ft1.c2 = local_tbl.c1)
               ->  Foreign Scan
                     Output: ft1.c1, ft1.c2, ft1.c3, ft1.c4, ft1.c5, ft1.c6, ft1.c7, ft1.c8, ft1.*, ft2.c1, ft2.c2, ft2.c3, ft2.c4, ft2.c5, ft2.c6, ft2.c7, ft2.c8, ft2.*, ft4.c1, ft4.c2, ft4.c3, ft4.*, ft5.c1, ft5.c2, ft5.c3, ft5.*
                     Local server startup cost: 10
                     Remote query: SELECT r1.`C 1`, r1.`c2`, r1.`c3`, r1.`c4`, r1.`c5`, r1.`c6`, r1.`c7`, r1.`c8`, CONCAT( '(', CONCAT_WS(',' , IFNULL( r1.`C 1` , '') , IFNULL( r1.`c2` , '') , IFNULL( r1.`c3` , '') , IFNULL( r1.`c4` , '') , IFNULL( r1.`c5` , '') , IFNULL( r1.`c6` , '') , IFNULL( r1.`c7` , '') , IFNULL( r1.`c8` , '')  ) , ')' ), r2.`C 1`, r2.`c2`, r2.`c3`, r2.`c4`, r2.`c5`, r2.`c6`, r2.`c7`, r2.`c8`, CONCAT( '(', CONCAT_WS(',' , IFNULL( r2.`C 1` , '') , IFNULL( r2.`c2` , '') , IFNULL( r2.`c3` , '') , IFNULL( r2.`c4` , '') , IFNULL( r2.`c5` , '') , IFNULL( r2.`c6` , '') , IFNULL( r2.`c7` , '') , IFNULL( r2.`c8` , '')  ) , ')' ), r3.`c1`, r3.`c2`, r3.`c3`, CONCAT( '(', CONCAT_WS(',' , IFNULL( r3.`c1` , '') , IFNULL( r3.`c2` , '') , IFNULL( r3.`c3` , '')  ) , ')' ), r4.`c1`, r4.`c2`, r4.`c3`, CONCAT( '(', CONCAT_WS(',' , IFNULL( r4.`c1` , '') , IFNULL( r4.`c2` , '') , IFNULL( r4.`c3` , '')  ) , ')' ) FROM (((`mysql_fdw_post`.`T 1` r1 INNER JOIN `mysql_fdw_post`.`T 1` r2 ON (((r1.`C 1` = r2.`C 1`)) AND ((r2.`C 1` < 100)) AND ((r1.`C 1` < 100)))) INNER JOIN `mysql_fdw_post`.`T 3` r3 ON (((r1.`c2` = r3.`c1`)))) INNER JOIN `mysql_fdw_post`.`T 4` r4 ON (((r1.`c2` = r4.`c1`)))) ORDER BY r1.`c2` IS NULL ASC, r1.`c2` ASC FOR UPDATE OF r1 FOR UPDATE OF r2 FOR UPDATE OF r3 FOR UPDATE OF r4
                     ->  Merge Join
                           Output: ft1.c1, ft1.c2, ft1.c3, ft1.c4, ft1.c5, ft1.c6, ft1.c7, ft1.c8, ft1.*, ft2.c1, ft2.c2, ft2.c3, ft2.c4, ft2.c5, ft2.c6, ft2.c7, ft2.c8, ft2.*, ft4.c1, ft4.c2, ft4.c3, ft4.*, ft5.c1, ft5.c2, ft5.c3, ft5.*
                           Merge Cond: (ft1.c2 = ft5.c1)
                           ->  Merge Join
                                 Output: ft1.c1, ft1.c2, ft1.c3, ft1.c4, ft1.c5, ft1.c6, ft1.c7, ft1.c8, ft1.*, ft2.c1, ft2.c2, ft2.c3, ft2.c4, ft2.c5, ft2.c6, ft2.c7, ft2.c8, ft2.*, ft4.c1, ft4.c2, ft4.c3, ft4.*
                                 Merge Cond: (ft1.c2 = ft4.c1)
                                 ->  Sort
                                       Output: ft1.c1, ft1.c2, ft1.c3, ft1.c4, ft1.c5, ft1.c6, ft1.c7, ft1.c8, ft1.*, ft2.c1, ft2.c2, ft2.c3, ft2.c4, ft2.c5, ft2.c6, ft2.c7, ft2.c8, ft2.*
                                       Sort Key: ft1.c2
                                       ->  Merge Join
                                             Output: ft1.c1, ft1.c2, ft1.c3, ft1.c4, ft1.c5, ft1.c6, ft1.c7, ft1.c8, ft1.*, ft2.c1, ft2.c2, ft2.c3, ft2.c4, ft2.c5, ft2.c6, ft2.c7, ft2.c8, ft2.*
                                             Merge Cond: (ft1.c1 = ft2.c1)
                                             ->  Foreign Scan on public.ft1
                                                   Output: ft1.c1, ft1.c2, ft1.c3, ft1.c4, ft1.c5, ft1.c6, ft1.c7, ft1.c8, ft1.*
                                                   Local server startup cost: 10
                                                   Remote query: SELECT `C 1`, `c2`, `c3`, `c4`, `c5`, `c6`, `c7`, `c8` FROM `mysql_fdw_post`.`T 1` WHERE ((`C 1` < 100)) ORDER BY `C 1` IS NULL ASC, `C 1` ASC FOR UPDATE
                                             ->  Materialize
                                                   Output: ft2.c1, ft2.c2, ft2.c3, ft2.c4, ft2.c5, ft2.c6, ft2.c7, ft2.c8, ft2.*
                                                   ->  Foreign Scan on public.ft2
                                                         Output: ft2.c1, ft2.c2, ft2.c3, ft2.c4, ft2.c5, ft2.c6, ft2.c7, ft2.c8, ft2.*
                                                         Local server startup cost: 10
                                                         Remote query: SELECT `C 1`, `c2`, `c3`, `c4`, `c5`, `c6`, `c7`, `c8` FROM `mysql_fdw_post`.`T 1` WHERE ((`C 1` < 100)) ORDER BY `C 1` IS NULL ASC, `C 1` ASC FOR UPDATE
                                 ->  Sort
                                       Output: ft4.c1, ft4.c2, ft4.c3, ft4.*
                                       Sort Key: ft4.c1
                                       ->  Foreign Scan on public.ft4
                                             Output: ft4.c1, ft4.c2, ft4.c3, ft4.*
                                             Local server startup cost: 10
                                             Remote query: SELECT `c1`, `c2`, `c3` FROM `mysql_fdw_post`.`T 3` FOR UPDATE
                           ->  Sort
                                 Output: ft5.c1, ft5.c2, ft5.c3, ft5.*
                                 Sort Key: ft5.c1
                                 ->  Foreign Scan on public.ft5
                                       Output: ft5.c1, ft5.c2, ft5.c3, ft5.*
                                       Local server startup cost: 10
                                       Remote query: SELECT `c1`, `c2`, `c3` FROM `mysql_fdw_post`.`T 4` FOR UPDATE
               ->  Index Scan using local_tbl_pkey on public.local_tbl
                     Output: local_tbl.c1, local_tbl.c2, local_tbl.c3, local_tbl.ctid
(51 rows)

--Testcase 167:
SELECT * FROM ft1, ft2, ft4, ft5, local_tbl WHERE ft1.c1 = ft2.c1 AND ft1.c2 = ft4.c1
    AND ft1.c2 = ft5.c1 AND ft1.c2 = local_tbl.c1 AND ft1.c1 < 100 AND ft2.c1 < 100 ORDER BY ft1.c1 FOR UPDATE;
 c1 | c2 |  c3   |              c4              |            c5            | c6 | c7 | c8  | c1 | c2 |  c3   |              c4              |            c5            | c6 | c7 | c8  | c1 | c2 |   c3   | c1 | c2 |   c3   | c1 | c2 |  c3  
----+----+-------+------------------------------+--------------------------+----+----+-----+----+----+-------+------------------------------+--------------------------+----+----+-----+----+----+--------+----+----+--------+----+----+------
  6 |  6 | 00006 | Wed Jan 07 00:00:00 1970 PST | Wed Jan 07 00:00:00 1970 | 6  | 6  | foo |  6 |  6 | 00006 | Wed Jan 07 00:00:00 1970 PST | Wed Jan 07 00:00:00 1970 | 6  | 6  | foo |  6 |  7 | AAA006 |  6 |  7 | AAA006 |  6 |  6 | 0006
 16 |  6 | 00016 | Sat Jan 17 00:00:00 1970 PST | Sat Jan 17 00:00:00 1970 | 6  | 6  | foo | 16 |  6 | 00016 | Sat Jan 17 00:00:00 1970 PST | Sat Jan 17 00:00:00 1970 | 6  | 6  | foo |  6 |  7 | AAA006 |  6 |  7 | AAA006 |  6 |  6 | 0006
 26 |  6 | 00026 | Tue Jan 27 00:00:00 1970 PST | Tue Jan 27 00:00:00 1970 | 6  | 6  | foo | 26 |  6 | 00026 | Tue Jan 27 00:00:00 1970 PST | Tue Jan 27 00:00:00 1970 | 6  | 6  | foo |  6 |  7 | AAA006 |  6 |  7 | AAA006 |  6 |  6 | 0006
 36 |  6 | 00036 | Fri Feb 06 00:00:00 1970 PST | Fri Feb 06 00:00:00 1970 | 6  | 6  | foo | 36 |  6 | 00036 | Fri Feb 06 00:00:00 1970 PST | Fri Feb 06 00:00:00 1970 | 6  | 6  | foo |  6 |  7 | AAA006 |  6 |  7 | AAA006 |  6 |  6 | 0006
 46 |  6 | 00046 | Mon Feb 16 00:00:00 1970 PST | Mon Feb 16 00:00:00 1970 | 6  | 6  | foo | 46 |  6 | 00046 | Mon Feb 16 00:00:00 1970 PST | Mon Feb 16 00:00:00 1970 | 6  | 6  | foo |  6 |  7 | AAA006 |  6 |  7 | AAA006 |  6 |  6 | 0006
 56 |  6 | 00056 | Thu Feb 26 00:00:00 1970 PST | Thu Feb 26 00:00:00 1970 | 6  | 6  | foo | 56 |  6 | 00056 | Thu Feb 26 00:00:00 1970 PST | Thu Feb 26 00:00:00 1970 | 6  | 6  | foo |  6 |  7 | AAA006 |  6 |  7 | AAA006 |  6 |  6 | 0006
 66 |  6 | 00066 | Sun Mar 08 00:00:00 1970 PST | Sun Mar 08 00:00:00 1970 | 6  | 6  | foo | 66 |  6 | 00066 | Sun Mar 08 00:00:00 1970 PST | Sun Mar 08 00:00:00 1970 | 6  | 6  | foo |  6 |  7 | AAA006 |  6 |  7 | AAA006 |  6 |  6 | 0006
 76 |  6 | 00076 | Wed Mar 18 00:00:00 1970 PST | Wed Mar 18 00:00:00 1970 | 6  | 6  | foo | 76 |  6 | 00076 | Wed Mar 18 00:00:00 1970 PST | Wed Mar 18 00:00:00 1970 | 6  | 6  | foo |  6 |  7 | AAA006 |  6 |  7 | AAA006 |  6 |  6 | 0006
 86 |  6 | 00086 | Sat Mar 28 00:00:00 1970 PST | Sat Mar 28 00:00:00 1970 | 6  | 6  | foo | 86 |  6 | 00086 | Sat Mar 28 00:00:00 1970 PST | Sat Mar 28 00:00:00 1970 | 6  | 6  | foo |  6 |  7 | AAA006 |  6 |  7 | AAA006 |  6 |  6 | 0006
 96 |  6 | 00096 | Tue Apr 07 00:00:00 1970 PST | Tue Apr 07 00:00:00 1970 | 6  | 6  | foo | 96 |  6 | 00096 | Tue Apr 07 00:00:00 1970 PST | Tue Apr 07 00:00:00 1970 | 6  | 6  | foo |  6 |  7 | AAA006 |  6 |  7 | AAA006 |  6 |  6 | 0006
(10 rows)

RESET enable_nestloop;
RESET enable_hashjoin;
--Testcase 168:
DROP TABLE local_tbl;
-- check join pushdown in situations where multiple userids are involved
--Testcase 169:
CREATE ROLE regress_view_owner SUPERUSER;
--Testcase 170:
CREATE USER MAPPING FOR regress_view_owner SERVER mysql_svr;
GRANT SELECT ON ft4 TO regress_view_owner;
GRANT SELECT ON ft5 TO regress_view_owner;
--Testcase 171:
CREATE VIEW v4 AS SELECT * FROM ft4;
--Testcase 172:
CREATE VIEW v5 AS SELECT * FROM ft5;
ALTER VIEW v5 OWNER TO regress_view_owner;
--Testcase 173:
EXPLAIN (VERBOSE, COSTS OFF)
SELECT t1.c1, t2.c2 FROM v4 t1 LEFT JOIN v5 t2 ON (t1.c1 = t2.c1) ORDER BY t1.c1, t2.c1 OFFSET 10 LIMIT 10;  -- can't be pushed down, different view owners
                                      QUERY PLAN                                       
---------------------------------------------------------------------------------------
 Limit
   Output: ft4.c1, ft5.c2, ft5.c1
   ->  Sort
         Output: ft4.c1, ft5.c2, ft5.c1
         Sort Key: ft4.c1, ft5.c1
         ->  Merge Right Join
               Output: ft4.c1, ft5.c2, ft5.c1
               Merge Cond: (ft5.c1 = ft4.c1)
               ->  Sort
                     Output: ft5.c2, ft5.c1
                     Sort Key: ft5.c1
                     ->  Foreign Scan on public.ft5
                           Output: ft5.c2, ft5.c1
                           Local server startup cost: 10
                           Remote query: SELECT `c1`, `c2` FROM `mysql_fdw_post`.`T 4`
               ->  Sort
                     Output: ft4.c1
                     Sort Key: ft4.c1
                     ->  Foreign Scan on public.ft4
                           Output: ft4.c1
                           Local server startup cost: 10
                           Remote query: SELECT `c1` FROM `mysql_fdw_post`.`T 3`
(22 rows)

--Testcase 174:
SELECT t1.c1, t2.c2 FROM v4 t1 LEFT JOIN v5 t2 ON (t1.c1 = t2.c1) ORDER BY t1.c1, t2.c1 OFFSET 10 LIMIT 10;
 c1 | c2 
----+----
 22 |   
 24 | 25
 26 |   
 28 |   
 30 | 31
 32 |   
 34 |   
 36 | 37
 38 |   
 40 |   
(10 rows)

ALTER VIEW v4 OWNER TO regress_view_owner;
--Testcase 175:
EXPLAIN (VERBOSE, COSTS OFF)
SELECT t1.c1, t2.c2 FROM v4 t1 LEFT JOIN v5 t2 ON (t1.c1 = t2.c1) ORDER BY t1.c1, t2.c1 OFFSET 10 LIMIT 10;  -- can be pushed down
                                                                                                                   QUERY PLAN                                                                                                                    
-------------------------------------------------------------------------------------------------------------------------------------------------------------------------------------------------------------------------------------------------
 Foreign Scan
   Output: ft4.c1, ft5.c2, ft5.c1
   Local server startup cost: 10
   Remote query: SELECT r6.`c1`, r9.`c2`, r9.`c1` FROM (`mysql_fdw_post`.`T 3` r6 LEFT JOIN `mysql_fdw_post`.`T 4` r9 ON (((r6.`c1` = r9.`c1`)))) ORDER BY r6.`c1` IS NULL ASC, r6.`c1` ASC, r9.`c1` IS NULL ASC, r9.`c1` ASC LIMIT 10 OFFSET 10
(4 rows)

--Testcase 176:
SELECT t1.c1, t2.c2 FROM v4 t1 LEFT JOIN v5 t2 ON (t1.c1 = t2.c1) ORDER BY t1.c1, t2.c1 OFFSET 10 LIMIT 10;
 c1 | c2 
----+----
 22 |   
 24 | 25
 26 |   
 28 |   
 30 | 31
 32 |   
 34 |   
 36 | 37
 38 |   
 40 |   
(10 rows)

--Testcase 177:
EXPLAIN (VERBOSE, COSTS OFF)
SELECT t1.c1, t2.c2 FROM v4 t1 LEFT JOIN ft5 t2 ON (t1.c1 = t2.c1) ORDER BY t1.c1, t2.c1 OFFSET 10 LIMIT 10;  -- can't be pushed down, view owner not current user
                                      QUERY PLAN                                       
---------------------------------------------------------------------------------------
 Limit
   Output: ft4.c1, t2.c2, t2.c1
   ->  Sort
         Output: ft4.c1, t2.c2, t2.c1
         Sort Key: ft4.c1, t2.c1
         ->  Merge Right Join
               Output: ft4.c1, t2.c2, t2.c1
               Merge Cond: (t2.c1 = ft4.c1)
               ->  Sort
                     Output: t2.c2, t2.c1
                     Sort Key: t2.c1
                     ->  Foreign Scan on public.ft5 t2
                           Output: t2.c2, t2.c1
                           Local server startup cost: 10
                           Remote query: SELECT `c1`, `c2` FROM `mysql_fdw_post`.`T 4`
               ->  Sort
                     Output: ft4.c1
                     Sort Key: ft4.c1
                     ->  Foreign Scan on public.ft4
                           Output: ft4.c1
                           Local server startup cost: 10
                           Remote query: SELECT `c1` FROM `mysql_fdw_post`.`T 3`
(22 rows)

--Testcase 178:
SELECT t1.c1, t2.c2 FROM v4 t1 LEFT JOIN ft5 t2 ON (t1.c1 = t2.c1) ORDER BY t1.c1, t2.c1 OFFSET 10 LIMIT 10;
 c1 | c2 
----+----
 22 |   
 24 | 25
 26 |   
 28 |   
 30 | 31
 32 |   
 34 |   
 36 | 37
 38 |   
 40 |   
(10 rows)

ALTER VIEW v4 OWNER TO CURRENT_USER;
--Testcase 179:
EXPLAIN (VERBOSE, COSTS OFF)
SELECT t1.c1, t2.c2 FROM v4 t1 LEFT JOIN ft5 t2 ON (t1.c1 = t2.c1) ORDER BY t1.c1, t2.c1 OFFSET 10 LIMIT 10;  -- can be pushed down
                                                                                                                   QUERY PLAN                                                                                                                    
-------------------------------------------------------------------------------------------------------------------------------------------------------------------------------------------------------------------------------------------------
 Foreign Scan
   Output: ft4.c1, t2.c2, t2.c1
   Local server startup cost: 10
   Remote query: SELECT r6.`c1`, r2.`c2`, r2.`c1` FROM (`mysql_fdw_post`.`T 3` r6 LEFT JOIN `mysql_fdw_post`.`T 4` r2 ON (((r6.`c1` = r2.`c1`)))) ORDER BY r6.`c1` IS NULL ASC, r6.`c1` ASC, r2.`c1` IS NULL ASC, r2.`c1` ASC LIMIT 10 OFFSET 10
(4 rows)

--Testcase 180:
SELECT t1.c1, t2.c2 FROM v4 t1 LEFT JOIN ft5 t2 ON (t1.c1 = t2.c1) ORDER BY t1.c1, t2.c1 OFFSET 10 LIMIT 10;
 c1 | c2 
----+----
 22 |   
 24 | 25
 26 |   
 28 |   
 30 | 31
 32 |   
 34 |   
 36 | 37
 38 |   
 40 |   
(10 rows)

ALTER VIEW v4 OWNER TO regress_view_owner;
-- cleanup
--Testcase 181:
DROP OWNED BY regress_view_owner;
--Testcase 182:
DROP ROLE regress_view_owner;
-- ===================================================================
-- Aggregate and grouping queries
-- ===================================================================
-- Simple aggregates
--Testcase 183:
explain (verbose, costs off)
select count(c6), sum(c1), avg(c1), min(c2), max(c1), stddev(c2), sum(c1) * (random() <= 1)::int as sum2 from ft1 where c2 < 5 group by c2 order by 1, 2;
                                                                                                                        QUERY PLAN                                                                                                                         
-----------------------------------------------------------------------------------------------------------------------------------------------------------------------------------------------------------------------------------------------------------
 Foreign Scan
   Output: (count(c6)), (sum(c1)), (avg(c1)), (min(c2)), (max(c1)), (stddev(c2)), ((sum(c1)) * ((random() <= '1'::double precision))::integer), c2
   Local server startup cost: 10
   Remote query: SELECT count(`c6`), sum(`C 1`), avg(`C 1`), min(`c2`), max(`C 1`), stddev(`c2`), `c2` FROM `mysql_fdw_post`.`T 1` WHERE ((`c2` < 5)) GROUP BY 7 ORDER BY count(`c6`) IS NULL ASC, count(`c6`) ASC, sum(`C 1`) IS NULL ASC, sum(`C 1`) ASC
(4 rows)

--Testcase 184:
select count(c6), sum(c1), avg(c1), min(c2), max(c1), stddev(c2), sum(c1) * (random() <= 1)::int as sum2 from ft1 where c2 < 5 group by c2 order by 1, 2;
 count |  sum  |   avg    | min | max  | stddev | sum2  
-------+-------+----------+-----+------+--------+-------
   100 | 49600 | 496.0000 |   1 |  991 |      0 | 49600
   100 | 49700 | 497.0000 |   2 |  992 |      0 | 49700
   100 | 49800 | 498.0000 |   3 |  993 |      0 | 49800
   100 | 49900 | 499.0000 |   4 |  994 |      0 | 49900
   100 | 50500 | 505.0000 |   0 | 1000 |      0 | 50500
(5 rows)

--Testcase 185:
explain (verbose, costs off)
select count(c6), sum(c1), avg(c1), min(c2), max(c1), stddev(c2), sum(c1) * (random() <= 1)::int as sum2 from ft1 where c2 < 5 group by c2 order by 1, 2 limit 1;
                                                                                                                            QUERY PLAN                                                                                                                             
-------------------------------------------------------------------------------------------------------------------------------------------------------------------------------------------------------------------------------------------------------------------
 Foreign Scan
   Output: (count(c6)), (sum(c1)), (avg(c1)), (min(c2)), (max(c1)), (stddev(c2)), ((sum(c1)) * ((random() <= '1'::double precision))::integer), c2
   Local server startup cost: 10
   Remote query: SELECT count(`c6`), sum(`C 1`), avg(`C 1`), min(`c2`), max(`C 1`), stddev(`c2`), `c2` FROM `mysql_fdw_post`.`T 1` WHERE ((`c2` < 5)) GROUP BY 7 ORDER BY count(`c6`) IS NULL ASC, count(`c6`) ASC, sum(`C 1`) IS NULL ASC, sum(`C 1`) ASC LIMIT 1
(4 rows)

--Testcase 186:
select count(c6), sum(c1), avg(c1), min(c2), max(c1), stddev(c2), sum(c1) * (random() <= 1)::int as sum2 from ft1 where c2 < 5 group by c2 order by 1, 2 limit 1;
 count |  sum  |   avg    | min | max | stddev | sum2  
-------+-------+----------+-----+-----+--------+-------
   100 | 49600 | 496.0000 |   1 | 991 |      0 | 49600
(1 row)

-- Aggregate is not pushed down as aggregation contains random()
--Testcase 187:
explain (verbose, costs off)
select sum(c1 * (random() <= 1)::int) as sum, avg(c1) from ft1;
                                  QUERY PLAN                                   
-------------------------------------------------------------------------------
 Aggregate
   Output: sum((c1 * ((random() <= '1'::double precision))::integer)), avg(c1)
   ->  Foreign Scan on public.ft1
         Output: c1
         Local server startup cost: 10
         Remote query: SELECT `C 1` FROM `mysql_fdw_post`.`T 1`
(6 rows)

-- Aggregate over join query
--Testcase 188:
explain (verbose, costs off)
select count(*), sum(t1.c1), avg(t2.c1) from ft1 t1 inner join ft1 t2 on (t1.c2 = t2.c2) where t1.c2 = 6;
                                                                                  QUERY PLAN                                                                                  
------------------------------------------------------------------------------------------------------------------------------------------------------------------------------
 Foreign Scan
   Output: (count(*)), (sum(t1.c1)), (avg(t2.c1))
   Local server startup cost: 10
   Remote query: SELECT count(*), sum(r1.`C 1`), avg(r2.`C 1`) FROM (`mysql_fdw_post`.`T 1` r1 INNER JOIN `mysql_fdw_post`.`T 1` r2 ON (((r2.`c2` = 6)) AND ((r1.`c2` = 6))))
(4 rows)

--Testcase 189:
select count(*), sum(t1.c1), avg(t2.c1) from ft1 t1 inner join ft1 t2 on (t1.c2 = t2.c2) where t1.c2 = 6;
 count |   sum   |   avg    
-------+---------+----------
 10000 | 5010000 | 501.0000
(1 row)

-- Not pushed down due to local conditions present in underneath input rel
--Testcase 190:
explain (verbose, costs off)
select sum(t1.c1), count(t2.c1) from ft1 t1 inner join ft2 t2 on (t1.c1 = t2.c1) where ((t1.c1 * t2.c1)/(t1.c1 * t2.c1)) * random() <= 1;
                                                                     QUERY PLAN                                                                     
----------------------------------------------------------------------------------------------------------------------------------------------------
 Aggregate
   Output: sum(t1.c1), count(t2.c1)
   ->  Foreign Scan
         Output: t1.c1, t2.c1
         Filter: (((((t1.c1 * t2.c1) / (t1.c1 * t2.c1)))::double precision * random()) <= '1'::double precision)
         Local server startup cost: 10
         Remote query: SELECT r1.`C 1`, r2.`C 1` FROM (`mysql_fdw_post`.`T 1` r1 INNER JOIN `mysql_fdw_post`.`T 1` r2 ON (((r1.`C 1` = r2.`C 1`))))
(7 rows)

-- GROUP BY clause having expressions
--Testcase 191:
explain (verbose, costs off)
select c2/2, sum(c2) * (c2/2) from ft1 group by c2/2 order by c2/2;
                                                                         QUERY PLAN                                                                         
------------------------------------------------------------------------------------------------------------------------------------------------------------
 Foreign Scan
   Output: ((c2 / 2)), ((sum(c2) * (c2 / 2)))
   Local server startup cost: 10
   Remote query: SELECT (`c2` DIV 2), (sum(`c2`) * (`c2` DIV 2)) FROM `mysql_fdw_post`.`T 1` GROUP BY 1 ORDER BY (`c2` DIV 2) IS NULL ASC, (`c2` DIV 2) ASC
(4 rows)

--Testcase 192:
select c2/2, sum(c2) * (c2/2) from ft1 group by c2/2 order by c2/2;
 ?column? | ?column? 
----------+----------
        0 |        0
        1 |      500
        2 |     1800
        3 |     3900
        4 |     6800
(5 rows)

-- Aggregates in subquery are pushed down.
--Testcase 193:
explain (verbose, costs off)
select count(x.a), sum(x.a) from (select c2 a, sum(c1) b from ft1 group by c2, sqrt(c1) order by 1, 2) x;
                                                                                    QUERY PLAN                                                                                    
----------------------------------------------------------------------------------------------------------------------------------------------------------------------------------
 Aggregate
   Output: count(ft1.c2), sum(ft1.c2)
   ->  Foreign Scan
         Output: ft1.c2, (sum(ft1.c1)), (sqrt((ft1.c1)::double precision))
         Local server startup cost: 10
         Remote query: SELECT `c2`, sum(`C 1`), sqrt(`C 1`) FROM `mysql_fdw_post`.`T 1` GROUP BY 1, 3 ORDER BY `c2` IS NULL ASC, `c2` ASC, sum(`C 1`) IS NULL ASC, sum(`C 1`) ASC
(6 rows)

--Testcase 194:
select count(x.a), sum(x.a) from (select c2 a, sum(c1) b from ft1 group by c2, sqrt(c1) order by 1, 2) x;
 count | sum  
-------+------
  1000 | 4500
(1 row)

-- Aggregate is still pushed down by taking unshippable expression out
--Testcase 195:
explain (verbose, costs off)
select c2 * (random() <= 1)::int as sum1, sum(c1) * c2 as sum2 from ft1 group by c2 order by 1, 2;
                                            QUERY PLAN                                             
---------------------------------------------------------------------------------------------------
 Sort
   Output: ((c2 * ((random() <= '1'::double precision))::integer)), ((sum(c1) * c2)), c2
   Sort Key: ((ft1.c2 * ((random() <= '1'::double precision))::integer)), ((sum(ft1.c1) * ft1.c2))
   ->  Foreign Scan
         Output: (c2 * ((random() <= '1'::double precision))::integer), ((sum(c1) * c2)), c2
         Local server startup cost: 10
         Remote query: SELECT (sum(`C 1`) * `c2`), `c2` FROM `mysql_fdw_post`.`T 1` GROUP BY 2
(7 rows)

--Testcase 196:
select c2 * (random() <= 1)::int as sum1, sum(c1) * c2 as sum2 from ft1 group by c2 order by 1, 2;
 sum1 |  sum2  
------+--------
    0 |      0
    1 |  49600
    2 |  99400
    3 | 149400
    4 | 199600
    5 | 250000
    6 | 300600
    7 | 351400
    8 | 402400
    9 | 453600
(10 rows)

-- Aggregate with unshippable GROUP BY clause are not pushed
--Testcase 197:
explain (verbose, costs off)
select c2 * (random() <= 1)::int as c2 from ft2 group by c2 * (random() <= 1)::int order by 1;
                                  QUERY PLAN                                  
------------------------------------------------------------------------------
 Sort
   Output: ((c2 * ((random() <= '1'::double precision))::integer))
   Sort Key: ((ft2.c2 * ((random() <= '1'::double precision))::integer))
   ->  HashAggregate
         Output: ((c2 * ((random() <= '1'::double precision))::integer))
         Group Key: (ft2.c2 * ((random() <= '1'::double precision))::integer)
         ->  Foreign Scan on public.ft2
               Output: (c2 * ((random() <= '1'::double precision))::integer)
               Local server startup cost: 10
               Remote query: SELECT `c2` FROM `mysql_fdw_post`.`T 1`
(10 rows)

-- GROUP BY clause in various forms, cardinal, alias and constant expression
--Testcase 198:
explain (verbose, costs off)
select count(c2) w, c2 x, 5 y, 7.0 z from ft1 group by 2, y, 9.0::int order by 2;
                                                              QUERY PLAN                                                              
--------------------------------------------------------------------------------------------------------------------------------------
 Foreign Scan
   Output: (count(c2)), c2, 5, 7.0, 9
   Local server startup cost: 10
   Remote query: SELECT count(`c2`), `c2`, 5, 7.0, 9 FROM `mysql_fdw_post`.`T 1` GROUP BY 2, 3, 5 ORDER BY `c2` IS NULL ASC, `c2` ASC
(4 rows)

--Testcase 199:
select count(c2) w, c2 x, 5 y, 7.0 z from ft1 group by 2, y, 9.0::int order by 2;
  w  | x | y |  z  
-----+---+---+-----
 100 | 0 | 5 | 7.0
 100 | 1 | 5 | 7.0
 100 | 2 | 5 | 7.0
 100 | 3 | 5 | 7.0
 100 | 4 | 5 | 7.0
 100 | 5 | 5 | 7.0
 100 | 6 | 5 | 7.0
 100 | 7 | 5 | 7.0
 100 | 8 | 5 | 7.0
 100 | 9 | 5 | 7.0
(10 rows)

-- GROUP BY clause referring to same column multiple times
-- Also, ORDER BY contains an aggregate function
--Testcase 200:
explain (verbose, costs off)
select c2, c2 from ft1 where c2 > 6 group by 1, 2 order by sum(c1);
                                                                         QUERY PLAN                                                                         
------------------------------------------------------------------------------------------------------------------------------------------------------------
 Foreign Scan
   Output: c2, c2, (sum(c1))
   Local server startup cost: 10
   Remote query: SELECT `c2`, `c2`, sum(`C 1`) FROM `mysql_fdw_post`.`T 1` WHERE ((`c2` > 6)) GROUP BY 1, 2 ORDER BY sum(`C 1`) IS NULL ASC, sum(`C 1`) ASC
(4 rows)

--Testcase 201:
select c2, c2 from ft1 where c2 > 6 group by 1, 2 order by sum(c1);
 c2 | c2 
----+----
  7 |  7
  8 |  8
  9 |  9
(3 rows)

-- Testing HAVING clause shippability
--Testcase 202:
explain (verbose, costs off)
select c2, sum(c1) from ft2 group by c2 having avg(c1) < 500 and sum(c1) < 49800 order by c2;
                                                                                QUERY PLAN                                                                                 
---------------------------------------------------------------------------------------------------------------------------------------------------------------------------
 Foreign Scan
   Output: c2, (sum(c1))
   Local server startup cost: 10
   Remote query: SELECT `c2`, sum(`C 1`) FROM `mysql_fdw_post`.`T 1` GROUP BY 1 HAVING ((avg(`C 1`) < 500)) AND ((sum(`C 1`) < 49800)) ORDER BY `c2` IS NULL ASC, `c2` ASC
(4 rows)

--Testcase 203:
select c2, sum(c1) from ft2 group by c2 having avg(c1) < 500 and sum(c1) < 49800 order by c2;
 c2 |  sum  
----+-------
  1 | 49600
  2 | 49700
(2 rows)

-- Unshippable HAVING clause will be evaluated locally, and other qual in HAVING clause is pushed down
--Testcase 204:
explain (verbose, costs off)
select count(*) from (select c5, count(c1) from ft1 group by c5, sqrt(c2) having (avg(c1) / avg(c1)) * random() <= 1 and avg(c1) < 500) x;
                                                              QUERY PLAN                                                               
---------------------------------------------------------------------------------------------------------------------------------------
 Aggregate
   Output: count(*)
   ->  Foreign Scan
         Output: ft1.c5, NULL::bigint, (sqrt((ft1.c2)::double precision))
         Filter: (((((avg(ft1.c1)) / (avg(ft1.c1))))::double precision * random()) <= '1'::double precision)
         Local server startup cost: 10
         Remote query: SELECT `c5`, NULL, sqrt(`c2`), avg(`C 1`) FROM `mysql_fdw_post`.`T 1` GROUP BY 1, 3 HAVING ((avg(`C 1`) < 500))
(7 rows)

--Testcase 205:
select count(*) from (select c5, count(c1) from ft1 group by c5, sqrt(c2) having (avg(c1) / avg(c1)) * random() <= 1 and avg(c1) < 500) x;
 count 
-------
    49
(1 row)

-- Aggregate in HAVING clause is not pushable, and thus aggregation is not pushed down
--Testcase 206:
explain (verbose, costs off)
select sum(c1) from ft1 group by c2 having avg(c1 * (random() <= 1)::int) > 100 order by 1;
                                            QUERY PLAN                                             
---------------------------------------------------------------------------------------------------
 Sort
   Output: (sum(c1)), c2
   Sort Key: (sum(ft1.c1))
   ->  HashAggregate
         Output: sum(c1), c2
         Group Key: ft1.c2
         Filter: (avg((ft1.c1 * ((random() <= '1'::double precision))::integer)) > '100'::numeric)
         ->  Foreign Scan on public.ft1
               Output: c1, c2
               Local server startup cost: 10
               Remote query: SELECT `C 1`, `c2` FROM `mysql_fdw_post`.`T 1`
(11 rows)

-- Remote aggregate in combination with a local Param (for the output
-- of an initplan) can be trouble, per bug #15781
--Testcase 207:
explain (verbose, costs off)
select exists(select 1 from pg_enum), sum(c1) from ft1;
                          QUERY PLAN                           
---------------------------------------------------------------
 Foreign Scan
   Output: $0, (sum(ft1.c1))
   Local server startup cost: 10
   Remote query: SELECT sum(`C 1`) FROM `mysql_fdw_post`.`T 1`
   InitPlan 1 (returns $0)
     ->  Seq Scan on pg_catalog.pg_enum
(6 rows)

--Testcase 208:
select exists(select 1 from pg_enum), sum(c1) from ft1;
 exists |  sum   
--------+--------
 t      | 500500
(1 row)

--Testcase 209:
explain (verbose, costs off)
select exists(select 1 from pg_enum), sum(c1) from ft1 group by 1;
                           QUERY PLAN                           
----------------------------------------------------------------
 GroupAggregate
   Output: ($0), sum(ft1.c1)
   Group Key: $0
   InitPlan 1 (returns $0)
     ->  Seq Scan on pg_catalog.pg_enum
   ->  Foreign Scan on public.ft1
         Output: $0, ft1.c1
         Local server startup cost: 10
         Remote query: SELECT `C 1` FROM `mysql_fdw_post`.`T 1`
(9 rows)

--Testcase 210:
select exists(select 1 from pg_enum), sum(c1) from ft1 group by 1;
 exists |  sum   
--------+--------
 t      | 500500
(1 row)

-- Testing ORDER BY, DISTINCT, FILTER, Ordered-sets and VARIADIC within aggregates
-- ORDER BY within aggregate, same column used to order
--Testcase 211:
explain (verbose, costs off)
select array_agg(c1 order by c1) from ft1 where c1 < 100 group by c2 order by 1;
                                                              QUERY PLAN                                                              
--------------------------------------------------------------------------------------------------------------------------------------
 Sort
   Output: (array_agg(c1 ORDER BY c1)), c2
   Sort Key: (array_agg(ft1.c1 ORDER BY ft1.c1))
   ->  GroupAggregate
         Output: array_agg(c1 ORDER BY c1), c2
         Group Key: ft1.c2
         ->  Foreign Scan on public.ft1
               Output: c1, c2
               Local server startup cost: 10
               Remote query: SELECT `C 1`, `c2` FROM `mysql_fdw_post`.`T 1` WHERE ((`C 1` < 100)) ORDER BY `c2` IS NULL ASC, `c2` ASC
(10 rows)

--Testcase 212:
select array_agg(c1 order by c1) from ft1 where c1 < 100 group by c2 order by 1;
           array_agg            
--------------------------------
 {1,11,21,31,41,51,61,71,81,91}
 {2,12,22,32,42,52,62,72,82,92}
 {3,13,23,33,43,53,63,73,83,93}
 {4,14,24,34,44,54,64,74,84,94}
 {5,15,25,35,45,55,65,75,85,95}
 {6,16,26,36,46,56,66,76,86,96}
 {7,17,27,37,47,57,67,77,87,97}
 {8,18,28,38,48,58,68,78,88,98}
 {9,19,29,39,49,59,69,79,89,99}
 {10,20,30,40,50,60,70,80,90}
(10 rows)

-- ORDER BY within aggregate, different column used to order also using DESC
--Testcase 213:
explain (verbose, costs off)
select array_agg(c5 order by c1 desc) from ft2 where c2 = 6 and c1 < 50;
                                                 QUERY PLAN                                                 
------------------------------------------------------------------------------------------------------------
 Aggregate
   Output: array_agg(c5 ORDER BY c1 DESC)
   ->  Foreign Scan on public.ft2
         Output: c5, c1
         Local server startup cost: 10
         Remote query: SELECT `C 1`, `c5` FROM `mysql_fdw_post`.`T 1` WHERE ((`C 1` < 50)) AND ((`c2` = 6))
(6 rows)

--Testcase 214:
select array_agg(c5 order by c1 desc) from ft2 where c2 = 6 and c1 < 50;
                                                                array_agg                                                                 
------------------------------------------------------------------------------------------------------------------------------------------
 {"Mon Feb 16 00:00:00 1970","Fri Feb 06 00:00:00 1970","Tue Jan 27 00:00:00 1970","Sat Jan 17 00:00:00 1970","Wed Jan 07 00:00:00 1970"}
(1 row)

-- DISTINCT within aggregate
--Testcase 215:
explain (verbose, costs off)
select array_agg(distinct (t1.c1)%5) from ft4 t1 full join ft5 t2 on (t1.c1 = t2.c1) where t1.c1 < 20 or (t1.c1 is null and t2.c1 < 5) group by (t2.c1)%3 order by 1;
                                      QUERY PLAN                                       
---------------------------------------------------------------------------------------
 Sort
   Output: (array_agg(DISTINCT (t1.c1 % 5))), ((t2.c1 % 3))
   Sort Key: (array_agg(DISTINCT (t1.c1 % 5)))
   ->  GroupAggregate
         Output: array_agg(DISTINCT (t1.c1 % 5)), ((t2.c1 % 3))
         Group Key: ((t2.c1 % 3))
         ->  Sort
               Output: ((t2.c1 % 3)), t1.c1
               Sort Key: ((t2.c1 % 3))
               ->  Merge Full Join
                     Output: (t2.c1 % 3), t1.c1
                     Merge Cond: (t1.c1 = t2.c1)
                     Filter: ((t1.c1 < 20) OR ((t1.c1 IS NULL) AND (t2.c1 < 5)))
                     ->  Sort
                           Output: t1.c1
                           Sort Key: t1.c1
                           ->  Foreign Scan on public.ft4 t1
                                 Output: t1.c1
                                 Local server startup cost: 10
                                 Remote query: SELECT `c1` FROM `mysql_fdw_post`.`T 3`
                     ->  Sort
                           Output: t2.c1
                           Sort Key: t2.c1
                           ->  Foreign Scan on public.ft5 t2
                                 Output: t2.c1
                                 Local server startup cost: 10
                                 Remote query: SELECT `c1` FROM `mysql_fdw_post`.`T 4`
(27 rows)

--Testcase 216:
select array_agg(distinct (t1.c1)%5) from ft4 t1 full join ft5 t2 on (t1.c1 = t2.c1) where t1.c1 < 20 or (t1.c1 is null and t2.c1 < 5) group by (t2.c1)%3 order by 1;
  array_agg   
--------------
 {0,1,2,3,4}
 {1,2,3,NULL}
(2 rows)

-- DISTINCT combined with ORDER BY within aggregate
--Testcase 217:
explain (verbose, costs off)
select array_agg(distinct (t1.c1)%5 order by (t1.c1)%5) from ft4 t1 full join ft5 t2 on (t1.c1 = t2.c1) where t1.c1 < 20 or (t1.c1 is null and t2.c1 < 5) group by (t2.c1)%3 order by 1;
                                      QUERY PLAN                                       
---------------------------------------------------------------------------------------
 Sort
   Output: (array_agg(DISTINCT (t1.c1 % 5) ORDER BY (t1.c1 % 5))), ((t2.c1 % 3))
   Sort Key: (array_agg(DISTINCT (t1.c1 % 5) ORDER BY (t1.c1 % 5)))
   ->  GroupAggregate
         Output: array_agg(DISTINCT (t1.c1 % 5) ORDER BY (t1.c1 % 5)), ((t2.c1 % 3))
         Group Key: ((t2.c1 % 3))
         ->  Sort
               Output: ((t2.c1 % 3)), t1.c1
               Sort Key: ((t2.c1 % 3))
               ->  Merge Full Join
                     Output: (t2.c1 % 3), t1.c1
                     Merge Cond: (t1.c1 = t2.c1)
                     Filter: ((t1.c1 < 20) OR ((t1.c1 IS NULL) AND (t2.c1 < 5)))
                     ->  Sort
                           Output: t1.c1
                           Sort Key: t1.c1
                           ->  Foreign Scan on public.ft4 t1
                                 Output: t1.c1
                                 Local server startup cost: 10
                                 Remote query: SELECT `c1` FROM `mysql_fdw_post`.`T 3`
                     ->  Sort
                           Output: t2.c1
                           Sort Key: t2.c1
                           ->  Foreign Scan on public.ft5 t2
                                 Output: t2.c1
                                 Local server startup cost: 10
                                 Remote query: SELECT `c1` FROM `mysql_fdw_post`.`T 4`
(27 rows)

--Testcase 218:
select array_agg(distinct (t1.c1)%5 order by (t1.c1)%5) from ft4 t1 full join ft5 t2 on (t1.c1 = t2.c1) where t1.c1 < 20 or (t1.c1 is null and t2.c1 < 5) group by (t2.c1)%3 order by 1;
  array_agg   
--------------
 {0,1,2,3,4}
 {1,2,3,NULL}
(2 rows)

--Testcase 219:
explain (verbose, costs off)
select array_agg(distinct (t1.c1)%5 order by (t1.c1)%5 desc nulls last) from ft4 t1 full join ft5 t2 on (t1.c1 = t2.c1) where t1.c1 < 20 or (t1.c1 is null and t2.c1 < 5) group by (t2.c1)%3 order by 1;
                                             QUERY PLAN                                              
-----------------------------------------------------------------------------------------------------
 Sort
   Output: (array_agg(DISTINCT (t1.c1 % 5) ORDER BY (t1.c1 % 5) DESC NULLS LAST)), ((t2.c1 % 3))
   Sort Key: (array_agg(DISTINCT (t1.c1 % 5) ORDER BY (t1.c1 % 5) DESC NULLS LAST))
   ->  GroupAggregate
         Output: array_agg(DISTINCT (t1.c1 % 5) ORDER BY (t1.c1 % 5) DESC NULLS LAST), ((t2.c1 % 3))
         Group Key: ((t2.c1 % 3))
         ->  Sort
               Output: ((t2.c1 % 3)), t1.c1
               Sort Key: ((t2.c1 % 3))
               ->  Merge Full Join
                     Output: (t2.c1 % 3), t1.c1
                     Merge Cond: (t1.c1 = t2.c1)
                     Filter: ((t1.c1 < 20) OR ((t1.c1 IS NULL) AND (t2.c1 < 5)))
                     ->  Sort
                           Output: t1.c1
                           Sort Key: t1.c1
                           ->  Foreign Scan on public.ft4 t1
                                 Output: t1.c1
                                 Local server startup cost: 10
                                 Remote query: SELECT `c1` FROM `mysql_fdw_post`.`T 3`
                     ->  Sort
                           Output: t2.c1
                           Sort Key: t2.c1
                           ->  Foreign Scan on public.ft5 t2
                                 Output: t2.c1
                                 Local server startup cost: 10
                                 Remote query: SELECT `c1` FROM `mysql_fdw_post`.`T 4`
(27 rows)

--Testcase 220:
select array_agg(distinct (t1.c1)%5 order by (t1.c1)%5 desc nulls last) from ft4 t1 full join ft5 t2 on (t1.c1 = t2.c1) where t1.c1 < 20 or (t1.c1 is null and t2.c1 < 5) group by (t2.c1)%3 order by 1;
  array_agg   
--------------
 {3,2,1,NULL}
 {4,3,2,1,0}
(2 rows)

-- FILTER within aggregate
--Testcase 221:
explain (verbose, costs off)
select sum(c1) filter (where c1 < 100 and c2 > 5) from ft1 group by c2 order by 1 nulls last;
                                 QUERY PLAN                                 
----------------------------------------------------------------------------
 Sort
   Output: (sum(c1) FILTER (WHERE ((c1 < 100) AND (c2 > 5)))), c2
   Sort Key: (sum(ft1.c1) FILTER (WHERE ((ft1.c1 < 100) AND (ft1.c2 > 5))))
   ->  HashAggregate
         Output: sum(c1) FILTER (WHERE ((c1 < 100) AND (c2 > 5))), c2
         Group Key: ft1.c2
         ->  Foreign Scan on public.ft1
               Output: c1, c2
               Local server startup cost: 10
               Remote query: SELECT `C 1`, `c2` FROM `mysql_fdw_post`.`T 1`
(10 rows)

--Testcase 222:
select sum(c1) filter (where c1 < 100 and c2 > 5) from ft1 group by c2 order by 1 nulls last;
 sum 
-----
 510
 520
 530
 540
    
    
    
    
    
    
(10 rows)

-- DISTINCT, ORDER BY and FILTER within aggregate
--Testcase 223:
explain (verbose, costs off)
select sum(c1%3), sum(distinct c1%3 order by c1%3) filter (where c1%3 < 2), c2 from ft1 where c2 = 6 group by c2;
                                             QUERY PLAN                                              
-----------------------------------------------------------------------------------------------------
 GroupAggregate
   Output: sum((c1 % 3)), sum(DISTINCT (c1 % 3) ORDER BY (c1 % 3)) FILTER (WHERE ((c1 % 3) < 2)), c2
   Group Key: ft1.c2
   ->  Foreign Scan on public.ft1
         Output: c1, c2
         Local server startup cost: 10
         Remote query: SELECT `C 1`, `c2` FROM `mysql_fdw_post`.`T 1` WHERE ((`c2` = 6))
(7 rows)

--Testcase 224:
select sum(c1%3), sum(distinct c1%3 order by c1%3) filter (where c1%3 < 2), c2 from ft1 where c2 = 6 group by c2;
 sum | sum | c2 
-----+-----+----
  99 |   1 |  6
(1 row)

-- Outer query is aggregation query
--Testcase 225:
explain (verbose, costs off)
select distinct (select count(*) filter (where t2.c2 = 6 and t2.c1 < 10) from ft1 t1 where t1.c1 = 6) from ft2 t2 where t2.c2 % 6 = 0 order by 1;
                                                QUERY PLAN                                                 
-----------------------------------------------------------------------------------------------------------
 Unique
   Output: ((SubPlan 1))
   ->  Sort
         Output: ((SubPlan 1))
         Sort Key: ((SubPlan 1))
         ->  Aggregate
               Output: (SubPlan 1)
               ->  Foreign Scan on public.ft2 t2
                     Output: t2.c2, t2.c1
                     Local server startup cost: 10
                     Remote query: SELECT `C 1`, `c2` FROM `mysql_fdw_post`.`T 1` WHERE (((`c2` % 6) = 0))
               SubPlan 1
                 ->  Foreign Scan on public.ft1 t1
                       Output: count(*) FILTER (WHERE ((t2.c2 = 6) AND (t2.c1 < 10)))
                       Local server startup cost: 10
                       Remote query: SELECT NULL FROM `mysql_fdw_post`.`T 1` WHERE ((`C 1` = 6))
(16 rows)

--Testcase 226:
select distinct (select count(*) filter (where t2.c2 = 6 and t2.c1 < 10) from ft1 t1 where t1.c1 = 6) from ft2 t2 where t2.c2 % 6 = 0 order by 1;
 count 
-------
     1
(1 row)

-- Inner query is aggregation query
--Testcase 227:
explain (verbose, costs off)
select distinct (select count(t1.c1) filter (where t2.c2 = 6 and t2.c1 < 10) from ft1 t1 where t1.c1 = 6) from ft2 t2 where t2.c2 % 6 = 0 order by 1;
                                               QUERY PLAN                                               
--------------------------------------------------------------------------------------------------------
 Unique
   Output: ((SubPlan 1))
   ->  Sort
         Output: ((SubPlan 1))
         Sort Key: ((SubPlan 1))
         ->  Foreign Scan on public.ft2 t2
               Output: (SubPlan 1)
               Local server startup cost: 10
               Remote query: SELECT `C 1`, `c2` FROM `mysql_fdw_post`.`T 1` WHERE (((`c2` % 6) = 0))
               SubPlan 1
                 ->  Aggregate
                       Output: count(t1.c1) FILTER (WHERE ((t2.c2 = 6) AND (t2.c1 < 10)))
                       ->  Foreign Scan on public.ft1 t1
                             Output: t1.c1
                             Local server startup cost: 10
                             Remote query: SELECT `C 1` FROM `mysql_fdw_post`.`T 1` WHERE ((`C 1` = 6))
(16 rows)

--Testcase 228:
select distinct (select count(t1.c1) filter (where t2.c2 = 6 and t2.c1 < 10) from ft1 t1 where t1.c1 = 6) from ft2 t2 where t2.c2 % 6 = 0 order by 1;
 count 
-------
     0
     1
(2 rows)

-- Aggregate not pushed down as FILTER condition is not pushable
--Testcase 229:
explain (verbose, costs off)
select sum(c1) filter (where (c1 / c1) * random() <= 1) from ft1 group by c2 order by 1;
                                                       QUERY PLAN                                                       
------------------------------------------------------------------------------------------------------------------------
 Sort
   Output: (sum(c1) FILTER (WHERE ((((c1 / c1))::double precision * random()) <= '1'::double precision))), c2
   Sort Key: (sum(ft1.c1) FILTER (WHERE ((((ft1.c1 / ft1.c1))::double precision * random()) <= '1'::double precision)))
   ->  HashAggregate
         Output: sum(c1) FILTER (WHERE ((((c1 / c1))::double precision * random()) <= '1'::double precision)), c2
         Group Key: ft1.c2
         ->  Foreign Scan on public.ft1
               Output: c1, c2
               Local server startup cost: 10
               Remote query: SELECT `C 1`, `c2` FROM `mysql_fdw_post`.`T 1`
(10 rows)

--Testcase 230:
explain (verbose, costs off)
select sum(c2) filter (where c2 in (select c2 from ft1 where c2 < 5)) from ft1;
                                     QUERY PLAN                                     
------------------------------------------------------------------------------------
 Aggregate
   Output: sum(ft1.c2) FILTER (WHERE (hashed SubPlan 1))
   ->  Foreign Scan on public.ft1
         Output: ft1.c2
         Local server startup cost: 10
         Remote query: SELECT `c2` FROM `mysql_fdw_post`.`T 1`
   SubPlan 1
     ->  Foreign Scan on public.ft1 ft1_1
           Output: ft1_1.c2
           Local server startup cost: 10
           Remote query: SELECT `c2` FROM `mysql_fdw_post`.`T 1` WHERE ((`c2` < 5))
(11 rows)

-- Ordered-sets within aggregate
--Testcase 231:
explain (verbose, costs off)
select c2, rank('10'::varchar) within group (order by c6), percentile_cont(c2/10::numeric) within group (order by c1) from ft1 where c2 < 10 group by c2 having percentile_cont(c2/10::numeric) within group (order by c1) < 500 order by c2;
                                                                                          QUERY PLAN                                                                                           
-----------------------------------------------------------------------------------------------------------------------------------------------------------------------------------------------
 GroupAggregate
   Output: c2, rank('10'::character varying) WITHIN GROUP (ORDER BY c6), percentile_cont((((c2)::numeric / '10'::numeric))::double precision) WITHIN GROUP (ORDER BY ((c1)::double precision))
   Group Key: ft1.c2
   Filter: (percentile_cont((((ft1.c2)::numeric / '10'::numeric))::double precision) WITHIN GROUP (ORDER BY ((ft1.c1)::double precision)) < '500'::double precision)
   ->  Foreign Scan on public.ft1
         Output: c2, c6, c1
         Local server startup cost: 10
         Remote query: SELECT `C 1`, `c2`, `c6` FROM `mysql_fdw_post`.`T 1` WHERE ((`c2` < 10)) ORDER BY `c2` IS NULL ASC, `c2` ASC
(8 rows)

--Testcase 232:
select c2, rank('10'::varchar) within group (order by c6), percentile_cont(c2/10::numeric) within group (order by c1) from ft1 where c2 < 10 group by c2 having percentile_cont(c2/10::numeric) within group (order by c1) < 500 order by c2;
 c2 | rank | percentile_cont 
----+------+-----------------
  0 |  101 |              10
  1 |  101 |             100
  2 |    1 |             200
  3 |    1 |             300
  4 |    1 |             400
(5 rows)

-- Using multiple arguments within aggregates
--Testcase 233:
explain (verbose, costs off)
select c1, rank(c1, c2) within group (order by c1, c2) from ft1 group by c1, c2 having c1 = 6 order by 1;
                                           QUERY PLAN                                           
------------------------------------------------------------------------------------------------
 GroupAggregate
   Output: c1, rank(c1, c2) WITHIN GROUP (ORDER BY c1, c2), c2
   Group Key: ft1.c1, ft1.c2
   ->  Sort
         Output: c1, c2
         Sort Key: ft1.c2
         ->  Foreign Scan on public.ft1
               Output: c1, c2
               Local server startup cost: 10
               Remote query: SELECT `C 1`, `c2` FROM `mysql_fdw_post`.`T 1` WHERE ((`C 1` = 6))
(10 rows)

--Testcase 234:
select c1, rank(c1, c2) within group (order by c1, c2) from ft1 group by c1, c2 having c1 = 6 order by 1;
 c1 | rank 
----+------
  6 |    1
(1 row)

-- User defined function for user defined aggregate, VARIADIC
--Testcase 235:
create function least_accum(anyelement, variadic anyarray)
returns anyelement language sql as
  'select least($1, min($2[i])) from generate_subscripts($2,1) g(i)';
--Testcase 236:
create aggregate least_agg(variadic items anyarray) (
  stype = anyelement, sfunc = least_accum
);
-- Disable hash aggregation for plan stability.
set enable_hashagg to false;
-- Not pushed down due to user defined aggregate
--Testcase 237:
explain (verbose, costs off)
select c2, least_agg(c1) from ft1 group by c2 order by c2;
                                                QUERY PLAN                                                
----------------------------------------------------------------------------------------------------------
 GroupAggregate
   Output: c2, least_agg(VARIADIC ARRAY[c1])
   Group Key: ft1.c2
   ->  Foreign Scan on public.ft1
         Output: c2, c1
         Local server startup cost: 10
         Remote query: SELECT `C 1`, `c2` FROM `mysql_fdw_post`.`T 1` ORDER BY `c2` IS NULL ASC, `c2` ASC
(7 rows)

-- Add function and aggregate into extension
alter extension mysql_fdw add function least_accum(anyelement, variadic anyarray);
alter extension mysql_fdw add aggregate least_agg(variadic items anyarray);
alter server mysql_svr options (set extensions 'mysql_fdw');
-- Now aggregate will be pushed.  Aggregate will display VARIADIC argument.
--Testcase 238:
explain (verbose, costs off)
select c2, least_agg(c1) from ft1 where c2 < 100 group by c2 order by c2;
                                                          QUERY PLAN                                                           
-------------------------------------------------------------------------------------------------------------------------------
 GroupAggregate
   Output: c2, least_agg(VARIADIC ARRAY[c1])
   Group Key: ft1.c2
   ->  Foreign Scan on public.ft1
         Output: c2, c1
         Local server startup cost: 10
         Remote query: SELECT `C 1`, `c2` FROM `mysql_fdw_post`.`T 1` WHERE ((`c2` < 100)) ORDER BY `c2` IS NULL ASC, `c2` ASC
(7 rows)

--Testcase 239:
select c2, least_agg(c1) from ft1 where c2 < 100 group by c2 order by c2;
 c2 | least_agg 
----+-----------
  0 |        10
  1 |         1
  2 |         2
  3 |         3
  4 |         4
  5 |         5
  6 |         6
  7 |         7
  8 |         8
  9 |         9
(10 rows)

-- Remove function and aggregate from extension
alter extension mysql_fdw drop function least_accum(anyelement, variadic anyarray);
alter extension mysql_fdw drop aggregate least_agg(variadic items anyarray);
alter server mysql_svr options (set extensions 'mysql_fdw');
-- Not pushed down as we have dropped objects from extension.
--Testcase 240:
explain (verbose, costs off)
select c2, least_agg(c1) from ft1 group by c2 order by c2;
                                                QUERY PLAN                                                
----------------------------------------------------------------------------------------------------------
 GroupAggregate
   Output: c2, least_agg(VARIADIC ARRAY[c1])
   Group Key: ft1.c2
   ->  Foreign Scan on public.ft1
         Output: c2, c1
         Local server startup cost: 10
         Remote query: SELECT `C 1`, `c2` FROM `mysql_fdw_post`.`T 1` ORDER BY `c2` IS NULL ASC, `c2` ASC
(7 rows)

-- Cleanup
reset enable_hashagg;
--Testcase 241:
drop aggregate least_agg(variadic items anyarray);
--Testcase 242:
drop function least_accum(anyelement, variadic anyarray);
-- Testing USING OPERATOR() in ORDER BY within aggregate.
-- For this, we need user defined operators along with operator family and
-- operator class.  Create those and then add them in extension.  Note that
-- user defined objects are considered unshippable unless they are part of
-- the extension.
--Testcase 243:
create operator public.<^ (
 leftarg = int4,
 rightarg = int4,
 procedure = int4eq
);
--Testcase 244:
create operator public.=^ (
 leftarg = int4,
 rightarg = int4,
 procedure = int4lt
);
--Testcase 245:
create operator public.>^ (
 leftarg = int4,
 rightarg = int4,
 procedure = int4gt
);
--Testcase 246:
create operator family my_op_family using btree;
--Testcase 247:
create function my_op_cmp(a int, b int) returns int as
  $$begin return btint4cmp(a, b); end $$ language plpgsql;
--Testcase 248:
create operator class my_op_class for type int using btree family my_op_family as
 operator 1 public.<^,
 operator 3 public.=^,
 operator 5 public.>^,
 function 1 my_op_cmp(int, int);
-- This will not be pushed as user defined sort operator is not part of the
-- extension yet.
--Testcase 249:
explain (verbose, costs off)
select array_agg(c1 order by c1 using operator(public.<^)) from ft2 where c2 = 6 and c1 < 100 group by c2;
                                                 QUERY PLAN                                                  
-------------------------------------------------------------------------------------------------------------
 GroupAggregate
   Output: array_agg(c1 ORDER BY c1 USING <^ NULLS LAST), c2
   Group Key: ft2.c2
   ->  Foreign Scan on public.ft2
         Output: c1, c2
         Local server startup cost: 10
         Remote query: SELECT `C 1`, `c2` FROM `mysql_fdw_post`.`T 1` WHERE ((`C 1` < 100)) AND ((`c2` = 6))
(7 rows)

-- Update local stats on ft2
-- ANALYZE ft2;
-- Add into extension
alter extension mysql_fdw add operator class my_op_class using btree;
alter extension mysql_fdw add function my_op_cmp(a int, b int);
alter extension mysql_fdw add operator family my_op_family using btree;
alter extension mysql_fdw add operator public.<^(int, int);
alter extension mysql_fdw add operator public.=^(int, int);
alter extension mysql_fdw add operator public.>^(int, int);
alter server mysql_svr options (set extensions 'mysql_fdw');
-- Now this will be pushed as sort operator is part of the extension.
--Testcase 250:
explain (verbose, costs off)
select array_agg(c1 order by c1 using operator(public.<^)) from ft2 where c2 = 6 and c1 < 100 group by c2;
                                                 QUERY PLAN                                                  
-------------------------------------------------------------------------------------------------------------
 GroupAggregate
   Output: array_agg(c1 ORDER BY c1 USING <^ NULLS LAST), c2
   Group Key: ft2.c2
   ->  Foreign Scan on public.ft2
         Output: c1, c2
         Local server startup cost: 10
         Remote query: SELECT `C 1`, `c2` FROM `mysql_fdw_post`.`T 1` WHERE ((`C 1` < 100)) AND ((`c2` = 6))
(7 rows)

--Testcase 251:
select array_agg(c1 order by c1 using operator(public.<^)) from ft2 where c2 = 6 and c1 < 100 group by c2;
           array_agg            
--------------------------------
 {6,16,26,36,46,56,66,76,86,96}
(1 row)

-- Remove from extension
alter extension mysql_fdw drop operator class my_op_class using btree;
alter extension mysql_fdw drop function my_op_cmp(a int, b int);
alter extension mysql_fdw drop operator family my_op_family using btree;
alter extension mysql_fdw drop operator public.<^(int, int);
alter extension mysql_fdw drop operator public.=^(int, int);
alter extension mysql_fdw drop operator public.>^(int, int);
alter server mysql_svr options (set extensions 'mysql_fdw');
-- This will not be pushed as sort operator is now removed from the extension.
--Testcase 252:
explain (verbose, costs off)
select array_agg(c1 order by c1 using operator(public.<^)) from ft2 where c2 = 6 and c1 < 100 group by c2;
                                                 QUERY PLAN                                                  
-------------------------------------------------------------------------------------------------------------
 GroupAggregate
   Output: array_agg(c1 ORDER BY c1 USING <^ NULLS LAST), c2
   Group Key: ft2.c2
   ->  Foreign Scan on public.ft2
         Output: c1, c2
         Local server startup cost: 10
         Remote query: SELECT `C 1`, `c2` FROM `mysql_fdw_post`.`T 1` WHERE ((`C 1` < 100)) AND ((`c2` = 6))
(7 rows)

-- Cleanup
--Testcase 253:
drop operator class my_op_class using btree;
--Testcase 254:
drop function my_op_cmp(a int, b int);
--Testcase 255:
drop operator family my_op_family using btree;
--Testcase 256:
drop operator public.>^(int, int);
--Testcase 257:
drop operator public.=^(int, int);
--Testcase 258:
drop operator public.<^(int, int);
-- Input relation to aggregate push down hook is not safe to pushdown and thus
-- the aggregate cannot be pushed down to foreign server.
--Testcase 259:
explain (verbose, costs off)
select count(t1.c3) from ft2 t1 left join ft2 t2 on (t1.c1 = random() * t2.c2);
                                        QUERY PLAN                                         
-------------------------------------------------------------------------------------------
 Aggregate
   Output: count(t1.c3)
   ->  Nested Loop Left Join
         Output: t1.c3
         Join Filter: ((t1.c1)::double precision = (random() * (t2.c2)::double precision))
         ->  Foreign Scan on public.ft2 t1
               Output: t1.c3, t1.c1
               Local server startup cost: 10
               Remote query: SELECT `C 1`, `c3` FROM `mysql_fdw_post`.`T 1`
         ->  Materialize
               Output: t2.c2
               ->  Foreign Scan on public.ft2 t2
                     Output: t2.c2
                     Local server startup cost: 10
                     Remote query: SELECT `c2` FROM `mysql_fdw_post`.`T 1`
(15 rows)

-- Subquery in FROM clause having aggregate
--Testcase 260:
explain (verbose, costs off)
select count(*), x.b from ft1, (select c2 a, sum(c1) b from ft1 group by c2) x where ft1.c2 = x.a group by x.b order by 1, 2;
                                                  QUERY PLAN                                                  
--------------------------------------------------------------------------------------------------------------
 Sort
   Output: (count(*)), x.b
   Sort Key: (count(*)), x.b
   ->  HashAggregate
         Output: count(*), x.b
         Group Key: x.b
         ->  Hash Join
               Output: x.b
               Inner Unique: true
               Hash Cond: (ft1.c2 = x.a)
               ->  Foreign Scan on public.ft1
                     Output: ft1.c2
                     Local server startup cost: 10
                     Remote query: SELECT `c2` FROM `mysql_fdw_post`.`T 1`
               ->  Hash
                     Output: x.b, x.a
                     ->  Subquery Scan on x
                           Output: x.b, x.a
                           ->  Foreign Scan
                                 Output: ft1_1.c2, (sum(ft1_1.c1))
                                 Local server startup cost: 10
                                 Remote query: SELECT `c2`, sum(`C 1`) FROM `mysql_fdw_post`.`T 1` GROUP BY 1
(22 rows)

--Testcase 261:
select count(*), x.b from ft1, (select c2 a, sum(c1) b from ft1 group by c2) x where ft1.c2 = x.a group by x.b order by 1, 2;
 count |   b   
-------+-------
   100 | 49600
   100 | 49700
   100 | 49800
   100 | 49900
   100 | 50000
   100 | 50100
   100 | 50200
   100 | 50300
   100 | 50400
   100 | 50500
(10 rows)

-- FULL join with IS NULL check in HAVING
--Testcase 262:
explain (verbose, costs off)
select avg(t1.c1), sum(t2.c1) from ft4 t1 full join ft5 t2 on (t1.c1 = t2.c1) group by t2.c1 having (avg(t1.c1) is null and sum(t2.c1) < 10) or sum(t2.c1) is null order by 1 nulls last, 2;
                                                  QUERY PLAN                                                   
---------------------------------------------------------------------------------------------------------------
 Sort
   Output: (avg(t1.c1)), (sum(t2.c1)), t2.c1
   Sort Key: (avg(t1.c1)), (sum(t2.c1))
   ->  HashAggregate
         Output: avg(t1.c1), sum(t2.c1), t2.c1
         Group Key: t2.c1
         Filter: (((avg(t1.c1) IS NULL) AND (sum(t2.c1) < 10)) OR (sum(t2.c1) IS NULL))
         ->  Merge Full Join
               Output: t2.c1, t1.c1
               Merge Cond: (t2.c1 = t1.c1)
               ->  Foreign Scan on public.ft5 t2
                     Output: t2.c1, t2.c2, t2.c3
                     Local server startup cost: 10
                     Remote query: SELECT `c1` FROM `mysql_fdw_post`.`T 4` ORDER BY `c1` IS NULL ASC, `c1` ASC
               ->  Sort
                     Output: t1.c1
                     Sort Key: t1.c1
                     ->  Foreign Scan on public.ft4 t1
                           Output: t1.c1
                           Local server startup cost: 10
                           Remote query: SELECT `c1` FROM `mysql_fdw_post`.`T 3`
(21 rows)

--Testcase 263:
select avg(t1.c1), sum(t2.c1) from ft4 t1 full join ft5 t2 on (t1.c1 = t2.c1) group by t2.c1 having (avg(t1.c1) is null and sum(t2.c1) < 10) or sum(t2.c1) is null order by 1 nulls last, 2;
         avg         | sum 
---------------------+-----
 51.0000000000000000 |    
                     |   3
                     |   9
(3 rows)

-- Aggregate over FULL join needing to deparse the joining relations as
-- subqueries.
--Testcase 264:
explain (verbose, costs off)
select count(*), sum(t1.c1), avg(t2.c1) from (select c1 from ft4 where c1 between 50 and 60) t1 full join (select c1 from ft5 where c1 between 50 and 60) t2 on (t1.c1 = t2.c1);
                                                    QUERY PLAN                                                     
-------------------------------------------------------------------------------------------------------------------
 Aggregate
   Output: count(*), sum(ft4.c1), avg(ft5.c1)
   ->  Hash Full Join
         Output: ft4.c1, ft5.c1
         Hash Cond: (ft4.c1 = ft5.c1)
         ->  Foreign Scan on public.ft4
               Output: ft4.c1, ft4.c2, ft4.c3
               Local server startup cost: 10
               Remote query: SELECT `c1` FROM `mysql_fdw_post`.`T 3` WHERE ((`c1` >= 50)) AND ((`c1` <= 60))
         ->  Hash
               Output: ft5.c1
               ->  Foreign Scan on public.ft5
                     Output: ft5.c1
                     Local server startup cost: 10
                     Remote query: SELECT `c1` FROM `mysql_fdw_post`.`T 4` WHERE ((`c1` >= 50)) AND ((`c1` <= 60))
(15 rows)

--Testcase 265:
select count(*), sum(t1.c1), avg(t2.c1) from (select c1 from ft4 where c1 between 50 and 60) t1 full join (select c1 from ft5 where c1 between 50 and 60) t2 on (t1.c1 = t2.c1);
 count | sum |         avg         
-------+-----+---------------------
     8 | 330 | 55.5000000000000000
(1 row)

-- ORDER BY expression is part of the target list but not pushed down to
-- foreign server.
--Testcase 266:
explain (verbose, costs off)
select sum(c2) * (random() <= 1)::int as sum from ft1 order by 1;
                                   QUERY PLAN                                   
--------------------------------------------------------------------------------
 Sort
   Output: (((sum(c2)) * ((random() <= '1'::double precision))::integer))
   Sort Key: (((sum(ft1.c2)) * ((random() <= '1'::double precision))::integer))
   ->  Foreign Scan
         Output: ((sum(c2)) * ((random() <= '1'::double precision))::integer)
         Local server startup cost: 10
         Remote query: SELECT sum(`c2`) FROM `mysql_fdw_post`.`T 1`
(7 rows)

--Testcase 267:
select sum(c2) * (random() <= 1)::int as sum from ft1 order by 1;
 sum  
------
 4500
(1 row)

-- LATERAL join, with parameterization
set enable_hashagg to false;
--Testcase 268:
explain (verbose, costs off)
select c2, sum from "S 1"."T 1" t1, lateral (select sum(t2.c1 + t1."C 1") sum from ft2 t2 group by t2.c1) qry where t1.c2 * 2 = qry.sum and t1.c2 < 3 and t1."C 1" < 100 order by 1;
                                                                   QUERY PLAN                                                                    
-------------------------------------------------------------------------------------------------------------------------------------------------
 Nested Loop
   Output: t1.c2, qry.sum
   ->  Foreign Scan on "S 1"."T 1" t1
         Output: t1."C 1", t1.c2, t1.c3, t1.c4, t1.c5, t1.c6, t1.c7, t1.c8
         Local server startup cost: 10
         Remote query: SELECT `C 1`, `c2` FROM `mysql_fdw_post`.`T 1` WHERE ((`c2` < 3)) AND ((`C 1` < 100)) ORDER BY `c2` IS NULL ASC, `c2` ASC
   ->  Subquery Scan on qry
         Output: qry.sum, t2.c1
         Filter: ((t1.c2 * 2) = qry.sum)
         ->  Foreign Scan
               Output: (sum((t2.c1 + t1."C 1"))), t2.c1
               Local server startup cost: 10
               Remote query: SELECT sum((`C 1` + ?)), `C 1` FROM `mysql_fdw_post`.`T 1` GROUP BY 2
(13 rows)

--Testcase 269:
select c2, sum from "S 1"."T 1" t1, lateral (select sum(t2.c1 + t1."C 1") sum from ft2 t2 group by t2.c1) qry where t1.c2 * 2 = qry.sum and t1.c2 < 3 and t1."C 1" < 100 order by 1;
 c2 | sum 
----+-----
  1 |   2
  2 |   4
(2 rows)

reset enable_hashagg;
-- bug #15613: bad plan for foreign table scan with lateral reference
--Testcase 270:
EXPLAIN (VERBOSE, COSTS OFF)
SELECT ref_0.c2, subq_1.*
FROM
    "S 1"."T 1" AS ref_0,
    LATERAL (
        SELECT ref_0."C 1" c1, subq_0.*
        FROM (SELECT ref_0.c2, ref_1.c3
              FROM ft1 AS ref_1) AS subq_0
             RIGHT JOIN ft2 AS ref_3 ON (subq_0.c3 = ref_3.c3)
    ) AS subq_1
WHERE ref_0."C 1" < 10 AND subq_1.c3 = '00001'
ORDER BY ref_0."C 1";
                                                              QUERY PLAN                                                               
---------------------------------------------------------------------------------------------------------------------------------------
 Nested Loop
   Output: ref_0.c2, ref_0."C 1", (ref_0.c2), ref_1.c3, ref_0."C 1"
   ->  Nested Loop
         Output: ref_0.c2, ref_0."C 1", ref_1.c3, (ref_0.c2)
         ->  Foreign Scan on "S 1"."T 1" ref_0
               Output: ref_0."C 1", ref_0.c2, ref_0.c3, ref_0.c4, ref_0.c5, ref_0.c6, ref_0.c7, ref_0.c8
               Local server startup cost: 10
               Remote query: SELECT `C 1`, `c2` FROM `mysql_fdw_post`.`T 1` WHERE ((`C 1` < 10)) ORDER BY `C 1` IS NULL ASC, `C 1` ASC
         ->  Foreign Scan on public.ft1 ref_1
               Output: ref_1.c3, ref_0.c2
               Local server startup cost: 10
               Remote query: SELECT `c3` FROM `mysql_fdw_post`.`T 1` WHERE ((`c3` = '00001'))
   ->  Materialize
         Output: ref_3.c3
         ->  Foreign Scan on public.ft2 ref_3
               Output: ref_3.c3
               Local server startup cost: 10
               Remote query: SELECT `c3` FROM `mysql_fdw_post`.`T 1` WHERE ((`c3` = '00001'))
(18 rows)

--Testcase 271:
SELECT ref_0.c2, subq_1.*
FROM
    "S 1"."T 1" AS ref_0,
    LATERAL (
        SELECT ref_0."C 1" c1, subq_0.*
        FROM (SELECT ref_0.c2, ref_1.c3
              FROM ft1 AS ref_1) AS subq_0
             RIGHT JOIN ft2 AS ref_3 ON (subq_0.c3 = ref_3.c3)
    ) AS subq_1
WHERE ref_0."C 1" < 10 AND subq_1.c3 = '00001'
ORDER BY ref_0."C 1";
 c2 | c1 | c2 |  c3   
----+----+----+-------
  1 |  1 |  1 | 00001
  2 |  2 |  2 | 00001
  3 |  3 |  3 | 00001
  4 |  4 |  4 | 00001
  5 |  5 |  5 | 00001
  6 |  6 |  6 | 00001
  7 |  7 |  7 | 00001
  8 |  8 |  8 | 00001
  9 |  9 |  9 | 00001
(9 rows)

-- Check with placeHolderVars
--Testcase 272:
explain (verbose, costs off)
select sum(q.a), count(q.b) from ft4 left join (select 13, avg(ft1.c1), sum(ft2.c1) from ft1 right join ft2 on (ft1.c1 = ft2.c1)) q(a, b, c) on (ft4.c1 <= q.b);
                                                                                QUERY PLAN                                                                                
--------------------------------------------------------------------------------------------------------------------------------------------------------------------------
 Aggregate
   Output: sum(q.a), count(q.b)
   ->  Nested Loop Left Join
         Output: q.a, q.b
         Inner Unique: true
         Join Filter: ((ft4.c1)::numeric <= q.b)
         ->  Foreign Scan on public.ft4
               Output: ft4.c1, ft4.c2, ft4.c3
               Local server startup cost: 10
               Remote query: SELECT `c1` FROM `mysql_fdw_post`.`T 3`
         ->  Materialize
               Output: q.a, q.b
               ->  Subquery Scan on q
                     Output: q.a, q.b
                     ->  Foreign Scan
                           Output: 13, (avg(ft1.c1)), NULL::bigint
                           Local server startup cost: 10
                           Remote query: SELECT 13, avg(r1.`C 1`), NULL FROM (`mysql_fdw_post`.`T 1` r2 LEFT JOIN `mysql_fdw_post`.`T 1` r1 ON (((r1.`C 1` = r2.`C 1`))))
(18 rows)

--Testcase 273:
select sum(q.a), count(q.b) from ft4 left join (select 13, avg(ft1.c1), sum(ft2.c1) from ft1 right join ft2 on (ft1.c1 = ft2.c1)) q(a, b, c) on (ft4.c1 <= q.b);
 sum | count 
-----+-------
 650 |    50
(1 row)

-- Not supported cases
-- Grouping sets
--Testcase 274:
explain (verbose, costs off)
select c2, sum(c1) from ft1 where c2 < 3 group by rollup(c2) order by 1 nulls last;
                                                         QUERY PLAN                                                          
-----------------------------------------------------------------------------------------------------------------------------
 GroupAggregate
   Output: c2, sum(c1)
   Group Key: ft1.c2
   Group Key: ()
   ->  Foreign Scan on public.ft1
         Output: c2, c1
         Local server startup cost: 10
         Remote query: SELECT `C 1`, `c2` FROM `mysql_fdw_post`.`T 1` WHERE ((`c2` < 3)) ORDER BY `c2` IS NULL ASC, `c2` ASC
(8 rows)

--Testcase 275:
select c2, sum(c1) from ft1 where c2 < 3 group by rollup(c2) order by 1 nulls last;
 c2 |  sum   
----+--------
  0 |  50500
  1 |  49600
  2 |  49700
    | 149800
(4 rows)

--Testcase 276:
explain (verbose, costs off)
select c2, sum(c1) from ft1 where c2 < 3 group by cube(c2) order by 1 nulls last;
                                                         QUERY PLAN                                                          
-----------------------------------------------------------------------------------------------------------------------------
 GroupAggregate
   Output: c2, sum(c1)
   Group Key: ft1.c2
   Group Key: ()
   ->  Foreign Scan on public.ft1
         Output: c2, c1
         Local server startup cost: 10
         Remote query: SELECT `C 1`, `c2` FROM `mysql_fdw_post`.`T 1` WHERE ((`c2` < 3)) ORDER BY `c2` IS NULL ASC, `c2` ASC
(8 rows)

--Testcase 277:
select c2, sum(c1) from ft1 where c2 < 3 group by cube(c2) order by 1 nulls last;
 c2 |  sum   
----+--------
  0 |  50500
  1 |  49600
  2 |  49700
    | 149800
(4 rows)

--Testcase 278:
explain (verbose, costs off)
select c2, c6, sum(c1) from ft1 where c2 < 3 group by grouping sets(c2, c6) order by 1 nulls last, 2 nulls last;
                                             QUERY PLAN                                              
-----------------------------------------------------------------------------------------------------
 Sort
   Output: c2, c6, (sum(c1))
   Sort Key: ft1.c2, ft1.c6
   ->  HashAggregate
         Output: c2, c6, sum(c1)
         Hash Key: ft1.c2
         Hash Key: ft1.c6
         ->  Foreign Scan on public.ft1
               Output: c2, c6, c1
               Local server startup cost: 10
               Remote query: SELECT `C 1`, `c2`, `c6` FROM `mysql_fdw_post`.`T 1` WHERE ((`c2` < 3))
(11 rows)

--Testcase 279:
select c2, c6, sum(c1) from ft1 where c2 < 3 group by grouping sets(c2, c6) order by 1 nulls last, 2 nulls last;
 c2 | c6 |  sum  
----+----+-------
  0 |    | 50500
  1 |    | 49600
  2 |    | 49700
    | 0  | 50500
    | 1  | 49600
    | 2  | 49700
(6 rows)

--Testcase 280:
explain (verbose, costs off)
select c2, sum(c1), grouping(c2) from ft1 where c2 < 3 group by c2 order by 1 nulls last;
                                                         QUERY PLAN                                                          
-----------------------------------------------------------------------------------------------------------------------------
 GroupAggregate
   Output: c2, sum(c1), GROUPING(c2)
   Group Key: ft1.c2
   ->  Foreign Scan on public.ft1
         Output: c2, c1
         Local server startup cost: 10
         Remote query: SELECT `C 1`, `c2` FROM `mysql_fdw_post`.`T 1` WHERE ((`c2` < 3)) ORDER BY `c2` IS NULL ASC, `c2` ASC
(7 rows)

--Testcase 281:
select c2, sum(c1), grouping(c2) from ft1 where c2 < 3 group by c2 order by 1 nulls last;
 c2 |  sum  | grouping 
----+-------+----------
  0 | 50500 |        0
  1 | 49600 |        0
  2 | 49700 |        0
(3 rows)

-- DISTINCT itself is not pushed down, whereas underneath aggregate is pushed
--Testcase 282:
explain (verbose, costs off)
select distinct sum(c1)/1000 s from ft2 where c2 < 6 group by c2 order by 1;
                                                        QUERY PLAN                                                        
--------------------------------------------------------------------------------------------------------------------------
 Unique
   Output: ((sum(c1) / 1000)), c2
   ->  Sort
         Output: ((sum(c1) / 1000)), c2
         Sort Key: ((sum(ft2.c1) / 1000))
         ->  Foreign Scan
               Output: ((sum(c1) / 1000)), c2
               Local server startup cost: 10
               Remote query: SELECT (sum(`C 1`) DIV 1000), `c2` FROM `mysql_fdw_post`.`T 1` WHERE ((`c2` < 6)) GROUP BY 2
(9 rows)

--Testcase 283:
select distinct sum(c1)/1000 s from ft2 where c2 < 6 group by c2 order by 1;
 s  
----
 49
 50
(2 rows)

-- WindowAgg
--Testcase 284:
explain (verbose, costs off)
select c2, sum(c2), count(c2) over (partition by c2%2) from ft2 where c2 < 10 group by c2 order by 1;
                                                           QUERY PLAN                                                            
---------------------------------------------------------------------------------------------------------------------------------
 Sort
   Output: c2, (sum(c2)), (count(c2) OVER (?)), ((c2 % 2))
   Sort Key: ft2.c2
   ->  WindowAgg
         Output: c2, (sum(c2)), count(c2) OVER (?), ((c2 % 2))
         ->  Sort
               Output: c2, ((c2 % 2)), (sum(c2))
               Sort Key: ((ft2.c2 % 2))
               ->  Foreign Scan
                     Output: c2, ((c2 % 2)), (sum(c2))
                     Local server startup cost: 10
                     Remote query: SELECT `c2`, (`c2` % 2), sum(`c2`) FROM `mysql_fdw_post`.`T 1` WHERE ((`c2` < 10)) GROUP BY 1
(12 rows)

--Testcase 285:
select c2, sum(c2), count(c2) over (partition by c2%2) from ft2 where c2 < 10 group by c2 order by 1;
 c2 | sum | count 
----+-----+-------
  0 |   0 |     5
  1 | 100 |     5
  2 | 200 |     5
  3 | 300 |     5
  4 | 400 |     5
  5 | 500 |     5
  6 | 600 |     5
  7 | 700 |     5
  8 | 800 |     5
  9 | 900 |     5
(10 rows)

--Testcase 286:
explain (verbose, costs off)
select c2, array_agg(c2) over (partition by c2%2 order by c2 desc) from ft1 where c2 < 10 group by c2 order by 1;
                                                      QUERY PLAN                                                      
----------------------------------------------------------------------------------------------------------------------
 Sort
   Output: c2, (array_agg(c2) OVER (?)), ((c2 % 2))
   Sort Key: ft1.c2
   ->  WindowAgg
         Output: c2, array_agg(c2) OVER (?), ((c2 % 2))
         ->  Sort
               Output: c2, ((c2 % 2))
               Sort Key: ((ft1.c2 % 2)), ft1.c2 DESC
               ->  Foreign Scan
                     Output: c2, ((c2 % 2))
                     Local server startup cost: 10
                     Remote query: SELECT `c2`, (`c2` % 2) FROM `mysql_fdw_post`.`T 1` WHERE ((`c2` < 10)) GROUP BY 1
(12 rows)

--Testcase 287:
select c2, array_agg(c2) over (partition by c2%2 order by c2 desc) from ft1 where c2 < 10 group by c2 order by 1;
 c2 |  array_agg  
----+-------------
  0 | {8,6,4,2,0}
  1 | {9,7,5,3,1}
  2 | {8,6,4,2}
  3 | {9,7,5,3}
  4 | {8,6,4}
  5 | {9,7,5}
  6 | {8,6}
  7 | {9,7}
  8 | {8}
  9 | {9}
(10 rows)

--Testcase 288:
explain (verbose, costs off)
select c2, array_agg(c2) over (partition by c2%2 order by c2 range between current row and unbounded following) from ft1 where c2 < 10 group by c2 order by 1;
                                                      QUERY PLAN                                                      
----------------------------------------------------------------------------------------------------------------------
 Sort
   Output: c2, (array_agg(c2) OVER (?)), ((c2 % 2))
   Sort Key: ft1.c2
   ->  WindowAgg
         Output: c2, array_agg(c2) OVER (?), ((c2 % 2))
         ->  Sort
               Output: c2, ((c2 % 2))
               Sort Key: ((ft1.c2 % 2)), ft1.c2
               ->  Foreign Scan
                     Output: c2, ((c2 % 2))
                     Local server startup cost: 10
                     Remote query: SELECT `c2`, (`c2` % 2) FROM `mysql_fdw_post`.`T 1` WHERE ((`c2` < 10)) GROUP BY 1
(12 rows)

--Testcase 289:
select c2, array_agg(c2) over (partition by c2%2 order by c2 range between current row and unbounded following) from ft1 where c2 < 10 group by c2 order by 1;
 c2 |  array_agg  
----+-------------
  0 | {0,2,4,6,8}
  1 | {1,3,5,7,9}
  2 | {2,4,6,8}
  3 | {3,5,7,9}
  4 | {4,6,8}
  5 | {5,7,9}
  6 | {6,8}
  7 | {7,9}
  8 | {8}
  9 | {9}
(10 rows)

-- ===================================================================
-- parameterized queries
-- ===================================================================
-- simple join
--Testcase 290:
PREPARE st1(int, int) AS SELECT t1.c3, t2.c3 FROM ft1 t1, ft2 t2 WHERE t1.c1 = $1 AND t2.c1 = $2;
--Testcase 291:
EXPLAIN (VERBOSE, COSTS OFF) EXECUTE st1(1, 2);
                                                                        QUERY PLAN                                                                        
----------------------------------------------------------------------------------------------------------------------------------------------------------
 Foreign Scan
   Output: t1.c3, t2.c3
   Local server startup cost: 10
   Remote query: SELECT r1.`c3`, r2.`c3` FROM (`mysql_fdw_post`.`T 1` r1 INNER JOIN `mysql_fdw_post`.`T 1` r2 ON (((r2.`C 1` = 2)) AND ((r1.`C 1` = 1))))
(4 rows)

--Testcase 292:
EXECUTE st1(1, 1);
  c3   |  c3   
-------+-------
 00001 | 00001
(1 row)

--Testcase 293:
EXECUTE st1(101, 101);
  c3   |  c3   
-------+-------
 00101 | 00101
(1 row)

-- subquery using stable function (can't be sent to remote)
SET datestyle TO "ISO, YMD";
--Testcase 379:
PREPARE st2(int) AS SELECT * FROM ft1 t1 WHERE t1.c1 < $2 AND t1.c3 IN (SELECT c3 FROM ft2 t2 WHERE c1 > $1 AND date(c4) = '1970-01-17'::date) ORDER BY c1;
--Testcase 380:
EXPLAIN (VERBOSE, COSTS OFF) EXECUTE st2(10, 20);
                                                                                 QUERY PLAN                                                                                 
----------------------------------------------------------------------------------------------------------------------------------------------------------------------------
 Sort
   Output: t1.c1, t1.c2, t1.c3, t1.c4, t1.c5, t1.c6, t1.c7, t1.c8
   Sort Key: t1.c1
   ->  Hash Join
         Output: t1.c1, t1.c2, t1.c3, t1.c4, t1.c5, t1.c6, t1.c7, t1.c8
         Inner Unique: true
         Hash Cond: (t1.c3 = t2.c3)
         ->  Foreign Scan on public.ft1 t1
               Output: t1.c1, t1.c2, t1.c3, t1.c4, t1.c5, t1.c6, t1.c7, t1.c8
               Local server startup cost: 10
               Remote query: SELECT `C 1`, `c2`, `c3`, `c4`, `c5`, `c6`, `c7`, `c8` FROM `mysql_fdw_post`.`T 1` WHERE ((`C 1` < 20))
         ->  Hash
               Output: t2.c3
               ->  HashAggregate
                     Output: t2.c3
                     Group Key: t2.c3
                     ->  Foreign Scan on public.ft2 t2
                           Output: t2.c3
                           Local server startup cost: 10
                           Remote query: SELECT `c3` FROM `mysql_fdw_post`.`T 1` WHERE ((`C 1` > 10)) AND ((date(`c4`) = '1970-01-17')) ORDER BY `c3` IS NULL ASC, `c3` ASC
(20 rows)

--Testcase 381:
EXECUTE st2(10, 20);
 c1 | c2 |  c3   |           c4           |         c5          | c6 | c7 | c8  
----+----+-------+------------------------+---------------------+----+----+-----
 16 |  6 | 00016 | 1970-01-17 00:00:00-08 | 1970-01-17 00:00:00 | 6  | 6  | foo
(1 row)

--Testcase 382:
EXECUTE st2(101, 121);
 c1  | c2 |  c3   |           c4           |         c5          | c6 | c7 | c8  
-----+----+-------+------------------------+---------------------+----+----+-----
 116 |  6 | 00116 | 1970-01-17 00:00:00-08 | 1970-01-17 00:00:00 | 6  | 6  | foo
(1 row)

-- subquery using immutable function (can be sent to remote)
--Testcase 383:
PREPARE st3(int) AS SELECT * FROM ft1 t1 WHERE t1.c1 < $2 AND t1.c3 IN (SELECT c3 FROM ft2 t2 WHERE c1 > $1 AND date(c5) = '1970-01-17'::date) ORDER BY c1;
--Testcase 384:
EXPLAIN (VERBOSE, COSTS OFF) EXECUTE st3(10, 20);
                                                                                 QUERY PLAN                                                                                 
----------------------------------------------------------------------------------------------------------------------------------------------------------------------------
 Sort
   Output: t1.c1, t1.c2, t1.c3, t1.c4, t1.c5, t1.c6, t1.c7, t1.c8
   Sort Key: t1.c1
   ->  Hash Join
         Output: t1.c1, t1.c2, t1.c3, t1.c4, t1.c5, t1.c6, t1.c7, t1.c8
         Inner Unique: true
         Hash Cond: (t1.c3 = t2.c3)
         ->  Foreign Scan on public.ft1 t1
               Output: t1.c1, t1.c2, t1.c3, t1.c4, t1.c5, t1.c6, t1.c7, t1.c8
               Local server startup cost: 10
               Remote query: SELECT `C 1`, `c2`, `c3`, `c4`, `c5`, `c6`, `c7`, `c8` FROM `mysql_fdw_post`.`T 1` WHERE ((`C 1` < 20))
         ->  Hash
               Output: t2.c3
               ->  HashAggregate
                     Output: t2.c3
                     Group Key: t2.c3
                     ->  Foreign Scan on public.ft2 t2
                           Output: t2.c3
                           Local server startup cost: 10
                           Remote query: SELECT `c3` FROM `mysql_fdw_post`.`T 1` WHERE ((`C 1` > 10)) AND ((date(`c5`) = '1970-01-17')) ORDER BY `c3` IS NULL ASC, `c3` ASC
(20 rows)

--Testcase 385:
EXECUTE st3(10, 20);
 c1 | c2 |  c3   |           c4           |         c5          | c6 | c7 | c8  
----+----+-------+------------------------+---------------------+----+----+-----
 16 |  6 | 00016 | 1970-01-17 00:00:00-08 | 1970-01-17 00:00:00 | 6  | 6  | foo
(1 row)

--Testcase 386:
EXECUTE st3(20, 30);
 c1 | c2 | c3 | c4 | c5 | c6 | c7 | c8 
----+----+----+----+----+----+----+----
(0 rows)

SET datestyle TO "Postgres, MDY";
-- custom plan should be chosen initially
--Testcase 294:
PREPARE st4(int) AS SELECT * FROM ft1 t1 WHERE t1.c1 = $1;
--Testcase 295:
EXPLAIN (VERBOSE, COSTS OFF) EXECUTE st4(1);
                                                       QUERY PLAN                                                       
------------------------------------------------------------------------------------------------------------------------
 Foreign Scan on public.ft1 t1
   Output: c1, c2, c3, c4, c5, c6, c7, c8
   Local server startup cost: 10
   Remote query: SELECT `C 1`, `c2`, `c3`, `c4`, `c5`, `c6`, `c7`, `c8` FROM `mysql_fdw_post`.`T 1` WHERE ((`C 1` = 1))
(4 rows)

--Testcase 296:
EXPLAIN (VERBOSE, COSTS OFF) EXECUTE st4(1);
                                                       QUERY PLAN                                                       
------------------------------------------------------------------------------------------------------------------------
 Foreign Scan on public.ft1 t1
   Output: c1, c2, c3, c4, c5, c6, c7, c8
   Local server startup cost: 10
   Remote query: SELECT `C 1`, `c2`, `c3`, `c4`, `c5`, `c6`, `c7`, `c8` FROM `mysql_fdw_post`.`T 1` WHERE ((`C 1` = 1))
(4 rows)

--Testcase 297:
EXPLAIN (VERBOSE, COSTS OFF) EXECUTE st4(1);
                                                       QUERY PLAN                                                       
------------------------------------------------------------------------------------------------------------------------
 Foreign Scan on public.ft1 t1
   Output: c1, c2, c3, c4, c5, c6, c7, c8
   Local server startup cost: 10
   Remote query: SELECT `C 1`, `c2`, `c3`, `c4`, `c5`, `c6`, `c7`, `c8` FROM `mysql_fdw_post`.`T 1` WHERE ((`C 1` = 1))
(4 rows)

--Testcase 298:
EXPLAIN (VERBOSE, COSTS OFF) EXECUTE st4(1);
                                                       QUERY PLAN                                                       
------------------------------------------------------------------------------------------------------------------------
 Foreign Scan on public.ft1 t1
   Output: c1, c2, c3, c4, c5, c6, c7, c8
   Local server startup cost: 10
   Remote query: SELECT `C 1`, `c2`, `c3`, `c4`, `c5`, `c6`, `c7`, `c8` FROM `mysql_fdw_post`.`T 1` WHERE ((`C 1` = 1))
(4 rows)

--Testcase 299:
EXPLAIN (VERBOSE, COSTS OFF) EXECUTE st4(1);
                                                       QUERY PLAN                                                       
------------------------------------------------------------------------------------------------------------------------
 Foreign Scan on public.ft1 t1
   Output: c1, c2, c3, c4, c5, c6, c7, c8
   Local server startup cost: 10
   Remote query: SELECT `C 1`, `c2`, `c3`, `c4`, `c5`, `c6`, `c7`, `c8` FROM `mysql_fdw_post`.`T 1` WHERE ((`C 1` = 1))
(4 rows)

-- once we try it enough times, should switch to generic plan
--Testcase 300:
EXPLAIN (VERBOSE, COSTS OFF) EXECUTE st4(1);
                                                       QUERY PLAN                                                       
------------------------------------------------------------------------------------------------------------------------
 Foreign Scan on public.ft1 t1
   Output: c1, c2, c3, c4, c5, c6, c7, c8
   Local server startup cost: 10
   Remote query: SELECT `C 1`, `c2`, `c3`, `c4`, `c5`, `c6`, `c7`, `c8` FROM `mysql_fdw_post`.`T 1` WHERE ((`C 1` = ?))
(4 rows)

-- value of $1 should not be sent to remote
--Testcase 301:
PREPARE st5(user_enum,int) AS SELECT * FROM ft1 t1 WHERE c8 = $1 and c1 = $2;
--Testcase 302:
EXPLAIN (VERBOSE, COSTS OFF) EXECUTE st5('foo', 1);
                                                       QUERY PLAN                                                       
------------------------------------------------------------------------------------------------------------------------
 Foreign Scan on public.ft1 t1
   Output: c1, c2, c3, c4, c5, c6, c7, c8
   Filter: (t1.c8 = 'foo'::user_enum)
   Local server startup cost: 10
   Remote query: SELECT `C 1`, `c2`, `c3`, `c4`, `c5`, `c6`, `c7`, `c8` FROM `mysql_fdw_post`.`T 1` WHERE ((`C 1` = 1))
(5 rows)

--Testcase 303:
EXPLAIN (VERBOSE, COSTS OFF) EXECUTE st5('foo', 1);
                                                       QUERY PLAN                                                       
------------------------------------------------------------------------------------------------------------------------
 Foreign Scan on public.ft1 t1
   Output: c1, c2, c3, c4, c5, c6, c7, c8
   Filter: (t1.c8 = 'foo'::user_enum)
   Local server startup cost: 10
   Remote query: SELECT `C 1`, `c2`, `c3`, `c4`, `c5`, `c6`, `c7`, `c8` FROM `mysql_fdw_post`.`T 1` WHERE ((`C 1` = 1))
(5 rows)

--Testcase 304:
EXPLAIN (VERBOSE, COSTS OFF) EXECUTE st5('foo', 1);
                                                       QUERY PLAN                                                       
------------------------------------------------------------------------------------------------------------------------
 Foreign Scan on public.ft1 t1
   Output: c1, c2, c3, c4, c5, c6, c7, c8
   Filter: (t1.c8 = 'foo'::user_enum)
   Local server startup cost: 10
   Remote query: SELECT `C 1`, `c2`, `c3`, `c4`, `c5`, `c6`, `c7`, `c8` FROM `mysql_fdw_post`.`T 1` WHERE ((`C 1` = 1))
(5 rows)

--Testcase 305:
EXPLAIN (VERBOSE, COSTS OFF) EXECUTE st5('foo', 1);
                                                       QUERY PLAN                                                       
------------------------------------------------------------------------------------------------------------------------
 Foreign Scan on public.ft1 t1
   Output: c1, c2, c3, c4, c5, c6, c7, c8
   Filter: (t1.c8 = 'foo'::user_enum)
   Local server startup cost: 10
   Remote query: SELECT `C 1`, `c2`, `c3`, `c4`, `c5`, `c6`, `c7`, `c8` FROM `mysql_fdw_post`.`T 1` WHERE ((`C 1` = 1))
(5 rows)

--Testcase 306:
EXPLAIN (VERBOSE, COSTS OFF) EXECUTE st5('foo', 1);
                                                       QUERY PLAN                                                       
------------------------------------------------------------------------------------------------------------------------
 Foreign Scan on public.ft1 t1
   Output: c1, c2, c3, c4, c5, c6, c7, c8
   Filter: (t1.c8 = 'foo'::user_enum)
   Local server startup cost: 10
   Remote query: SELECT `C 1`, `c2`, `c3`, `c4`, `c5`, `c6`, `c7`, `c8` FROM `mysql_fdw_post`.`T 1` WHERE ((`C 1` = 1))
(5 rows)

--Testcase 307:
EXPLAIN (VERBOSE, COSTS OFF) EXECUTE st5('foo', 1);
                                                       QUERY PLAN                                                       
------------------------------------------------------------------------------------------------------------------------
 Foreign Scan on public.ft1 t1
   Output: c1, c2, c3, c4, c5, c6, c7, c8
   Filter: (t1.c8 = $1)
   Local server startup cost: 10
   Remote query: SELECT `C 1`, `c2`, `c3`, `c4`, `c5`, `c6`, `c7`, `c8` FROM `mysql_fdw_post`.`T 1` WHERE ((`C 1` = ?))
(5 rows)

--Testcase 308:
EXECUTE st5('foo', 1);
 c1 | c2 |  c3   |              c4              |            c5            | c6 | c7 | c8  
----+----+-------+------------------------------+--------------------------+----+----+-----
  1 |  1 | 00001 | Fri Jan 02 00:00:00 1970 PST | Fri Jan 02 00:00:00 1970 | 1  | 1  | foo
(1 row)

-- altering FDW options requires replanning
--Testcase 309:
PREPARE st6 AS SELECT * FROM ft1 t1 WHERE t1.c1 = t1.c2;
--Testcase 310:
EXPLAIN (VERBOSE, COSTS OFF) EXECUTE st6;
                                                        QUERY PLAN                                                         
---------------------------------------------------------------------------------------------------------------------------
 Foreign Scan on public.ft1 t1
   Output: c1, c2, c3, c4, c5, c6, c7, c8
   Local server startup cost: 10
   Remote query: SELECT `C 1`, `c2`, `c3`, `c4`, `c5`, `c6`, `c7`, `c8` FROM `mysql_fdw_post`.`T 1` WHERE ((`C 1` = `c2`))
(4 rows)

--Testcase 311:
PREPARE st7 AS INSERT INTO ft1 (c1,c2,c3) VALUES (1001,101,'foo');
--Testcase 312:
EXPLAIN (VERBOSE, COSTS OFF) EXECUTE st7;
                                                                                           QUERY PLAN                                                                                            
-------------------------------------------------------------------------------------------------------------------------------------------------------------------------------------------------
 Insert on public.ft1
   ->  Result
         Output: NULL::integer, 1001, 101, 'foo'::text, NULL::timestamp with time zone, NULL::timestamp without time zone, NULL::character varying, 'ft1       '::character(10), NULL::user_enum
(3 rows)

-- ALTER TABLE "S 1"."T 1" RENAME TO "T 0";
-- ALTER FOREIGN TABLE ft1 OPTIONS (SET table_name 'T 0');
--Testcase 313:
EXPLAIN (VERBOSE, COSTS OFF) EXECUTE st6;
                                                        QUERY PLAN                                                         
---------------------------------------------------------------------------------------------------------------------------
 Foreign Scan on public.ft1 t1
   Output: c1, c2, c3, c4, c5, c6, c7, c8
   Local server startup cost: 10
   Remote query: SELECT `C 1`, `c2`, `c3`, `c4`, `c5`, `c6`, `c7`, `c8` FROM `mysql_fdw_post`.`T 1` WHERE ((`C 1` = `c2`))
(4 rows)

--Testcase 314:
EXECUTE st6;
 c1 | c2 |  c3   |              c4              |            c5            | c6 | c7 | c8  
----+----+-------+------------------------------+--------------------------+----+----+-----
  1 |  1 | 00001 | Fri Jan 02 00:00:00 1970 PST | Fri Jan 02 00:00:00 1970 | 1  | 1  | foo
  2 |  2 | 00002 | Sat Jan 03 00:00:00 1970 PST | Sat Jan 03 00:00:00 1970 | 2  | 2  | foo
  3 |  3 | 00003 | Sun Jan 04 00:00:00 1970 PST | Sun Jan 04 00:00:00 1970 | 3  | 3  | foo
  4 |  4 | 00004 | Mon Jan 05 00:00:00 1970 PST | Mon Jan 05 00:00:00 1970 | 4  | 4  | foo
  5 |  5 | 00005 | Tue Jan 06 00:00:00 1970 PST | Tue Jan 06 00:00:00 1970 | 5  | 5  | foo
  6 |  6 | 00006 | Wed Jan 07 00:00:00 1970 PST | Wed Jan 07 00:00:00 1970 | 6  | 6  | foo
  7 |  7 | 00007 | Thu Jan 08 00:00:00 1970 PST | Thu Jan 08 00:00:00 1970 | 7  | 7  | foo
  8 |  8 | 00008 | Fri Jan 09 00:00:00 1970 PST | Fri Jan 09 00:00:00 1970 | 8  | 8  | foo
  9 |  9 | 00009 | Sat Jan 10 00:00:00 1970 PST | Sat Jan 10 00:00:00 1970 | 9  | 9  | foo
(9 rows)

--Testcase 315:
EXPLAIN (VERBOSE, COSTS OFF) EXECUTE st7;
                                                                                           QUERY PLAN                                                                                            
-------------------------------------------------------------------------------------------------------------------------------------------------------------------------------------------------
 Insert on public.ft1
   ->  Result
         Output: NULL::integer, 1001, 101, 'foo'::text, NULL::timestamp with time zone, NULL::timestamp without time zone, NULL::character varying, 'ft1       '::character(10), NULL::user_enum
(3 rows)

-- ALTER TABLE "S 1"."T 0" RENAME TO "T 1";
-- ALTER FOREIGN TABLE ft1 OPTIONS (SET table_name 'T 1');
--Testcase 316:
PREPARE st8 AS SELECT count(c3) FROM ft1 t1 WHERE t1.c1 === t1.c2;
--Testcase 317:
EXPLAIN (VERBOSE, COSTS OFF) EXECUTE st8;
                                 QUERY PLAN                                 
----------------------------------------------------------------------------
 Aggregate
   Output: count(c3)
   ->  Foreign Scan on public.ft1 t1
         Output: c3
         Filter: (t1.c1 === t1.c2)
         Local server startup cost: 10
         Remote query: SELECT `C 1`, `c2`, `c3` FROM `mysql_fdw_post`.`T 1`
(7 rows)

ALTER SERVER mysql_svr OPTIONS (DROP extensions);
--Testcase 318:
EXPLAIN (VERBOSE, COSTS OFF) EXECUTE st8;
                                 QUERY PLAN                                 
----------------------------------------------------------------------------
 Aggregate
   Output: count(c3)
   ->  Foreign Scan on public.ft1 t1
         Output: c3
         Filter: (t1.c1 === t1.c2)
         Local server startup cost: 10
         Remote query: SELECT `C 1`, `c2`, `c3` FROM `mysql_fdw_post`.`T 1`
(7 rows)

--Testcase 319:
EXECUTE st8;
 count 
-------
     9
(1 row)

ALTER SERVER mysql_svr OPTIONS (ADD extensions 'mysql_fdw');
-- cleanup
DEALLOCATE st1;
-- DEALLOCATE st2;
-- DEALLOCATE st3;
DEALLOCATE st4;
DEALLOCATE st5;
DEALLOCATE st6;
DEALLOCATE st7;
DEALLOCATE st8;
-- mysql_fdw not support tableoid
-- -- System columns, except ctid and oid, should not be sent to remote
-- EXPLAIN (VERBOSE, COSTS OFF)
-- SELECT * FROM ft1 t1 WHERE t1.tableoid = 'pg_class'::regclass LIMIT 1;
-- SELECT * FROM ft1 t1 WHERE t1.tableoid = 'ft1'::regclass LIMIT 1;
-- EXPLAIN (VERBOSE, COSTS OFF)
-- SELECT tableoid::regclass, * FROM ft1 t1 LIMIT 1;
-- SELECT tableoid::regclass, * FROM ft1 t1 LIMIT 1;
-- mysql_fdw does not support ctid
-- EXPLAIN (VERBOSE, COSTS OFF)
-- SELECT * FROM ft1 t1 WHERE t1.ctid = '(0,2)';
-- SELECT * FROM ft1 t1 WHERE t1.ctid = '(0,2)';
-- EXPLAIN (VERBOSE, COSTS OFF)
-- SELECT ctid, * FROM ft1 t1 LIMIT 1;
-- SELECT ctid, * FROM ft1 t1 LIMIT 1;
-- ===================================================================
-- used in PL/pgSQL function
-- ===================================================================
--Testcase 320:
CREATE OR REPLACE FUNCTION f_test(p_c1 int) RETURNS int AS $$
DECLARE
	v_c1 int;
BEGIN
--Testcase 321:
    SELECT c1 INTO v_c1 FROM ft1 WHERE c1 = p_c1 LIMIT 1;
    PERFORM c1 FROM ft1 WHERE c1 = p_c1 AND p_c1 = v_c1 LIMIT 1;
    RETURN v_c1;
END;
$$ LANGUAGE plpgsql;
--Testcase 322:
SELECT f_test(100);
 f_test 
--------
    100
(1 row)

--Testcase 323:
DROP FUNCTION f_test(int);
-- ===================================================================
-- conversion error
-- ===================================================================
ALTER FOREIGN TABLE ft1 ALTER COLUMN c8 TYPE int;
--Testcase 324:
SELECT * FROM ft1 WHERE c1 = 1;  -- ERROR
ERROR:  invalid input syntax for type integer: "foo"
--Testcase 325:
SELECT  ft1.c1,  ft2.c2, ft1.c8 FROM ft1, ft2 WHERE ft1.c1 = ft2.c1 AND ft1.c1 = 1; -- ERROR
ERROR:  invalid input syntax for type integer: "foo"
--Testcase 326:
SELECT  ft1.c1,  ft2.c2, ft1 FROM ft1, ft2 WHERE ft1.c1 = ft2.c1 AND ft1.c1 = 1; -- ERROR
ERROR:  invalid input syntax for type integer: "foo"
--Testcase 327:
SELECT sum(c2), array_agg(c8) FROM ft1 GROUP BY c8; -- ERROR
ERROR:  invalid input syntax for type integer: "foo"
ALTER FOREIGN TABLE ft1 ALTER COLUMN c8 TYPE user_enum;
-- ===================================================================
-- subtransaction
--  + local/remote error doesn't break cursor
-- ===================================================================
BEGIN;
DECLARE c CURSOR FOR SELECT * FROM ft1 ORDER BY c1;
--Testcase 328:
FETCH c;
 c1 | c2 |  c3   |              c4              |            c5            | c6 | c7 | c8  
----+----+-------+------------------------------+--------------------------+----+----+-----
  1 |  1 | 00001 | Fri Jan 02 00:00:00 1970 PST | Fri Jan 02 00:00:00 1970 | 1  | 1  | foo
(1 row)

SAVEPOINT s;
ERROR OUT;          -- ERROR
ERROR:  syntax error at or near "ERROR" at character 1
ROLLBACK TO s;
--Testcase 329:
FETCH c;
 c1 | c2 |  c3   |              c4              |            c5            | c6 | c7 | c8  
----+----+-------+------------------------------+--------------------------+----+----+-----
  2 |  2 | 00002 | Sat Jan 03 00:00:00 1970 PST | Sat Jan 03 00:00:00 1970 | 2  | 2  | foo
(1 row)

SAVEPOINT s;
--Testcase 330:
SELECT * FROM ft1 WHERE 1 / (c1 - 1) > 0;  -- ERROR
ERROR:  division by zero
ROLLBACK TO s;
--Testcase 331:
FETCH c;
 c1 | c2 |  c3   |              c4              |            c5            | c6 | c7 | c8  
----+----+-------+------------------------------+--------------------------+----+----+-----
  3 |  3 | 00003 | Sun Jan 04 00:00:00 1970 PST | Sun Jan 04 00:00:00 1970 | 3  | 3  | foo
(1 row)

--Testcase 332:
SELECT * FROM ft1 ORDER BY c1 LIMIT 1;
 c1 | c2 |  c3   |              c4              |            c5            | c6 | c7 | c8  
----+----+-------+------------------------------+--------------------------+----+----+-----
  1 |  1 | 00001 | Fri Jan 02 00:00:00 1970 PST | Fri Jan 02 00:00:00 1970 | 1  | 1  | foo
(1 row)

COMMIT;
-- -- ===================================================================
-- -- test handling of collations
-- -- ===================================================================
-- create foreign table ft3 (f1 text collate "C", f2 text, f3 varchar(10))
--   server mysql_svr options (dbname 'mysql_fdw_post', table_name 'loct3', use_remote_estimate 'true');
-- -- can be sent to remote
-- explain (verbose, costs off) select * from ft3 where f1 = 'foo';
-- explain (verbose, costs off) select * from ft3 where f1 COLLATE "C" = 'foo';
-- explain (verbose, costs off) select * from ft3 where f2 = 'foo';
-- explain (verbose, costs off) select * from ft3 where f3 = 'foo';
-- explain (verbose, costs off) select * from ft3 f, loct3 l
--   where f.f3 = l.f3 and l.f1 = 'foo';
-- -- can't be sent to remote
-- explain (verbose, costs off) select * from ft3 where f1 COLLATE "POSIX" = 'foo';
-- explain (verbose, costs off) select * from ft3 where f1 = 'foo' COLLATE "C";
-- explain (verbose, costs off) select * from ft3 where f2 COLLATE "C" = 'foo';
-- explain (verbose, costs off) select * from ft3 where f2 = 'foo' COLLATE "C";
-- explain (verbose, costs off) select * from ft3 f, loct3 l
--   where f.f3 = l.f3 COLLATE "POSIX" and l.f1 = 'foo';
-- -- ===================================================================
-- -- test writable foreign table stuff
-- -- ===================================================================
--Testcase 387:
EXPLAIN (verbose, costs off)
INSERT INTO ft2 (c1,c2,c3) SELECT c1+1000,c2+100, c3 || c3 FROM ft2 LIMIT 20;
                                                                                                                    QUERY PLAN                                                                                                                    
--------------------------------------------------------------------------------------------------------------------------------------------------------------------------------------------------------------------------------------------------
 Insert on public.ft2
   ->  Subquery Scan on "*SELECT*"
         Output: "*SELECT*"."?column?", "*SELECT*"."?column?_1", NULL::integer, "*SELECT*"."?column?_2", NULL::timestamp with time zone, NULL::timestamp without time zone, NULL::character varying, 'ft2       '::character(10), NULL::user_enum
         ->  Foreign Scan on public.ft2 ft2_1
               Output: (ft2_1.c1 + 1000), (ft2_1.c2 + 100), (ft2_1.c3 || ft2_1.c3)
               Local server startup cost: 10
               Remote query: SELECT `C 1`, `c2`, `c3` FROM `mysql_fdw_post`.`T 1` LIMIT 20
(7 rows)

--Testcase 388:
INSERT INTO ft2 (c1,c2,c3) SELECT c1+1000,c2+100, c3 || c3 FROM ft2 LIMIT 20;
--Testcase 389:
INSERT INTO ft2 (c1,c2,c3)
   VALUES (1101,201,'aaa'), (1102,202,'bbb'), (1103,203,'ccc');
-- MySQL does not support RETURNING, so we use SELECT with condition to check data after INSERT/UPDATE/DELETE.
--Testcase 390:
SELECT * FROM ft2 WHERE c1 IN (1101, 1102, 1103);
  c1  | c2  | c3  | c4 | c5 | c6 | c7  | c8 
------+-----+-----+----+----+----+-----+----
 1101 | 201 | aaa |    |    |    | ft2 | 
 1102 | 202 | bbb |    |    |    | ft2 | 
 1103 | 203 | ccc |    |    |    | ft2 | 
(3 rows)

--Testcase 391:
INSERT INTO ft2 (c1,c2,c3) VALUES (1104,204,'ddd'), (1105,205,'eee');
--Testcase 392:
EXPLAIN (verbose, costs off)
UPDATE ft2 SET c2 = c2 + 300, c3 = c3 || '_update3' WHERE c1 % 10 = 3;              -- can be pushed down
                                                               QUERY PLAN                                                                
-----------------------------------------------------------------------------------------------------------------------------------------
 Update on public.ft2
   ->  Foreign Update on public.ft2
         mysql query: UPDATE `mysql_fdw_post`.`T 1` SET `c2` = (`c2` + 300), `c3` = CONCAT(`c3` , '_update3') WHERE (((`C 1` % 10) = 3))
(3 rows)

--Testcase 393:
UPDATE ft2 SET c2 = c2 + 300, c3 = c3 || '_update3' WHERE c1 % 10 = 3;
--Testcase 394:
EXPLAIN (verbose, costs off)
UPDATE ft2 SET c2 = c2 + 400, c3 = c3 || '_update7' WHERE c1 % 10 = 7;  -- can be pushed down
                                                               QUERY PLAN                                                                
-----------------------------------------------------------------------------------------------------------------------------------------
 Update on public.ft2
   ->  Foreign Update on public.ft2
         mysql query: UPDATE `mysql_fdw_post`.`T 1` SET `c2` = (`c2` + 400), `c3` = CONCAT(`c3` , '_update7') WHERE (((`C 1` % 10) = 7))
(3 rows)

--Testcase 395:
UPDATE ft2 SET c2 = c2 + 400, c3 = c3 || '_update7' WHERE c1 % 10 = 7;
-- MySQL does not support RETURNING, so we use SELECT with condition to check data after INSERT/UPDATE/DELETE.
--Testcase 396:
SELECT * FROM ft2 WHERE c1 % 10 = 7;
  c1  | c2  |         c3         |              c4              |            c5            | c6 | c7  | c8  
------+-----+--------------------+------------------------------+--------------------------+----+-----+-----
    7 | 407 | 00007_update7      | Thu Jan 08 00:00:00 1970 PST | Thu Jan 08 00:00:00 1970 | 7  | 7   | foo
   17 | 407 | 00017_update7      | Sun Jan 18 00:00:00 1970 PST | Sun Jan 18 00:00:00 1970 | 7  | 7   | foo
   27 | 407 | 00027_update7      | Wed Jan 28 00:00:00 1970 PST | Wed Jan 28 00:00:00 1970 | 7  | 7   | foo
   37 | 407 | 00037_update7      | Sat Feb 07 00:00:00 1970 PST | Sat Feb 07 00:00:00 1970 | 7  | 7   | foo
   47 | 407 | 00047_update7      | Tue Feb 17 00:00:00 1970 PST | Tue Feb 17 00:00:00 1970 | 7  | 7   | foo
   57 | 407 | 00057_update7      | Fri Feb 27 00:00:00 1970 PST | Fri Feb 27 00:00:00 1970 | 7  | 7   | foo
   67 | 407 | 00067_update7      | Mon Mar 09 00:00:00 1970 PST | Mon Mar 09 00:00:00 1970 | 7  | 7   | foo
   77 | 407 | 00077_update7      | Thu Mar 19 00:00:00 1970 PST | Thu Mar 19 00:00:00 1970 | 7  | 7   | foo
   87 | 407 | 00087_update7      | Sun Mar 29 00:00:00 1970 PST | Sun Mar 29 00:00:00 1970 | 7  | 7   | foo
   97 | 407 | 00097_update7      | Wed Apr 08 00:00:00 1970 PST | Wed Apr 08 00:00:00 1970 | 7  | 7   | foo
  107 | 407 | 00107_update7      | Thu Jan 08 00:00:00 1970 PST | Thu Jan 08 00:00:00 1970 | 7  | 7   | foo
  117 | 407 | 00117_update7      | Sun Jan 18 00:00:00 1970 PST | Sun Jan 18 00:00:00 1970 | 7  | 7   | foo
  127 | 407 | 00127_update7      | Wed Jan 28 00:00:00 1970 PST | Wed Jan 28 00:00:00 1970 | 7  | 7   | foo
  137 | 407 | 00137_update7      | Sat Feb 07 00:00:00 1970 PST | Sat Feb 07 00:00:00 1970 | 7  | 7   | foo
  147 | 407 | 00147_update7      | Tue Feb 17 00:00:00 1970 PST | Tue Feb 17 00:00:00 1970 | 7  | 7   | foo
  157 | 407 | 00157_update7      | Fri Feb 27 00:00:00 1970 PST | Fri Feb 27 00:00:00 1970 | 7  | 7   | foo
  167 | 407 | 00167_update7      | Mon Mar 09 00:00:00 1970 PST | Mon Mar 09 00:00:00 1970 | 7  | 7   | foo
  177 | 407 | 00177_update7      | Thu Mar 19 00:00:00 1970 PST | Thu Mar 19 00:00:00 1970 | 7  | 7   | foo
  187 | 407 | 00187_update7      | Sun Mar 29 00:00:00 1970 PST | Sun Mar 29 00:00:00 1970 | 7  | 7   | foo
  197 | 407 | 00197_update7      | Wed Apr 08 00:00:00 1970 PST | Wed Apr 08 00:00:00 1970 | 7  | 7   | foo
  207 | 407 | 00207_update7      | Thu Jan 08 00:00:00 1970 PST | Thu Jan 08 00:00:00 1970 | 7  | 7   | foo
  217 | 407 | 00217_update7      | Sun Jan 18 00:00:00 1970 PST | Sun Jan 18 00:00:00 1970 | 7  | 7   | foo
  227 | 407 | 00227_update7      | Wed Jan 28 00:00:00 1970 PST | Wed Jan 28 00:00:00 1970 | 7  | 7   | foo
  237 | 407 | 00237_update7      | Sat Feb 07 00:00:00 1970 PST | Sat Feb 07 00:00:00 1970 | 7  | 7   | foo
  247 | 407 | 00247_update7      | Tue Feb 17 00:00:00 1970 PST | Tue Feb 17 00:00:00 1970 | 7  | 7   | foo
  257 | 407 | 00257_update7      | Fri Feb 27 00:00:00 1970 PST | Fri Feb 27 00:00:00 1970 | 7  | 7   | foo
  267 | 407 | 00267_update7      | Mon Mar 09 00:00:00 1970 PST | Mon Mar 09 00:00:00 1970 | 7  | 7   | foo
  277 | 407 | 00277_update7      | Thu Mar 19 00:00:00 1970 PST | Thu Mar 19 00:00:00 1970 | 7  | 7   | foo
  287 | 407 | 00287_update7      | Sun Mar 29 00:00:00 1970 PST | Sun Mar 29 00:00:00 1970 | 7  | 7   | foo
  297 | 407 | 00297_update7      | Wed Apr 08 00:00:00 1970 PST | Wed Apr 08 00:00:00 1970 | 7  | 7   | foo
  307 | 407 | 00307_update7      | Thu Jan 08 00:00:00 1970 PST | Thu Jan 08 00:00:00 1970 | 7  | 7   | foo
  317 | 407 | 00317_update7      | Sun Jan 18 00:00:00 1970 PST | Sun Jan 18 00:00:00 1970 | 7  | 7   | foo
  327 | 407 | 00327_update7      | Wed Jan 28 00:00:00 1970 PST | Wed Jan 28 00:00:00 1970 | 7  | 7   | foo
  337 | 407 | 00337_update7      | Sat Feb 07 00:00:00 1970 PST | Sat Feb 07 00:00:00 1970 | 7  | 7   | foo
  347 | 407 | 00347_update7      | Tue Feb 17 00:00:00 1970 PST | Tue Feb 17 00:00:00 1970 | 7  | 7   | foo
  357 | 407 | 00357_update7      | Fri Feb 27 00:00:00 1970 PST | Fri Feb 27 00:00:00 1970 | 7  | 7   | foo
  367 | 407 | 00367_update7      | Mon Mar 09 00:00:00 1970 PST | Mon Mar 09 00:00:00 1970 | 7  | 7   | foo
  377 | 407 | 00377_update7      | Thu Mar 19 00:00:00 1970 PST | Thu Mar 19 00:00:00 1970 | 7  | 7   | foo
  387 | 407 | 00387_update7      | Sun Mar 29 00:00:00 1970 PST | Sun Mar 29 00:00:00 1970 | 7  | 7   | foo
  397 | 407 | 00397_update7      | Wed Apr 08 00:00:00 1970 PST | Wed Apr 08 00:00:00 1970 | 7  | 7   | foo
  407 | 407 | 00407_update7      | Thu Jan 08 00:00:00 1970 PST | Thu Jan 08 00:00:00 1970 | 7  | 7   | foo
  417 | 407 | 00417_update7      | Sun Jan 18 00:00:00 1970 PST | Sun Jan 18 00:00:00 1970 | 7  | 7   | foo
  427 | 407 | 00427_update7      | Wed Jan 28 00:00:00 1970 PST | Wed Jan 28 00:00:00 1970 | 7  | 7   | foo
  437 | 407 | 00437_update7      | Sat Feb 07 00:00:00 1970 PST | Sat Feb 07 00:00:00 1970 | 7  | 7   | foo
  447 | 407 | 00447_update7      | Tue Feb 17 00:00:00 1970 PST | Tue Feb 17 00:00:00 1970 | 7  | 7   | foo
  457 | 407 | 00457_update7      | Fri Feb 27 00:00:00 1970 PST | Fri Feb 27 00:00:00 1970 | 7  | 7   | foo
  467 | 407 | 00467_update7      | Mon Mar 09 00:00:00 1970 PST | Mon Mar 09 00:00:00 1970 | 7  | 7   | foo
  477 | 407 | 00477_update7      | Thu Mar 19 00:00:00 1970 PST | Thu Mar 19 00:00:00 1970 | 7  | 7   | foo
  487 | 407 | 00487_update7      | Sun Mar 29 00:00:00 1970 PST | Sun Mar 29 00:00:00 1970 | 7  | 7   | foo
  497 | 407 | 00497_update7      | Wed Apr 08 00:00:00 1970 PST | Wed Apr 08 00:00:00 1970 | 7  | 7   | foo
  507 | 407 | 00507_update7      | Thu Jan 08 00:00:00 1970 PST | Thu Jan 08 00:00:00 1970 | 7  | 7   | foo
  517 | 407 | 00517_update7      | Sun Jan 18 00:00:00 1970 PST | Sun Jan 18 00:00:00 1970 | 7  | 7   | foo
  527 | 407 | 00527_update7      | Wed Jan 28 00:00:00 1970 PST | Wed Jan 28 00:00:00 1970 | 7  | 7   | foo
  537 | 407 | 00537_update7      | Sat Feb 07 00:00:00 1970 PST | Sat Feb 07 00:00:00 1970 | 7  | 7   | foo
  547 | 407 | 00547_update7      | Tue Feb 17 00:00:00 1970 PST | Tue Feb 17 00:00:00 1970 | 7  | 7   | foo
  557 | 407 | 00557_update7      | Fri Feb 27 00:00:00 1970 PST | Fri Feb 27 00:00:00 1970 | 7  | 7   | foo
  567 | 407 | 00567_update7      | Mon Mar 09 00:00:00 1970 PST | Mon Mar 09 00:00:00 1970 | 7  | 7   | foo
  577 | 407 | 00577_update7      | Thu Mar 19 00:00:00 1970 PST | Thu Mar 19 00:00:00 1970 | 7  | 7   | foo
  587 | 407 | 00587_update7      | Sun Mar 29 00:00:00 1970 PST | Sun Mar 29 00:00:00 1970 | 7  | 7   | foo
  597 | 407 | 00597_update7      | Wed Apr 08 00:00:00 1970 PST | Wed Apr 08 00:00:00 1970 | 7  | 7   | foo
  607 | 407 | 00607_update7      | Thu Jan 08 00:00:00 1970 PST | Thu Jan 08 00:00:00 1970 | 7  | 7   | foo
  617 | 407 | 00617_update7      | Sun Jan 18 00:00:00 1970 PST | Sun Jan 18 00:00:00 1970 | 7  | 7   | foo
  627 | 407 | 00627_update7      | Wed Jan 28 00:00:00 1970 PST | Wed Jan 28 00:00:00 1970 | 7  | 7   | foo
  637 | 407 | 00637_update7      | Sat Feb 07 00:00:00 1970 PST | Sat Feb 07 00:00:00 1970 | 7  | 7   | foo
  647 | 407 | 00647_update7      | Tue Feb 17 00:00:00 1970 PST | Tue Feb 17 00:00:00 1970 | 7  | 7   | foo
  657 | 407 | 00657_update7      | Fri Feb 27 00:00:00 1970 PST | Fri Feb 27 00:00:00 1970 | 7  | 7   | foo
  667 | 407 | 00667_update7      | Mon Mar 09 00:00:00 1970 PST | Mon Mar 09 00:00:00 1970 | 7  | 7   | foo
  677 | 407 | 00677_update7      | Thu Mar 19 00:00:00 1970 PST | Thu Mar 19 00:00:00 1970 | 7  | 7   | foo
  687 | 407 | 00687_update7      | Sun Mar 29 00:00:00 1970 PST | Sun Mar 29 00:00:00 1970 | 7  | 7   | foo
  697 | 407 | 00697_update7      | Wed Apr 08 00:00:00 1970 PST | Wed Apr 08 00:00:00 1970 | 7  | 7   | foo
  707 | 407 | 00707_update7      | Thu Jan 08 00:00:00 1970 PST | Thu Jan 08 00:00:00 1970 | 7  | 7   | foo
  717 | 407 | 00717_update7      | Sun Jan 18 00:00:00 1970 PST | Sun Jan 18 00:00:00 1970 | 7  | 7   | foo
  727 | 407 | 00727_update7      | Wed Jan 28 00:00:00 1970 PST | Wed Jan 28 00:00:00 1970 | 7  | 7   | foo
  737 | 407 | 00737_update7      | Sat Feb 07 00:00:00 1970 PST | Sat Feb 07 00:00:00 1970 | 7  | 7   | foo
  747 | 407 | 00747_update7      | Tue Feb 17 00:00:00 1970 PST | Tue Feb 17 00:00:00 1970 | 7  | 7   | foo
  757 | 407 | 00757_update7      | Fri Feb 27 00:00:00 1970 PST | Fri Feb 27 00:00:00 1970 | 7  | 7   | foo
  767 | 407 | 00767_update7      | Mon Mar 09 00:00:00 1970 PST | Mon Mar 09 00:00:00 1970 | 7  | 7   | foo
  777 | 407 | 00777_update7      | Thu Mar 19 00:00:00 1970 PST | Thu Mar 19 00:00:00 1970 | 7  | 7   | foo
  787 | 407 | 00787_update7      | Sun Mar 29 00:00:00 1970 PST | Sun Mar 29 00:00:00 1970 | 7  | 7   | foo
  797 | 407 | 00797_update7      | Wed Apr 08 00:00:00 1970 PST | Wed Apr 08 00:00:00 1970 | 7  | 7   | foo
  807 | 407 | 00807_update7      | Thu Jan 08 00:00:00 1970 PST | Thu Jan 08 00:00:00 1970 | 7  | 7   | foo
  817 | 407 | 00817_update7      | Sun Jan 18 00:00:00 1970 PST | Sun Jan 18 00:00:00 1970 | 7  | 7   | foo
  827 | 407 | 00827_update7      | Wed Jan 28 00:00:00 1970 PST | Wed Jan 28 00:00:00 1970 | 7  | 7   | foo
  837 | 407 | 00837_update7      | Sat Feb 07 00:00:00 1970 PST | Sat Feb 07 00:00:00 1970 | 7  | 7   | foo
  847 | 407 | 00847_update7      | Tue Feb 17 00:00:00 1970 PST | Tue Feb 17 00:00:00 1970 | 7  | 7   | foo
  857 | 407 | 00857_update7      | Fri Feb 27 00:00:00 1970 PST | Fri Feb 27 00:00:00 1970 | 7  | 7   | foo
  867 | 407 | 00867_update7      | Mon Mar 09 00:00:00 1970 PST | Mon Mar 09 00:00:00 1970 | 7  | 7   | foo
  877 | 407 | 00877_update7      | Thu Mar 19 00:00:00 1970 PST | Thu Mar 19 00:00:00 1970 | 7  | 7   | foo
  887 | 407 | 00887_update7      | Sun Mar 29 00:00:00 1970 PST | Sun Mar 29 00:00:00 1970 | 7  | 7   | foo
  897 | 407 | 00897_update7      | Wed Apr 08 00:00:00 1970 PST | Wed Apr 08 00:00:00 1970 | 7  | 7   | foo
  907 | 407 | 00907_update7      | Thu Jan 08 00:00:00 1970 PST | Thu Jan 08 00:00:00 1970 | 7  | 7   | foo
  917 | 407 | 00917_update7      | Sun Jan 18 00:00:00 1970 PST | Sun Jan 18 00:00:00 1970 | 7  | 7   | foo
  927 | 407 | 00927_update7      | Wed Jan 28 00:00:00 1970 PST | Wed Jan 28 00:00:00 1970 | 7  | 7   | foo
  937 | 407 | 00937_update7      | Sat Feb 07 00:00:00 1970 PST | Sat Feb 07 00:00:00 1970 | 7  | 7   | foo
  947 | 407 | 00947_update7      | Tue Feb 17 00:00:00 1970 PST | Tue Feb 17 00:00:00 1970 | 7  | 7   | foo
  957 | 407 | 00957_update7      | Fri Feb 27 00:00:00 1970 PST | Fri Feb 27 00:00:00 1970 | 7  | 7   | foo
  967 | 407 | 00967_update7      | Mon Mar 09 00:00:00 1970 PST | Mon Mar 09 00:00:00 1970 | 7  | 7   | foo
  977 | 407 | 00977_update7      | Thu Mar 19 00:00:00 1970 PST | Thu Mar 19 00:00:00 1970 | 7  | 7   | foo
  987 | 407 | 00987_update7      | Sun Mar 29 00:00:00 1970 PST | Sun Mar 29 00:00:00 1970 | 7  | 7   | foo
  997 | 407 | 00997_update7      | Wed Apr 08 00:00:00 1970 PST | Wed Apr 08 00:00:00 1970 | 7  | 7   | foo
 1007 | 507 | 0000700007_update7 |                              |                          |    | ft2 | 
 1017 | 507 | 0001700017_update7 |                              |                          |    | ft2 | 
(102 rows)

--Testcase 397:
EXPLAIN (verbose, costs off)
UPDATE ft2 SET c2 = ft2.c2 + 500, c3 = ft2.c3 || '_update9', c7 = DEFAULT
   FROM ft1 WHERE ft1.c1 = ft2.c2 AND ft1.c1 % 10 = 9;                               -- can be pushed down
                                                                                                                      QUERY PLAN                                                                                                                      
------------------------------------------------------------------------------------------------------------------------------------------------------------------------------------------------------------------------------------------------------
 Update on public.ft2
   ->  Foreign Update
         mysql query: UPDATE `mysql_fdw_post`.`T 1` r1 INNER JOIN `mysql_fdw_post`.`T 1` r2 SET  r1.`c2` = (r1.`c2` + 500),  r1.`c3` = CONCAT(r1.`c3` , '_update9'),  r1.`c7` = 'ft2       ' WHERE ((r1.`c2` = r2.`C 1`)) AND (((r2.`C 1` % 10) = 9))
(3 rows)

--Testcase 398:
 UPDATE ft2 SET c2 = ft2.c2 + 500, c3 = ft2.c3 || '_update9', c7 = DEFAULT
   FROM ft1 WHERE ft1.c1 = ft2.c2 AND ft1.c1 % 10 = 9;
--Testcase 399:
EXPLAIN (verbose, costs off)
   DELETE FROM ft2 WHERE c1 % 10 = 5;                               -- can be pushed down
                                     QUERY PLAN                                     
------------------------------------------------------------------------------------
 Delete on public.ft2
   ->  Foreign Delete on public.ft2
         mysql query: DELETE FROM `mysql_fdw_post`.`T 1` WHERE (((`C 1` % 10) = 5))
(3 rows)

--Testcase 400:
DELETE FROM ft2 WHERE c1 % 10 = 5;
-- MySQL does not support RETURNING, so we use SELECT with condition to check data after INSERT/UPDATE/DELETE.
--Testcase 401:
SELECT c1, c4 FROM ft2 WHERE c1 % 10 = 5; -- empty result
 c1 | c4 
----+----
(0 rows)

--Testcase 402:
EXPLAIN (verbose, costs off)
DELETE FROM ft2 USING ft1 WHERE ft1.c1 = ft2.c2 AND ft1.c1 % 10 = 2;                -- can be pushed down
                                                                             QUERY PLAN                                                                             
--------------------------------------------------------------------------------------------------------------------------------------------------------------------
 Delete on public.ft2
   ->  Foreign Delete
         mysql query: DELETE FROM  r1 USING `mysql_fdw_post`.`T 1` r1 INNER JOIN `mysql_fdw_post`.`T 1` r2 WHERE ((r1.`c2` = r2.`C 1`)) AND (((r2.`C 1` % 10) = 2))
(3 rows)

--Testcase 403:
DELETE FROM ft2 USING ft1 WHERE ft1.c1 = ft2.c2 AND ft1.c1 % 10 = 2;
--Testcase 404:
SELECT c1,c2,c3,c4 FROM ft2 ORDER BY c1;
  c1  | c2  |         c3         |              c4              
------+-----+--------------------+------------------------------
    1 |   1 | 00001              | Fri Jan 02 00:00:00 1970 PST
    3 | 303 | 00003_update3      | Sun Jan 04 00:00:00 1970 PST
    4 |   4 | 00004              | Mon Jan 05 00:00:00 1970 PST
    6 |   6 | 00006              | Wed Jan 07 00:00:00 1970 PST
    7 | 407 | 00007_update7      | Thu Jan 08 00:00:00 1970 PST
    8 |   8 | 00008              | Fri Jan 09 00:00:00 1970 PST
    9 | 509 | 00009_update9      | Sat Jan 10 00:00:00 1970 PST
   10 |   0 | 00010              | Sun Jan 11 00:00:00 1970 PST
   11 |   1 | 00011              | Mon Jan 12 00:00:00 1970 PST
   13 | 303 | 00013_update3      | Wed Jan 14 00:00:00 1970 PST
   14 |   4 | 00014              | Thu Jan 15 00:00:00 1970 PST
   16 |   6 | 00016              | Sat Jan 17 00:00:00 1970 PST
   17 | 407 | 00017_update7      | Sun Jan 18 00:00:00 1970 PST
   18 |   8 | 00018              | Mon Jan 19 00:00:00 1970 PST
   19 | 509 | 00019_update9      | Tue Jan 20 00:00:00 1970 PST
   20 |   0 | 00020              | Wed Jan 21 00:00:00 1970 PST
   21 |   1 | 00021              | Thu Jan 22 00:00:00 1970 PST
   23 | 303 | 00023_update3      | Sat Jan 24 00:00:00 1970 PST
   24 |   4 | 00024              | Sun Jan 25 00:00:00 1970 PST
   26 |   6 | 00026              | Tue Jan 27 00:00:00 1970 PST
   27 | 407 | 00027_update7      | Wed Jan 28 00:00:00 1970 PST
   28 |   8 | 00028              | Thu Jan 29 00:00:00 1970 PST
   29 | 509 | 00029_update9      | Fri Jan 30 00:00:00 1970 PST
   30 |   0 | 00030              | Sat Jan 31 00:00:00 1970 PST
   31 |   1 | 00031              | Sun Feb 01 00:00:00 1970 PST
   33 | 303 | 00033_update3      | Tue Feb 03 00:00:00 1970 PST
   34 |   4 | 00034              | Wed Feb 04 00:00:00 1970 PST
   36 |   6 | 00036              | Fri Feb 06 00:00:00 1970 PST
   37 | 407 | 00037_update7      | Sat Feb 07 00:00:00 1970 PST
   38 |   8 | 00038              | Sun Feb 08 00:00:00 1970 PST
   39 | 509 | 00039_update9      | Mon Feb 09 00:00:00 1970 PST
   40 |   0 | 00040              | Tue Feb 10 00:00:00 1970 PST
   41 |   1 | 00041              | Wed Feb 11 00:00:00 1970 PST
   43 | 303 | 00043_update3      | Fri Feb 13 00:00:00 1970 PST
   44 |   4 | 00044              | Sat Feb 14 00:00:00 1970 PST
   46 |   6 | 00046              | Mon Feb 16 00:00:00 1970 PST
   47 | 407 | 00047_update7      | Tue Feb 17 00:00:00 1970 PST
   48 |   8 | 00048              | Wed Feb 18 00:00:00 1970 PST
   49 | 509 | 00049_update9      | Thu Feb 19 00:00:00 1970 PST
   50 |   0 | 00050              | Fri Feb 20 00:00:00 1970 PST
   51 |   1 | 00051              | Sat Feb 21 00:00:00 1970 PST
   53 | 303 | 00053_update3      | Mon Feb 23 00:00:00 1970 PST
   54 |   4 | 00054              | Tue Feb 24 00:00:00 1970 PST
   56 |   6 | 00056              | Thu Feb 26 00:00:00 1970 PST
   57 | 407 | 00057_update7      | Fri Feb 27 00:00:00 1970 PST
   58 |   8 | 00058              | Sat Feb 28 00:00:00 1970 PST
   59 | 509 | 00059_update9      | Sun Mar 01 00:00:00 1970 PST
   60 |   0 | 00060              | Mon Mar 02 00:00:00 1970 PST
   61 |   1 | 00061              | Tue Mar 03 00:00:00 1970 PST
   63 | 303 | 00063_update3      | Thu Mar 05 00:00:00 1970 PST
   64 |   4 | 00064              | Fri Mar 06 00:00:00 1970 PST
   66 |   6 | 00066              | Sun Mar 08 00:00:00 1970 PST
   67 | 407 | 00067_update7      | Mon Mar 09 00:00:00 1970 PST
   68 |   8 | 00068              | Tue Mar 10 00:00:00 1970 PST
   69 | 509 | 00069_update9      | Wed Mar 11 00:00:00 1970 PST
   70 |   0 | 00070              | Thu Mar 12 00:00:00 1970 PST
   71 |   1 | 00071              | Fri Mar 13 00:00:00 1970 PST
   73 | 303 | 00073_update3      | Sun Mar 15 00:00:00 1970 PST
   74 |   4 | 00074              | Mon Mar 16 00:00:00 1970 PST
   76 |   6 | 00076              | Wed Mar 18 00:00:00 1970 PST
   77 | 407 | 00077_update7      | Thu Mar 19 00:00:00 1970 PST
   78 |   8 | 00078              | Fri Mar 20 00:00:00 1970 PST
   79 | 509 | 00079_update9      | Sat Mar 21 00:00:00 1970 PST
   80 |   0 | 00080              | Sun Mar 22 00:00:00 1970 PST
   81 |   1 | 00081              | Mon Mar 23 00:00:00 1970 PST
   83 | 303 | 00083_update3      | Wed Mar 25 00:00:00 1970 PST
   84 |   4 | 00084              | Thu Mar 26 00:00:00 1970 PST
   86 |   6 | 00086              | Sat Mar 28 00:00:00 1970 PST
   87 | 407 | 00087_update7      | Sun Mar 29 00:00:00 1970 PST
   88 |   8 | 00088              | Mon Mar 30 00:00:00 1970 PST
   89 | 509 | 00089_update9      | Tue Mar 31 00:00:00 1970 PST
   90 |   0 | 00090              | Wed Apr 01 00:00:00 1970 PST
   91 |   1 | 00091              | Thu Apr 02 00:00:00 1970 PST
   93 | 303 | 00093_update3      | Sat Apr 04 00:00:00 1970 PST
   94 |   4 | 00094              | Sun Apr 05 00:00:00 1970 PST
   96 |   6 | 00096              | Tue Apr 07 00:00:00 1970 PST
   97 | 407 | 00097_update7      | Wed Apr 08 00:00:00 1970 PST
   98 |   8 | 00098              | Thu Apr 09 00:00:00 1970 PST
   99 | 509 | 00099_update9      | Fri Apr 10 00:00:00 1970 PST
  100 |   0 | 00100              | Thu Jan 01 00:00:00 1970 PST
  101 |   1 | 00101              | Fri Jan 02 00:00:00 1970 PST
  103 | 303 | 00103_update3      | Sun Jan 04 00:00:00 1970 PST
  104 |   4 | 00104              | Mon Jan 05 00:00:00 1970 PST
  106 |   6 | 00106              | Wed Jan 07 00:00:00 1970 PST
  107 | 407 | 00107_update7      | Thu Jan 08 00:00:00 1970 PST
  108 |   8 | 00108              | Fri Jan 09 00:00:00 1970 PST
  109 | 509 | 00109_update9      | Sat Jan 10 00:00:00 1970 PST
  110 |   0 | 00110              | Sun Jan 11 00:00:00 1970 PST
  111 |   1 | 00111              | Mon Jan 12 00:00:00 1970 PST
  113 | 303 | 00113_update3      | Wed Jan 14 00:00:00 1970 PST
  114 |   4 | 00114              | Thu Jan 15 00:00:00 1970 PST
  116 |   6 | 00116              | Sat Jan 17 00:00:00 1970 PST
  117 | 407 | 00117_update7      | Sun Jan 18 00:00:00 1970 PST
  118 |   8 | 00118              | Mon Jan 19 00:00:00 1970 PST
  119 | 509 | 00119_update9      | Tue Jan 20 00:00:00 1970 PST
  120 |   0 | 00120              | Wed Jan 21 00:00:00 1970 PST
  121 |   1 | 00121              | Thu Jan 22 00:00:00 1970 PST
  123 | 303 | 00123_update3      | Sat Jan 24 00:00:00 1970 PST
  124 |   4 | 00124              | Sun Jan 25 00:00:00 1970 PST
  126 |   6 | 00126              | Tue Jan 27 00:00:00 1970 PST
  127 | 407 | 00127_update7      | Wed Jan 28 00:00:00 1970 PST
  128 |   8 | 00128              | Thu Jan 29 00:00:00 1970 PST
  129 | 509 | 00129_update9      | Fri Jan 30 00:00:00 1970 PST
  130 |   0 | 00130              | Sat Jan 31 00:00:00 1970 PST
  131 |   1 | 00131              | Sun Feb 01 00:00:00 1970 PST
  133 | 303 | 00133_update3      | Tue Feb 03 00:00:00 1970 PST
  134 |   4 | 00134              | Wed Feb 04 00:00:00 1970 PST
  136 |   6 | 00136              | Fri Feb 06 00:00:00 1970 PST
  137 | 407 | 00137_update7      | Sat Feb 07 00:00:00 1970 PST
  138 |   8 | 00138              | Sun Feb 08 00:00:00 1970 PST
  139 | 509 | 00139_update9      | Mon Feb 09 00:00:00 1970 PST
  140 |   0 | 00140              | Tue Feb 10 00:00:00 1970 PST
  141 |   1 | 00141              | Wed Feb 11 00:00:00 1970 PST
  143 | 303 | 00143_update3      | Fri Feb 13 00:00:00 1970 PST
  144 |   4 | 00144              | Sat Feb 14 00:00:00 1970 PST
  146 |   6 | 00146              | Mon Feb 16 00:00:00 1970 PST
  147 | 407 | 00147_update7      | Tue Feb 17 00:00:00 1970 PST
  148 |   8 | 00148              | Wed Feb 18 00:00:00 1970 PST
  149 | 509 | 00149_update9      | Thu Feb 19 00:00:00 1970 PST
  150 |   0 | 00150              | Fri Feb 20 00:00:00 1970 PST
  151 |   1 | 00151              | Sat Feb 21 00:00:00 1970 PST
  153 | 303 | 00153_update3      | Mon Feb 23 00:00:00 1970 PST
  154 |   4 | 00154              | Tue Feb 24 00:00:00 1970 PST
  156 |   6 | 00156              | Thu Feb 26 00:00:00 1970 PST
  157 | 407 | 00157_update7      | Fri Feb 27 00:00:00 1970 PST
  158 |   8 | 00158              | Sat Feb 28 00:00:00 1970 PST
  159 | 509 | 00159_update9      | Sun Mar 01 00:00:00 1970 PST
  160 |   0 | 00160              | Mon Mar 02 00:00:00 1970 PST
  161 |   1 | 00161              | Tue Mar 03 00:00:00 1970 PST
  163 | 303 | 00163_update3      | Thu Mar 05 00:00:00 1970 PST
  164 |   4 | 00164              | Fri Mar 06 00:00:00 1970 PST
  166 |   6 | 00166              | Sun Mar 08 00:00:00 1970 PST
  167 | 407 | 00167_update7      | Mon Mar 09 00:00:00 1970 PST
  168 |   8 | 00168              | Tue Mar 10 00:00:00 1970 PST
  169 | 509 | 00169_update9      | Wed Mar 11 00:00:00 1970 PST
  170 |   0 | 00170              | Thu Mar 12 00:00:00 1970 PST
  171 |   1 | 00171              | Fri Mar 13 00:00:00 1970 PST
  173 | 303 | 00173_update3      | Sun Mar 15 00:00:00 1970 PST
  174 |   4 | 00174              | Mon Mar 16 00:00:00 1970 PST
  176 |   6 | 00176              | Wed Mar 18 00:00:00 1970 PST
  177 | 407 | 00177_update7      | Thu Mar 19 00:00:00 1970 PST
  178 |   8 | 00178              | Fri Mar 20 00:00:00 1970 PST
  179 | 509 | 00179_update9      | Sat Mar 21 00:00:00 1970 PST
  180 |   0 | 00180              | Sun Mar 22 00:00:00 1970 PST
  181 |   1 | 00181              | Mon Mar 23 00:00:00 1970 PST
  183 | 303 | 00183_update3      | Wed Mar 25 00:00:00 1970 PST
  184 |   4 | 00184              | Thu Mar 26 00:00:00 1970 PST
  186 |   6 | 00186              | Sat Mar 28 00:00:00 1970 PST
  187 | 407 | 00187_update7      | Sun Mar 29 00:00:00 1970 PST
  188 |   8 | 00188              | Mon Mar 30 00:00:00 1970 PST
  189 | 509 | 00189_update9      | Tue Mar 31 00:00:00 1970 PST
  190 |   0 | 00190              | Wed Apr 01 00:00:00 1970 PST
  191 |   1 | 00191              | Thu Apr 02 00:00:00 1970 PST
  193 | 303 | 00193_update3      | Sat Apr 04 00:00:00 1970 PST
  194 |   4 | 00194              | Sun Apr 05 00:00:00 1970 PST
  196 |   6 | 00196              | Tue Apr 07 00:00:00 1970 PST
  197 | 407 | 00197_update7      | Wed Apr 08 00:00:00 1970 PST
  198 |   8 | 00198              | Thu Apr 09 00:00:00 1970 PST
  199 | 509 | 00199_update9      | Fri Apr 10 00:00:00 1970 PST
  200 |   0 | 00200              | Thu Jan 01 00:00:00 1970 PST
  201 |   1 | 00201              | Fri Jan 02 00:00:00 1970 PST
  203 | 303 | 00203_update3      | Sun Jan 04 00:00:00 1970 PST
  204 |   4 | 00204              | Mon Jan 05 00:00:00 1970 PST
  206 |   6 | 00206              | Wed Jan 07 00:00:00 1970 PST
  207 | 407 | 00207_update7      | Thu Jan 08 00:00:00 1970 PST
  208 |   8 | 00208              | Fri Jan 09 00:00:00 1970 PST
  209 | 509 | 00209_update9      | Sat Jan 10 00:00:00 1970 PST
  210 |   0 | 00210              | Sun Jan 11 00:00:00 1970 PST
  211 |   1 | 00211              | Mon Jan 12 00:00:00 1970 PST
  213 | 303 | 00213_update3      | Wed Jan 14 00:00:00 1970 PST
  214 |   4 | 00214              | Thu Jan 15 00:00:00 1970 PST
  216 |   6 | 00216              | Sat Jan 17 00:00:00 1970 PST
  217 | 407 | 00217_update7      | Sun Jan 18 00:00:00 1970 PST
  218 |   8 | 00218              | Mon Jan 19 00:00:00 1970 PST
  219 | 509 | 00219_update9      | Tue Jan 20 00:00:00 1970 PST
  220 |   0 | 00220              | Wed Jan 21 00:00:00 1970 PST
  221 |   1 | 00221              | Thu Jan 22 00:00:00 1970 PST
  223 | 303 | 00223_update3      | Sat Jan 24 00:00:00 1970 PST
  224 |   4 | 00224              | Sun Jan 25 00:00:00 1970 PST
  226 |   6 | 00226              | Tue Jan 27 00:00:00 1970 PST
  227 | 407 | 00227_update7      | Wed Jan 28 00:00:00 1970 PST
  228 |   8 | 00228              | Thu Jan 29 00:00:00 1970 PST
  229 | 509 | 00229_update9      | Fri Jan 30 00:00:00 1970 PST
  230 |   0 | 00230              | Sat Jan 31 00:00:00 1970 PST
  231 |   1 | 00231              | Sun Feb 01 00:00:00 1970 PST
  233 | 303 | 00233_update3      | Tue Feb 03 00:00:00 1970 PST
  234 |   4 | 00234              | Wed Feb 04 00:00:00 1970 PST
  236 |   6 | 00236              | Fri Feb 06 00:00:00 1970 PST
  237 | 407 | 00237_update7      | Sat Feb 07 00:00:00 1970 PST
  238 |   8 | 00238              | Sun Feb 08 00:00:00 1970 PST
  239 | 509 | 00239_update9      | Mon Feb 09 00:00:00 1970 PST
  240 |   0 | 00240              | Tue Feb 10 00:00:00 1970 PST
  241 |   1 | 00241              | Wed Feb 11 00:00:00 1970 PST
  243 | 303 | 00243_update3      | Fri Feb 13 00:00:00 1970 PST
  244 |   4 | 00244              | Sat Feb 14 00:00:00 1970 PST
  246 |   6 | 00246              | Mon Feb 16 00:00:00 1970 PST
  247 | 407 | 00247_update7      | Tue Feb 17 00:00:00 1970 PST
  248 |   8 | 00248              | Wed Feb 18 00:00:00 1970 PST
  249 | 509 | 00249_update9      | Thu Feb 19 00:00:00 1970 PST
  250 |   0 | 00250              | Fri Feb 20 00:00:00 1970 PST
  251 |   1 | 00251              | Sat Feb 21 00:00:00 1970 PST
  253 | 303 | 00253_update3      | Mon Feb 23 00:00:00 1970 PST
  254 |   4 | 00254              | Tue Feb 24 00:00:00 1970 PST
  256 |   6 | 00256              | Thu Feb 26 00:00:00 1970 PST
  257 | 407 | 00257_update7      | Fri Feb 27 00:00:00 1970 PST
  258 |   8 | 00258              | Sat Feb 28 00:00:00 1970 PST
  259 | 509 | 00259_update9      | Sun Mar 01 00:00:00 1970 PST
  260 |   0 | 00260              | Mon Mar 02 00:00:00 1970 PST
  261 |   1 | 00261              | Tue Mar 03 00:00:00 1970 PST
  263 | 303 | 00263_update3      | Thu Mar 05 00:00:00 1970 PST
  264 |   4 | 00264              | Fri Mar 06 00:00:00 1970 PST
  266 |   6 | 00266              | Sun Mar 08 00:00:00 1970 PST
  267 | 407 | 00267_update7      | Mon Mar 09 00:00:00 1970 PST
  268 |   8 | 00268              | Tue Mar 10 00:00:00 1970 PST
  269 | 509 | 00269_update9      | Wed Mar 11 00:00:00 1970 PST
  270 |   0 | 00270              | Thu Mar 12 00:00:00 1970 PST
  271 |   1 | 00271              | Fri Mar 13 00:00:00 1970 PST
  273 | 303 | 00273_update3      | Sun Mar 15 00:00:00 1970 PST
  274 |   4 | 00274              | Mon Mar 16 00:00:00 1970 PST
  276 |   6 | 00276              | Wed Mar 18 00:00:00 1970 PST
  277 | 407 | 00277_update7      | Thu Mar 19 00:00:00 1970 PST
  278 |   8 | 00278              | Fri Mar 20 00:00:00 1970 PST
  279 | 509 | 00279_update9      | Sat Mar 21 00:00:00 1970 PST
  280 |   0 | 00280              | Sun Mar 22 00:00:00 1970 PST
  281 |   1 | 00281              | Mon Mar 23 00:00:00 1970 PST
  283 | 303 | 00283_update3      | Wed Mar 25 00:00:00 1970 PST
  284 |   4 | 00284              | Thu Mar 26 00:00:00 1970 PST
  286 |   6 | 00286              | Sat Mar 28 00:00:00 1970 PST
  287 | 407 | 00287_update7      | Sun Mar 29 00:00:00 1970 PST
  288 |   8 | 00288              | Mon Mar 30 00:00:00 1970 PST
  289 | 509 | 00289_update9      | Tue Mar 31 00:00:00 1970 PST
  290 |   0 | 00290              | Wed Apr 01 00:00:00 1970 PST
  291 |   1 | 00291              | Thu Apr 02 00:00:00 1970 PST
  293 | 303 | 00293_update3      | Sat Apr 04 00:00:00 1970 PST
  294 |   4 | 00294              | Sun Apr 05 00:00:00 1970 PST
  296 |   6 | 00296              | Tue Apr 07 00:00:00 1970 PST
  297 | 407 | 00297_update7      | Wed Apr 08 00:00:00 1970 PST
  298 |   8 | 00298              | Thu Apr 09 00:00:00 1970 PST
  299 | 509 | 00299_update9      | Fri Apr 10 00:00:00 1970 PST
  300 |   0 | 00300              | Thu Jan 01 00:00:00 1970 PST
  301 |   1 | 00301              | Fri Jan 02 00:00:00 1970 PST
  303 | 303 | 00303_update3      | Sun Jan 04 00:00:00 1970 PST
  304 |   4 | 00304              | Mon Jan 05 00:00:00 1970 PST
  306 |   6 | 00306              | Wed Jan 07 00:00:00 1970 PST
  307 | 407 | 00307_update7      | Thu Jan 08 00:00:00 1970 PST
  308 |   8 | 00308              | Fri Jan 09 00:00:00 1970 PST
  309 | 509 | 00309_update9      | Sat Jan 10 00:00:00 1970 PST
  310 |   0 | 00310              | Sun Jan 11 00:00:00 1970 PST
  311 |   1 | 00311              | Mon Jan 12 00:00:00 1970 PST
  313 | 303 | 00313_update3      | Wed Jan 14 00:00:00 1970 PST
  314 |   4 | 00314              | Thu Jan 15 00:00:00 1970 PST
  316 |   6 | 00316              | Sat Jan 17 00:00:00 1970 PST
  317 | 407 | 00317_update7      | Sun Jan 18 00:00:00 1970 PST
  318 |   8 | 00318              | Mon Jan 19 00:00:00 1970 PST
  319 | 509 | 00319_update9      | Tue Jan 20 00:00:00 1970 PST
  320 |   0 | 00320              | Wed Jan 21 00:00:00 1970 PST
  321 |   1 | 00321              | Thu Jan 22 00:00:00 1970 PST
  323 | 303 | 00323_update3      | Sat Jan 24 00:00:00 1970 PST
  324 |   4 | 00324              | Sun Jan 25 00:00:00 1970 PST
  326 |   6 | 00326              | Tue Jan 27 00:00:00 1970 PST
  327 | 407 | 00327_update7      | Wed Jan 28 00:00:00 1970 PST
  328 |   8 | 00328              | Thu Jan 29 00:00:00 1970 PST
  329 | 509 | 00329_update9      | Fri Jan 30 00:00:00 1970 PST
  330 |   0 | 00330              | Sat Jan 31 00:00:00 1970 PST
  331 |   1 | 00331              | Sun Feb 01 00:00:00 1970 PST
  333 | 303 | 00333_update3      | Tue Feb 03 00:00:00 1970 PST
  334 |   4 | 00334              | Wed Feb 04 00:00:00 1970 PST
  336 |   6 | 00336              | Fri Feb 06 00:00:00 1970 PST
  337 | 407 | 00337_update7      | Sat Feb 07 00:00:00 1970 PST
  338 |   8 | 00338              | Sun Feb 08 00:00:00 1970 PST
  339 | 509 | 00339_update9      | Mon Feb 09 00:00:00 1970 PST
  340 |   0 | 00340              | Tue Feb 10 00:00:00 1970 PST
  341 |   1 | 00341              | Wed Feb 11 00:00:00 1970 PST
  343 | 303 | 00343_update3      | Fri Feb 13 00:00:00 1970 PST
  344 |   4 | 00344              | Sat Feb 14 00:00:00 1970 PST
  346 |   6 | 00346              | Mon Feb 16 00:00:00 1970 PST
  347 | 407 | 00347_update7      | Tue Feb 17 00:00:00 1970 PST
  348 |   8 | 00348              | Wed Feb 18 00:00:00 1970 PST
  349 | 509 | 00349_update9      | Thu Feb 19 00:00:00 1970 PST
  350 |   0 | 00350              | Fri Feb 20 00:00:00 1970 PST
  351 |   1 | 00351              | Sat Feb 21 00:00:00 1970 PST
  353 | 303 | 00353_update3      | Mon Feb 23 00:00:00 1970 PST
  354 |   4 | 00354              | Tue Feb 24 00:00:00 1970 PST
  356 |   6 | 00356              | Thu Feb 26 00:00:00 1970 PST
  357 | 407 | 00357_update7      | Fri Feb 27 00:00:00 1970 PST
  358 |   8 | 00358              | Sat Feb 28 00:00:00 1970 PST
  359 | 509 | 00359_update9      | Sun Mar 01 00:00:00 1970 PST
  360 |   0 | 00360              | Mon Mar 02 00:00:00 1970 PST
  361 |   1 | 00361              | Tue Mar 03 00:00:00 1970 PST
  363 | 303 | 00363_update3      | Thu Mar 05 00:00:00 1970 PST
  364 |   4 | 00364              | Fri Mar 06 00:00:00 1970 PST
  366 |   6 | 00366              | Sun Mar 08 00:00:00 1970 PST
  367 | 407 | 00367_update7      | Mon Mar 09 00:00:00 1970 PST
  368 |   8 | 00368              | Tue Mar 10 00:00:00 1970 PST
  369 | 509 | 00369_update9      | Wed Mar 11 00:00:00 1970 PST
  370 |   0 | 00370              | Thu Mar 12 00:00:00 1970 PST
  371 |   1 | 00371              | Fri Mar 13 00:00:00 1970 PST
  373 | 303 | 00373_update3      | Sun Mar 15 00:00:00 1970 PST
  374 |   4 | 00374              | Mon Mar 16 00:00:00 1970 PST
  376 |   6 | 00376              | Wed Mar 18 00:00:00 1970 PST
  377 | 407 | 00377_update7      | Thu Mar 19 00:00:00 1970 PST
  378 |   8 | 00378              | Fri Mar 20 00:00:00 1970 PST
  379 | 509 | 00379_update9      | Sat Mar 21 00:00:00 1970 PST
  380 |   0 | 00380              | Sun Mar 22 00:00:00 1970 PST
  381 |   1 | 00381              | Mon Mar 23 00:00:00 1970 PST
  383 | 303 | 00383_update3      | Wed Mar 25 00:00:00 1970 PST
  384 |   4 | 00384              | Thu Mar 26 00:00:00 1970 PST
  386 |   6 | 00386              | Sat Mar 28 00:00:00 1970 PST
  387 | 407 | 00387_update7      | Sun Mar 29 00:00:00 1970 PST
  388 |   8 | 00388              | Mon Mar 30 00:00:00 1970 PST
  389 | 509 | 00389_update9      | Tue Mar 31 00:00:00 1970 PST
  390 |   0 | 00390              | Wed Apr 01 00:00:00 1970 PST
  391 |   1 | 00391              | Thu Apr 02 00:00:00 1970 PST
  393 | 303 | 00393_update3      | Sat Apr 04 00:00:00 1970 PST
  394 |   4 | 00394              | Sun Apr 05 00:00:00 1970 PST
  396 |   6 | 00396              | Tue Apr 07 00:00:00 1970 PST
  397 | 407 | 00397_update7      | Wed Apr 08 00:00:00 1970 PST
  398 |   8 | 00398              | Thu Apr 09 00:00:00 1970 PST
  399 | 509 | 00399_update9      | Fri Apr 10 00:00:00 1970 PST
  400 |   0 | 00400              | Thu Jan 01 00:00:00 1970 PST
  401 |   1 | 00401              | Fri Jan 02 00:00:00 1970 PST
  403 | 303 | 00403_update3      | Sun Jan 04 00:00:00 1970 PST
  404 |   4 | 00404              | Mon Jan 05 00:00:00 1970 PST
  406 |   6 | 00406              | Wed Jan 07 00:00:00 1970 PST
  407 | 407 | 00407_update7      | Thu Jan 08 00:00:00 1970 PST
  408 |   8 | 00408              | Fri Jan 09 00:00:00 1970 PST
  409 | 509 | 00409_update9      | Sat Jan 10 00:00:00 1970 PST
  410 |   0 | 00410              | Sun Jan 11 00:00:00 1970 PST
  411 |   1 | 00411              | Mon Jan 12 00:00:00 1970 PST
  413 | 303 | 00413_update3      | Wed Jan 14 00:00:00 1970 PST
  414 |   4 | 00414              | Thu Jan 15 00:00:00 1970 PST
  416 |   6 | 00416              | Sat Jan 17 00:00:00 1970 PST
  417 | 407 | 00417_update7      | Sun Jan 18 00:00:00 1970 PST
  418 |   8 | 00418              | Mon Jan 19 00:00:00 1970 PST
  419 | 509 | 00419_update9      | Tue Jan 20 00:00:00 1970 PST
  420 |   0 | 00420              | Wed Jan 21 00:00:00 1970 PST
  421 |   1 | 00421              | Thu Jan 22 00:00:00 1970 PST
  423 | 303 | 00423_update3      | Sat Jan 24 00:00:00 1970 PST
  424 |   4 | 00424              | Sun Jan 25 00:00:00 1970 PST
  426 |   6 | 00426              | Tue Jan 27 00:00:00 1970 PST
  427 | 407 | 00427_update7      | Wed Jan 28 00:00:00 1970 PST
  428 |   8 | 00428              | Thu Jan 29 00:00:00 1970 PST
  429 | 509 | 00429_update9      | Fri Jan 30 00:00:00 1970 PST
  430 |   0 | 00430              | Sat Jan 31 00:00:00 1970 PST
  431 |   1 | 00431              | Sun Feb 01 00:00:00 1970 PST
  433 | 303 | 00433_update3      | Tue Feb 03 00:00:00 1970 PST
  434 |   4 | 00434              | Wed Feb 04 00:00:00 1970 PST
  436 |   6 | 00436              | Fri Feb 06 00:00:00 1970 PST
  437 | 407 | 00437_update7      | Sat Feb 07 00:00:00 1970 PST
  438 |   8 | 00438              | Sun Feb 08 00:00:00 1970 PST
  439 | 509 | 00439_update9      | Mon Feb 09 00:00:00 1970 PST
  440 |   0 | 00440              | Tue Feb 10 00:00:00 1970 PST
  441 |   1 | 00441              | Wed Feb 11 00:00:00 1970 PST
  443 | 303 | 00443_update3      | Fri Feb 13 00:00:00 1970 PST
  444 |   4 | 00444              | Sat Feb 14 00:00:00 1970 PST
  446 |   6 | 00446              | Mon Feb 16 00:00:00 1970 PST
  447 | 407 | 00447_update7      | Tue Feb 17 00:00:00 1970 PST
  448 |   8 | 00448              | Wed Feb 18 00:00:00 1970 PST
  449 | 509 | 00449_update9      | Thu Feb 19 00:00:00 1970 PST
  450 |   0 | 00450              | Fri Feb 20 00:00:00 1970 PST
  451 |   1 | 00451              | Sat Feb 21 00:00:00 1970 PST
  453 | 303 | 00453_update3      | Mon Feb 23 00:00:00 1970 PST
  454 |   4 | 00454              | Tue Feb 24 00:00:00 1970 PST
  456 |   6 | 00456              | Thu Feb 26 00:00:00 1970 PST
  457 | 407 | 00457_update7      | Fri Feb 27 00:00:00 1970 PST
  458 |   8 | 00458              | Sat Feb 28 00:00:00 1970 PST
  459 | 509 | 00459_update9      | Sun Mar 01 00:00:00 1970 PST
  460 |   0 | 00460              | Mon Mar 02 00:00:00 1970 PST
  461 |   1 | 00461              | Tue Mar 03 00:00:00 1970 PST
  463 | 303 | 00463_update3      | Thu Mar 05 00:00:00 1970 PST
  464 |   4 | 00464              | Fri Mar 06 00:00:00 1970 PST
  466 |   6 | 00466              | Sun Mar 08 00:00:00 1970 PST
  467 | 407 | 00467_update7      | Mon Mar 09 00:00:00 1970 PST
  468 |   8 | 00468              | Tue Mar 10 00:00:00 1970 PST
  469 | 509 | 00469_update9      | Wed Mar 11 00:00:00 1970 PST
  470 |   0 | 00470              | Thu Mar 12 00:00:00 1970 PST
  471 |   1 | 00471              | Fri Mar 13 00:00:00 1970 PST
  473 | 303 | 00473_update3      | Sun Mar 15 00:00:00 1970 PST
  474 |   4 | 00474              | Mon Mar 16 00:00:00 1970 PST
  476 |   6 | 00476              | Wed Mar 18 00:00:00 1970 PST
  477 | 407 | 00477_update7      | Thu Mar 19 00:00:00 1970 PST
  478 |   8 | 00478              | Fri Mar 20 00:00:00 1970 PST
  479 | 509 | 00479_update9      | Sat Mar 21 00:00:00 1970 PST
  480 |   0 | 00480              | Sun Mar 22 00:00:00 1970 PST
  481 |   1 | 00481              | Mon Mar 23 00:00:00 1970 PST
  483 | 303 | 00483_update3      | Wed Mar 25 00:00:00 1970 PST
  484 |   4 | 00484              | Thu Mar 26 00:00:00 1970 PST
  486 |   6 | 00486              | Sat Mar 28 00:00:00 1970 PST
  487 | 407 | 00487_update7      | Sun Mar 29 00:00:00 1970 PST
  488 |   8 | 00488              | Mon Mar 30 00:00:00 1970 PST
  489 | 509 | 00489_update9      | Tue Mar 31 00:00:00 1970 PST
  490 |   0 | 00490              | Wed Apr 01 00:00:00 1970 PST
  491 |   1 | 00491              | Thu Apr 02 00:00:00 1970 PST
  493 | 303 | 00493_update3      | Sat Apr 04 00:00:00 1970 PST
  494 |   4 | 00494              | Sun Apr 05 00:00:00 1970 PST
  496 |   6 | 00496              | Tue Apr 07 00:00:00 1970 PST
  497 | 407 | 00497_update7      | Wed Apr 08 00:00:00 1970 PST
  498 |   8 | 00498              | Thu Apr 09 00:00:00 1970 PST
  499 | 509 | 00499_update9      | Fri Apr 10 00:00:00 1970 PST
  500 |   0 | 00500              | Thu Jan 01 00:00:00 1970 PST
  501 |   1 | 00501              | Fri Jan 02 00:00:00 1970 PST
  503 | 303 | 00503_update3      | Sun Jan 04 00:00:00 1970 PST
  504 |   4 | 00504              | Mon Jan 05 00:00:00 1970 PST
  506 |   6 | 00506              | Wed Jan 07 00:00:00 1970 PST
  507 | 407 | 00507_update7      | Thu Jan 08 00:00:00 1970 PST
  508 |   8 | 00508              | Fri Jan 09 00:00:00 1970 PST
  509 | 509 | 00509_update9      | Sat Jan 10 00:00:00 1970 PST
  510 |   0 | 00510              | Sun Jan 11 00:00:00 1970 PST
  511 |   1 | 00511              | Mon Jan 12 00:00:00 1970 PST
  513 | 303 | 00513_update3      | Wed Jan 14 00:00:00 1970 PST
  514 |   4 | 00514              | Thu Jan 15 00:00:00 1970 PST
  516 |   6 | 00516              | Sat Jan 17 00:00:00 1970 PST
  517 | 407 | 00517_update7      | Sun Jan 18 00:00:00 1970 PST
  518 |   8 | 00518              | Mon Jan 19 00:00:00 1970 PST
  519 | 509 | 00519_update9      | Tue Jan 20 00:00:00 1970 PST
  520 |   0 | 00520              | Wed Jan 21 00:00:00 1970 PST
  521 |   1 | 00521              | Thu Jan 22 00:00:00 1970 PST
  523 | 303 | 00523_update3      | Sat Jan 24 00:00:00 1970 PST
  524 |   4 | 00524              | Sun Jan 25 00:00:00 1970 PST
  526 |   6 | 00526              | Tue Jan 27 00:00:00 1970 PST
  527 | 407 | 00527_update7      | Wed Jan 28 00:00:00 1970 PST
  528 |   8 | 00528              | Thu Jan 29 00:00:00 1970 PST
  529 | 509 | 00529_update9      | Fri Jan 30 00:00:00 1970 PST
  530 |   0 | 00530              | Sat Jan 31 00:00:00 1970 PST
  531 |   1 | 00531              | Sun Feb 01 00:00:00 1970 PST
  533 | 303 | 00533_update3      | Tue Feb 03 00:00:00 1970 PST
  534 |   4 | 00534              | Wed Feb 04 00:00:00 1970 PST
  536 |   6 | 00536              | Fri Feb 06 00:00:00 1970 PST
  537 | 407 | 00537_update7      | Sat Feb 07 00:00:00 1970 PST
  538 |   8 | 00538              | Sun Feb 08 00:00:00 1970 PST
  539 | 509 | 00539_update9      | Mon Feb 09 00:00:00 1970 PST
  540 |   0 | 00540              | Tue Feb 10 00:00:00 1970 PST
  541 |   1 | 00541              | Wed Feb 11 00:00:00 1970 PST
  543 | 303 | 00543_update3      | Fri Feb 13 00:00:00 1970 PST
  544 |   4 | 00544              | Sat Feb 14 00:00:00 1970 PST
  546 |   6 | 00546              | Mon Feb 16 00:00:00 1970 PST
  547 | 407 | 00547_update7      | Tue Feb 17 00:00:00 1970 PST
  548 |   8 | 00548              | Wed Feb 18 00:00:00 1970 PST
  549 | 509 | 00549_update9      | Thu Feb 19 00:00:00 1970 PST
  550 |   0 | 00550              | Fri Feb 20 00:00:00 1970 PST
  551 |   1 | 00551              | Sat Feb 21 00:00:00 1970 PST
  553 | 303 | 00553_update3      | Mon Feb 23 00:00:00 1970 PST
  554 |   4 | 00554              | Tue Feb 24 00:00:00 1970 PST
  556 |   6 | 00556              | Thu Feb 26 00:00:00 1970 PST
  557 | 407 | 00557_update7      | Fri Feb 27 00:00:00 1970 PST
  558 |   8 | 00558              | Sat Feb 28 00:00:00 1970 PST
  559 | 509 | 00559_update9      | Sun Mar 01 00:00:00 1970 PST
  560 |   0 | 00560              | Mon Mar 02 00:00:00 1970 PST
  561 |   1 | 00561              | Tue Mar 03 00:00:00 1970 PST
  563 | 303 | 00563_update3      | Thu Mar 05 00:00:00 1970 PST
  564 |   4 | 00564              | Fri Mar 06 00:00:00 1970 PST
  566 |   6 | 00566              | Sun Mar 08 00:00:00 1970 PST
  567 | 407 | 00567_update7      | Mon Mar 09 00:00:00 1970 PST
  568 |   8 | 00568              | Tue Mar 10 00:00:00 1970 PST
  569 | 509 | 00569_update9      | Wed Mar 11 00:00:00 1970 PST
  570 |   0 | 00570              | Thu Mar 12 00:00:00 1970 PST
  571 |   1 | 00571              | Fri Mar 13 00:00:00 1970 PST
  573 | 303 | 00573_update3      | Sun Mar 15 00:00:00 1970 PST
  574 |   4 | 00574              | Mon Mar 16 00:00:00 1970 PST
  576 |   6 | 00576              | Wed Mar 18 00:00:00 1970 PST
  577 | 407 | 00577_update7      | Thu Mar 19 00:00:00 1970 PST
  578 |   8 | 00578              | Fri Mar 20 00:00:00 1970 PST
  579 | 509 | 00579_update9      | Sat Mar 21 00:00:00 1970 PST
  580 |   0 | 00580              | Sun Mar 22 00:00:00 1970 PST
  581 |   1 | 00581              | Mon Mar 23 00:00:00 1970 PST
  583 | 303 | 00583_update3      | Wed Mar 25 00:00:00 1970 PST
  584 |   4 | 00584              | Thu Mar 26 00:00:00 1970 PST
  586 |   6 | 00586              | Sat Mar 28 00:00:00 1970 PST
  587 | 407 | 00587_update7      | Sun Mar 29 00:00:00 1970 PST
  588 |   8 | 00588              | Mon Mar 30 00:00:00 1970 PST
  589 | 509 | 00589_update9      | Tue Mar 31 00:00:00 1970 PST
  590 |   0 | 00590              | Wed Apr 01 00:00:00 1970 PST
  591 |   1 | 00591              | Thu Apr 02 00:00:00 1970 PST
  593 | 303 | 00593_update3      | Sat Apr 04 00:00:00 1970 PST
  594 |   4 | 00594              | Sun Apr 05 00:00:00 1970 PST
  596 |   6 | 00596              | Tue Apr 07 00:00:00 1970 PST
  597 | 407 | 00597_update7      | Wed Apr 08 00:00:00 1970 PST
  598 |   8 | 00598              | Thu Apr 09 00:00:00 1970 PST
  599 | 509 | 00599_update9      | Fri Apr 10 00:00:00 1970 PST
  600 |   0 | 00600              | Thu Jan 01 00:00:00 1970 PST
  601 |   1 | 00601              | Fri Jan 02 00:00:00 1970 PST
  603 | 303 | 00603_update3      | Sun Jan 04 00:00:00 1970 PST
  604 |   4 | 00604              | Mon Jan 05 00:00:00 1970 PST
  606 |   6 | 00606              | Wed Jan 07 00:00:00 1970 PST
  607 | 407 | 00607_update7      | Thu Jan 08 00:00:00 1970 PST
  608 |   8 | 00608              | Fri Jan 09 00:00:00 1970 PST
  609 | 509 | 00609_update9      | Sat Jan 10 00:00:00 1970 PST
  610 |   0 | 00610              | Sun Jan 11 00:00:00 1970 PST
  611 |   1 | 00611              | Mon Jan 12 00:00:00 1970 PST
  613 | 303 | 00613_update3      | Wed Jan 14 00:00:00 1970 PST
  614 |   4 | 00614              | Thu Jan 15 00:00:00 1970 PST
  616 |   6 | 00616              | Sat Jan 17 00:00:00 1970 PST
  617 | 407 | 00617_update7      | Sun Jan 18 00:00:00 1970 PST
  618 |   8 | 00618              | Mon Jan 19 00:00:00 1970 PST
  619 | 509 | 00619_update9      | Tue Jan 20 00:00:00 1970 PST
  620 |   0 | 00620              | Wed Jan 21 00:00:00 1970 PST
  621 |   1 | 00621              | Thu Jan 22 00:00:00 1970 PST
  623 | 303 | 00623_update3      | Sat Jan 24 00:00:00 1970 PST
  624 |   4 | 00624              | Sun Jan 25 00:00:00 1970 PST
  626 |   6 | 00626              | Tue Jan 27 00:00:00 1970 PST
  627 | 407 | 00627_update7      | Wed Jan 28 00:00:00 1970 PST
  628 |   8 | 00628              | Thu Jan 29 00:00:00 1970 PST
  629 | 509 | 00629_update9      | Fri Jan 30 00:00:00 1970 PST
  630 |   0 | 00630              | Sat Jan 31 00:00:00 1970 PST
  631 |   1 | 00631              | Sun Feb 01 00:00:00 1970 PST
  633 | 303 | 00633_update3      | Tue Feb 03 00:00:00 1970 PST
  634 |   4 | 00634              | Wed Feb 04 00:00:00 1970 PST
  636 |   6 | 00636              | Fri Feb 06 00:00:00 1970 PST
  637 | 407 | 00637_update7      | Sat Feb 07 00:00:00 1970 PST
  638 |   8 | 00638              | Sun Feb 08 00:00:00 1970 PST
  639 | 509 | 00639_update9      | Mon Feb 09 00:00:00 1970 PST
  640 |   0 | 00640              | Tue Feb 10 00:00:00 1970 PST
  641 |   1 | 00641              | Wed Feb 11 00:00:00 1970 PST
  643 | 303 | 00643_update3      | Fri Feb 13 00:00:00 1970 PST
  644 |   4 | 00644              | Sat Feb 14 00:00:00 1970 PST
  646 |   6 | 00646              | Mon Feb 16 00:00:00 1970 PST
  647 | 407 | 00647_update7      | Tue Feb 17 00:00:00 1970 PST
  648 |   8 | 00648              | Wed Feb 18 00:00:00 1970 PST
  649 | 509 | 00649_update9      | Thu Feb 19 00:00:00 1970 PST
  650 |   0 | 00650              | Fri Feb 20 00:00:00 1970 PST
  651 |   1 | 00651              | Sat Feb 21 00:00:00 1970 PST
  653 | 303 | 00653_update3      | Mon Feb 23 00:00:00 1970 PST
  654 |   4 | 00654              | Tue Feb 24 00:00:00 1970 PST
  656 |   6 | 00656              | Thu Feb 26 00:00:00 1970 PST
  657 | 407 | 00657_update7      | Fri Feb 27 00:00:00 1970 PST
  658 |   8 | 00658              | Sat Feb 28 00:00:00 1970 PST
  659 | 509 | 00659_update9      | Sun Mar 01 00:00:00 1970 PST
  660 |   0 | 00660              | Mon Mar 02 00:00:00 1970 PST
  661 |   1 | 00661              | Tue Mar 03 00:00:00 1970 PST
  663 | 303 | 00663_update3      | Thu Mar 05 00:00:00 1970 PST
  664 |   4 | 00664              | Fri Mar 06 00:00:00 1970 PST
  666 |   6 | 00666              | Sun Mar 08 00:00:00 1970 PST
  667 | 407 | 00667_update7      | Mon Mar 09 00:00:00 1970 PST
  668 |   8 | 00668              | Tue Mar 10 00:00:00 1970 PST
  669 | 509 | 00669_update9      | Wed Mar 11 00:00:00 1970 PST
  670 |   0 | 00670              | Thu Mar 12 00:00:00 1970 PST
  671 |   1 | 00671              | Fri Mar 13 00:00:00 1970 PST
  673 | 303 | 00673_update3      | Sun Mar 15 00:00:00 1970 PST
  674 |   4 | 00674              | Mon Mar 16 00:00:00 1970 PST
  676 |   6 | 00676              | Wed Mar 18 00:00:00 1970 PST
  677 | 407 | 00677_update7      | Thu Mar 19 00:00:00 1970 PST
  678 |   8 | 00678              | Fri Mar 20 00:00:00 1970 PST
  679 | 509 | 00679_update9      | Sat Mar 21 00:00:00 1970 PST
  680 |   0 | 00680              | Sun Mar 22 00:00:00 1970 PST
  681 |   1 | 00681              | Mon Mar 23 00:00:00 1970 PST
  683 | 303 | 00683_update3      | Wed Mar 25 00:00:00 1970 PST
  684 |   4 | 00684              | Thu Mar 26 00:00:00 1970 PST
  686 |   6 | 00686              | Sat Mar 28 00:00:00 1970 PST
  687 | 407 | 00687_update7      | Sun Mar 29 00:00:00 1970 PST
  688 |   8 | 00688              | Mon Mar 30 00:00:00 1970 PST
  689 | 509 | 00689_update9      | Tue Mar 31 00:00:00 1970 PST
  690 |   0 | 00690              | Wed Apr 01 00:00:00 1970 PST
  691 |   1 | 00691              | Thu Apr 02 00:00:00 1970 PST
  693 | 303 | 00693_update3      | Sat Apr 04 00:00:00 1970 PST
  694 |   4 | 00694              | Sun Apr 05 00:00:00 1970 PST
  696 |   6 | 00696              | Tue Apr 07 00:00:00 1970 PST
  697 | 407 | 00697_update7      | Wed Apr 08 00:00:00 1970 PST
  698 |   8 | 00698              | Thu Apr 09 00:00:00 1970 PST
  699 | 509 | 00699_update9      | Fri Apr 10 00:00:00 1970 PST
  700 |   0 | 00700              | Thu Jan 01 00:00:00 1970 PST
  701 |   1 | 00701              | Fri Jan 02 00:00:00 1970 PST
  703 | 303 | 00703_update3      | Sun Jan 04 00:00:00 1970 PST
  704 |   4 | 00704              | Mon Jan 05 00:00:00 1970 PST
  706 |   6 | 00706              | Wed Jan 07 00:00:00 1970 PST
  707 | 407 | 00707_update7      | Thu Jan 08 00:00:00 1970 PST
  708 |   8 | 00708              | Fri Jan 09 00:00:00 1970 PST
  709 | 509 | 00709_update9      | Sat Jan 10 00:00:00 1970 PST
  710 |   0 | 00710              | Sun Jan 11 00:00:00 1970 PST
  711 |   1 | 00711              | Mon Jan 12 00:00:00 1970 PST
  713 | 303 | 00713_update3      | Wed Jan 14 00:00:00 1970 PST
  714 |   4 | 00714              | Thu Jan 15 00:00:00 1970 PST
  716 |   6 | 00716              | Sat Jan 17 00:00:00 1970 PST
  717 | 407 | 00717_update7      | Sun Jan 18 00:00:00 1970 PST
  718 |   8 | 00718              | Mon Jan 19 00:00:00 1970 PST
  719 | 509 | 00719_update9      | Tue Jan 20 00:00:00 1970 PST
  720 |   0 | 00720              | Wed Jan 21 00:00:00 1970 PST
  721 |   1 | 00721              | Thu Jan 22 00:00:00 1970 PST
  723 | 303 | 00723_update3      | Sat Jan 24 00:00:00 1970 PST
  724 |   4 | 00724              | Sun Jan 25 00:00:00 1970 PST
  726 |   6 | 00726              | Tue Jan 27 00:00:00 1970 PST
  727 | 407 | 00727_update7      | Wed Jan 28 00:00:00 1970 PST
  728 |   8 | 00728              | Thu Jan 29 00:00:00 1970 PST
  729 | 509 | 00729_update9      | Fri Jan 30 00:00:00 1970 PST
  730 |   0 | 00730              | Sat Jan 31 00:00:00 1970 PST
  731 |   1 | 00731              | Sun Feb 01 00:00:00 1970 PST
  733 | 303 | 00733_update3      | Tue Feb 03 00:00:00 1970 PST
  734 |   4 | 00734              | Wed Feb 04 00:00:00 1970 PST
  736 |   6 | 00736              | Fri Feb 06 00:00:00 1970 PST
  737 | 407 | 00737_update7      | Sat Feb 07 00:00:00 1970 PST
  738 |   8 | 00738              | Sun Feb 08 00:00:00 1970 PST
  739 | 509 | 00739_update9      | Mon Feb 09 00:00:00 1970 PST
  740 |   0 | 00740              | Tue Feb 10 00:00:00 1970 PST
  741 |   1 | 00741              | Wed Feb 11 00:00:00 1970 PST
  743 | 303 | 00743_update3      | Fri Feb 13 00:00:00 1970 PST
  744 |   4 | 00744              | Sat Feb 14 00:00:00 1970 PST
  746 |   6 | 00746              | Mon Feb 16 00:00:00 1970 PST
  747 | 407 | 00747_update7      | Tue Feb 17 00:00:00 1970 PST
  748 |   8 | 00748              | Wed Feb 18 00:00:00 1970 PST
  749 | 509 | 00749_update9      | Thu Feb 19 00:00:00 1970 PST
  750 |   0 | 00750              | Fri Feb 20 00:00:00 1970 PST
  751 |   1 | 00751              | Sat Feb 21 00:00:00 1970 PST
  753 | 303 | 00753_update3      | Mon Feb 23 00:00:00 1970 PST
  754 |   4 | 00754              | Tue Feb 24 00:00:00 1970 PST
  756 |   6 | 00756              | Thu Feb 26 00:00:00 1970 PST
  757 | 407 | 00757_update7      | Fri Feb 27 00:00:00 1970 PST
  758 |   8 | 00758              | Sat Feb 28 00:00:00 1970 PST
  759 | 509 | 00759_update9      | Sun Mar 01 00:00:00 1970 PST
  760 |   0 | 00760              | Mon Mar 02 00:00:00 1970 PST
  761 |   1 | 00761              | Tue Mar 03 00:00:00 1970 PST
  763 | 303 | 00763_update3      | Thu Mar 05 00:00:00 1970 PST
  764 |   4 | 00764              | Fri Mar 06 00:00:00 1970 PST
  766 |   6 | 00766              | Sun Mar 08 00:00:00 1970 PST
  767 | 407 | 00767_update7      | Mon Mar 09 00:00:00 1970 PST
  768 |   8 | 00768              | Tue Mar 10 00:00:00 1970 PST
  769 | 509 | 00769_update9      | Wed Mar 11 00:00:00 1970 PST
  770 |   0 | 00770              | Thu Mar 12 00:00:00 1970 PST
  771 |   1 | 00771              | Fri Mar 13 00:00:00 1970 PST
  773 | 303 | 00773_update3      | Sun Mar 15 00:00:00 1970 PST
  774 |   4 | 00774              | Mon Mar 16 00:00:00 1970 PST
  776 |   6 | 00776              | Wed Mar 18 00:00:00 1970 PST
  777 | 407 | 00777_update7      | Thu Mar 19 00:00:00 1970 PST
  778 |   8 | 00778              | Fri Mar 20 00:00:00 1970 PST
  779 | 509 | 00779_update9      | Sat Mar 21 00:00:00 1970 PST
  780 |   0 | 00780              | Sun Mar 22 00:00:00 1970 PST
  781 |   1 | 00781              | Mon Mar 23 00:00:00 1970 PST
  783 | 303 | 00783_update3      | Wed Mar 25 00:00:00 1970 PST
  784 |   4 | 00784              | Thu Mar 26 00:00:00 1970 PST
  786 |   6 | 00786              | Sat Mar 28 00:00:00 1970 PST
  787 | 407 | 00787_update7      | Sun Mar 29 00:00:00 1970 PST
  788 |   8 | 00788              | Mon Mar 30 00:00:00 1970 PST
  789 | 509 | 00789_update9      | Tue Mar 31 00:00:00 1970 PST
  790 |   0 | 00790              | Wed Apr 01 00:00:00 1970 PST
  791 |   1 | 00791              | Thu Apr 02 00:00:00 1970 PST
  793 | 303 | 00793_update3      | Sat Apr 04 00:00:00 1970 PST
  794 |   4 | 00794              | Sun Apr 05 00:00:00 1970 PST
  796 |   6 | 00796              | Tue Apr 07 00:00:00 1970 PST
  797 | 407 | 00797_update7      | Wed Apr 08 00:00:00 1970 PST
  798 |   8 | 00798              | Thu Apr 09 00:00:00 1970 PST
  799 | 509 | 00799_update9      | Fri Apr 10 00:00:00 1970 PST
  800 |   0 | 00800              | Thu Jan 01 00:00:00 1970 PST
  801 |   1 | 00801              | Fri Jan 02 00:00:00 1970 PST
  803 | 303 | 00803_update3      | Sun Jan 04 00:00:00 1970 PST
  804 |   4 | 00804              | Mon Jan 05 00:00:00 1970 PST
  806 |   6 | 00806              | Wed Jan 07 00:00:00 1970 PST
  807 | 407 | 00807_update7      | Thu Jan 08 00:00:00 1970 PST
  808 |   8 | 00808              | Fri Jan 09 00:00:00 1970 PST
  809 | 509 | 00809_update9      | Sat Jan 10 00:00:00 1970 PST
  810 |   0 | 00810              | Sun Jan 11 00:00:00 1970 PST
  811 |   1 | 00811              | Mon Jan 12 00:00:00 1970 PST
  813 | 303 | 00813_update3      | Wed Jan 14 00:00:00 1970 PST
  814 |   4 | 00814              | Thu Jan 15 00:00:00 1970 PST
  816 |   6 | 00816              | Sat Jan 17 00:00:00 1970 PST
  817 | 407 | 00817_update7      | Sun Jan 18 00:00:00 1970 PST
  818 |   8 | 00818              | Mon Jan 19 00:00:00 1970 PST
  819 | 509 | 00819_update9      | Tue Jan 20 00:00:00 1970 PST
  820 |   0 | 00820              | Wed Jan 21 00:00:00 1970 PST
  821 |   1 | 00821              | Thu Jan 22 00:00:00 1970 PST
  823 | 303 | 00823_update3      | Sat Jan 24 00:00:00 1970 PST
  824 |   4 | 00824              | Sun Jan 25 00:00:00 1970 PST
  826 |   6 | 00826              | Tue Jan 27 00:00:00 1970 PST
  827 | 407 | 00827_update7      | Wed Jan 28 00:00:00 1970 PST
  828 |   8 | 00828              | Thu Jan 29 00:00:00 1970 PST
  829 | 509 | 00829_update9      | Fri Jan 30 00:00:00 1970 PST
  830 |   0 | 00830              | Sat Jan 31 00:00:00 1970 PST
  831 |   1 | 00831              | Sun Feb 01 00:00:00 1970 PST
  833 | 303 | 00833_update3      | Tue Feb 03 00:00:00 1970 PST
  834 |   4 | 00834              | Wed Feb 04 00:00:00 1970 PST
  836 |   6 | 00836              | Fri Feb 06 00:00:00 1970 PST
  837 | 407 | 00837_update7      | Sat Feb 07 00:00:00 1970 PST
  838 |   8 | 00838              | Sun Feb 08 00:00:00 1970 PST
  839 | 509 | 00839_update9      | Mon Feb 09 00:00:00 1970 PST
  840 |   0 | 00840              | Tue Feb 10 00:00:00 1970 PST
  841 |   1 | 00841              | Wed Feb 11 00:00:00 1970 PST
  843 | 303 | 00843_update3      | Fri Feb 13 00:00:00 1970 PST
  844 |   4 | 00844              | Sat Feb 14 00:00:00 1970 PST
  846 |   6 | 00846              | Mon Feb 16 00:00:00 1970 PST
  847 | 407 | 00847_update7      | Tue Feb 17 00:00:00 1970 PST
  848 |   8 | 00848              | Wed Feb 18 00:00:00 1970 PST
  849 | 509 | 00849_update9      | Thu Feb 19 00:00:00 1970 PST
  850 |   0 | 00850              | Fri Feb 20 00:00:00 1970 PST
  851 |   1 | 00851              | Sat Feb 21 00:00:00 1970 PST
  853 | 303 | 00853_update3      | Mon Feb 23 00:00:00 1970 PST
  854 |   4 | 00854              | Tue Feb 24 00:00:00 1970 PST
  856 |   6 | 00856              | Thu Feb 26 00:00:00 1970 PST
  857 | 407 | 00857_update7      | Fri Feb 27 00:00:00 1970 PST
  858 |   8 | 00858              | Sat Feb 28 00:00:00 1970 PST
  859 | 509 | 00859_update9      | Sun Mar 01 00:00:00 1970 PST
  860 |   0 | 00860              | Mon Mar 02 00:00:00 1970 PST
  861 |   1 | 00861              | Tue Mar 03 00:00:00 1970 PST
  863 | 303 | 00863_update3      | Thu Mar 05 00:00:00 1970 PST
  864 |   4 | 00864              | Fri Mar 06 00:00:00 1970 PST
  866 |   6 | 00866              | Sun Mar 08 00:00:00 1970 PST
  867 | 407 | 00867_update7      | Mon Mar 09 00:00:00 1970 PST
  868 |   8 | 00868              | Tue Mar 10 00:00:00 1970 PST
  869 | 509 | 00869_update9      | Wed Mar 11 00:00:00 1970 PST
  870 |   0 | 00870              | Thu Mar 12 00:00:00 1970 PST
  871 |   1 | 00871              | Fri Mar 13 00:00:00 1970 PST
  873 | 303 | 00873_update3      | Sun Mar 15 00:00:00 1970 PST
  874 |   4 | 00874              | Mon Mar 16 00:00:00 1970 PST
  876 |   6 | 00876              | Wed Mar 18 00:00:00 1970 PST
  877 | 407 | 00877_update7      | Thu Mar 19 00:00:00 1970 PST
  878 |   8 | 00878              | Fri Mar 20 00:00:00 1970 PST
  879 | 509 | 00879_update9      | Sat Mar 21 00:00:00 1970 PST
  880 |   0 | 00880              | Sun Mar 22 00:00:00 1970 PST
  881 |   1 | 00881              | Mon Mar 23 00:00:00 1970 PST
  883 | 303 | 00883_update3      | Wed Mar 25 00:00:00 1970 PST
  884 |   4 | 00884              | Thu Mar 26 00:00:00 1970 PST
  886 |   6 | 00886              | Sat Mar 28 00:00:00 1970 PST
  887 | 407 | 00887_update7      | Sun Mar 29 00:00:00 1970 PST
  888 |   8 | 00888              | Mon Mar 30 00:00:00 1970 PST
  889 | 509 | 00889_update9      | Tue Mar 31 00:00:00 1970 PST
  890 |   0 | 00890              | Wed Apr 01 00:00:00 1970 PST
  891 |   1 | 00891              | Thu Apr 02 00:00:00 1970 PST
  893 | 303 | 00893_update3      | Sat Apr 04 00:00:00 1970 PST
  894 |   4 | 00894              | Sun Apr 05 00:00:00 1970 PST
  896 |   6 | 00896              | Tue Apr 07 00:00:00 1970 PST
  897 | 407 | 00897_update7      | Wed Apr 08 00:00:00 1970 PST
  898 |   8 | 00898              | Thu Apr 09 00:00:00 1970 PST
  899 | 509 | 00899_update9      | Fri Apr 10 00:00:00 1970 PST
  900 |   0 | 00900              | Thu Jan 01 00:00:00 1970 PST
  901 |   1 | 00901              | Fri Jan 02 00:00:00 1970 PST
  903 | 303 | 00903_update3      | Sun Jan 04 00:00:00 1970 PST
  904 |   4 | 00904              | Mon Jan 05 00:00:00 1970 PST
  906 |   6 | 00906              | Wed Jan 07 00:00:00 1970 PST
  907 | 407 | 00907_update7      | Thu Jan 08 00:00:00 1970 PST
  908 |   8 | 00908              | Fri Jan 09 00:00:00 1970 PST
  909 | 509 | 00909_update9      | Sat Jan 10 00:00:00 1970 PST
  910 |   0 | 00910              | Sun Jan 11 00:00:00 1970 PST
  911 |   1 | 00911              | Mon Jan 12 00:00:00 1970 PST
  913 | 303 | 00913_update3      | Wed Jan 14 00:00:00 1970 PST
  914 |   4 | 00914              | Thu Jan 15 00:00:00 1970 PST
  916 |   6 | 00916              | Sat Jan 17 00:00:00 1970 PST
  917 | 407 | 00917_update7      | Sun Jan 18 00:00:00 1970 PST
  918 |   8 | 00918              | Mon Jan 19 00:00:00 1970 PST
  919 | 509 | 00919_update9      | Tue Jan 20 00:00:00 1970 PST
  920 |   0 | 00920              | Wed Jan 21 00:00:00 1970 PST
  921 |   1 | 00921              | Thu Jan 22 00:00:00 1970 PST
  923 | 303 | 00923_update3      | Sat Jan 24 00:00:00 1970 PST
  924 |   4 | 00924              | Sun Jan 25 00:00:00 1970 PST
  926 |   6 | 00926              | Tue Jan 27 00:00:00 1970 PST
  927 | 407 | 00927_update7      | Wed Jan 28 00:00:00 1970 PST
  928 |   8 | 00928              | Thu Jan 29 00:00:00 1970 PST
  929 | 509 | 00929_update9      | Fri Jan 30 00:00:00 1970 PST
  930 |   0 | 00930              | Sat Jan 31 00:00:00 1970 PST
  931 |   1 | 00931              | Sun Feb 01 00:00:00 1970 PST
  933 | 303 | 00933_update3      | Tue Feb 03 00:00:00 1970 PST
  934 |   4 | 00934              | Wed Feb 04 00:00:00 1970 PST
  936 |   6 | 00936              | Fri Feb 06 00:00:00 1970 PST
  937 | 407 | 00937_update7      | Sat Feb 07 00:00:00 1970 PST
  938 |   8 | 00938              | Sun Feb 08 00:00:00 1970 PST
  939 | 509 | 00939_update9      | Mon Feb 09 00:00:00 1970 PST
  940 |   0 | 00940              | Tue Feb 10 00:00:00 1970 PST
  941 |   1 | 00941              | Wed Feb 11 00:00:00 1970 PST
  943 | 303 | 00943_update3      | Fri Feb 13 00:00:00 1970 PST
  944 |   4 | 00944              | Sat Feb 14 00:00:00 1970 PST
  946 |   6 | 00946              | Mon Feb 16 00:00:00 1970 PST
  947 | 407 | 00947_update7      | Tue Feb 17 00:00:00 1970 PST
  948 |   8 | 00948              | Wed Feb 18 00:00:00 1970 PST
  949 | 509 | 00949_update9      | Thu Feb 19 00:00:00 1970 PST
  950 |   0 | 00950              | Fri Feb 20 00:00:00 1970 PST
  951 |   1 | 00951              | Sat Feb 21 00:00:00 1970 PST
  953 | 303 | 00953_update3      | Mon Feb 23 00:00:00 1970 PST
  954 |   4 | 00954              | Tue Feb 24 00:00:00 1970 PST
  956 |   6 | 00956              | Thu Feb 26 00:00:00 1970 PST
  957 | 407 | 00957_update7      | Fri Feb 27 00:00:00 1970 PST
  958 |   8 | 00958              | Sat Feb 28 00:00:00 1970 PST
  959 | 509 | 00959_update9      | Sun Mar 01 00:00:00 1970 PST
  960 |   0 | 00960              | Mon Mar 02 00:00:00 1970 PST
  961 |   1 | 00961              | Tue Mar 03 00:00:00 1970 PST
  963 | 303 | 00963_update3      | Thu Mar 05 00:00:00 1970 PST
  964 |   4 | 00964              | Fri Mar 06 00:00:00 1970 PST
  966 |   6 | 00966              | Sun Mar 08 00:00:00 1970 PST
  967 | 407 | 00967_update7      | Mon Mar 09 00:00:00 1970 PST
  968 |   8 | 00968              | Tue Mar 10 00:00:00 1970 PST
  969 | 509 | 00969_update9      | Wed Mar 11 00:00:00 1970 PST
  970 |   0 | 00970              | Thu Mar 12 00:00:00 1970 PST
  971 |   1 | 00971              | Fri Mar 13 00:00:00 1970 PST
  973 | 303 | 00973_update3      | Sun Mar 15 00:00:00 1970 PST
  974 |   4 | 00974              | Mon Mar 16 00:00:00 1970 PST
  976 |   6 | 00976              | Wed Mar 18 00:00:00 1970 PST
  977 | 407 | 00977_update7      | Thu Mar 19 00:00:00 1970 PST
  978 |   8 | 00978              | Fri Mar 20 00:00:00 1970 PST
  979 | 509 | 00979_update9      | Sat Mar 21 00:00:00 1970 PST
  980 |   0 | 00980              | Sun Mar 22 00:00:00 1970 PST
  981 |   1 | 00981              | Mon Mar 23 00:00:00 1970 PST
  983 | 303 | 00983_update3      | Wed Mar 25 00:00:00 1970 PST
  984 |   4 | 00984              | Thu Mar 26 00:00:00 1970 PST
  986 |   6 | 00986              | Sat Mar 28 00:00:00 1970 PST
  987 | 407 | 00987_update7      | Sun Mar 29 00:00:00 1970 PST
  988 |   8 | 00988              | Mon Mar 30 00:00:00 1970 PST
  989 | 509 | 00989_update9      | Tue Mar 31 00:00:00 1970 PST
  990 |   0 | 00990              | Wed Apr 01 00:00:00 1970 PST
  991 |   1 | 00991              | Thu Apr 02 00:00:00 1970 PST
  993 | 303 | 00993_update3      | Sat Apr 04 00:00:00 1970 PST
  994 |   4 | 00994              | Sun Apr 05 00:00:00 1970 PST
  996 |   6 | 00996              | Tue Apr 07 00:00:00 1970 PST
  997 | 407 | 00997_update7      | Wed Apr 08 00:00:00 1970 PST
  998 |   8 | 00998              | Thu Apr 09 00:00:00 1970 PST
  999 | 509 | 00999_update9      | Fri Apr 10 00:00:00 1970 PST
 1000 |   0 | 01000              | Thu Jan 01 00:00:00 1970 PST
 1001 | 101 | 0000100001         | 
 1003 | 403 | 0000300003_update3 | 
 1004 | 104 | 0000400004         | 
 1006 | 106 | 0000600006         | 
 1007 | 507 | 0000700007_update7 | 
 1008 | 108 | 0000800008         | 
 1009 | 609 | 0000900009_update9 | 
 1010 | 100 | 0001000010         | 
 1011 | 101 | 0001100011         | 
 1013 | 403 | 0001300013_update3 | 
 1014 | 104 | 0001400014         | 
 1016 | 106 | 0001600016         | 
 1017 | 507 | 0001700017_update7 | 
 1018 | 108 | 0001800018         | 
 1019 | 609 | 0001900019_update9 | 
 1020 | 100 | 0002000020         | 
 1101 | 201 | aaa                | 
 1103 | 503 | ccc_update3        | 
 1104 | 204 | ddd                | 
(819 rows)

--Testcase 405:
EXPLAIN (verbose, costs off)
INSERT INTO ft2 (c1,c2,c3) VALUES (1200,999,'foo');
                                                                                           QUERY PLAN                                                                                            
-------------------------------------------------------------------------------------------------------------------------------------------------------------------------------------------------
 Insert on public.ft2
   ->  Result
         Output: 1200, 999, NULL::integer, 'foo'::text, NULL::timestamp with time zone, NULL::timestamp without time zone, NULL::character varying, 'ft2       '::character(10), NULL::user_enum
(3 rows)

--Testcase 406:
INSERT INTO ft2 (c1,c2,c3) VALUES (1200,999,'foo');
--Testcase 407:
EXPLAIN (verbose, costs off)
UPDATE ft2 SET c3 = 'bar' WHERE c1 = 1200;             -- can be pushed down
                                         QUERY PLAN                                         
--------------------------------------------------------------------------------------------
 Update on public.ft2
   ->  Foreign Update on public.ft2
         mysql query: UPDATE `mysql_fdw_post`.`T 1` SET `c3` = 'bar' WHERE ((`C 1` = 1200))
(3 rows)

--Testcase 408:
UPDATE ft2 SET c3 = 'bar' WHERE c1 = 1200;
--Testcase 409:
EXPLAIN (verbose, costs off)
DELETE FROM ft2 WHERE c1 = 1200;                       -- can be pushed down
                                   QUERY PLAN                                   
--------------------------------------------------------------------------------
 Delete on public.ft2
   ->  Foreign Delete on public.ft2
         mysql query: DELETE FROM `mysql_fdw_post`.`T 1` WHERE ((`C 1` = 1200))
(3 rows)

--Testcase 410:
DELETE FROM ft2 WHERE c1 = 1200;
-- -- Test UPDATE/DELETE with RETURNING on a three-table join
-- INSERT INTO ft2 (c1,c2,c3)
--   SELECT id, id - 1200, to_char(id, 'FM00000') FROM generate_series(1201, 1300) id;
-- EXPLAIN (verbose, costs off)
-- UPDATE ft2 SET c3 = 'foo'
--   FROM ft4 INNER JOIN ft5 ON (ft4.c1 = ft5.c1)
--   WHERE ft2.c1 > 1200 AND ft2.c2 = ft4.c1
--   RETURNING ft2, ft2.*, ft4, ft4.*;       -- can be pushed down
-- UPDATE ft2 SET c3 = 'foo'
--   FROM ft4 INNER JOIN ft5 ON (ft4.c1 = ft5.c1)
--   WHERE ft2.c1 > 1200 AND ft2.c2 = ft4.c1
--   RETURNING ft2, ft2.*, ft4, ft4.*;
-- EXPLAIN (verbose, costs off)
-- DELETE FROM ft2
--   USING ft4 LEFT JOIN ft5 ON (ft4.c1 = ft5.c1)
--   WHERE ft2.c1 > 1200 AND ft2.c1 % 10 = 0 AND ft2.c2 = ft4.c1
--   RETURNING 100;                          -- can be pushed down
-- DELETE FROM ft2
--   USING ft4 LEFT JOIN ft5 ON (ft4.c1 = ft5.c1)
--   WHERE ft2.c1 > 1200 AND ft2.c1 % 10 = 0 AND ft2.c2 = ft4.c1
--   RETURNING 100;
-- DELETE FROM ft2 WHERE ft2.c1 > 1200;
-- -- Test UPDATE with a MULTIEXPR sub-select
-- -- (maybe someday this'll be remotely executable, but not today)
-- EXPLAIN (verbose, costs off)
-- UPDATE ft2 AS target SET (c2, c7) = (
--     SELECT c2 * 10, c7
--         FROM ft2 AS src
--         WHERE target.c1 = src.c1
-- ) WHERE c1 > 1100;
-- UPDATE ft2 AS target SET (c2, c7) = (
--     SELECT c2 * 10, c7
--         FROM ft2 AS src
--         WHERE target.c1 = src.c1
-- ) WHERE c1 > 1100;
-- UPDATE ft2 AS target SET (c2) = (
--     SELECT c2 / 10
--         FROM ft2 AS src
--         WHERE target.c1 = src.c1
-- ) WHERE c1 > 1100;
-- -- Test UPDATE/DELETE with WHERE or JOIN/ON conditions containing
-- -- user-defined operators/functions
-- ALTER SERVER mysql_svr OPTIONS (DROP extensions);
-- INSERT INTO ft2 (c1,c2,c3)
--   SELECT id, id % 10, to_char(id, 'FM00000') FROM generate_series(2001, 2010) id;
-- EXPLAIN (verbose, costs off)
-- UPDATE ft2 SET c3 = 'bar' WHERE mysql_fdw_abs(c1) > 2000 RETURNING *;            -- can't be pushed down
-- UPDATE ft2 SET c3 = 'bar' WHERE mysql_fdw_abs(c1) > 2000 RETURNING *;
-- EXPLAIN (verbose, costs off)
-- UPDATE ft2 SET c3 = 'baz'
--   FROM ft4 INNER JOIN ft5 ON (ft4.c1 = ft5.c1)
--   WHERE ft2.c1 > 2000 AND ft2.c2 === ft4.c1
--   RETURNING ft2.*, ft4.*, ft5.*;                                                    -- can't be pushed down
-- UPDATE ft2 SET c3 = 'baz'
--   FROM ft4 INNER JOIN ft5 ON (ft4.c1 = ft5.c1)
--   WHERE ft2.c1 > 2000 AND ft2.c2 === ft4.c1
--   RETURNING ft2.*, ft4.*, ft5.*;
-- EXPLAIN (verbose, costs off)
-- DELETE FROM ft2
--   USING ft4 INNER JOIN ft5 ON (ft4.c1 === ft5.c1)
--   WHERE ft2.c1 > 2000 AND ft2.c2 = ft4.c1
--   RETURNING ft2.c1, ft2.c2, ft2.c3;       -- can't be pushed down
-- DELETE FROM ft2
--   USING ft4 INNER JOIN ft5 ON (ft4.c1 === ft5.c1)
--   WHERE ft2.c1 > 2000 AND ft2.c2 = ft4.c1
--   RETURNING ft2.c1, ft2.c2, ft2.c3;
-- DELETE FROM ft2 WHERE ft2.c1 > 2000;
-- ALTER SERVER mysql_svr OPTIONS (ADD extensions 'mysql_fdw');
-- -- Test that trigger on remote table works as expected
-- CREATE OR REPLACE FUNCTION "S 1".F_BRTRIG() RETURNS trigger AS $$
-- BEGIN
--     NEW.c3 = NEW.c3 || '_trig_update';
--     RETURN NEW;
-- END;
-- $$ LANGUAGE plpgsql;
-- CREATE TRIGGER t1_br_insert BEFORE INSERT OR UPDATE
--     ON "S 1"."T 1" FOR EACH ROW EXECUTE PROCEDURE "S 1".F_BRTRIG();
-- INSERT INTO ft2 (c1,c2,c3) VALUES (1208, 818, 'fff') RETURNING *;
-- INSERT INTO ft2 (c1,c2,c3,c6) VALUES (1218, 818, 'ggg', '(--;') RETURNING *;
-- UPDATE ft2 SET c2 = c2 + 600 WHERE c1 % 10 = 8 AND c1 < 1200 RETURNING *;
-- -- Test errors thrown on remote side during update
-- ALTER TABLE "S 1"."T 1" ADD CONSTRAINT c2positive CHECK (c2 >= 0);
-- INSERT INTO ft1(c1, c2) VALUES(11, 12);  -- duplicate key
-- INSERT INTO ft1(c1, c2) VALUES(11, 12) ON CONFLICT DO NOTHING; -- works
-- INSERT INTO ft1(c1, c2) VALUES(11, 12) ON CONFLICT (c1, c2) DO NOTHING; -- unsupported
-- INSERT INTO ft1(c1, c2) VALUES(11, 12) ON CONFLICT (c1, c2) DO UPDATE SET c3 = 'ffg'; -- unsupported
-- INSERT INTO ft1(c1, c2) VALUES(1111, -2);  -- c2positive
-- UPDATE ft1 SET c2 = -c2 WHERE c1 = 1;  -- c2positive
-- -- Test savepoint/rollback behavior
-- select c2, count(*) from ft2 where c2 < 500 group by 1 order by 1;
-- select c2, count(*) from "S 1"."T 1" where c2 < 500 group by 1 order by 1;
-- begin;
-- update ft2 set c2 = 42 where c2 = 0;
-- select c2, count(*) from ft2 where c2 < 500 group by 1 order by 1;
-- savepoint s1;
-- update ft2 set c2 = 44 where c2 = 4;
-- select c2, count(*) from ft2 where c2 < 500 group by 1 order by 1;
-- release savepoint s1;
-- select c2, count(*) from ft2 where c2 < 500 group by 1 order by 1;
-- savepoint s2;
-- update ft2 set c2 = 46 where c2 = 6;
-- select c2, count(*) from ft2 where c2 < 500 group by 1 order by 1;
-- rollback to savepoint s2;
-- select c2, count(*) from ft2 where c2 < 500 group by 1 order by 1;
-- release savepoint s2;
-- select c2, count(*) from ft2 where c2 < 500 group by 1 order by 1;
-- savepoint s3;
-- update ft2 set c2 = -2 where c2 = 42 and c1 = 10; -- fail on remote side
-- rollback to savepoint s3;
-- select c2, count(*) from ft2 where c2 < 500 group by 1 order by 1;
-- release savepoint s3;
-- select c2, count(*) from ft2 where c2 < 500 group by 1 order by 1;
-- -- none of the above is committed yet remotely
-- select c2, count(*) from "S 1"."T 1" where c2 < 500 group by 1 order by 1;
-- commit;
-- select c2, count(*) from ft2 where c2 < 500 group by 1 order by 1;
-- select c2, count(*) from "S 1"."T 1" where c2 < 500 group by 1 order by 1;
-- VACUUM ANALYZE "S 1"."T 1";
-- -- Above DMLs add data with c6 as NULL in ft1, so test ORDER BY NULLS LAST and NULLs
-- -- FIRST behavior here.
-- -- ORDER BY DESC NULLS LAST options
-- EXPLAIN (VERBOSE, COSTS OFF) SELECT * FROM ft1 ORDER BY c6 DESC NULLS LAST, c1 OFFSET 795 LIMIT 10;
-- SELECT * FROM ft1 ORDER BY c6 DESC NULLS LAST, c1 OFFSET 795  LIMIT 10;
-- -- ORDER BY DESC NULLS FIRST options
-- EXPLAIN (VERBOSE, COSTS OFF) SELECT * FROM ft1 ORDER BY c6 DESC NULLS FIRST, c1 OFFSET 15 LIMIT 10;
-- SELECT * FROM ft1 ORDER BY c6 DESC NULLS FIRST, c1 OFFSET 15 LIMIT 10;
-- -- ORDER BY ASC NULLS FIRST options
-- EXPLAIN (VERBOSE, COSTS OFF) SELECT * FROM ft1 ORDER BY c6 ASC NULLS FIRST, c1 OFFSET 15 LIMIT 10;
-- SELECT * FROM ft1 ORDER BY c6 ASC NULLS FIRST, c1 OFFSET 15 LIMIT 10;
-- -- ===================================================================
-- -- test check constraints
-- -- ===================================================================
-- -- Consistent check constraints provide consistent results
-- ALTER FOREIGN TABLE ft1 ADD CONSTRAINT ft1_c2positive CHECK (c2 >= 0);
-- EXPLAIN (VERBOSE, COSTS OFF) SELECT count(*) FROM ft1 WHERE c2 < 0;
-- SELECT count(*) FROM ft1 WHERE c2 < 0;
-- SET constraint_exclusion = 'on';
-- EXPLAIN (VERBOSE, COSTS OFF) SELECT count(*) FROM ft1 WHERE c2 < 0;
-- SELECT count(*) FROM ft1 WHERE c2 < 0;
-- RESET constraint_exclusion;
-- -- check constraint is enforced on the remote side, not locally
-- INSERT INTO ft1(c1, c2) VALUES(1111, -2);  -- c2positive
-- UPDATE ft1 SET c2 = -c2 WHERE c1 = 1;  -- c2positive
-- ALTER FOREIGN TABLE ft1 DROP CONSTRAINT ft1_c2positive;
-- -- But inconsistent check constraints provide inconsistent results
-- ALTER FOREIGN TABLE ft1 ADD CONSTRAINT ft1_c2negative CHECK (c2 < 0);
-- EXPLAIN (VERBOSE, COSTS OFF) SELECT count(*) FROM ft1 WHERE c2 >= 0;
-- SELECT count(*) FROM ft1 WHERE c2 >= 0;
-- SET constraint_exclusion = 'on';
-- EXPLAIN (VERBOSE, COSTS OFF) SELECT count(*) FROM ft1 WHERE c2 >= 0;
-- SELECT count(*) FROM ft1 WHERE c2 >= 0;
-- RESET constraint_exclusion;
-- -- local check constraint is not actually enforced
-- INSERT INTO ft1(c1, c2) VALUES(1111, 2);
-- UPDATE ft1 SET c2 = c2 + 1 WHERE c1 = 1;
-- ALTER FOREIGN TABLE ft1 DROP CONSTRAINT ft1_c2negative;
-- -- ===================================================================
-- -- test WITH CHECK OPTION constraints
-- -- ===================================================================
-- CREATE FUNCTION row_before_insupd_trigfunc() RETURNS trigger AS $$BEGIN NEW.a := NEW.a + 10; RETURN NEW; END$$ LANGUAGE plpgsql;
-- CREATE TABLE base_tbl (a int, b int);
-- ALTER TABLE base_tbl SET (autovacuum_enabled = 'false');
-- CREATE TRIGGER row_before_insupd_trigger BEFORE INSERT OR UPDATE ON base_tbl FOR EACH ROW EXECUTE PROCEDURE row_before_insupd_trigfunc();
-- CREATE FOREIGN TABLE foreign_tbl (a int, b int)
--   SERVER mysql_svr OPTIONS (dbname 'mysql_fdw_post', table_name 'base_tbl');
-- CREATE VIEW rw_view AS SELECT * FROM foreign_tbl
--   WHERE a < b WITH CHECK OPTION;
-- \d+ rw_view
-- EXPLAIN (VERBOSE, COSTS OFF)
-- INSERT INTO rw_view VALUES (0, 5);
-- INSERT INTO rw_view VALUES (0, 5); -- should fail
-- EXPLAIN (VERBOSE, COSTS OFF)
-- INSERT INTO rw_view VALUES (0, 15);
-- INSERT INTO rw_view VALUES (0, 15); -- ok
-- SELECT * FROM foreign_tbl;
-- EXPLAIN (VERBOSE, COSTS OFF)
-- UPDATE rw_view SET b = b + 5;
-- UPDATE rw_view SET b = b + 5; -- should fail
-- EXPLAIN (VERBOSE, COSTS OFF)
-- UPDATE rw_view SET b = b + 15;
-- UPDATE rw_view SET b = b + 15; -- ok
-- SELECT * FROM foreign_tbl;
-- DROP FOREIGN TABLE foreign_tbl CASCADE;
-- DROP TRIGGER row_before_insupd_trigger ON base_tbl;
-- DROP TABLE base_tbl;
-- -- test WCO for partitions
-- CREATE TABLE child_tbl (a int, b int);
-- ALTER TABLE child_tbl SET (autovacuum_enabled = 'false');
-- CREATE TRIGGER row_before_insupd_trigger BEFORE INSERT OR UPDATE ON child_tbl FOR EACH ROW EXECUTE PROCEDURE row_before_insupd_trigfunc();
-- CREATE FOREIGN TABLE foreign_tbl (a int, b int)
--   SERVER mysql_svr OPTIONS (dbname 'mysql_fdw_post', table_name 'child_tbl');
-- CREATE TABLE parent_tbl (a int, b int) PARTITION BY RANGE(a);
-- ALTER TABLE parent_tbl ATTACH PARTITION foreign_tbl FOR VALUES FROM (0) TO (100);
-- CREATE VIEW rw_view AS SELECT * FROM parent_tbl
--   WHERE a < b WITH CHECK OPTION;
-- \d+ rw_view
-- EXPLAIN (VERBOSE, COSTS OFF)
-- INSERT INTO rw_view VALUES (0, 5);
-- INSERT INTO rw_view VALUES (0, 5); -- should fail
-- EXPLAIN (VERBOSE, COSTS OFF)
-- INSERT INTO rw_view VALUES (0, 15);
-- INSERT INTO rw_view VALUES (0, 15); -- ok
-- SELECT * FROM foreign_tbl;
-- EXPLAIN (VERBOSE, COSTS OFF)
-- UPDATE rw_view SET b = b + 5;
-- UPDATE rw_view SET b = b + 5; -- should fail
-- EXPLAIN (VERBOSE, COSTS OFF)
-- UPDATE rw_view SET b = b + 15;
-- UPDATE rw_view SET b = b + 15; -- ok
-- SELECT * FROM foreign_tbl;
-- DROP FOREIGN TABLE foreign_tbl CASCADE;
-- DROP TRIGGER row_before_insupd_trigger ON child_tbl;
-- DROP TABLE parent_tbl CASCADE;
-- DROP FUNCTION row_before_insupd_trigfunc;
-- -- ===================================================================
-- -- test serial columns (ie, sequence-based defaults)
-- -- ===================================================================
-- create table loc1 (f1 serial, f2 text);
-- alter table loc1 set (autovacuum_enabled = 'false');
-- create foreign table rem1 (f1 serial, f2 text)
--   server mysql_svr options(dbname 'mysql_fdw_post', table_name 'loc1');
-- select pg_catalog.setval('rem1_f1_seq', 10, false);
-- insert into loc1(f2) values('hi');
-- insert into rem1(f2) values('hi remote');
-- insert into loc1(f2) values('bye');
-- insert into rem1(f2) values('bye remote');
-- select * from loc1;
-- select * from rem1;
-- -- ===================================================================
-- -- test generated columns
-- -- ===================================================================
-- -- create table gloc1 (a int, b int);
-- -- alter table gloc1 set (autovacuum_enabled = 'false');
-- create foreign table grem1 (
--   a int,
--   b int generated always as (a * 2) stored)
--   server mysql_svr options(dbname 'mysql_fdw_post', table_name 'gloc1');
-- insert into grem1 (a) values (1), (2);
-- update grem1 set a = 22 where a = 2;
-- select * from gloc1;
-- select * from grem1;
-- -- ===================================================================
-- -- test local triggers
-- -- ===================================================================
-- -- Trigger functions "borrowed" from triggers regress test.
-- CREATE FUNCTION trigger_func() RETURNS trigger LANGUAGE plpgsql AS $$
-- BEGIN
-- 	RAISE NOTICE 'trigger_func(%) called: action = %, when = %, level = %',
-- 		TG_ARGV[0], TG_OP, TG_WHEN, TG_LEVEL;
-- 	RETURN NULL;
-- END;$$;
-- CREATE TRIGGER trig_stmt_before BEFORE DELETE OR INSERT OR UPDATE ON rem1
-- 	FOR EACH STATEMENT EXECUTE PROCEDURE trigger_func();
-- CREATE TRIGGER trig_stmt_after AFTER DELETE OR INSERT OR UPDATE ON rem1
-- 	FOR EACH STATEMENT EXECUTE PROCEDURE trigger_func();
-- CREATE OR REPLACE FUNCTION trigger_data()  RETURNS trigger
-- LANGUAGE plpgsql AS $$
-- declare
-- 	oldnew text[];
-- 	relid text;
--     argstr text;
-- begin
-- 	relid := TG_relid::regclass;
-- 	argstr := '';
-- 	for i in 0 .. TG_nargs - 1 loop
-- 		if i > 0 then
-- 			argstr := argstr || ', ';
-- 		end if;
-- 		argstr := argstr || TG_argv[i];
-- 	end loop;
--     RAISE NOTICE '%(%) % % % ON %',
-- 		tg_name, argstr, TG_when, TG_level, TG_OP, relid;
--     oldnew := '{}'::text[];
-- 	if TG_OP != 'INSERT' then
-- 		oldnew := array_append(oldnew, format('OLD: %s', OLD));
-- 	end if;
-- 	if TG_OP != 'DELETE' then
-- 		oldnew := array_append(oldnew, format('NEW: %s', NEW));
-- 	end if;
--     RAISE NOTICE '%', array_to_string(oldnew, ',');
-- 	if TG_OP = 'DELETE' then
-- 		return OLD;
-- 	else
-- 		return NEW;
-- 	end if;
-- end;
-- $$;
-- -- Test basic functionality
-- CREATE TRIGGER trig_row_before
-- BEFORE INSERT OR UPDATE OR DELETE ON rem1
-- FOR EACH ROW EXECUTE PROCEDURE trigger_data(23,'skidoo');
-- CREATE TRIGGER trig_row_after
-- AFTER INSERT OR UPDATE OR DELETE ON rem1
-- FOR EACH ROW EXECUTE PROCEDURE trigger_data(23,'skidoo');
-- delete from rem1;
-- insert into rem1 values(1,'insert');
-- update rem1 set f2  = 'update' where f1 = 1;
-- update rem1 set f2 = f2 || f2;
-- -- cleanup
-- DROP TRIGGER trig_row_before ON rem1;
-- DROP TRIGGER trig_row_after ON rem1;
-- DROP TRIGGER trig_stmt_before ON rem1;
-- DROP TRIGGER trig_stmt_after ON rem1;
-- DELETE from rem1;
-- -- Test multiple AFTER ROW triggers on a foreign table
-- CREATE TRIGGER trig_row_after1
-- AFTER INSERT OR UPDATE OR DELETE ON rem1
-- FOR EACH ROW EXECUTE PROCEDURE trigger_data(23,'skidoo');
-- CREATE TRIGGER trig_row_after2
-- AFTER INSERT OR UPDATE OR DELETE ON rem1
-- FOR EACH ROW EXECUTE PROCEDURE trigger_data(23,'skidoo');
-- insert into rem1 values(1,'insert');
-- update rem1 set f2  = 'update' where f1 = 1;
-- update rem1 set f2 = f2 || f2;
-- delete from rem1;
-- -- cleanup
-- DROP TRIGGER trig_row_after1 ON rem1;
-- DROP TRIGGER trig_row_after2 ON rem1;
-- -- Test WHEN conditions
-- CREATE TRIGGER trig_row_before_insupd
-- BEFORE INSERT OR UPDATE ON rem1
-- FOR EACH ROW
-- WHEN (NEW.f2 like '%update%')
-- EXECUTE PROCEDURE trigger_data(23,'skidoo');
-- CREATE TRIGGER trig_row_after_insupd
-- AFTER INSERT OR UPDATE ON rem1
-- FOR EACH ROW
-- WHEN (NEW.f2 like '%update%')
-- EXECUTE PROCEDURE trigger_data(23,'skidoo');
-- -- Insert or update not matching: nothing happens
-- INSERT INTO rem1 values(1, 'insert');
-- UPDATE rem1 set f2 = 'test';
-- -- Insert or update matching: triggers are fired
-- INSERT INTO rem1 values(2, 'update');
-- UPDATE rem1 set f2 = 'update update' where f1 = '2';
-- CREATE TRIGGER trig_row_before_delete
-- BEFORE DELETE ON rem1
-- FOR EACH ROW
-- WHEN (OLD.f2 like '%update%')
-- EXECUTE PROCEDURE trigger_data(23,'skidoo');
-- CREATE TRIGGER trig_row_after_delete
-- AFTER DELETE ON rem1
-- FOR EACH ROW
-- WHEN (OLD.f2 like '%update%')
-- EXECUTE PROCEDURE trigger_data(23,'skidoo');
-- -- Trigger is fired for f1=2, not for f1=1
-- DELETE FROM rem1;
-- -- cleanup
-- DROP TRIGGER trig_row_before_insupd ON rem1;
-- DROP TRIGGER trig_row_after_insupd ON rem1;
-- DROP TRIGGER trig_row_before_delete ON rem1;
-- DROP TRIGGER trig_row_after_delete ON rem1;
-- -- Test various RETURN statements in BEFORE triggers.
-- CREATE FUNCTION trig_row_before_insupdate() RETURNS TRIGGER AS $$
--   BEGIN
--     NEW.f2 := NEW.f2 || ' triggered !';
--     RETURN NEW;
--   END
-- $$ language plpgsql;
-- CREATE TRIGGER trig_row_before_insupd
-- BEFORE INSERT OR UPDATE ON rem1
-- FOR EACH ROW EXECUTE PROCEDURE trig_row_before_insupdate();
-- -- The new values should have 'triggered' appended
-- INSERT INTO rem1 values(1, 'insert');
-- SELECT * from loc1;
-- INSERT INTO rem1 values(2, 'insert') RETURNING f2;
-- SELECT * from loc1;
-- UPDATE rem1 set f2 = '';
-- SELECT * from loc1;
-- UPDATE rem1 set f2 = 'skidoo' RETURNING f2;
-- SELECT * from loc1;
-- EXPLAIN (verbose, costs off)
-- UPDATE rem1 set f1 = 10;          -- all columns should be transmitted
-- UPDATE rem1 set f1 = 10;
-- SELECT * from loc1;
-- DELETE FROM rem1;
-- -- Add a second trigger, to check that the changes are propagated correctly
-- -- from trigger to trigger
-- CREATE TRIGGER trig_row_before_insupd2
-- BEFORE INSERT OR UPDATE ON rem1
-- FOR EACH ROW EXECUTE PROCEDURE trig_row_before_insupdate();
-- INSERT INTO rem1 values(1, 'insert');
-- SELECT * from loc1;
-- INSERT INTO rem1 values(2, 'insert') RETURNING f2;
-- SELECT * from loc1;
-- UPDATE rem1 set f2 = '';
-- SELECT * from loc1;
-- UPDATE rem1 set f2 = 'skidoo' RETURNING f2;
-- SELECT * from loc1;
-- DROP TRIGGER trig_row_before_insupd ON rem1;
-- DROP TRIGGER trig_row_before_insupd2 ON rem1;
-- DELETE from rem1;
-- INSERT INTO rem1 VALUES (1, 'test');
-- -- Test with a trigger returning NULL
-- CREATE FUNCTION trig_null() RETURNS TRIGGER AS $$
--   BEGIN
--     RETURN NULL;
--   END
-- $$ language plpgsql;
-- CREATE TRIGGER trig_null
-- BEFORE INSERT OR UPDATE OR DELETE ON rem1
-- FOR EACH ROW EXECUTE PROCEDURE trig_null();
-- -- Nothing should have changed.
-- INSERT INTO rem1 VALUES (2, 'test2');
-- SELECT * from loc1;
-- UPDATE rem1 SET f2 = 'test2';
-- SELECT * from loc1;
-- DELETE from rem1;
-- SELECT * from loc1;
-- DROP TRIGGER trig_null ON rem1;
-- DELETE from rem1;
-- -- Test a combination of local and remote triggers
-- CREATE TRIGGER trig_row_before
-- BEFORE INSERT OR UPDATE OR DELETE ON rem1
-- FOR EACH ROW EXECUTE PROCEDURE trigger_data(23,'skidoo');
-- CREATE TRIGGER trig_row_after
-- AFTER INSERT OR UPDATE OR DELETE ON rem1
-- FOR EACH ROW EXECUTE PROCEDURE trigger_data(23,'skidoo');
-- CREATE TRIGGER trig_local_before BEFORE INSERT OR UPDATE ON loc1
-- FOR EACH ROW EXECUTE PROCEDURE trig_row_before_insupdate();
-- INSERT INTO rem1(f2) VALUES ('test');
-- UPDATE rem1 SET f2 = 'testo';
-- -- Test returning a system attribute
-- INSERT INTO rem1(f2) VALUES ('test') RETURNING ctid;
-- -- cleanup
-- DROP TRIGGER trig_row_before ON rem1;
-- DROP TRIGGER trig_row_after ON rem1;
-- DROP TRIGGER trig_local_before ON loc1;
-- -- Test direct foreign table modification functionality
-- -- Test with statement-level triggers
-- CREATE TRIGGER trig_stmt_before
-- 	BEFORE DELETE OR INSERT OR UPDATE ON rem1
-- 	FOR EACH STATEMENT EXECUTE PROCEDURE trigger_func();
-- EXPLAIN (verbose, costs off)
-- UPDATE rem1 set f2 = '';          -- can be pushed down
-- EXPLAIN (verbose, costs off)
-- DELETE FROM rem1;                 -- can be pushed down
-- DROP TRIGGER trig_stmt_before ON rem1;
-- CREATE TRIGGER trig_stmt_after
-- 	AFTER DELETE OR INSERT OR UPDATE ON rem1
-- 	FOR EACH STATEMENT EXECUTE PROCEDURE trigger_func();
-- EXPLAIN (verbose, costs off)
-- UPDATE rem1 set f2 = '';          -- can be pushed down
-- EXPLAIN (verbose, costs off)
-- DELETE FROM rem1;                 -- can be pushed down
-- DROP TRIGGER trig_stmt_after ON rem1;
-- -- Test with row-level ON INSERT triggers
-- CREATE TRIGGER trig_row_before_insert
-- BEFORE INSERT ON rem1
-- FOR EACH ROW EXECUTE PROCEDURE trigger_data(23,'skidoo');
-- EXPLAIN (verbose, costs off)
-- UPDATE rem1 set f2 = '';          -- can be pushed down
-- EXPLAIN (verbose, costs off)
-- DELETE FROM rem1;                 -- can be pushed down
-- DROP TRIGGER trig_row_before_insert ON rem1;
-- CREATE TRIGGER trig_row_after_insert
-- AFTER INSERT ON rem1
-- FOR EACH ROW EXECUTE PROCEDURE trigger_data(23,'skidoo');
-- EXPLAIN (verbose, costs off)
-- UPDATE rem1 set f2 = '';          -- can be pushed down
-- EXPLAIN (verbose, costs off)
-- DELETE FROM rem1;                 -- can be pushed down
-- DROP TRIGGER trig_row_after_insert ON rem1;
-- -- Test with row-level ON UPDATE triggers
-- CREATE TRIGGER trig_row_before_update
-- BEFORE UPDATE ON rem1
-- FOR EACH ROW EXECUTE PROCEDURE trigger_data(23,'skidoo');
-- EXPLAIN (verbose, costs off)
-- UPDATE rem1 set f2 = '';          -- can't be pushed down
-- EXPLAIN (verbose, costs off)
-- DELETE FROM rem1;                 -- can be pushed down
-- DROP TRIGGER trig_row_before_update ON rem1;
-- CREATE TRIGGER trig_row_after_update
-- AFTER UPDATE ON rem1
-- FOR EACH ROW EXECUTE PROCEDURE trigger_data(23,'skidoo');
-- EXPLAIN (verbose, costs off)
-- UPDATE rem1 set f2 = '';          -- can't be pushed down
-- EXPLAIN (verbose, costs off)
-- DELETE FROM rem1;                 -- can be pushed down
-- DROP TRIGGER trig_row_after_update ON rem1;
-- -- Test with row-level ON DELETE triggers
-- CREATE TRIGGER trig_row_before_delete
-- BEFORE DELETE ON rem1
-- FOR EACH ROW EXECUTE PROCEDURE trigger_data(23,'skidoo');
-- EXPLAIN (verbose, costs off)
-- UPDATE rem1 set f2 = '';          -- can be pushed down
-- EXPLAIN (verbose, costs off)
-- DELETE FROM rem1;                 -- can't be pushed down
-- DROP TRIGGER trig_row_before_delete ON rem1;
-- CREATE TRIGGER trig_row_after_delete
-- AFTER DELETE ON rem1
-- FOR EACH ROW EXECUTE PROCEDURE trigger_data(23,'skidoo');
-- EXPLAIN (verbose, costs off)
-- UPDATE rem1 set f2 = '';          -- can be pushed down
-- EXPLAIN (verbose, costs off)
-- DELETE FROM rem1;                 -- can't be pushed down
-- DROP TRIGGER trig_row_after_delete ON rem1;
-- ===================================================================
-- test inheritance features
-- ===================================================================
--Testcase 333:
CREATE TABLE a (aa TEXT);
--Testcase 334:
CREATE TABLE loct (aa TEXT, bb TEXT);
ALTER TABLE a SET (autovacuum_enabled = 'false');
ALTER TABLE loct SET (autovacuum_enabled = 'false');
--Testcase 335:
CREATE FOREIGN TABLE b (bb TEXT) INHERITS (a)
  SERVER mysql_svr OPTIONS (dbname 'mysql_fdw_post', table_name 'loct');
--Testcase 336:
INSERT INTO a(aa) VALUES('aaa');
--Testcase 337:
INSERT INTO a(aa) VALUES('aaaa');
--Testcase 338:
INSERT INTO a(aa) VALUES('aaaaa');
--Testcase 339:
INSERT INTO b(aa) VALUES('bbb');
--Testcase 340:
INSERT INTO b(aa) VALUES('bbbb');
--Testcase 341:
INSERT INTO b(aa) VALUES('bbbbb');
-- mysql does not support tableoid
-- SELECT tableoid::regclass, * FROM a;
-- SELECT tableoid::regclass, * FROM b;
-- SELECT tableoid::regclass, * FROM ONLY a;
--Testcase 342:
UPDATE a SET aa = 'zzzzzz' WHERE aa LIKE 'aaaa%';
-- SELECT tableoid::regclass, * FROM a;
-- SELECT tableoid::regclass, * FROM b;
-- SELECT tableoid::regclass, * FROM ONLY a;
--Testcase 343:
UPDATE b SET aa = 'new';
-- SELECT tableoid::regclass, * FROM a;
-- SELECT tableoid::regclass, * FROM b;
-- SELECT tableoid::regclass, * FROM ONLY a;
--Testcase 344:
UPDATE a SET aa = 'newtoo';
-- SELECT tableoid::regclass, * FROM a;
-- SELECT tableoid::regclass, * FROM b;
-- SELECT tableoid::regclass, * FROM ONLY a;
--Testcase 345:
DELETE FROM a;
-- SELECT tableoid::regclass, * FROM a;
-- SELECT tableoid::regclass, * FROM b;
-- SELECT tableoid::regclass, * FROM ONLY a;
--Testcase 346:
DROP TABLE a CASCADE;
NOTICE:  drop cascades to foreign table b
--Testcase 347:
DROP TABLE loct;
-- Check SELECT FOR UPDATE/SHARE with an inherited source table
--Testcase 348:
create table foo (f1 int, f2 int);
--Testcase 349:
create foreign table foo2 (f3 int) inherits (foo)
  server mysql_svr options (dbname 'mysql_fdw_post', table_name 'loct1');
--Testcase 350:
create table bar (f1 int, f2 int);
--Testcase 351:
create foreign table bar2 (f3 int) inherits (bar)
  server mysql_svr options (dbname 'mysql_fdw_post', table_name 'loct2');
alter table foo set (autovacuum_enabled = 'false');
alter table bar set (autovacuum_enabled = 'false');
--Testcase 352:
insert into foo values(1,1);
--Testcase 353:
insert into foo values(3,3);
--Testcase 354:
insert into foo2 values(2,2,2);
--Testcase 355:
insert into foo2 values(4,4,4);
--Testcase 356:
insert into bar values(1,11);
--Testcase 357:
insert into bar values(2,22);
--Testcase 358:
insert into bar values(6,66);
--Testcase 359:
insert into bar2 values(3,33,33);
--Testcase 360:
insert into bar2 values(4,44,44);
--Testcase 361:
insert into bar2 values(7,77,77);
--Testcase 362:
explain (verbose, costs off)
select * from bar where f1 in (select f1 from foo) for update;
ERROR:  failed to prepare the MySQL query: 
Unknown column 'ctid' in 'field list'
--Testcase 363:
select * from bar where f1 in (select f1 from foo) for update;
ERROR:  failed to prepare the MySQL query: 
Unknown column 'ctid' in 'field list'
--Testcase 364:
explain (verbose, costs off)
select * from bar where f1 in (select f1 from foo) for share;
ERROR:  failed to prepare the MySQL query: 
Unknown column 'ctid' in 'field list'
--Testcase 365:
select * from bar where f1 in (select f1 from foo) for share;
ERROR:  failed to prepare the MySQL query: 
Unknown column 'ctid' in 'field list'
-- Check UPDATE with inherited target and an inherited source table
--Testcase 366:
explain (verbose, costs off)
update bar set f2 = f2 + 100 where f1 in (select f1 from foo);
ERROR:  failed to prepare the MySQL query: 
Unknown column 'ctid' in 'field list'
--Testcase 367:
update bar set f2 = f2 + 100 where f1 in (select f1 from foo);
ERROR:  failed to prepare the MySQL query: 
Unknown column 'ctid' in 'field list'
--Testcase 368:
select tableoid::regclass, * from bar order by 1,2;
ERROR:  failed to prepare the MySQL query: 
Unknown column 'tableoid' in 'order clause'
-- Check UPDATE with inherited target and an appendrel subquery
--Testcase 369:
explain (verbose, costs off)
update bar set f2 = f2 + 100
from
  ( select f1 from foo union all select f1+3 from foo ) ss
where bar.f1 = ss.f1;
                                             QUERY PLAN                                             
----------------------------------------------------------------------------------------------------
 Update on public.bar
   Update on public.bar
   Foreign Update on public.bar2
   ->  Hash Join
         Output: bar.f1, (bar.f2 + 100), bar.ctid, (ROW(foo.f1))
         Hash Cond: (foo.f1 = bar.f1)
         ->  Append
               ->  Seq Scan on public.foo
                     Output: ROW(foo.f1), foo.f1
               ->  Foreign Scan on public.foo2
                     Output: ROW(foo2.f1), foo2.f1
                     Local server startup cost: 10
                     Remote query: SELECT `f1` FROM `mysql_fdw_post`.`loct1`
               ->  Seq Scan on public.foo foo_1
                     Output: ROW((foo_1.f1 + 3)), (foo_1.f1 + 3)
               ->  Foreign Scan on public.foo2 foo2_1
                     Output: ROW((foo2_1.f1 + 3)), (foo2_1.f1 + 3)
                     Local server startup cost: 10
                     Remote query: SELECT `f1` FROM `mysql_fdw_post`.`loct1`
         ->  Hash
               Output: bar.f1, bar.f2, bar.ctid
               ->  Seq Scan on public.bar
                     Output: bar.f1, bar.f2, bar.ctid
   ->  Merge Join
         Output: bar2.f1, (bar2.f2 + 100), bar2.f3, bar2.f1, (ROW(foo.f1))
         Merge Cond: (bar2.f1 = foo.f1)
         ->  Sort
               Output: bar2.f1, bar2.f2, bar2.f3
               Sort Key: bar2.f1
               ->  Foreign Scan on public.bar2
                     Output: bar2.f1, bar2.f2, bar2.f3
                     Local server startup cost: 10
                     Remote query: SELECT `f1`, `f2`, `f3` FROM `mysql_fdw_post`.`loct2` FOR UPDATE
         ->  Sort
               Output: (ROW(foo.f1)), foo.f1
               Sort Key: foo.f1
               ->  Append
                     ->  Seq Scan on public.foo
                           Output: ROW(foo.f1), foo.f1
                     ->  Foreign Scan on public.foo2
                           Output: ROW(foo2.f1), foo2.f1
                           Local server startup cost: 10
                           Remote query: SELECT `f1` FROM `mysql_fdw_post`.`loct1`
                     ->  Seq Scan on public.foo foo_1
                           Output: ROW((foo_1.f1 + 3)), (foo_1.f1 + 3)
                     ->  Foreign Scan on public.foo2 foo2_1
                           Output: ROW((foo2_1.f1 + 3)), (foo2_1.f1 + 3)
                           Local server startup cost: 10
                           Remote query: SELECT `f1` FROM `mysql_fdw_post`.`loct1`
(49 rows)

--Testcase 370:
update bar set f2 = f2 + 100
from
  ( select f1 from foo union all select f1+3 from foo ) ss
where bar.f1 = ss.f1;
--Testcase 371:
select tableoid::regclass, * from bar order by 1,2;
ERROR:  failed to prepare the MySQL query: 
Unknown column 'tableoid' in 'order clause'
-- Test forcing the remote server to produce sorted data for a merge join,
-- but the foreign table is an inheritance child.
--truncate table foo2;
--Testcase 372:
delete from foo2;
truncate table only foo;
\set num_rows_foo 2000
--Testcase 373:
insert into foo2 select generate_series(0, :num_rows_foo, 2), generate_series(0, :num_rows_foo, 2), generate_series(0, :num_rows_foo, 2);
--Testcase 374:
insert into foo select generate_series(1, :num_rows_foo, 2), generate_series(1, :num_rows_foo, 2);
SET enable_hashjoin to false;
SET enable_nestloop to false;
--alter foreign table foo2 options (use_remote_estimate 'true');
--create index i_loct1_f1 on loct1(f1);
--create index i_foo_f1 on foo(f1);
--analyze foo;
--analyze loct1;
-- inner join; expressions in the clauses appear in the equivalence class list
--Testcase 375:
explain (verbose, costs off)
	select foo.f1, foo2.f1 from foo join foo2 on (foo.f1 = foo2.f1) order by foo.f2 offset 10 limit 10;
                                          QUERY PLAN                                           
-----------------------------------------------------------------------------------------------
 Limit
   Output: foo.f1, foo2.f1, foo.f2
   ->  Sort
         Output: foo.f1, foo2.f1, foo.f2
         Sort Key: foo.f2
         ->  Merge Join
               Output: foo.f1, foo2.f1, foo.f2
               Merge Cond: (foo2.f1 = foo.f1)
               ->  Sort
                     Output: foo2.f1
                     Sort Key: foo2.f1
                     ->  Foreign Scan on public.foo2
                           Output: foo2.f1
                           Local server startup cost: 10
                           Remote query: SELECT `f1` FROM `mysql_fdw_post`.`loct1`
               ->  Sort
                     Output: foo.f1, foo.f2
                     Sort Key: foo.f1
                     ->  Append
                           ->  Seq Scan on public.foo
                                 Output: foo.f1, foo.f2
                           ->  Foreign Scan on public.foo2 foo2_1
                                 Output: foo2_1.f1, foo2_1.f2
                                 Local server startup cost: 10
                                 Remote query: SELECT `f1`, `f2` FROM `mysql_fdw_post`.`loct1`
(25 rows)

--Testcase 376:
select foo.f1, foo2.f1 from foo join foo2 on (foo.f1 = foo2.f1) order by foo.f2 offset 10 limit 10;
 f1 | f1 
----+----
 20 | 20
 22 | 22
 24 | 24
 26 | 26
 28 | 28
 30 | 30
 32 | 32
 34 | 34
 36 | 36
 38 | 38
(10 rows)

-- outer join; expressions in the clauses do not appear in equivalence class
-- list but no output change as compared to the previous query
--Testcase 377:
explain (verbose, costs off)
	select foo.f1, foo2.f1 from foo left join foo2 on (foo.f1 = foo2.f1) order by foo.f2 offset 10 limit 10;
                                          QUERY PLAN                                           
-----------------------------------------------------------------------------------------------
 Limit
   Output: foo.f1, foo2.f1, foo.f2
   ->  Sort
         Output: foo.f1, foo2.f1, foo.f2
         Sort Key: foo.f2
         ->  Merge Right Join
               Output: foo.f1, foo2.f1, foo.f2
               Merge Cond: (foo2.f1 = foo.f1)
               ->  Sort
                     Output: foo2.f1
                     Sort Key: foo2.f1
                     ->  Foreign Scan on public.foo2
                           Output: foo2.f1
                           Local server startup cost: 10
                           Remote query: SELECT `f1` FROM `mysql_fdw_post`.`loct1`
               ->  Sort
                     Output: foo.f1, foo.f2
                     Sort Key: foo.f1
                     ->  Append
                           ->  Seq Scan on public.foo
                                 Output: foo.f1, foo.f2
                           ->  Foreign Scan on public.foo2 foo2_1
                                 Output: foo2_1.f1, foo2_1.f2
                                 Local server startup cost: 10
                                 Remote query: SELECT `f1`, `f2` FROM `mysql_fdw_post`.`loct1`
(25 rows)

--Testcase 378:
select foo.f1, foo2.f1 from foo left join foo2 on (foo.f1 = foo2.f1) order by foo.f2 offset 10 limit 10;
 f1 | f1 
----+----
 10 | 10
 11 |   
 12 | 12
 13 |   
 14 | 14
 15 |   
 16 | 16
 17 |   
 18 | 18
 19 |   
(10 rows)

RESET enable_hashjoin;
RESET enable_nestloop;
-- mysql does not support transaction
-- -- Test that WHERE CURRENT OF is not supported
-- begin;
-- declare c cursor for select * from bar where f1 = 7;
-- fetch from c;
-- update bar set f2 = null where current of c;
-- rollback;
-- explain (verbose, costs off)
-- delete from foo where f1 < 5 returning *;
-- delete from foo where f1 < 5 returning *;
-- explain (verbose, costs off)
-- update bar set f2 = f2 + 100 returning *;
-- update bar set f2 = f2 + 100 returning *;
-- -- Test that UPDATE/DELETE with inherited target works with row-level triggers
-- CREATE TRIGGER trig_row_before
-- BEFORE UPDATE OR DELETE ON bar2
-- FOR EACH ROW EXECUTE PROCEDURE trigger_data(23,'skidoo');
-- CREATE TRIGGER trig_row_after
-- AFTER UPDATE OR DELETE ON bar2
-- FOR EACH ROW EXECUTE PROCEDURE trigger_data(23,'skidoo');
-- explain (verbose, costs off)
-- update bar set f2 = f2 + 100;
-- update bar set f2 = f2 + 100;
-- explain (verbose, costs off)
-- delete from bar where f2 < 400;
-- delete from bar where f2 < 400;
-- -- cleanup
-- drop table foo cascade;
-- drop table bar cascade;
-- drop table loct1;
-- drop table loct2;
-- -- Test pushing down UPDATE/DELETE joins to the remote server
-- create table parent (a int, b text);
-- create table loct1 (a int, b text);
-- create table loct2 (a int, b text);
-- create foreign table remt1 (a int, b text)
--   server mysql_svr options (dbname 'mysql_fdw_post', table_name 'loct1');
-- create foreign table remt2 (a int, b text)
--   server mysql_svr options (dbname 'mysql_fdw_post', table_name 'loct2');
-- alter foreign table remt1 inherit parent;
-- insert into remt1 values (1, 'foo');
-- insert into remt1 values (2, 'bar');
-- insert into remt2 values (1, 'foo');
-- insert into remt2 values (2, 'bar');
-- -- analyze remt1;
-- -- analyze remt2;
-- explain (verbose, costs off)
-- update parent set b = parent.b || remt2.b from remt2 where parent.a = remt2.a returning *;
-- update parent set b = parent.b || remt2.b from remt2 where parent.a = remt2.a returning *;
-- explain (verbose, costs off)
-- delete from parent using remt2 where parent.a = remt2.a returning parent;
-- delete from parent using remt2 where parent.a = remt2.a returning parent;
-- -- cleanup
-- drop foreign table remt1;
-- drop foreign table remt2;
-- drop table loct1;
-- drop table loct2;
-- drop table parent;
-- -- ===================================================================
-- -- test tuple routing for foreign-table partitions
-- -- ===================================================================
-- -- Test insert tuple routing
-- create table itrtest (a int, b text) partition by list (a);
-- create table loct1 (a int check (a in (1)), b text);
-- create foreign table remp1 (a int check (a in (1)), b text) server mysql_svr options (dbname 'mysql_fdw_post', table_name 'loct1');
-- create table loct2 (a int check (a in (2)), b text);
-- create foreign table remp2 (b text, a int check (a in (2))) server mysql_svr options (dbname 'mysql_fdw_post', table_name 'loct2');
-- alter table itrtest attach partition remp1 for values in (1);
-- alter table itrtest attach partition remp2 for values in (2);
-- insert into itrtest values (1, 'foo');
-- insert into itrtest values (1, 'bar') returning *;
-- insert into itrtest values (2, 'baz');
-- insert into itrtest values (2, 'qux') returning *;
-- insert into itrtest values (1, 'test1'), (2, 'test2') returning *;
-- select tableoid::regclass, * FROM itrtest;
-- select tableoid::regclass, * FROM remp1;
-- select tableoid::regclass, * FROM remp2;
-- delete from itrtest;
-- create unique index loct1_idx on loct1 (a);
-- -- DO NOTHING without an inference specification is supported
-- insert into itrtest values (1, 'foo') on conflict do nothing returning *;
-- insert into itrtest values (1, 'foo') on conflict do nothing returning *;
-- -- But other cases are not supported
-- insert into itrtest values (1, 'bar') on conflict (a) do nothing;
-- insert into itrtest values (1, 'bar') on conflict (a) do update set b = excluded.b;
-- select tableoid::regclass, * FROM itrtest;
-- delete from itrtest;
-- drop index loct1_idx;
-- -- Test that remote triggers work with insert tuple routing
-- create function br_insert_trigfunc() returns trigger as $$
-- begin
-- 	new.b := new.b || ' triggered !';
-- 	return new;
-- end
-- $$ language plpgsql;
-- create trigger loct1_br_insert_trigger before insert on loct1
-- 	for each row execute procedure br_insert_trigfunc();
-- create trigger loct2_br_insert_trigger before insert on loct2
-- 	for each row execute procedure br_insert_trigfunc();
-- -- The new values are concatenated with ' triggered !'
-- insert into itrtest values (1, 'foo') returning *;
-- insert into itrtest values (2, 'qux') returning *;
-- insert into itrtest values (1, 'test1'), (2, 'test2') returning *;
-- with result as (insert into itrtest values (1, 'test1'), (2, 'test2') returning *) select * from result;
-- drop trigger loct1_br_insert_trigger on loct1;
-- drop trigger loct2_br_insert_trigger on loct2;
-- drop table itrtest;
-- drop table loct1;
-- drop table loct2;
-- -- Test update tuple routing
-- create table utrtest (a int, b text) partition by list (a);
-- create table loct (a int check (a in (1)), b text);
-- create foreign table remp (a int check (a in (1)), b text) server mysql_svr options (dbname 'mysql_fdw_post', table_name 'loct');
-- create table locp (a int check (a in (2)), b text);
-- alter table utrtest attach partition remp for values in (1);
-- alter table utrtest attach partition locp for values in (2);
-- insert into utrtest values (1, 'foo');
-- insert into utrtest values (2, 'qux');
-- select tableoid::regclass, * FROM utrtest;
-- select tableoid::regclass, * FROM remp;
-- select tableoid::regclass, * FROM locp;
-- -- It's not allowed to move a row from a partition that is foreign to another
-- update utrtest set a = 2 where b = 'foo' returning *;
-- -- But the reverse is allowed
-- update utrtest set a = 1 where b = 'qux' returning *;
-- select tableoid::regclass, * FROM utrtest;
-- select tableoid::regclass, * FROM remp;
-- select tableoid::regclass, * FROM locp;
-- -- The executor should not let unexercised FDWs shut down
-- update utrtest set a = 1 where b = 'foo';
-- -- Test that remote triggers work with update tuple routing
-- create trigger loct_br_insert_trigger before insert on loct
-- 	for each row execute procedure br_insert_trigfunc();
-- delete from utrtest;
-- insert into utrtest values (2, 'qux');
-- -- Check case where the foreign partition is a subplan target rel
-- explain (verbose, costs off)
-- update utrtest set a = 1 where a = 1 or a = 2 returning *;
-- -- The new values are concatenated with ' triggered !'
-- update utrtest set a = 1 where a = 1 or a = 2 returning *;
-- delete from utrtest;
-- insert into utrtest values (2, 'qux');
-- -- Check case where the foreign partition isn't a subplan target rel
-- explain (verbose, costs off)
-- update utrtest set a = 1 where a = 2 returning *;
-- -- The new values are concatenated with ' triggered !'
-- update utrtest set a = 1 where a = 2 returning *;
-- drop trigger loct_br_insert_trigger on loct;
-- -- We can move rows to a foreign partition that has been updated already,
-- -- but can't move rows to a foreign partition that hasn't been updated yet
-- delete from utrtest;
-- insert into utrtest values (1, 'foo');
-- insert into utrtest values (2, 'qux');
-- -- Test the former case:
-- -- with a direct modification plan
-- explain (verbose, costs off)
-- update utrtest set a = 1 returning *;
-- update utrtest set a = 1 returning *;
-- delete from utrtest;
-- insert into utrtest values (1, 'foo');
-- insert into utrtest values (2, 'qux');
-- -- with a non-direct modification plan
-- explain (verbose, costs off)
-- update utrtest set a = 1 from (values (1), (2)) s(x) where a = s.x returning *;
-- update utrtest set a = 1 from (values (1), (2)) s(x) where a = s.x returning *;
-- -- Change the definition of utrtest so that the foreign partition get updated
-- -- after the local partition
-- delete from utrtest;
-- alter table utrtest detach partition remp;
-- drop foreign table remp;
-- alter table loct drop constraint loct_a_check;
-- alter table loct add check (a in (3));
-- create foreign table remp (a int check (a in (3)), b text) server mysql_svr options (dbname 'mysql_fdw_post', table_name 'loct');
-- alter table utrtest attach partition remp for values in (3);
-- insert into utrtest values (2, 'qux');
-- insert into utrtest values (3, 'xyzzy');
-- -- Test the latter case:
-- -- with a direct modification plan
-- explain (verbose, costs off)
-- update utrtest set a = 3 returning *;
-- update utrtest set a = 3 returning *; -- ERROR
-- -- with a non-direct modification plan
-- explain (verbose, costs off)
-- update utrtest set a = 3 from (values (2), (3)) s(x) where a = s.x returning *;
-- update utrtest set a = 3 from (values (2), (3)) s(x) where a = s.x returning *; -- ERROR
-- drop table utrtest;
-- drop table loct;
-- -- Test copy tuple routing
-- create table ctrtest (a int, b text) partition by list (a);
-- create table loct1 (a int check (a in (1)), b text);
-- create foreign table remp1 (a int check (a in (1)), b text) server mysql_svr options (dbname 'mysql_fdw_post', table_name 'loct1');
-- create table loct2 (a int check (a in (2)), b text);
-- create foreign table remp2 (b text, a int check (a in (2))) server mysql_svr options (dbname 'mysql_fdw_post', table_name 'loct2');
-- alter table ctrtest attach partition remp1 for values in (1);
-- alter table ctrtest attach partition remp2 for values in (2);
-- copy ctrtest from stdin;
-- 1	foo
-- 2	qux
-- \.
-- select tableoid::regclass, * FROM ctrtest;
-- select tableoid::regclass, * FROM remp1;
-- select tableoid::regclass, * FROM remp2;
-- -- Copying into foreign partitions directly should work as well
-- copy remp1 from stdin;
-- 1	bar
-- \.
-- select tableoid::regclass, * FROM remp1;
-- drop table ctrtest;
-- drop table loct1;
-- drop table loct2;
-- -- ===================================================================
-- -- test COPY FROM
-- -- ===================================================================
-- create table loc2 (f1 int, f2 text);
-- alter table loc2 set (autovacuum_enabled = 'false');
-- create foreign table rem2 (f1 int, f2 text) server mysql_svr options(dbname 'mysql_fdw_post', table_name 'loc2');
-- -- Test basic functionality
-- copy rem2 from stdin;
-- 1	foo
-- 2	bar
-- \.
-- select * from rem2;
-- delete from rem2;
-- -- Test check constraints
-- alter table loc2 add constraint loc2_f1positive check (f1 >= 0);
-- alter foreign table rem2 add constraint rem2_f1positive check (f1 >= 0);
-- -- check constraint is enforced on the remote side, not locally
-- copy rem2 from stdin;
-- 1	foo
-- 2	bar
-- \.
-- copy rem2 from stdin; -- ERROR
-- -1	xyzzy
-- \.
-- select * from rem2;
-- alter foreign table rem2 drop constraint rem2_f1positive;
-- alter table loc2 drop constraint loc2_f1positive;
-- delete from rem2;
-- -- Test local triggers
-- create trigger trig_stmt_before before insert on rem2
-- 	for each statement execute procedure trigger_func();
-- create trigger trig_stmt_after after insert on rem2
-- 	for each statement execute procedure trigger_func();
-- create trigger trig_row_before before insert on rem2
-- 	for each row execute procedure trigger_data(23,'skidoo');
-- create trigger trig_row_after after insert on rem2
-- 	for each row execute procedure trigger_data(23,'skidoo');
-- copy rem2 from stdin;
-- 1	foo
-- 2	bar
-- \.
-- select * from rem2;
-- drop trigger trig_row_before on rem2;
-- drop trigger trig_row_after on rem2;
-- drop trigger trig_stmt_before on rem2;
-- drop trigger trig_stmt_after on rem2;
-- delete from rem2;
-- create trigger trig_row_before_insert before insert on rem2
-- 	for each row execute procedure trig_row_before_insupdate();
-- -- The new values are concatenated with ' triggered !'
-- copy rem2 from stdin;
-- 1	foo
-- 2	bar
-- \.
-- select * from rem2;
-- drop trigger trig_row_before_insert on rem2;
-- delete from rem2;
-- create trigger trig_null before insert on rem2
-- 	for each row execute procedure trig_null();
-- -- Nothing happens
-- copy rem2 from stdin;
-- 1	foo
-- 2	bar
-- \.
-- select * from rem2;
-- drop trigger trig_null on rem2;
-- delete from rem2;
-- -- Test remote triggers
-- create trigger trig_row_before_insert before insert on loc2
-- 	for each row execute procedure trig_row_before_insupdate();
-- -- The new values are concatenated with ' triggered !'
-- copy rem2 from stdin;
-- 1	foo
-- 2	bar
-- \.
-- select * from rem2;
-- drop trigger trig_row_before_insert on loc2;
-- delete from rem2;
-- create trigger trig_null before insert on loc2
-- 	for each row execute procedure trig_null();
-- -- Nothing happens
-- copy rem2 from stdin;
-- 1	foo
-- 2	bar
-- \.
-- select * from rem2;
-- drop trigger trig_null on loc2;
-- delete from rem2;
-- -- Test a combination of local and remote triggers
-- create trigger rem2_trig_row_before before insert on rem2
-- 	for each row execute procedure trigger_data(23,'skidoo');
-- create trigger rem2_trig_row_after after insert on rem2
-- 	for each row execute procedure trigger_data(23,'skidoo');
-- create trigger loc2_trig_row_before_insert before insert on loc2
-- 	for each row execute procedure trig_row_before_insupdate();
-- copy rem2 from stdin;
-- 1	foo
-- 2	bar
-- \.
-- select * from rem2;
-- drop trigger rem2_trig_row_before on rem2;
-- drop trigger rem2_trig_row_after on rem2;
-- drop trigger loc2_trig_row_before_insert on loc2;
-- delete from rem2;
-- -- test COPY FROM with foreign table created in the same transaction
-- create table loc3 (f1 int, f2 text);
-- begin;
-- create foreign table rem3 (f1 int, f2 text)
-- 	server mysql_svr options(dbname 'mysql_fdw_post', table_name 'loc3');
-- copy rem3 from stdin;
-- 1	foo
-- 2	bar
-- \.
-- commit;
-- select * from rem3;
-- drop foreign table rem3;
-- drop table loc3;
-- -- ===================================================================
-- -- test IMPORT FOREIGN SCHEMA
-- -- ===================================================================
-- CREATE SCHEMA import_source;
-- CREATE TABLE import_source.t1 (c1 int, c2 varchar NOT NULL);
-- CREATE TABLE import_source.t2 (c1 int default 42, c2 varchar NULL, c3 text collate "POSIX");
-- CREATE TYPE typ1 AS (m1 int, m2 varchar);
-- CREATE TABLE import_source.t3 (c1 timestamptz default now(), c2 typ1);
-- CREATE TABLE import_source."x 4" (c1 float8, "C 2" text, c3 varchar(42));
-- CREATE TABLE import_source."x 5" (c1 float8);
-- ALTER TABLE import_source."x 5" DROP COLUMN c1;
-- CREATE TABLE import_source.t4 (c1 int) PARTITION BY RANGE (c1);
-- CREATE TABLE import_source.t4_part PARTITION OF import_source.t4
--   FOR VALUES FROM (1) TO (100);
-- CREATE SCHEMA import_dest1;
-- IMPORT FOREIGN SCHEMA import_source FROM SERVER mysql_svr INTO import_dest1;
-- \det+ import_dest1.*
-- \d import_dest1.*
-- -- Options
-- CREATE SCHEMA import_dest2;
-- IMPORT FOREIGN SCHEMA import_source FROM SERVER mysql_svr INTO import_dest2
--   OPTIONS (import_default 'true');
-- \det+ import_dest2.*
-- \d import_dest2.*
-- CREATE SCHEMA import_dest3;
-- IMPORT FOREIGN SCHEMA import_source FROM SERVER mysql_svr INTO import_dest3
--   OPTIONS (import_collate 'false', import_not_null 'false');
-- \det+ import_dest3.*
-- \d import_dest3.*
-- -- Check LIMIT TO and EXCEPT
-- CREATE SCHEMA import_dest4;
-- IMPORT FOREIGN SCHEMA import_source LIMIT TO (t1, nonesuch)
--   FROM SERVER mysql_svr INTO import_dest4;
-- \det+ import_dest4.*
-- IMPORT FOREIGN SCHEMA import_source EXCEPT (t1, "x 4", nonesuch)
--   FROM SERVER mysql_svr INTO import_dest4;
-- \det+ import_dest4.*
-- -- Assorted error cases
-- IMPORT FOREIGN SCHEMA import_source FROM SERVER mysql_svr INTO import_dest4;
-- IMPORT FOREIGN SCHEMA nonesuch FROM SERVER mysql_svr INTO import_dest4;
-- IMPORT FOREIGN SCHEMA nonesuch FROM SERVER mysql_svr INTO notthere;
-- IMPORT FOREIGN SCHEMA nonesuch FROM SERVER nowhere INTO notthere;
-- -- Check case of a type present only on the remote server.
-- -- We can fake this by dropping the type locally in our transaction.
-- CREATE TYPE "Colors" AS ENUM ('red', 'green', 'blue');
-- CREATE TABLE import_source.t5 (c1 int, c2 text collate "C", "Col" "Colors");
-- CREATE SCHEMA import_dest5;
-- BEGIN;
-- DROP TYPE "Colors" CASCADE;
-- IMPORT FOREIGN SCHEMA import_source LIMIT TO (t5)
--   FROM SERVER mysql_svr INTO import_dest5;  -- ERROR
-- ROLLBACK;
-- mysql_fdw does not support fetch_size option.
-- BEGIN;
-- CREATE SERVER fetch101 FOREIGN DATA WRAPPER mysql_fdw OPTIONS( fetch_size '101' );
-- SELECT count(*)
-- FROM pg_foreign_server
-- WHERE srvname = 'fetch101'
-- AND srvoptions @> array['fetch_size=101'];
-- ALTER SERVER fetch101 OPTIONS( SET fetch_size '202' );
-- SELECT count(*)
-- FROM pg_foreign_server
-- WHERE srvname = 'fetch101'
-- AND srvoptions @> array['fetch_size=101'];
-- SELECT count(*)
-- FROM pg_foreign_server
-- WHERE srvname = 'fetch101'
-- AND srvoptions @> array['fetch_size=202'];
-- CREATE FOREIGN TABLE table30000 ( x int ) SERVER fetch101 OPTIONS ( fetch_size '30000' );
-- SELECT COUNT(*)
-- FROM pg_foreign_table
-- WHERE ftrelid = 'table30000'::regclass
-- AND ftoptions @> array['fetch_size=30000'];
-- ALTER FOREIGN TABLE table30000 OPTIONS ( SET fetch_size '60000');
-- SELECT COUNT(*)
-- FROM pg_foreign_table
-- WHERE ftrelid = 'table30000'::regclass
-- AND ftoptions @> array['fetch_size=30000'];
-- SELECT COUNT(*)
-- FROM pg_foreign_table
-- WHERE ftrelid = 'table30000'::regclass
-- AND ftoptions @> array['fetch_size=60000'];
-- ROLLBACK;
-- mysql_fdw does not support PARTITION in local table.
-- -- ===================================================================
-- -- test partitionwise joins
-- -- ===================================================================
-- SET enable_partitionwise_join=on;
-- CREATE TABLE fprt1 (a int, b int, c varchar) PARTITION BY RANGE(a);
-- CREATE TABLE fprt1_p1 (LIKE fprt1);
-- CREATE TABLE fprt1_p2 (LIKE fprt1);
-- ALTER TABLE fprt1_p1 SET (autovacuum_enabled = 'false');
-- ALTER TABLE fprt1_p2 SET (autovacuum_enabled = 'false');
-- INSERT INTO fprt1_p1 SELECT i, i, to_char(i/50, 'FM0000') FROM generate_series(0, 249, 2) i;
-- INSERT INTO fprt1_p2 SELECT i, i, to_char(i/50, 'FM0000') FROM generate_series(250, 499, 2) i;
-- CREATE FOREIGN TABLE ftprt1_p1 PARTITION OF fprt1 FOR VALUES FROM (0) TO (250)
-- 	SERVER mysql_svr OPTIONS (dbname 'mysql_fdw_post', table_name 'fprt1_p1', use_remote_estimate 'true');
-- CREATE FOREIGN TABLE ftprt1_p2 PARTITION OF fprt1 FOR VALUES FROM (250) TO (500)
-- 	SERVER mysql_svr OPTIONS (dbname 'mysql_fdw_post', TABLE_NAME 'fprt1_p2');
-- ANALYZE fprt1;
-- ANALYZE fprt1_p1;
-- ANALYZE fprt1_p2;
-- CREATE TABLE fprt2 (a int, b int, c varchar) PARTITION BY RANGE(b);
-- CREATE TABLE fprt2_p1 (LIKE fprt2);
-- CREATE TABLE fprt2_p2 (LIKE fprt2);
-- ALTER TABLE fprt2_p1 SET (autovacuum_enabled = 'false');
-- ALTER TABLE fprt2_p2 SET (autovacuum_enabled = 'false');
-- INSERT INTO fprt2_p1 SELECT i, i, to_char(i/50, 'FM0000') FROM generate_series(0, 249, 3) i;
-- INSERT INTO fprt2_p2 SELECT i, i, to_char(i/50, 'FM0000') FROM generate_series(250, 499, 3) i;
-- CREATE FOREIGN TABLE ftprt2_p1 (b int, c varchar, a int)
-- 	SERVER mysql_svr OPTIONS (dbname 'mysql_fdw_post', table_name 'fprt2_p1', use_remote_estimate 'true');
-- ALTER TABLE fprt2 ATTACH PARTITION ftprt2_p1 FOR VALUES FROM (0) TO (250);
-- CREATE FOREIGN TABLE ftprt2_p2 PARTITION OF fprt2 FOR VALUES FROM (250) TO (500)
-- 	SERVER mysql_svr OPTIONS (dbname 'mysql_fdw_post', table_name 'fprt2_p2', use_remote_estimate 'true');
-- ANALYZE fprt2;
-- ANALYZE fprt2_p1;
-- ANALYZE fprt2_p2;
-- -- inner join three tables
-- EXPLAIN (COSTS OFF)
-- SELECT t1.a,t2.b,t3.c FROM fprt1 t1 INNER JOIN fprt2 t2 ON (t1.a = t2.b) INNER JOIN fprt1 t3 ON (t2.b = t3.a) WHERE t1.a % 25 =0 ORDER BY 1,2,3;
-- SELECT t1.a,t2.b,t3.c FROM fprt1 t1 INNER JOIN fprt2 t2 ON (t1.a = t2.b) INNER JOIN fprt1 t3 ON (t2.b = t3.a) WHERE t1.a % 25 =0 ORDER BY 1,2,3;
-- -- left outer join + nullable clause
-- EXPLAIN (VERBOSE, COSTS OFF)
-- SELECT t1.a,t2.b,t2.c FROM fprt1 t1 LEFT JOIN (SELECT * FROM fprt2 WHERE a < 10) t2 ON (t1.a = t2.b and t1.b = t2.a) WHERE t1.a < 10 ORDER BY 1,2,3;
-- SELECT t1.a,t2.b,t2.c FROM fprt1 t1 LEFT JOIN (SELECT * FROM fprt2 WHERE a < 10) t2 ON (t1.a = t2.b and t1.b = t2.a) WHERE t1.a < 10 ORDER BY 1,2,3;
-- -- with whole-row reference; partitionwise join does not apply
-- EXPLAIN (COSTS OFF)
-- SELECT t1.wr, t2.wr FROM (SELECT t1 wr, a FROM fprt1 t1 WHERE t1.a % 25 = 0) t1 FULL JOIN (SELECT t2 wr, b FROM fprt2 t2 WHERE t2.b % 25 = 0) t2 ON (t1.a = t2.b) ORDER BY 1,2;
-- SELECT t1.wr, t2.wr FROM (SELECT t1 wr, a FROM fprt1 t1 WHERE t1.a % 25 = 0) t1 FULL JOIN (SELECT t2 wr, b FROM fprt2 t2 WHERE t2.b % 25 = 0) t2 ON (t1.a = t2.b) ORDER BY 1,2;
-- -- join with lateral reference
-- EXPLAIN (COSTS OFF)
-- SELECT t1.a,t1.b FROM fprt1 t1, LATERAL (SELECT t2.a, t2.b FROM fprt2 t2 WHERE t1.a = t2.b AND t1.b = t2.a) q WHERE t1.a%25 = 0 ORDER BY 1,2;
-- SELECT t1.a,t1.b FROM fprt1 t1, LATERAL (SELECT t2.a, t2.b FROM fprt2 t2 WHERE t1.a = t2.b AND t1.b = t2.a) q WHERE t1.a%25 = 0 ORDER BY 1,2;
-- -- with PHVs, partitionwise join selected but no join pushdown
-- EXPLAIN (COSTS OFF)
-- SELECT t1.a, t1.phv, t2.b, t2.phv FROM (SELECT 't1_phv' phv, * FROM fprt1 WHERE a % 25 = 0) t1 FULL JOIN (SELECT 't2_phv' phv, * FROM fprt2 WHERE b % 25 = 0) t2 ON (t1.a = t2.b) ORDER BY t1.a, t2.b;
-- SELECT t1.a, t1.phv, t2.b, t2.phv FROM (SELECT 't1_phv' phv, * FROM fprt1 WHERE a % 25 = 0) t1 FULL JOIN (SELECT 't2_phv' phv, * FROM fprt2 WHERE b % 25 = 0) t2 ON (t1.a = t2.b) ORDER BY t1.a, t2.b;
-- -- test FOR UPDATE; partitionwise join does not apply
-- EXPLAIN (COSTS OFF)
-- SELECT t1.a, t2.b FROM fprt1 t1 INNER JOIN fprt2 t2 ON (t1.a = t2.b) WHERE t1.a % 25 = 0 ORDER BY 1,2 FOR UPDATE OF t1;
-- SELECT t1.a, t2.b FROM fprt1 t1 INNER JOIN fprt2 t2 ON (t1.a = t2.b) WHERE t1.a % 25 = 0 ORDER BY 1,2 FOR UPDATE OF t1;
-- RESET enable_partitionwise_join;
-- -- ===================================================================
-- -- test partitionwise aggregates
-- -- ===================================================================
-- CREATE TABLE pagg_tab (a int, b int, c text) PARTITION BY RANGE(a);
-- CREATE TABLE pagg_tab_p1 (LIKE pagg_tab);
-- CREATE TABLE pagg_tab_p2 (LIKE pagg_tab);
-- CREATE TABLE pagg_tab_p3 (LIKE pagg_tab);
-- INSERT INTO pagg_tab_p1 SELECT i % 30, i % 50, to_char(i/30, 'FM0000') FROM generate_series(1, 3000) i WHERE (i % 30) < 10;
-- INSERT INTO pagg_tab_p2 SELECT i % 30, i % 50, to_char(i/30, 'FM0000') FROM generate_series(1, 3000) i WHERE (i % 30) < 20 and (i % 30) >= 10;
-- INSERT INTO pagg_tab_p3 SELECT i % 30, i % 50, to_char(i/30, 'FM0000') FROM generate_series(1, 3000) i WHERE (i % 30) < 30 and (i % 30) >= 20;
-- -- Create foreign partitions
-- CREATE FOREIGN TABLE fpagg_tab_p1 PARTITION OF pagg_tab FOR VALUES FROM (0) TO (10) SERVER mysql_svr OPTIONS (dbname 'mysql_fdw_post', table_name 'pagg_tab_p1');
-- CREATE FOREIGN TABLE fpagg_tab_p2 PARTITION OF pagg_tab FOR VALUES FROM (10) TO (20) SERVER mysql_svr OPTIONS (dbname 'mysql_fdw_post', table_name 'pagg_tab_p2');;
-- CREATE FOREIGN TABLE fpagg_tab_p3 PARTITION OF pagg_tab FOR VALUES FROM (20) TO (30) SERVER mysql_svr OPTIONS (dbname 'mysql_fdw_post', table_name 'pagg_tab_p3');;
-- ANALYZE pagg_tab;
-- ANALYZE fpagg_tab_p1;
-- ANALYZE fpagg_tab_p2;
-- ANALYZE fpagg_tab_p3;
-- -- When GROUP BY clause matches with PARTITION KEY.
-- -- Plan with partitionwise aggregates is disabled
-- SET enable_partitionwise_aggregate TO false;
-- EXPLAIN (COSTS OFF)
-- SELECT a, sum(b), min(b), count(*) FROM pagg_tab GROUP BY a HAVING avg(b) < 22 ORDER BY 1;
-- -- Plan with partitionwise aggregates is enabled
-- SET enable_partitionwise_aggregate TO true;
-- EXPLAIN (COSTS OFF)
-- SELECT a, sum(b), min(b), count(*) FROM pagg_tab GROUP BY a HAVING avg(b) < 22 ORDER BY 1;
-- SELECT a, sum(b), min(b), count(*) FROM pagg_tab GROUP BY a HAVING avg(b) < 22 ORDER BY 1;
-- -- Check with whole-row reference
-- -- Should have all the columns in the target list for the given relation
-- EXPLAIN (VERBOSE, COSTS OFF)
-- SELECT a, count(t1) FROM pagg_tab t1 GROUP BY a HAVING avg(b) < 22 ORDER BY 1;
-- SELECT a, count(t1) FROM pagg_tab t1 GROUP BY a HAVING avg(b) < 22 ORDER BY 1;
-- -- When GROUP BY clause does not match with PARTITION KEY.
-- EXPLAIN (COSTS OFF)
-- SELECT b, avg(a), max(a), count(*) FROM pagg_tab GROUP BY b HAVING sum(a) < 700 ORDER BY 1;
-- -- ===================================================================
-- -- access rights and superuser
-- -- ===================================================================
-- -- Non-superuser cannot create a FDW without a password in the connstr
-- CREATE ROLE regress_nosuper NOSUPERUSER;
-- GRANT USAGE ON FOREIGN DATA WRAPPER mysql_fdw TO regress_nosuper;
-- SET ROLE regress_nosuper;
-- SHOW is_superuser;
-- -- This will be OK, we can create the FDW
-- DO $d$
--     BEGIN
--         EXECUTE $$CREATE SERVER mysql_svr_nopw FOREIGN DATA WRAPPER mysql_fdw
--             OPTIONS (dbname '$$||current_database()||$$',
--                      port '$$||current_setting('port')||$$'
--             )$$;
--     END;
-- $d$;
-- -- But creation of user mappings for non-superusers should fail
-- CREATE USER MAPPING FOR public SERVER mysql_svr_nopw;
-- CREATE USER MAPPING FOR CURRENT_USER SERVER mysql_svr_nopw;
-- CREATE FOREIGN TABLE ft1_nopw (
-- 	c1 int NOT NULL,
-- 	c2 int NOT NULL,
-- 	c3 text,
-- 	c4 timestamptz,
-- 	c5 timestamp,
-- 	c6 varchar(10),
-- 	c7 char(10) default 'ft1',
-- 	c8 user_enum
-- ) SERVER mysql_svr_nopw OPTIONS (table_name 'ft1');
-- SELECT * FROM ft1_nopw LIMIT 1;
-- -- If we add a password to the connstr it'll fail, because we don't allow passwords
-- -- in connstrs only in user mappings.
-- DO $d$
--     BEGIN
--         EXECUTE $$ALTER SERVER mysql_svr_nopw OPTIONS (ADD password 'dummypw')$$;
--     END;
-- $d$;
-- -- If we add a password for our user mapping instead, we should get a different
-- -- error because the password wasn't actually *used* when we run with trust auth.
-- --
-- -- This won't work with installcheck, but neither will most of the FDW checks.
-- ALTER USER MAPPING FOR CURRENT_USER SERVER mysql_svr_nopw OPTIONS (ADD password 'dummypw');
-- SELECT * FROM ft1_nopw LIMIT 1;
-- -- Unpriv user cannot make the mapping passwordless
-- ALTER USER MAPPING FOR CURRENT_USER SERVER mysql_svr_nopw OPTIONS (ADD password_required 'false');
-- SELECT * FROM ft1_nopw LIMIT 1;
-- RESET ROLE;
-- -- But the superuser can
-- ALTER USER MAPPING FOR regress_nosuper SERVER mysql_svr_nopw OPTIONS (ADD password_required 'false');
-- SET ROLE regress_nosuper;
-- -- Should finally work now
-- SELECT * FROM ft1_nopw LIMIT 1;
-- -- unpriv user also cannot set sslcert / sslkey on the user mapping
-- -- first set password_required so we see the right error messages
-- ALTER USER MAPPING FOR CURRENT_USER SERVER mysql_svr_nopw OPTIONS (SET password_required 'true');
-- ALTER USER MAPPING FOR CURRENT_USER SERVER mysql_svr_nopw OPTIONS (ADD sslcert 'foo.crt');
-- ALTER USER MAPPING FOR CURRENT_USER SERVER mysql_svr_nopw OPTIONS (ADD sslkey 'foo.key');
-- -- We're done with the role named after a specific user and need to check the
-- -- changes to the public mapping.
-- DROP USER MAPPING FOR CURRENT_USER SERVER mysql_svr_nopw;
-- -- This will fail again as it'll resolve the user mapping for public, which
-- -- lacks password_required=false
-- SELECT * FROM ft1_nopw LIMIT 1;
-- RESET ROLE;
-- -- The user mapping for public is passwordless and lacks the password_required=false
-- -- mapping option, but will work because the current user is a superuser.
-- SELECT * FROM ft1_nopw LIMIT 1;
-- -- cleanup
-- DROP USER MAPPING FOR public SERVER mysql_svr_nopw;
-- DROP OWNED BY regress_nosuper;
-- DROP ROLE regress_nosuper;
-- -- Clean-up
-- RESET enable_partitionwise_aggregate;
-- -- Two-phase transactions are not supported.
-- BEGIN;
-- SELECT count(*) FROM ft1;
-- -- error here
-- PREPARE TRANSACTION 'fdw_tpc';
-- ROLLBACK;
--Testcase 387:
DROP USER MAPPING FOR PUBLIC SERVER mysql_svr;
--Testcase 388:
DROP USER MAPPING FOR PUBLIC SERVER mysql_svr2;
--Testcase 389:
DROP SERVER mysql_svr CASCADE;
NOTICE:  drop cascades to 30 other objects
--Testcase 390:
DROP SERVER mysql_svr2 CASCADE;
NOTICE:  drop cascades to foreign table ft6
--Testcase 391:
DROP EXTENSION mysql_fdw CASCADE;
