\set ECHO none
-- Before running this file User must create database mysql_fdw_regress on
-- mysql with all permission for MYSQL_USER_NAME user with MYSQL_PWD password
-- and ran mysql_init.sh file to create tables.
\c contrib_regression
--Testcase 1:
CREATE EXTENSION IF NOT EXISTS mysql_fdw;
--Testcase 2:
CREATE SERVER mysql_svr FOREIGN DATA WRAPPER mysql_fdw
  OPTIONS (host :MYSQL_HOST, port :MYSQL_PORT);
--Testcase 3:
CREATE USER MAPPING FOR PUBLIC SERVER mysql_svr
  OPTIONS (username :MYSQL_USER_NAME, password :MYSQL_PASS);
-- Check version
--Testcase 4:
SELECT mysql_fdw_version();
 mysql_fdw_version 
-------------------
             20601
(1 row)

-- Create foreign tables
--Testcase 5:
CREATE FOREIGN TABLE f_mysql_test(a int, b int)
  SERVER mysql_svr OPTIONS (dbname 'mysql_fdw_regress', table_name 'mysql_test');
--Testcase 6:
CREATE FOREIGN TABLE f_numbers(a int, b varchar(255))
  SERVER mysql_svr OPTIONS (dbname 'mysql_fdw_regress', table_name 'numbers');
--Testcase 7:
CREATE FOREIGN TABLE f_test_tbl1 (c1 INTEGER, c2 VARCHAR(10), c3 CHAR(9),c4 BIGINT, c5 pg_catalog.Date, c6 DECIMAL, c7 INTEGER, c8 SMALLINT)
  SERVER mysql_svr OPTIONS (dbname 'mysql_fdw_regress', table_name 'test_tbl1');
--Testcase 8:
CREATE FOREIGN TABLE f_test_tbl2 (c1 INTEGER, c2 VARCHAR(14), c3 VARCHAR(13))
  SERVER mysql_svr OPTIONS (dbname 'mysql_fdw_regress', table_name 'test_tbl2');
--Testcase 9:
CREATE TYPE size_t AS enum('small','medium','large');
--Testcase 10:
CREATE FOREIGN TABLE f_enum_t1(id int, size size_t)
  SERVER mysql_svr OPTIONS (dbname 'mysql_fdw_regress', table_name 'enum_t1');
-- Insert data in MySQL db using foreign tables
--Testcase 11:
INSERT INTO f_test_tbl1 VALUES (100, 'EMP1', 'ADMIN', 1300, '1980-12-17', 800.23, NULL, 20);
--Testcase 12:
INSERT INTO f_test_tbl1 VALUES (200, 'EMP2', 'SALESMAN', 600, '1981-02-20', 1600.00, 300, 30);
--Testcase 13:
INSERT INTO f_test_tbl1 VALUES (300, 'EMP3', 'SALESMAN', 600, '1981-02-22', 1250, 500, 30);
--Testcase 14:
INSERT INTO f_test_tbl1 VALUES (400, 'EMP4', 'MANAGER', 900, '1981-04-02', 2975.12, NULL, 20);
--Testcase 15:
INSERT INTO f_test_tbl1 VALUES (500, 'EMP5', 'SALESMAN', 600, '1981-09-28', 1250, 1400, 30);
--Testcase 16:
INSERT INTO f_test_tbl1 VALUES (600, 'EMP6', 'MANAGER', 900, '1981-05-01', 2850, NULL, 30);
--Testcase 17:
INSERT INTO f_test_tbl1 VALUES (700, 'EMP7', 'MANAGER', 900, '1981-06-09', 2450.45, NULL, 10);
--Testcase 18:
INSERT INTO f_test_tbl1 VALUES (800, 'EMP8', 'FINANCE', 400, '1987-04-19', 3000, NULL, 20);
--Testcase 19:
INSERT INTO f_test_tbl1 VALUES (900, 'EMP9', 'HEAD', NULL, '1981-11-17', 5000, NULL, 10);
--Testcase 20:
INSERT INTO f_test_tbl1 VALUES (1000, 'EMP10', 'SALESMAN', 600, '1980-09-08', 1500, 0, 30);
--Testcase 21:
INSERT INTO f_test_tbl1 VALUES (1100, 'EMP11', 'ADMIN', 800, '1987-05-23', 1100, NULL, 20);
--Testcase 22:
INSERT INTO f_test_tbl1 VALUES (1200, 'EMP12', 'ADMIN', 600, '1981-12-03', 950, NULL, 30);
--Testcase 23:
INSERT INTO f_test_tbl1 VALUES (1300, 'EMP13', 'FINANCE', 400, '1981-12-03', 3000, NULL, 20);
--Testcase 24:
INSERT INTO f_test_tbl1 VALUES (1400, 'EMP14', 'ADMIN', 700, '1982-01-23', 1300, NULL, 10);
--Testcase 25:
INSERT INTO f_test_tbl2 VALUES(10, 'DEVELOPMENT', 'PUNE');
--Testcase 26:
INSERT INTO f_test_tbl2 VALUES(20, 'ADMINISTRATION', 'BANGLORE');
--Testcase 27:
INSERT INTO f_test_tbl2 VALUES(30, 'SALES', 'MUMBAI');
--Testcase 28:
INSERT INTO f_test_tbl2 VALUES(40, 'HR', 'NAGPUR');
SET datestyle TO ISO;
-- Retrieve Data from Foreign Table using SELECT Statement.
--Testcase 29:
SELECT c1, c2, c3, c4, c5, c6, c7, c8 FROM f_test_tbl1
  ORDER BY c1 DESC, c8;
  c1  |  c2   |    c3    |  c4  |     c5     |     c6     |  c7  | c8 
------+-------+----------+------+------------+------------+------+----
 1400 | EMP14 | ADMIN    |  700 | 1982-01-23 | 1300.00000 |      | 10
 1300 | EMP13 | FINANCE  |  400 | 1981-12-03 | 3000.00000 |      | 20
 1200 | EMP12 | ADMIN    |  600 | 1981-12-03 |  950.00000 |      | 30
 1100 | EMP11 | ADMIN    |  800 | 1987-05-23 | 1100.00000 |      | 20
 1000 | EMP10 | SALESMAN |  600 | 1980-09-08 | 1500.00000 |    0 | 30
  900 | EMP9  | HEAD     |      | 1981-11-17 | 5000.00000 |      | 10
  800 | EMP8  | FINANCE  |  400 | 1987-04-19 | 3000.00000 |      | 20
  700 | EMP7  | MANAGER  |  900 | 1981-06-09 | 2450.45000 |      | 10
  600 | EMP6  | MANAGER  |  900 | 1981-05-01 | 2850.00000 |      | 30
  500 | EMP5  | SALESMAN |  600 | 1981-09-28 | 1250.00000 | 1400 | 30
  400 | EMP4  | MANAGER  |  900 | 1981-04-02 | 2975.12000 |      | 20
  300 | EMP3  | SALESMAN |  600 | 1981-02-22 | 1250.00000 |  500 | 30
  200 | EMP2  | SALESMAN |  600 | 1981-02-20 | 1600.00000 |  300 | 30
  100 | EMP1  | ADMIN    | 1300 | 1980-12-17 |  800.23000 |      | 20
(14 rows)

--Testcase 30:
SELECT DISTINCT c8 FROM f_test_tbl1 ORDER BY 1;
 c8 
----
 10
 20
 30
(3 rows)

--Testcase 31:
SELECT c2 AS "Employee Name" FROM f_test_tbl1 ORDER BY 1;
 Employee Name 
---------------
 EMP1
 EMP10
 EMP11
 EMP12
 EMP13
 EMP14
 EMP2
 EMP3
 EMP4
 EMP5
 EMP6
 EMP7
 EMP8
 EMP9
(14 rows)

--Testcase 32:
SELECT c8, c6, c7 FROM f_test_tbl1 ORDER BY 1, 2, 3;
 c8 |     c6     |  c7  
----+------------+------
 10 | 1300.00000 |     
 10 | 2450.45000 |     
 10 | 5000.00000 |     
 20 |  800.23000 |     
 20 | 1100.00000 |     
 20 | 2975.12000 |     
 20 | 3000.00000 |     
 20 | 3000.00000 |     
 30 |  950.00000 |     
 30 | 1250.00000 |  500
 30 | 1250.00000 | 1400
 30 | 1500.00000 |    0
 30 | 1600.00000 |  300
 30 | 2850.00000 |     
(14 rows)

--Testcase 33:
SELECT c1, c2, c3, c4, c5, c6, c7, c8 FROM f_test_tbl1
  WHERE c1 = 100 ORDER BY 1;
 c1  |  c2  |  c3   |  c4  |     c5     |    c6     | c7 | c8 
-----+------+-------+------+------------+-----------+----+----
 100 | EMP1 | ADMIN | 1300 | 1980-12-17 | 800.23000 |    | 20
(1 row)

--Testcase 34:
SELECT c1, c2, c3, c4, c5, c6, c7, c8 FROM f_test_tbl1
  WHERE c1 = 100 OR c1 = 700 ORDER BY 1;
 c1  |  c2  |   c3    |  c4  |     c5     |     c6     | c7 | c8 
-----+------+---------+------+------------+------------+----+----
 100 | EMP1 | ADMIN   | 1300 | 1980-12-17 |  800.23000 |    | 20
 700 | EMP7 | MANAGER |  900 | 1981-06-09 | 2450.45000 |    | 10
(2 rows)

--Testcase 35:
SELECT * FROM f_test_tbl1 WHERE c3 like 'SALESMAN' ORDER BY 1;
  c1  |  c2   |    c3    | c4  |     c5     |     c6     |  c7  | c8 
------+-------+----------+-----+------------+------------+------+----
  200 | EMP2  | SALESMAN | 600 | 1981-02-20 | 1600.00000 |  300 | 30
  300 | EMP3  | SALESMAN | 600 | 1981-02-22 | 1250.00000 |  500 | 30
  500 | EMP5  | SALESMAN | 600 | 1981-09-28 | 1250.00000 | 1400 | 30
 1000 | EMP10 | SALESMAN | 600 | 1980-09-08 | 1500.00000 |    0 | 30
(4 rows)

--Testcase 36:
SELECT * FROM f_test_tbl1 WHERE c1 IN (100, 700) ORDER BY 1;
 c1  |  c2  |   c3    |  c4  |     c5     |     c6     | c7 | c8 
-----+------+---------+------+------------+------------+----+----
 100 | EMP1 | ADMIN   | 1300 | 1980-12-17 |  800.23000 |    | 20
 700 | EMP7 | MANAGER |  900 | 1981-06-09 | 2450.45000 |    | 10
(2 rows)

--Testcase 37:
SELECT * FROM f_test_tbl1 WHERE c1 NOT IN (100, 700) ORDER BY 1 LIMIT 5;
 c1  |  c2  |    c3    | c4  |     c5     |     c6     |  c7  | c8 
-----+------+----------+-----+------------+------------+------+----
 200 | EMP2 | SALESMAN | 600 | 1981-02-20 | 1600.00000 |  300 | 30
 300 | EMP3 | SALESMAN | 600 | 1981-02-22 | 1250.00000 |  500 | 30
 400 | EMP4 | MANAGER  | 900 | 1981-04-02 | 2975.12000 |      | 20
 500 | EMP5 | SALESMAN | 600 | 1981-09-28 | 1250.00000 | 1400 | 30
 600 | EMP6 | MANAGER  | 900 | 1981-05-01 | 2850.00000 |      | 30
(5 rows)

--Testcase 38:
SELECT * FROM f_test_tbl1 WHERE c8 BETWEEN 10 AND 20 ORDER BY 1;
  c1  |  c2   |   c3    |  c4  |     c5     |     c6     | c7 | c8 
------+-------+---------+------+------------+------------+----+----
  100 | EMP1  | ADMIN   | 1300 | 1980-12-17 |  800.23000 |    | 20
  400 | EMP4  | MANAGER |  900 | 1981-04-02 | 2975.12000 |    | 20
  700 | EMP7  | MANAGER |  900 | 1981-06-09 | 2450.45000 |    | 10
  800 | EMP8  | FINANCE |  400 | 1987-04-19 | 3000.00000 |    | 20
  900 | EMP9  | HEAD    |      | 1981-11-17 | 5000.00000 |    | 10
 1100 | EMP11 | ADMIN   |  800 | 1987-05-23 | 1100.00000 |    | 20
 1300 | EMP13 | FINANCE |  400 | 1981-12-03 | 3000.00000 |    | 20
 1400 | EMP14 | ADMIN   |  700 | 1982-01-23 | 1300.00000 |    | 10
(8 rows)

--Testcase 39:
SELECT * FROM f_test_tbl1 ORDER BY 1 OFFSET 5;
  c1  |  c2   |    c3    | c4  |     c5     |     c6     | c7 | c8 
------+-------+----------+-----+------------+------------+----+----
  600 | EMP6  | MANAGER  | 900 | 1981-05-01 | 2850.00000 |    | 30
  700 | EMP7  | MANAGER  | 900 | 1981-06-09 | 2450.45000 |    | 10
  800 | EMP8  | FINANCE  | 400 | 1987-04-19 | 3000.00000 |    | 20
  900 | EMP9  | HEAD     |     | 1981-11-17 | 5000.00000 |    | 10
 1000 | EMP10 | SALESMAN | 600 | 1980-09-08 | 1500.00000 |  0 | 30
 1100 | EMP11 | ADMIN    | 800 | 1987-05-23 | 1100.00000 |    | 20
 1200 | EMP12 | ADMIN    | 600 | 1981-12-03 |  950.00000 |    | 30
 1300 | EMP13 | FINANCE  | 400 | 1981-12-03 | 3000.00000 |    | 20
 1400 | EMP14 | ADMIN    | 700 | 1982-01-23 | 1300.00000 |    | 10
(9 rows)

-- Retrieve Data from Foreign Table using Group By Clause.
--Testcase 40:
SELECT c8 "Department", COUNT(c1) "Total Employees" FROM f_test_tbl1
  GROUP BY c8 ORDER BY c8;
 Department | Total Employees 
------------+-----------------
         10 |               3
         20 |               5
         30 |               6
(3 rows)

--Testcase 41:
SELECT c8, SUM(c6) FROM f_test_tbl1
  GROUP BY c8 HAVING c8 IN (10, 30) ORDER BY c8;
 c8 |    sum     
----+------------
 10 | 8750.45000
 30 | 9400.00000
(2 rows)

--Testcase 42:
SELECT c8, SUM(c6) FROM f_test_tbl1
  GROUP BY c8 HAVING SUM(c6) > 9400 ORDER BY c8;
 c8 |     sum     
----+-------------
 20 | 10875.35000
(1 row)

-- Row Level Functions
--Testcase 43:
SELECT UPPER(c2), LOWER(c2) FROM f_test_tbl2 ORDER BY 1, 2;
     upper      |     lower      
----------------+----------------
 ADMINISTRATION | administration
 DEVELOPMENT    | development
 HR             | hr
 SALES          | sales
(4 rows)

-- Retrieve Data from Foreign Table using Sub Queries.
--Testcase 44:
SELECT * FROM f_test_tbl1
  WHERE c8 <> ALL (SELECT c1 FROM f_test_tbl2 WHERE c1 IN (10, 30, 40))
  ORDER BY c1;
  c1  |  c2   |   c3    |  c4  |     c5     |     c6     | c7 | c8 
------+-------+---------+------+------------+------------+----+----
  100 | EMP1  | ADMIN   | 1300 | 1980-12-17 |  800.23000 |    | 20
  400 | EMP4  | MANAGER |  900 | 1981-04-02 | 2975.12000 |    | 20
  800 | EMP8  | FINANCE |  400 | 1987-04-19 | 3000.00000 |    | 20
 1100 | EMP11 | ADMIN   |  800 | 1987-05-23 | 1100.00000 |    | 20
 1300 | EMP13 | FINANCE |  400 | 1981-12-03 | 3000.00000 |    | 20
(5 rows)

--Testcase 45:
SELECT c1, c2, c3 FROM f_test_tbl2
  WHERE EXISTS (SELECT 1 FROM f_test_tbl1 WHERE f_test_tbl2.c1 = f_test_tbl1.c8)
  ORDER BY 1, 2;
 c1 |       c2       |    c3    
----+----------------+----------
 10 | DEVELOPMENT    | PUNE
 20 | ADMINISTRATION | BANGLORE
 30 | SALES          | MUMBAI
(3 rows)

--Testcase 46:
SELECT c1, c2, c3, c4, c5, c6, c7, c8 FROM f_test_tbl1
  WHERE c8 NOT IN (SELECT c1 FROM f_test_tbl2) ORDER BY c1;
 c1 | c2 | c3 | c4 | c5 | c6 | c7 | c8 
----+----+----+----+----+----+----+----
(0 rows)

-- Retrieve Data from Foreign Table using UNION Operator.
--Testcase 47:
SELECT c1, c2 FROM f_test_tbl2 UNION
SELECT c1, c2 FROM f_test_tbl1 ORDER BY c1;
  c1  |       c2       
------+----------------
   10 | DEVELOPMENT
   20 | ADMINISTRATION
   30 | SALES
   40 | HR
  100 | EMP1
  200 | EMP2
  300 | EMP3
  400 | EMP4
  500 | EMP5
  600 | EMP6
  700 | EMP7
  800 | EMP8
  900 | EMP9
 1000 | EMP10
 1100 | EMP11
 1200 | EMP12
 1300 | EMP13
 1400 | EMP14
(18 rows)

--Testcase 48:
SELECT c2 FROM f_test_tbl2  UNION ALL
SELECT c2 FROM f_test_tbl1 ORDER BY c2;
       c2       
----------------
 ADMINISTRATION
 DEVELOPMENT
 EMP1
 EMP10
 EMP11
 EMP12
 EMP13
 EMP14
 EMP2
 EMP3
 EMP4
 EMP5
 EMP6
 EMP7
 EMP8
 EMP9
 HR
 SALES
(18 rows)

-- Retrieve Data from Foreign Table using INTERSECT Operator.
--Testcase 49:
SELECT c2 FROM f_test_tbl1 WHERE c1 >= 800 INTERSECT
SELECT c2 FROM f_test_tbl1 WHERE c1 >= 400 ORDER BY c2;
  c2   
-------
 EMP10
 EMP11
 EMP12
 EMP13
 EMP14
 EMP8
 EMP9
(7 rows)

--Testcase 50:
SELECT c2 FROM f_test_tbl1 WHERE c1 >= 800 INTERSECT ALL
SELECT c2 FROM f_test_tbl1 WHERE c1 >= 400 ORDER BY c2;
  c2   
-------
 EMP10
 EMP11
 EMP12
 EMP13
 EMP14
 EMP8
 EMP9
(7 rows)

-- Retrieve Data from Foreign Table using EXCEPT.
--Testcase 51:
SELECT c2 FROM f_test_tbl1 EXCEPT
SELECT c2 FROM f_test_tbl1 WHERE c1 > 900 ORDER BY c2;
  c2  
------
 EMP1
 EMP2
 EMP3
 EMP4
 EMP5
 EMP6
 EMP7
 EMP8
 EMP9
(9 rows)

--Testcase 52:
SELECT c2 FROM f_test_tbl1 EXCEPT ALL
SELECT c2 FROM f_test_tbl1 WHERE c1 > 900 ORDER BY c2;
  c2  
------
 EMP1
 EMP2
 EMP3
 EMP4
 EMP5
 EMP6
 EMP7
 EMP8
 EMP9
(9 rows)

-- Retrieve Data from Foreign Table using CTE (With Clause).
--Testcase 53:
WITH
  with_qry AS (SELECT c1, c2, c3 FROM f_test_tbl2)
SELECT e.c2, e.c6, w.c1, w.c2 FROM f_test_tbl1 e, with_qry w
  WHERE e.c8 = w.c1 ORDER BY e.c8, e.c2;
  c2   |     c6     | c1 |       c2       
-------+------------+----+----------------
 EMP14 | 1300.00000 | 10 | DEVELOPMENT
 EMP7  | 2450.45000 | 10 | DEVELOPMENT
 EMP9  | 5000.00000 | 10 | DEVELOPMENT
 EMP1  |  800.23000 | 20 | ADMINISTRATION
 EMP11 | 1100.00000 | 20 | ADMINISTRATION
 EMP13 | 3000.00000 | 20 | ADMINISTRATION
 EMP4  | 2975.12000 | 20 | ADMINISTRATION
 EMP8  | 3000.00000 | 20 | ADMINISTRATION
 EMP10 | 1500.00000 | 30 | SALES
 EMP12 |  950.00000 | 30 | SALES
 EMP2  | 1600.00000 | 30 | SALES
 EMP3  | 1250.00000 | 30 | SALES
 EMP5  | 1250.00000 | 30 | SALES
 EMP6  | 2850.00000 | 30 | SALES
(14 rows)

--Testcase 54:
WITH
  test_tbl2_costs AS (SELECT d.c2, SUM(c6) test_tbl2_total FROM f_test_tbl1 e, f_test_tbl2 d
    WHERE e.c8 = d.c1 GROUP BY 1),
  avg_cost AS (SELECT SUM(test_tbl2_total)/COUNT(*) avg FROM test_tbl2_costs)
SELECT * FROM test_tbl2_costs
  WHERE test_tbl2_total > (SELECT avg FROM avg_cost) ORDER BY c2;
       c2       | test_tbl2_total 
----------------+-----------------
 ADMINISTRATION |     10875.35000
(1 row)

-- Retrieve Data from Foreign Table using Window Clause.
--Testcase 55:
SELECT c8, c1, c6, AVG(c6) OVER (PARTITION BY c8) FROM f_test_tbl1
  ORDER BY c8, c1;
 c8 |  c1  |     c6     |          avg          
----+------+------------+-----------------------
 10 |  700 | 2450.45000 | 2916.8166666666666667
 10 |  900 | 5000.00000 | 2916.8166666666666667
 10 | 1400 | 1300.00000 | 2916.8166666666666667
 20 |  100 |  800.23000 | 2175.0700000000000000
 20 |  400 | 2975.12000 | 2175.0700000000000000
 20 |  800 | 3000.00000 | 2175.0700000000000000
 20 | 1100 | 1100.00000 | 2175.0700000000000000
 20 | 1300 | 3000.00000 | 2175.0700000000000000
 30 |  200 | 1600.00000 | 1566.6666666666666667
 30 |  300 | 1250.00000 | 1566.6666666666666667
 30 |  500 | 1250.00000 | 1566.6666666666666667
 30 |  600 | 2850.00000 | 1566.6666666666666667
 30 | 1000 | 1500.00000 | 1566.6666666666666667
 30 | 1200 |  950.00000 | 1566.6666666666666667
(14 rows)

--Testcase 56:
SELECT c8, c1, c6, COUNT(c6) OVER (PARTITION BY c8) FROM f_test_tbl1
  WHERE c8 IN (10, 30, 40, 50, 60, 70) ORDER BY c8, c1;
 c8 |  c1  |     c6     | count 
----+------+------------+-------
 10 |  700 | 2450.45000 |     3
 10 |  900 | 5000.00000 |     3
 10 | 1400 | 1300.00000 |     3
 30 |  200 | 1600.00000 |     6
 30 |  300 | 1250.00000 |     6
 30 |  500 | 1250.00000 |     6
 30 |  600 | 2850.00000 |     6
 30 | 1000 | 1500.00000 |     6
 30 | 1200 |  950.00000 |     6
(9 rows)

--Testcase 57:
SELECT c8, c1, c6, SUM(c6) OVER (PARTITION BY c8) FROM f_test_tbl1
  ORDER BY c8, c1;
 c8 |  c1  |     c6     |     sum     
----+------+------------+-------------
 10 |  700 | 2450.45000 |  8750.45000
 10 |  900 | 5000.00000 |  8750.45000
 10 | 1400 | 1300.00000 |  8750.45000
 20 |  100 |  800.23000 | 10875.35000
 20 |  400 | 2975.12000 | 10875.35000
 20 |  800 | 3000.00000 | 10875.35000
 20 | 1100 | 1100.00000 | 10875.35000
 20 | 1300 | 3000.00000 | 10875.35000
 30 |  200 | 1600.00000 |  9400.00000
 30 |  300 | 1250.00000 |  9400.00000
 30 |  500 | 1250.00000 |  9400.00000
 30 |  600 | 2850.00000 |  9400.00000
 30 | 1000 | 1500.00000 |  9400.00000
 30 | 1200 |  950.00000 |  9400.00000
(14 rows)

-- Views
--Testcase 58:
CREATE VIEW smpl_vw AS
  SELECT c1, c2, c3, c4, c5, c6, c7, c8 FROM f_test_tbl1
    ORDER BY c1;
--Testcase 59:
SELECT * FROM smpl_vw ORDER BY 1;
  c1  |  c2   |    c3    |  c4  |     c5     |     c6     |  c7  | c8 
------+-------+----------+------+------------+------------+------+----
  100 | EMP1  | ADMIN    | 1300 | 1980-12-17 |  800.23000 |      | 20
  200 | EMP2  | SALESMAN |  600 | 1981-02-20 | 1600.00000 |  300 | 30
  300 | EMP3  | SALESMAN |  600 | 1981-02-22 | 1250.00000 |  500 | 30
  400 | EMP4  | MANAGER  |  900 | 1981-04-02 | 2975.12000 |      | 20
  500 | EMP5  | SALESMAN |  600 | 1981-09-28 | 1250.00000 | 1400 | 30
  600 | EMP6  | MANAGER  |  900 | 1981-05-01 | 2850.00000 |      | 30
  700 | EMP7  | MANAGER  |  900 | 1981-06-09 | 2450.45000 |      | 10
  800 | EMP8  | FINANCE  |  400 | 1987-04-19 | 3000.00000 |      | 20
  900 | EMP9  | HEAD     |      | 1981-11-17 | 5000.00000 |      | 10
 1000 | EMP10 | SALESMAN |  600 | 1980-09-08 | 1500.00000 |    0 | 30
 1100 | EMP11 | ADMIN    |  800 | 1987-05-23 | 1100.00000 |      | 20
 1200 | EMP12 | ADMIN    |  600 | 1981-12-03 |  950.00000 |      | 30
 1300 | EMP13 | FINANCE  |  400 | 1981-12-03 | 3000.00000 |      | 20
 1400 | EMP14 | ADMIN    |  700 | 1982-01-23 | 1300.00000 |      | 10
(14 rows)

--Testcase 60:
CREATE VIEW comp_vw (s1, s2, s3, s6, s7, s8, d2) AS
  SELECT s.c1, s.c2, s.c3, s.c6, s.c7, s.c8, d.c2
    FROM f_test_tbl2 d, f_test_tbl1 s WHERE d.c1 = s.c8 AND d.c1 = 10
    ORDER BY s.c1;
--Testcase 61:
SELECT * FROM comp_vw ORDER BY 1;
  s1  |  s2   |   s3    |     s6     | s7 | s8 |     d2      
------+-------+---------+------------+----+----+-------------
  700 | EMP7  | MANAGER | 2450.45000 |    | 10 | DEVELOPMENT
  900 | EMP9  | HEAD    | 5000.00000 |    | 10 | DEVELOPMENT
 1400 | EMP14 | ADMIN   | 1300.00000 |    | 10 | DEVELOPMENT
(3 rows)

--Testcase 62:
CREATE TEMPORARY VIEW ttest_tbl1_vw AS
  SELECT c1, c2, c3 FROM f_test_tbl2;
--Testcase 63:
SELECT * FROM ttest_tbl1_vw ORDER BY 1, 2;
 c1 |       c2       |    c3    
----+----------------+----------
 10 | DEVELOPMENT    | PUNE
 20 | ADMINISTRATION | BANGLORE
 30 | SALES          | MUMBAI
 40 | HR             | NAGPUR
(4 rows)

--Testcase 64:
CREATE VIEW mul_tbl_view AS
  SELECT d.c1 dc1, d.c2 dc2, e.c1 ec1, e.c2 ec2, e.c6 ec6
    FROM f_test_tbl2 d INNER JOIN f_test_tbl1 e ON d.c1 = e.c8 ORDER BY d.c1;
--Testcase 65:
SELECT * FROM mul_tbl_view ORDER BY 1, 2,3;
 dc1 |      dc2       | ec1  |  ec2  |    ec6     
-----+----------------+------+-------+------------
  10 | DEVELOPMENT    |  700 | EMP7  | 2450.45000
  10 | DEVELOPMENT    |  900 | EMP9  | 5000.00000
  10 | DEVELOPMENT    | 1400 | EMP14 | 1300.00000
  20 | ADMINISTRATION |  100 | EMP1  |  800.23000
  20 | ADMINISTRATION |  400 | EMP4  | 2975.12000
  20 | ADMINISTRATION |  800 | EMP8  | 3000.00000
  20 | ADMINISTRATION | 1100 | EMP11 | 1100.00000
  20 | ADMINISTRATION | 1300 | EMP13 | 3000.00000
  30 | SALES          |  200 | EMP2  | 1600.00000
  30 | SALES          |  300 | EMP3  | 1250.00000
  30 | SALES          |  500 | EMP5  | 1250.00000
  30 | SALES          |  600 | EMP6  | 2850.00000
  30 | SALES          | 1000 | EMP10 | 1500.00000
  30 | SALES          | 1200 | EMP12 |  950.00000
(14 rows)

-- Insert Some records in numbers table.
--Testcase 66:
INSERT INTO f_numbers VALUES (1, 'One');
--Testcase 67:
INSERT INTO f_numbers VALUES (2, 'Two');
--Testcase 68:
INSERT INTO f_numbers VALUES (3, 'Three');
--Testcase 69:
INSERT INTO f_numbers VALUES (4, 'Four');
--Testcase 70:
INSERT INTO f_numbers VALUES (5, 'Five');
--Testcase 71:
INSERT INTO f_numbers VALUES (6, 'Six');
--Testcase 72:
INSERT INTO f_numbers VALUES (7, 'Seven');
--Testcase 73:
INSERT INTO f_numbers VALUES (8, 'Eight');
--Testcase 74:
INSERT INTO f_numbers VALUES (9, 'Nine');
-- Retrieve Data From foreign tables in functions.
--Testcase 75:
CREATE OR REPLACE FUNCTION test_param_where() RETURNS void AS $$
DECLARE
  n varchar;
BEGIN
  FOR x IN 1..9 LOOP
--Testcase 76:
    SELECT b INTO n FROM f_numbers WHERE a = x;
    RAISE NOTICE 'Found number %', n;
  END LOOP;
  return;
END
$$ LANGUAGE plpgsql;
--Testcase 77:
SELECT test_param_where();
NOTICE:  Found number One
NOTICE:  Found number Two
NOTICE:  Found number Three
NOTICE:  Found number Four
NOTICE:  Found number Five
NOTICE:  Found number Six
NOTICE:  Found number Seven
NOTICE:  Found number Eight
NOTICE:  Found number Nine
 test_param_where 
------------------
 
(1 row)

--Testcase 78:
CREATE OR REPLACE FUNCTION test_param_where2(int, text) RETURNS integer AS '
  SELECT a FROM f_numbers WHERE a = $1 AND b = $2;
' LANGUAGE sql;
--Testcase 79:
SELECT test_param_where2(1, 'One');
 test_param_where2 
-------------------
                 1
(1 row)

-- Foreign-Foreign table joins
-- CROSS JOIN.
--Testcase 80:
SELECT f_test_tbl2.c2, f_test_tbl1.c2 FROM f_test_tbl2 CROSS JOIN f_test_tbl1 ORDER BY 1, 2;
       c2       |  c2   
----------------+-------
 ADMINISTRATION | EMP1
 ADMINISTRATION | EMP10
 ADMINISTRATION | EMP11
 ADMINISTRATION | EMP12
 ADMINISTRATION | EMP13
 ADMINISTRATION | EMP14
 ADMINISTRATION | EMP2
 ADMINISTRATION | EMP3
 ADMINISTRATION | EMP4
 ADMINISTRATION | EMP5
 ADMINISTRATION | EMP6
 ADMINISTRATION | EMP7
 ADMINISTRATION | EMP8
 ADMINISTRATION | EMP9
 DEVELOPMENT    | EMP1
 DEVELOPMENT    | EMP10
 DEVELOPMENT    | EMP11
 DEVELOPMENT    | EMP12
 DEVELOPMENT    | EMP13
 DEVELOPMENT    | EMP14
 DEVELOPMENT    | EMP2
 DEVELOPMENT    | EMP3
 DEVELOPMENT    | EMP4
 DEVELOPMENT    | EMP5
 DEVELOPMENT    | EMP6
 DEVELOPMENT    | EMP7
 DEVELOPMENT    | EMP8
 DEVELOPMENT    | EMP9
 HR             | EMP1
 HR             | EMP10
 HR             | EMP11
 HR             | EMP12
 HR             | EMP13
 HR             | EMP14
 HR             | EMP2
 HR             | EMP3
 HR             | EMP4
 HR             | EMP5
 HR             | EMP6
 HR             | EMP7
 HR             | EMP8
 HR             | EMP9
 SALES          | EMP1
 SALES          | EMP10
 SALES          | EMP11
 SALES          | EMP12
 SALES          | EMP13
 SALES          | EMP14
 SALES          | EMP2
 SALES          | EMP3
 SALES          | EMP4
 SALES          | EMP5
 SALES          | EMP6
 SALES          | EMP7
 SALES          | EMP8
 SALES          | EMP9
(56 rows)

-- INNER JOIN.
--Testcase 81:
SELECT d.c1, d.c2, e.c1, e.c2, e.c6, e.c8
  FROM f_test_tbl2 d, f_test_tbl1 e WHERE d.c1 = e.c8 ORDER BY 1, 3;
 c1 |       c2       |  c1  |  c2   |     c6     | c8 
----+----------------+------+-------+------------+----
 10 | DEVELOPMENT    |  700 | EMP7  | 2450.45000 | 10
 10 | DEVELOPMENT    |  900 | EMP9  | 5000.00000 | 10
 10 | DEVELOPMENT    | 1400 | EMP14 | 1300.00000 | 10
 20 | ADMINISTRATION |  100 | EMP1  |  800.23000 | 20
 20 | ADMINISTRATION |  400 | EMP4  | 2975.12000 | 20
 20 | ADMINISTRATION |  800 | EMP8  | 3000.00000 | 20
 20 | ADMINISTRATION | 1100 | EMP11 | 1100.00000 | 20
 20 | ADMINISTRATION | 1300 | EMP13 | 3000.00000 | 20
 30 | SALES          |  200 | EMP2  | 1600.00000 | 30
 30 | SALES          |  300 | EMP3  | 1250.00000 | 30
 30 | SALES          |  500 | EMP5  | 1250.00000 | 30
 30 | SALES          |  600 | EMP6  | 2850.00000 | 30
 30 | SALES          | 1000 | EMP10 | 1500.00000 | 30
 30 | SALES          | 1200 | EMP12 |  950.00000 | 30
(14 rows)

--Testcase 82:
SELECT d.c1, d.c2, e.c1, e.c2, e.c6, e.c8
  FROM f_test_tbl2 d INNER JOIN f_test_tbl1 e ON d.c1 = e.c8 ORDER BY 1, 3;
 c1 |       c2       |  c1  |  c2   |     c6     | c8 
----+----------------+------+-------+------------+----
 10 | DEVELOPMENT    |  700 | EMP7  | 2450.45000 | 10
 10 | DEVELOPMENT    |  900 | EMP9  | 5000.00000 | 10
 10 | DEVELOPMENT    | 1400 | EMP14 | 1300.00000 | 10
 20 | ADMINISTRATION |  100 | EMP1  |  800.23000 | 20
 20 | ADMINISTRATION |  400 | EMP4  | 2975.12000 | 20
 20 | ADMINISTRATION |  800 | EMP8  | 3000.00000 | 20
 20 | ADMINISTRATION | 1100 | EMP11 | 1100.00000 | 20
 20 | ADMINISTRATION | 1300 | EMP13 | 3000.00000 | 20
 30 | SALES          |  200 | EMP2  | 1600.00000 | 30
 30 | SALES          |  300 | EMP3  | 1250.00000 | 30
 30 | SALES          |  500 | EMP5  | 1250.00000 | 30
 30 | SALES          |  600 | EMP6  | 2850.00000 | 30
 30 | SALES          | 1000 | EMP10 | 1500.00000 | 30
 30 | SALES          | 1200 | EMP12 |  950.00000 | 30
(14 rows)

-- OUTER JOINS.
--Testcase 83:
SELECT d.c1, d.c2, e.c1, e.c2, e.c6, e.c8
  FROM f_test_tbl2 d LEFT OUTER JOIN f_test_tbl1 e ON d.c1 = e.c8 ORDER BY 1, 3;
 c1 |       c2       |  c1  |  c2   |     c6     | c8 
----+----------------+------+-------+------------+----
 10 | DEVELOPMENT    |  700 | EMP7  | 2450.45000 | 10
 10 | DEVELOPMENT    |  900 | EMP9  | 5000.00000 | 10
 10 | DEVELOPMENT    | 1400 | EMP14 | 1300.00000 | 10
 20 | ADMINISTRATION |  100 | EMP1  |  800.23000 | 20
 20 | ADMINISTRATION |  400 | EMP4  | 2975.12000 | 20
 20 | ADMINISTRATION |  800 | EMP8  | 3000.00000 | 20
 20 | ADMINISTRATION | 1100 | EMP11 | 1100.00000 | 20
 20 | ADMINISTRATION | 1300 | EMP13 | 3000.00000 | 20
 30 | SALES          |  200 | EMP2  | 1600.00000 | 30
 30 | SALES          |  300 | EMP3  | 1250.00000 | 30
 30 | SALES          |  500 | EMP5  | 1250.00000 | 30
 30 | SALES          |  600 | EMP6  | 2850.00000 | 30
 30 | SALES          | 1000 | EMP10 | 1500.00000 | 30
 30 | SALES          | 1200 | EMP12 |  950.00000 | 30
 40 | HR             |      |       |            |   
(15 rows)

--Testcase 84:
SELECT d.c1, d.c2, e.c1, e.c2, e.c6, e.c8
  FROM f_test_tbl2 d RIGHT OUTER JOIN f_test_tbl1 e ON d.c1 = e.c8 ORDER BY 1, 3;
 c1 |       c2       |  c1  |  c2   |     c6     | c8 
----+----------------+------+-------+------------+----
 10 | DEVELOPMENT    |  700 | EMP7  | 2450.45000 | 10
 10 | DEVELOPMENT    |  900 | EMP9  | 5000.00000 | 10
 10 | DEVELOPMENT    | 1400 | EMP14 | 1300.00000 | 10
 20 | ADMINISTRATION |  100 | EMP1  |  800.23000 | 20
 20 | ADMINISTRATION |  400 | EMP4  | 2975.12000 | 20
 20 | ADMINISTRATION |  800 | EMP8  | 3000.00000 | 20
 20 | ADMINISTRATION | 1100 | EMP11 | 1100.00000 | 20
 20 | ADMINISTRATION | 1300 | EMP13 | 3000.00000 | 20
 30 | SALES          |  200 | EMP2  | 1600.00000 | 30
 30 | SALES          |  300 | EMP3  | 1250.00000 | 30
 30 | SALES          |  500 | EMP5  | 1250.00000 | 30
 30 | SALES          |  600 | EMP6  | 2850.00000 | 30
 30 | SALES          | 1000 | EMP10 | 1500.00000 | 30
 30 | SALES          | 1200 | EMP12 |  950.00000 | 30
(14 rows)

--Testcase 85:
SELECT d.c1, d.c2, e.c1, e.c2, e.c6, e.c8
  FROM f_test_tbl2 d FULL OUTER JOIN f_test_tbl1 e ON d.c1 = e.c8 ORDER BY 1, 3;
 c1 |       c2       |  c1  |  c2   |     c6     | c8 
----+----------------+------+-------+------------+----
 10 | DEVELOPMENT    |  700 | EMP7  | 2450.45000 | 10
 10 | DEVELOPMENT    |  900 | EMP9  | 5000.00000 | 10
 10 | DEVELOPMENT    | 1400 | EMP14 | 1300.00000 | 10
 20 | ADMINISTRATION |  100 | EMP1  |  800.23000 | 20
 20 | ADMINISTRATION |  400 | EMP4  | 2975.12000 | 20
 20 | ADMINISTRATION |  800 | EMP8  | 3000.00000 | 20
 20 | ADMINISTRATION | 1100 | EMP11 | 1100.00000 | 20
 20 | ADMINISTRATION | 1300 | EMP13 | 3000.00000 | 20
 30 | SALES          |  200 | EMP2  | 1600.00000 | 30
 30 | SALES          |  300 | EMP3  | 1250.00000 | 30
 30 | SALES          |  500 | EMP5  | 1250.00000 | 30
 30 | SALES          |  600 | EMP6  | 2850.00000 | 30
 30 | SALES          | 1000 | EMP10 | 1500.00000 | 30
 30 | SALES          | 1200 | EMP12 |  950.00000 | 30
 40 | HR             |      |       |            |   
(15 rows)

-- Local-Foreign table joins.
--Testcase 86:
CREATE TABLE l_test_tbl1 AS
  SELECT c1, c2, c3, c4, c5, c6, c7, c8 FROM f_test_tbl1;
--Testcase 87:
CREATE TABLE l_test_tbl2 AS
  SELECT c1, c2, c3 FROM f_test_tbl2;
-- CROSS JOIN.
--Testcase 88:
SELECT f_test_tbl2.c2, l_test_tbl1.c2 FROM f_test_tbl2 CROSS JOIN l_test_tbl1 ORDER BY 1, 2;
       c2       |  c2   
----------------+-------
 ADMINISTRATION | EMP1
 ADMINISTRATION | EMP10
 ADMINISTRATION | EMP11
 ADMINISTRATION | EMP12
 ADMINISTRATION | EMP13
 ADMINISTRATION | EMP14
 ADMINISTRATION | EMP2
 ADMINISTRATION | EMP3
 ADMINISTRATION | EMP4
 ADMINISTRATION | EMP5
 ADMINISTRATION | EMP6
 ADMINISTRATION | EMP7
 ADMINISTRATION | EMP8
 ADMINISTRATION | EMP9
 DEVELOPMENT    | EMP1
 DEVELOPMENT    | EMP10
 DEVELOPMENT    | EMP11
 DEVELOPMENT    | EMP12
 DEVELOPMENT    | EMP13
 DEVELOPMENT    | EMP14
 DEVELOPMENT    | EMP2
 DEVELOPMENT    | EMP3
 DEVELOPMENT    | EMP4
 DEVELOPMENT    | EMP5
 DEVELOPMENT    | EMP6
 DEVELOPMENT    | EMP7
 DEVELOPMENT    | EMP8
 DEVELOPMENT    | EMP9
 HR             | EMP1
 HR             | EMP10
 HR             | EMP11
 HR             | EMP12
 HR             | EMP13
 HR             | EMP14
 HR             | EMP2
 HR             | EMP3
 HR             | EMP4
 HR             | EMP5
 HR             | EMP6
 HR             | EMP7
 HR             | EMP8
 HR             | EMP9
 SALES          | EMP1
 SALES          | EMP10
 SALES          | EMP11
 SALES          | EMP12
 SALES          | EMP13
 SALES          | EMP14
 SALES          | EMP2
 SALES          | EMP3
 SALES          | EMP4
 SALES          | EMP5
 SALES          | EMP6
 SALES          | EMP7
 SALES          | EMP8
 SALES          | EMP9
(56 rows)

-- INNER JOIN.
--Testcase 89:
SELECT d.c1, d.c2, e.c1, e.c2, e.c6, e.c8
  FROM l_test_tbl2 d, f_test_tbl1 e WHERE d.c1 = e.c8 ORDER BY 1, 3;
 c1 |       c2       |  c1  |  c2   |     c6     | c8 
----+----------------+------+-------+------------+----
 10 | DEVELOPMENT    |  700 | EMP7  | 2450.45000 | 10
 10 | DEVELOPMENT    |  900 | EMP9  | 5000.00000 | 10
 10 | DEVELOPMENT    | 1400 | EMP14 | 1300.00000 | 10
 20 | ADMINISTRATION |  100 | EMP1  |  800.23000 | 20
 20 | ADMINISTRATION |  400 | EMP4  | 2975.12000 | 20
 20 | ADMINISTRATION |  800 | EMP8  | 3000.00000 | 20
 20 | ADMINISTRATION | 1100 | EMP11 | 1100.00000 | 20
 20 | ADMINISTRATION | 1300 | EMP13 | 3000.00000 | 20
 30 | SALES          |  200 | EMP2  | 1600.00000 | 30
 30 | SALES          |  300 | EMP3  | 1250.00000 | 30
 30 | SALES          |  500 | EMP5  | 1250.00000 | 30
 30 | SALES          |  600 | EMP6  | 2850.00000 | 30
 30 | SALES          | 1000 | EMP10 | 1500.00000 | 30
 30 | SALES          | 1200 | EMP12 |  950.00000 | 30
(14 rows)

--Testcase 90:
SELECT d.c1, d.c2, e.c1, e.c2, e.c6, e.c8
  FROM f_test_tbl2 d INNER JOIN l_test_tbl1 e ON d.c1 = e.c8 ORDER BY 1, 3;
 c1 |       c2       |  c1  |  c2   |     c6     | c8 
----+----------------+------+-------+------------+----
 10 | DEVELOPMENT    |  700 | EMP7  | 2450.45000 | 10
 10 | DEVELOPMENT    |  900 | EMP9  | 5000.00000 | 10
 10 | DEVELOPMENT    | 1400 | EMP14 | 1300.00000 | 10
 20 | ADMINISTRATION |  100 | EMP1  |  800.23000 | 20
 20 | ADMINISTRATION |  400 | EMP4  | 2975.12000 | 20
 20 | ADMINISTRATION |  800 | EMP8  | 3000.00000 | 20
 20 | ADMINISTRATION | 1100 | EMP11 | 1100.00000 | 20
 20 | ADMINISTRATION | 1300 | EMP13 | 3000.00000 | 20
 30 | SALES          |  200 | EMP2  | 1600.00000 | 30
 30 | SALES          |  300 | EMP3  | 1250.00000 | 30
 30 | SALES          |  500 | EMP5  | 1250.00000 | 30
 30 | SALES          |  600 | EMP6  | 2850.00000 | 30
 30 | SALES          | 1000 | EMP10 | 1500.00000 | 30
 30 | SALES          | 1200 | EMP12 |  950.00000 | 30
(14 rows)

-- OUTER JOINS.
--Testcase 91:
SELECT d.c1, d.c2, e.c1, e.c2, e.c6, e.c8
  FROM f_test_tbl2 d LEFT OUTER JOIN l_test_tbl1 e ON d.c1 = e.c8 ORDER BY 1, 3;
 c1 |       c2       |  c1  |  c2   |     c6     | c8 
----+----------------+------+-------+------------+----
 10 | DEVELOPMENT    |  700 | EMP7  | 2450.45000 | 10
 10 | DEVELOPMENT    |  900 | EMP9  | 5000.00000 | 10
 10 | DEVELOPMENT    | 1400 | EMP14 | 1300.00000 | 10
 20 | ADMINISTRATION |  100 | EMP1  |  800.23000 | 20
 20 | ADMINISTRATION |  400 | EMP4  | 2975.12000 | 20
 20 | ADMINISTRATION |  800 | EMP8  | 3000.00000 | 20
 20 | ADMINISTRATION | 1100 | EMP11 | 1100.00000 | 20
 20 | ADMINISTRATION | 1300 | EMP13 | 3000.00000 | 20
 30 | SALES          |  200 | EMP2  | 1600.00000 | 30
 30 | SALES          |  300 | EMP3  | 1250.00000 | 30
 30 | SALES          |  500 | EMP5  | 1250.00000 | 30
 30 | SALES          |  600 | EMP6  | 2850.00000 | 30
 30 | SALES          | 1000 | EMP10 | 1500.00000 | 30
 30 | SALES          | 1200 | EMP12 |  950.00000 | 30
 40 | HR             |      |       |            |   
(15 rows)

--Testcase 92:
SELECT d.c1, d.c2, e.c1, e.c2, e.c6, e.c8
  FROM f_test_tbl2 d RIGHT OUTER JOIN l_test_tbl1 e ON d.c1 = e.c8 ORDER BY 1, 3;
 c1 |       c2       |  c1  |  c2   |     c6     | c8 
----+----------------+------+-------+------------+----
 10 | DEVELOPMENT    |  700 | EMP7  | 2450.45000 | 10
 10 | DEVELOPMENT    |  900 | EMP9  | 5000.00000 | 10
 10 | DEVELOPMENT    | 1400 | EMP14 | 1300.00000 | 10
 20 | ADMINISTRATION |  100 | EMP1  |  800.23000 | 20
 20 | ADMINISTRATION |  400 | EMP4  | 2975.12000 | 20
 20 | ADMINISTRATION |  800 | EMP8  | 3000.00000 | 20
 20 | ADMINISTRATION | 1100 | EMP11 | 1100.00000 | 20
 20 | ADMINISTRATION | 1300 | EMP13 | 3000.00000 | 20
 30 | SALES          |  200 | EMP2  | 1600.00000 | 30
 30 | SALES          |  300 | EMP3  | 1250.00000 | 30
 30 | SALES          |  500 | EMP5  | 1250.00000 | 30
 30 | SALES          |  600 | EMP6  | 2850.00000 | 30
 30 | SALES          | 1000 | EMP10 | 1500.00000 | 30
 30 | SALES          | 1200 | EMP12 |  950.00000 | 30
(14 rows)

--Testcase 93:
SELECT d.c1, d.c2, e.c1, e.c2, e.c6, e.c8
  FROM f_test_tbl2 d FULL OUTER JOIN l_test_tbl1 e ON d.c1 = e.c8 ORDER BY 1, 3;
 c1 |       c2       |  c1  |  c2   |     c6     | c8 
----+----------------+------+-------+------------+----
 10 | DEVELOPMENT    |  700 | EMP7  | 2450.45000 | 10
 10 | DEVELOPMENT    |  900 | EMP9  | 5000.00000 | 10
 10 | DEVELOPMENT    | 1400 | EMP14 | 1300.00000 | 10
 20 | ADMINISTRATION |  100 | EMP1  |  800.23000 | 20
 20 | ADMINISTRATION |  400 | EMP4  | 2975.12000 | 20
 20 | ADMINISTRATION |  800 | EMP8  | 3000.00000 | 20
 20 | ADMINISTRATION | 1100 | EMP11 | 1100.00000 | 20
 20 | ADMINISTRATION | 1300 | EMP13 | 3000.00000 | 20
 30 | SALES          |  200 | EMP2  | 1600.00000 | 30
 30 | SALES          |  300 | EMP3  | 1250.00000 | 30
 30 | SALES          |  500 | EMP5  | 1250.00000 | 30
 30 | SALES          |  600 | EMP6  | 2850.00000 | 30
 30 | SALES          | 1000 | EMP10 | 1500.00000 | 30
 30 | SALES          | 1200 | EMP12 |  950.00000 | 30
 40 | HR             |      |       |            |   
(15 rows)

-- FDW-206: LEFT JOIN LATERAL case should not crash
--Testcase 121:
EXPLAIN (VERBOSE, COSTS OFF)
SELECT * FROM f_mysql_test t1 LEFT JOIN LATERAL (
  SELECT t2.a, t1.a AS t1_a FROM f_mysql_test t2) t3 ON t1.a = t3.a ORDER BY 1;
                                                  QUERY PLAN                                                   
---------------------------------------------------------------------------------------------------------------
 Nested Loop Left Join
   Output: t1.a, t1.b, t2.a, (t1.a)
   ->  Foreign Scan on public.f_mysql_test t1
         Output: t1.a, t1.b
         Remote query: SELECT `a`, `b` FROM `mysql_fdw_regress`.`mysql_test` ORDER BY `a` IS NULL ASC, `a` ASC
   ->  Foreign Scan on public.f_mysql_test t2
         Output: t2.a, t1.a
         Remote query: SELECT `a` FROM `mysql_fdw_regress`.`mysql_test` WHERE ((? = `a`))
(8 rows)

--Testcase 122:
SELECT * FROM f_mysql_test t1 LEFT JOIN LATERAL (
  SELECT t2.a, t1.a AS t1_a FROM f_mysql_test t2) t3 ON t1.a = t3.a ORDER BY 1;
 a | b | a | t1_a 
---+---+---+------
 1 | 1 | 1 |    1
(1 row)

--Testcase 141:
SELECT t1.c1, t3.c1, t3.t1_c8 FROM f_test_tbl1 t1 INNER JOIN LATERAL (
  SELECT t2.c1, t1.c8 AS t1_c8 FROM f_test_tbl2 t2) t3 ON t3.c1 = t3.t1_c8
  ORDER BY 1, 2, 3;
  c1  | c1 | t1_c8 
------+----+-------
  100 | 20 |    20
  200 | 30 |    30
  300 | 30 |    30
  400 | 20 |    20
  500 | 30 |    30
  600 | 30 |    30
  700 | 10 |    10
  800 | 20 |    20
  900 | 10 |    10
 1000 | 30 |    30
 1100 | 20 |    20
 1200 | 30 |    30
 1300 | 20 |    20
 1400 | 10 |    10
(14 rows)

--Testcase 142:
SELECT t1.c1, t3.c1, t3.t1_c8 FROM l_test_tbl1 t1 LEFT JOIN LATERAL (
  SELECT t2.c1, t1.c8 AS t1_c8 FROM f_test_tbl2 t2) t3 ON t3.c1 = t3.t1_c8
  ORDER BY 1, 2, 3;
  c1  | c1 | t1_c8 
------+----+-------
  100 | 20 |    20
  200 | 30 |    30
  300 | 30 |    30
  400 | 20 |    20
  500 | 30 |    30
  600 | 30 |    30
  700 | 10 |    10
  800 | 20 |    20
  900 | 10 |    10
 1000 | 30 |    30
 1100 | 20 |    20
 1200 | 30 |    30
 1300 | 20 |    20
 1400 | 10 |    10
(14 rows)

--Testcase 143:
SELECT *, (SELECT r FROM (SELECT c1 AS c1) x, LATERAL (SELECT c1 AS r) y)
  FROM f_test_tbl1 ORDER BY 1, 2, 3;
  c1  |  c2   |    c3    |  c4  |     c5     |     c6     |  c7  | c8 |  r   
------+-------+----------+------+------------+------------+------+----+------
  100 | EMP1  | ADMIN    | 1300 | 1980-12-17 |  800.23000 |      | 20 |  100
  200 | EMP2  | SALESMAN |  600 | 1981-02-20 | 1600.00000 |  300 | 30 |  200
  300 | EMP3  | SALESMAN |  600 | 1981-02-22 | 1250.00000 |  500 | 30 |  300
  400 | EMP4  | MANAGER  |  900 | 1981-04-02 | 2975.12000 |      | 20 |  400
  500 | EMP5  | SALESMAN |  600 | 1981-09-28 | 1250.00000 | 1400 | 30 |  500
  600 | EMP6  | MANAGER  |  900 | 1981-05-01 | 2850.00000 |      | 30 |  600
  700 | EMP7  | MANAGER  |  900 | 1981-06-09 | 2450.45000 |      | 10 |  700
  800 | EMP8  | FINANCE  |  400 | 1987-04-19 | 3000.00000 |      | 20 |  800
  900 | EMP9  | HEAD     |      | 1981-11-17 | 5000.00000 |      | 10 |  900
 1000 | EMP10 | SALESMAN |  600 | 1980-09-08 | 1500.00000 |    0 | 30 | 1000
 1100 | EMP11 | ADMIN    |  800 | 1987-05-23 | 1100.00000 |      | 20 | 1100
 1200 | EMP12 | ADMIN    |  600 | 1981-12-03 |  950.00000 |      | 30 | 1200
 1300 | EMP13 | FINANCE  |  400 | 1981-12-03 | 3000.00000 |      | 20 | 1300
 1400 | EMP14 | ADMIN    |  700 | 1982-01-23 | 1300.00000 |      | 10 | 1400
(14 rows)

-- LATERAL JOIN with RIGHT should throw error
--Testcase 144:
SELECT t1.c1, t3.c1, t3.t1_c8 FROM f_test_tbl1 t1 RIGHT JOIN LATERAL (
  SELECT t2.c1, t1.c8 AS t1_c8 FROM f_test_tbl2 t2) t3 ON t3.c1 = t3.t1_c8
  ORDER BY 1, 2, 3;
ERROR:  invalid reference to FROM-clause entry for table "t1"
LINE 2:   SELECT t2.c1, t1.c8 AS t1_c8 FROM f_test_tbl2 t2) t3 ON t3...
                        ^
DETAIL:  The combining JOIN type must be INNER or LEFT for a LATERAL reference.
-- FDW-207: NATURAL JOIN should give correct output
--Testcase 145:
SELECT t1.c1, t2.c1, t3.c1
  FROM f_test_tbl1 t1 NATURAL JOIN f_test_tbl1 t2 NATURAL JOIN f_test_tbl1 t3
  ORDER BY 1, 2, 3;
  c1  |  c1  |  c1  
------+------+------
  200 |  200 |  200
  300 |  300 |  300
  500 |  500 |  500
 1000 | 1000 | 1000
(4 rows)

-- FDW-208: IS NULL and LIKE should give the correct output with
-- use_remote_estimate set to true.
--Testcase 146:
INSERT INTO f_test_tbl2 VALUES (50, 'TEMP1', NULL);
--Testcase 147:
INSERT INTO f_test_tbl2 VALUES (60, 'TEMP2', NULL);
ALTER SERVER mysql_svr OPTIONS (use_remote_estimate 'true');
--Testcase 148:
SELECT t1.c1, t2.c1
  FROM f_test_tbl2 t1 INNER JOIN f_test_tbl2 t2 ON t1.c1 = t2.c1
  WHERE t1.c3 IS NULL ORDER BY 1, 2;
 c1 | c1 
----+----
 50 | 50
 60 | 60
(2 rows)

--Testcase 149:
SELECT t1.c1, t2.c1
  FROM f_test_tbl2 t1 INNER JOIN f_test_tbl2 t2 ON t1.c1 = t2.c1 AND t1.c2 LIKE 'TEMP%'
  ORDER BY 1, 2;
 c1 | c1 
----+----
 50 | 50
 60 | 60
(2 rows)

--Testcase 150:
DELETE FROM f_test_tbl2 WHERE c1 IN (50, 60);
ALTER SERVER mysql_svr OPTIONS (SET use_remote_estimate 'false');
-- FDW-169: Insert/Update/Delete on enum column.
--Testcase 151:
INSERT INTO f_enum_t1
  VALUES (1, 'small'), (2, 'medium'), (3, 'medium'), (4, 'small');
--Testcase 152:
SELECT * FROM f_enum_t1 WHERE id = 4;
 id | size  
----+-------
  4 | small
(1 row)

--Testcase 153:
UPDATE f_enum_t1 SET size = 'large' WHERE id = 4;
--Testcase 154:
SELECT * FROM f_enum_t1 WHERE id = 4;
 id | size  
----+-------
  4 | large
(1 row)

--Testcase 155:
DELETE FROM f_enum_t1 WHERE size = 'large';
--Testcase 156:
SELECT * FROM f_enum_t1 WHERE id = 4;
 id | size 
----+------
(0 rows)

-- Negative scenarios for ENUM handling.
-- Test that if we insert the ENUM value which is not present on MySQL side,
-- but present on Postgres side.
--Testcase 157:
DROP FOREIGN TABLE f_enum_t1;
--Testcase 158:
DROP TYPE size_t;
-- Create the type with extra enum values.
--Testcase 159:
CREATE TYPE size_t AS enum('small', 'medium', 'large', 'largest', '');
--Testcase 160:
CREATE FOREIGN TABLE f_enum_t1(id int, size size_t)
  SERVER mysql_svr OPTIONS (dbname 'mysql_fdw_regress', table_name 'enum_t1');
-- If we insert the enum value which is not present on MySQL side then it
-- inserts empty string in ANSI_QUOTES sql_mode, so verify that.
--Testcase 161:
INSERT INTO f_enum_t1 VALUES (4, 'largest');
--Testcase 162:
SELECT * from f_enum_t1;
 id |  size  
----+--------
  1 | small
  2 | medium
  3 | medium
  4 | 
(4 rows)

--Testcase 163:
DELETE FROM f_enum_t1 WHERE size = '';
-- Postgres should throw an error as the value which we are inserting for enum
-- column is not present in enum on Postgres side, no matter whether it is
-- present on MySQL side or not. PG's sanity check itself throws an error.
--Testcase 164:
INSERT INTO f_enum_t1 VALUES (4, 'big');
ERROR:  invalid input value for enum size_t: "big"
LINE 1: INSERT INTO f_enum_t1 VALUES (4, 'big');
                                         ^
-- FDW-155: Enum data type can be handled correctly in select statements on
-- foreign table.
--Testcase 94:
SELECT * FROM f_enum_t1 WHERE size = 'medium' ORDER BY id;
 id |  size  
----+--------
  2 | medium
  3 | medium
(2 rows)

-- Remote aggregate in combination with a local Param (for the output
-- of an initplan)
--Testcase 95:
EXPLAIN (VERBOSE, COSTS OFF)
SELECT EXISTS(SELECT 1 FROM pg_enum), sum(id) from f_enum_t1;
                             QUERY PLAN                              
---------------------------------------------------------------------
 Foreign Scan
   Output: $0, (sum(f_enum_t1.id))
   Remote query: SELECT sum(`id`) FROM `mysql_fdw_regress`.`enum_t1`
   InitPlan 1 (returns $0)
     ->  Seq Scan on pg_catalog.pg_enum
(5 rows)

--Testcase 96:
SELECT EXISTS(SELECT 1 FROM pg_enum), sum(id) from f_enum_t1;
 exists | sum 
--------+-----
 t      |   6
(1 row)

-- Check with the IMPORT FOREIGN SCHEMA command.  Also, check ENUM types with
-- the IMPORT FOREIGN SCHEMA command. If the enum name is the same for multiple
-- tables, then it should handle correctly by prefixing the table name.
--Testcase 123:
CREATE TYPE enum_t1_size_t AS enum('small', 'medium', 'large');
--Testcase 124:
CREATE TYPE enum_t2_size_t AS enum('S', 'M', 'L');
IMPORT FOREIGN SCHEMA mysql_fdw_regress LIMIT TO (enum_t1, enum_t2)
  FROM SERVER mysql_svr INTO public;
NOTICE:  error while generating the table definition
HINT:  If you encounter an error, you may need to execute the following first:
DO $$BEGIN IF NOT EXISTS (SELECT 1 FROM pg_catalog.pg_type WHERE typname = 'enum_t1_size_t') THEN CREATE TYPE enum_t1_size_t AS enum('small','medium','large'); END IF; END$$;

NOTICE:  error while generating the table definition
HINT:  If you encounter an error, you may need to execute the following first:
DO $$BEGIN IF NOT EXISTS (SELECT 1 FROM pg_catalog.pg_type WHERE typname = 'enum_t2_size_t') THEN CREATE TYPE enum_t2_size_t AS enum('S','M','L'); END IF; END$$;

--Testcase 125:
SELECT attrelid::regclass, atttypid::regtype FROM pg_attribute
  WHERE (attrelid = 'enum_t1'::regclass OR attrelid = 'enum_t2'::regclass) AND
    attnum > 1 ORDER BY 1;
 attrelid |    atttypid    
----------+----------------
 enum_t1  | enum_t1_size_t
 enum_t2  | enum_t2_size_t
(2 rows)

--Testcase 126:
SELECT * FROM enum_t1 ORDER BY id;
 id |  size  
----+--------
  1 | small
  2 | medium
  3 | medium
(3 rows)

--Testcase 127:
SELECT * FROM enum_t2 ORDER BY id;
 id | size 
----+------
 10 | S
 20 | M
 30 | M
(3 rows)

--Testcase 128:
DROP FOREIGN TABLE enum_t1;
--Testcase 129:
DROP FOREIGN TABLE enum_t2;
-- FDW-248: IMPORT FOREIGN SCHEMA command should work correctly if called
-- multiple times. Earlier we wrongly used PG_TRY/CATCH block to get the server
-- options without clearing the error state and that exceeded
-- ERRORDATA_STACK_SIZE hard coded to 5 on postgres and 40 on PGSpider
DO
$DO$
DECLARE
  i int;
BEGIN
  FOR i IN 1..40
  LOOP
    IMPORT FOREIGN SCHEMA mysql_fdw_regress LIMIT TO (mysql_test)
    FROM SERVER mysql_svr INTO public;

    DROP FOREIGN TABLE mysql_test;
  END LOOP;
END;
$DO$;
-- Parameterized queries should work correctly.
--Testcase 130:
EXPLAIN (VERBOSE, COSTS OFF)
SELECT c1, c2 FROM f_test_tbl1
  WHERE c8 = (SELECT c1 FROM f_test_tbl2 WHERE c1 = (SELECT 20))
  ORDER BY c1;
                                           QUERY PLAN                                            
-------------------------------------------------------------------------------------------------
 Sort
   Output: f_test_tbl1.c1, f_test_tbl1.c2
   Sort Key: f_test_tbl1.c1
   InitPlan 2 (returns $1)
     ->  Foreign Scan on public.f_test_tbl2
           Output: f_test_tbl2.c1
           Remote query: SELECT `c1` FROM `mysql_fdw_regress`.`test_tbl2` WHERE ((`c1` = ?))
           InitPlan 1 (returns $0)
             ->  Result
                   Output: 20
   ->  Foreign Scan on public.f_test_tbl1
         Output: f_test_tbl1.c1, f_test_tbl1.c2
         Remote query: SELECT `c1`, `c2` FROM `mysql_fdw_regress`.`test_tbl1` WHERE ((`c8` = ?))
(13 rows)

--Testcase 131:
SELECT c1, c2 FROM f_test_tbl1
  WHERE c8 = (SELECT c1 FROM f_test_tbl2 WHERE c1 = (SELECT 20))
  ORDER BY c1;
  c1  |  c2   
------+-------
  100 | EMP1
  400 | EMP4
  800 | EMP8
 1100 | EMP11
 1300 | EMP13
(5 rows)

--Testcase 132:
SELECT * FROM f_test_tbl1
  WHERE c8 NOT IN (SELECT c1 FROM f_test_tbl2 WHERE c1 = (SELECT 20))
  ORDER BY c1;
  c1  |  c2   |    c3    | c4  |     c5     |     c6     |  c7  | c8 
------+-------+----------+-----+------------+------------+------+----
  200 | EMP2  | SALESMAN | 600 | 1981-02-20 | 1600.00000 |  300 | 30
  300 | EMP3  | SALESMAN | 600 | 1981-02-22 | 1250.00000 |  500 | 30
  500 | EMP5  | SALESMAN | 600 | 1981-09-28 | 1250.00000 | 1400 | 30
  600 | EMP6  | MANAGER  | 900 | 1981-05-01 | 2850.00000 |      | 30
  700 | EMP7  | MANAGER  | 900 | 1981-06-09 | 2450.45000 |      | 10
  900 | EMP9  | HEAD     |     | 1981-11-17 | 5000.00000 |      | 10
 1000 | EMP10 | SALESMAN | 600 | 1980-09-08 | 1500.00000 |    0 | 30
 1200 | EMP12 | ADMIN    | 600 | 1981-12-03 |  950.00000 |      | 30
 1400 | EMP14 | ADMIN    | 700 | 1982-01-23 | 1300.00000 |      | 10
(9 rows)

-- Check parameterized queries with text/varchar column, should not crash.
--Testcase 133:
CREATE FOREIGN TABLE f_test_tbl3 (c1 INTEGER, c2 text, c3 text)
  SERVER mysql_svr OPTIONS (dbname 'mysql_fdw_regress', table_name 'test_tbl2');
--Testcase 134:
CREATE TABLE local_t1 (c1 INTEGER, c2 text);
--Testcase 135:
INSERT INTO local_t1 VALUES (1, 'SALES');
--Testcase 136:
SELECT c1, c2 FROM f_test_tbl3 WHERE c3 = (SELECT 'PUNE'::text) ORDER BY c1;
 c1 |     c2      
----+-------------
 10 | DEVELOPMENT
(1 row)

--Testcase 137:
SELECT c1, c2 FROM f_test_tbl2 WHERE c3 = (SELECT 'PUNE'::varchar) ORDER BY c1;
 c1 |     c2      
----+-------------
 10 | DEVELOPMENT
(1 row)

--Testcase 138:
SELECT * FROM local_t1 lt1 WHERE lt1.c1 =
  (SELECT count(*) FROM f_test_tbl3 ft1 WHERE ft1.c2 = lt1.c2) ORDER BY lt1.c1;
 c1 |  c2   
----+-------
  1 | SALES
(1 row)

--Testcase 165:
EXPLAIN (VERBOSE, COSTS OFF)
SELECT c1, c2 FROM f_test_tbl1 WHERE c8 = (
  SELECT c1 FROM f_test_tbl2 WHERE c1 = (
    SELECT min(c1) + 1 FROM f_test_tbl2)) ORDER BY c1;
                                                                          QUERY PLAN                                                                           
---------------------------------------------------------------------------------------------------------------------------------------------------------------
 Sort
   Output: f_test_tbl1.c1, f_test_tbl1.c2
   Sort Key: f_test_tbl1.c1
   InitPlan 3 (returns $2)
     ->  Foreign Scan on public.f_test_tbl2 f_test_tbl2_1
           Output: f_test_tbl2_1.c1
           Remote query: SELECT `c1` FROM `mysql_fdw_regress`.`test_tbl2` WHERE ((`c1` = ?))
           InitPlan 2 (returns $1)
             ->  Result
                   Output: ($0 + 1)
                   InitPlan 1 (returns $0)
                     ->  Limit
                           Output: f_test_tbl2.c1
                           ->  Foreign Scan on public.f_test_tbl2
                                 Output: f_test_tbl2.c1
                                 Remote query: SELECT `c1` FROM `mysql_fdw_regress`.`test_tbl2` WHERE ((`c1` IS NOT NULL)) ORDER BY `c1` IS NULL ASC, `c1` ASC
   ->  Foreign Scan on public.f_test_tbl1
         Output: f_test_tbl1.c1, f_test_tbl1.c2
         Remote query: SELECT `c1`, `c2` FROM `mysql_fdw_regress`.`test_tbl1` WHERE ((`c8` = ?))
(19 rows)

--Testcase 166:
SELECT c1, c2 FROM f_test_tbl1 WHERE c8 = (
  SELECT c1 FROM f_test_tbl2 WHERE c1 = (
    SELECT min(c1) + 1 FROM f_test_tbl2)) ORDER BY c1;
 c1 | c2 
----+----
(0 rows)

--Testcase 167:
SELECT * FROM f_test_tbl1 WHERE c1 = (SELECT 500) AND c2 = (
  SELECT max(c2) FROM f_test_tbl1 WHERE c4 = (SELECT 600))
  ORDER BY 1, 2;
 c1  |  c2  |    c3    | c4  |     c5     |     c6     |  c7  | c8 
-----+------+----------+-----+------------+------------+------+----
 500 | EMP5 | SALESMAN | 600 | 1981-09-28 | 1250.00000 | 1400 | 30
(1 row)

--Testcase 168:
SELECT t1.c1, (SELECT c2 FROM f_test_tbl1 WHERE c1 =(SELECT 500))
  FROM f_test_tbl2 t1, (
    SELECT c1, c2 FROM f_test_tbl2 WHERE c1 > ANY (SELECT 20)) t2
  ORDER BY 1, 2;
 c1 |  c2  
----+------
 10 | EMP5
 10 | EMP5
 20 | EMP5
 20 | EMP5
 30 | EMP5
 30 | EMP5
 40 | EMP5
 40 | EMP5
(8 rows)

-- FDW-255: Should throw an error when we select system attribute.
SELECT xmin FROM f_test_tbl1;
 xmin 
------
   96
   96
   96
   96
   96
   96
   96
   96
   96
   96
   96
   96
   96
   96
(14 rows)

SELECT ctid, xmax, tableoid FROM f_test_tbl1;
      ctid      |    xmax    | tableoid 
----------------+------------+----------
 (4294967295,0) | 4294967295 |    17593
 (4294967295,0) | 4294967295 |    17593
 (4294967295,0) | 4294967295 |    17593
 (4294967295,0) | 4294967295 |    17593
 (4294967295,0) | 4294967295 |    17593
 (4294967295,0) | 4294967295 |    17593
 (4294967295,0) | 4294967295 |    17593
 (4294967295,0) | 4294967295 |    17593
 (4294967295,0) | 4294967295 |    17593
 (4294967295,0) | 4294967295 |    17593
 (4294967295,0) | 4294967295 |    17593
 (4294967295,0) | 4294967295 |    17593
 (4294967295,0) | 4294967295 |    17593
 (4294967295,0) | 4294967295 |    17593
(14 rows)

SELECT xmax, c1 FROM f_test_tbl1;
    xmax    |  c1  
------------+------
 4294967295 |  100
 4294967295 |  200
 4294967295 |  300
 4294967295 |  400
 4294967295 |  500
 4294967295 |  600
 4294967295 |  700
 4294967295 |  800
 4294967295 |  900
 4294967295 | 1000
 4294967295 | 1100
 4294967295 | 1200
 4294967295 | 1300
 4294967295 | 1400
(14 rows)

SELECT count(tableoid) FROM f_test_tbl1;
 count 
-------
    14
(1 row)

-- FDW-333: MySQL BINARY and VARBINARY data type should map to BYTEA in
-- Postgres while importing the schema.
IMPORT FOREIGN SCHEMA mysql_fdw_regress LIMIT TO ("test5")
  FROM SERVER mysql_svr INTO public;
SELECT attrelid::regclass, atttypid::regtype FROM pg_attribute
  WHERE attrelid = 'test5'::regclass AND attnum > 1 ORDER BY 1;
 attrelid | atttypid 
----------+----------
 test5    | bytea
 test5    | bytea
(2 rows)

SELECT * FROM test5 ORDER BY 1;
 c1 |    c2    |   c3   
----+----------+--------
  1 | \x610000 | \x6162
(1 row)

-- Cleanup
--Testcase 99:
DROP TABLE l_test_tbl1;
--Testcase 100:
DROP TABLE l_test_tbl2;
--Testcase 101:
DROP TABLE local_t1;
--Testcase 119:
DROP VIEW smpl_vw;
--Testcase 102:
DROP VIEW comp_vw;
--Testcase 103:
DROP VIEW ttest_tbl1_vw;
--Testcase 104:
DROP VIEW mul_tbl_view;
--Testcase 105:
DELETE FROM f_test_tbl1;
--Testcase 106:
DELETE FROM f_test_tbl2;
--Testcase 107:
DELETE FROM f_numbers;
--Testcase 108:
DELETE FROM f_enum_t1;
--Testcase 169:
DROP FOREIGN TABLE f_test_tbl1;
--Testcase 109:
DROP FOREIGN TABLE f_test_tbl2;
--Testcase 110:
DROP FOREIGN TABLE f_numbers;
--Testcase 111:
DROP FOREIGN TABLE f_mysql_test;
--Testcase 112:
DROP FOREIGN TABLE f_enum_t1;
--Testcase 113:
DROP FOREIGN TABLE f_test_tbl3;
DROP FOREIGN TABLE test5;
--Testcase 120:
DROP TYPE size_t;
--Testcase 139:
DROP TYPE enum_t1_size_t;
--Testcase 140:
DROP TYPE enum_t2_size_t;
--Testcase 114:
DROP FUNCTION test_param_where();
--Testcase 115:
DROP FUNCTION test_param_where2(int, text);
--Testcase 116:
DROP USER MAPPING FOR public SERVER mysql_svr;
--Testcase 117:
DROP SERVER mysql_svr;
--Testcase 118:
DROP EXTENSION mysql_fdw;
